QuestionId,Question,language,Type,Categorie,LLM,answer,context,answer_similarity,answer_consistency,augmentation_accuracy,retrieval_precision,contains_context,language_match,language_similarity,language_score,word_count
1G advanced RAG,Was ist der Stellenwert von PRRT innerhalb GEP-NET?,german,general,therapy,claude-3-opus-20240229 advanced RAG,"Basierend auf den gegebenen Informationen hat die Peptidrezeptor-Radionuklidtherapie (PRRT) folgenden Stellenwert innerhalb der gastroenteropankreatischen neuroendokrinen Tumoren (GEP-NET):

- Bei Midgut-NET, die unter Somatostatin-Analoga (SSA) fortschreiten, ist PRRT klar positioniert. Der genaue Stellenwert bei pankreatischen NET muss noch evaluiert werden [1].

- Bei pankreatischen NET zeigen retrospektive Studien eine Wirksamkeit der PRRT hinsichtlich Krankheitskontrolle und geringer Toxizität. Eine Metaanalyse ergab höhere objektive Ansprechraten, Krankheitskontrollraten und progressionsfreies Überleben für PRRT im Vergleich zu Everolimus [1]. 

- Bei GEP-NET Patienten mit großer Tumorlast oder hoher Proliferationsrate (Ki-67 10-55%) kann 177Lu-DOTATATE aufgrund der Ansprechraten von 39-55% als First-Line-Therapie erwogen werden, wenn ein Ansprechen klinisch erforderlich ist [2].

- Bei hochgradigen neuroendokrinen Neoplasien (NEN) wie Grad 3 NET und neuroendokrinen Karzinomen (NEC) mit Ki-67 21-55% könnte PRRT in Betracht gezogen werden, sofern die Läsionen eine SSTR-Aufnahme zeigen [2].","['The objective response rate was\nhigher with PRRT compared to everolimus (47% vs. 12% respectively , p< 0.001), as was the\nrate of disease control (81% vs. 73% respectively, p< 0.001), and progression-free survival\n(25.7 months vs. 14.7 months respectively , p< 0.001). The tolerance profile was also better with\nPRRT than everolimus. Grade 3/4 hematotoxicity was found in 5% of cases with PRRT versus\n11% with everolimus ( p= 0.02). This result is less contrasted for grade 3/4 nephrotoxicity\nfound in 1% of PRRT and 2.5% of everolimus treatments ( p= 0.34). The number of treatment\ninterruptions related to its toxicity was 59 in the everolimus arm versus 0 in the PRRT arm [ 22].\nThese findings suggest that PRRT is effective in controlling disease in patients who are not\namenable to surgical treatment, as well as less toxicity (Table 2, [ 6,9–13,21,23–25]) compared\nto other treatment alternatives. Nevertheless, these data for pancreatic NETs need to be\nconfirmed by a prospective, randomized, double-blind, phase 3 study , similar to the NETTER-\n1 trial for NET in the small intestine. A possible role for PRRT as a neoadjuvant agent has\nbeen suggested by case reports or small case series, but need to be further explored [26]\nFurthermore,90Y-DOTATOC have also been tested prospectively in panNET [ 27]\nmainly by a phase 2 trial including 342 patients with an ORR of 47% [ 7]. Pancreatic NETs\nare more sensitive to the cytotoxic chemotherapy than other NETs. Thus, the place of the\nPRRT in the treatment strategy has to be evaluated.\nIn summary, the PRRT is perfectly positioned in midgut NETs progressing under SSA\nand has yet to ﬁnd its place in pancreatic NETs.', 'J. Clin. Med. 2021 ,10, 1267 6 of 15\nMore recently , some studies have investigated the role of PRRT in high-grade (G3, Ki-67\n> 20%) gastroenteropancreatic (GEP) neuroendocrine neoplasms, called NEN G3. NEN G3\nincluded well differentiated tumor (NET G3) and poorly differentiated (Neuroendocrine\ncarcinoma, NEC), as described in the 2017 WHO classification for pancreatic NEN [ 17], with a\nsimilar expansion to gastrointestinal G3 tumors anticipated in the next WHO classification. In\na study population of 19 well differentiated grade 3 NETs [ 9], a mean overall survival time of\n38 months was observed. Other studies, including both NET G3, and NEC, have suggested a\nbenefit on clinical outcome [ 18–20]. Particularly , in a multicenter retrospective study including\n149 patients with GEP NEN G3, PRRT demonstrates promising response rates, disease control\nrates, PFS and OS [ 19]68Ga-SSTR PET/CT and 18FDG PET/CT may also help to select the\nNET G3 patients who might benefit from PRRT. Indeed, a high SUV on SSTR PET/CT and no\nor minor 18F-FDG avidity appeared to be associated with a better prognosis [18].\n4.2. Pancreatic NET\nIn pancreatic NETs, the effects are not conﬁrmed by a controlled randomized Phase III\nstudy (Table 2). Available data consist of multiple single-arm prospective and retrospective\ntrials. A Retrospective study series of 68 patients treated for pancreatic NET and having\nreceived four cycles of177Lu-DOTATATE at 8 GBq showed no beneﬁt in terms of survival\nin patients ( n= 35) treated with PRRT on the front line [ 21]. On the other hand, signals\nin favor of an efﬁciency are identiﬁed. In this cohort a disease control rate of 85% and a\nmedian time to progression of 34 months was observed [6].\nOther retrospective studies argue for efficacy in disease control and low toxicity of PRRT\nin pancreatic NETs. A retrospective series of 443 gastroenteropancreatic and pulmonary\nneuroendocrine tumours, including 133 pancreatic NETs, showed a disease control rate of\n84% and an objective response rate of 54% in the pancreatic tumour subgroup. The median\nprogression-free survival was 30 months and overall survival was 71 months in this subgroup.\nShort-term tolerability was marked by nausea, vomiting, and abdominal pain (related to the\nprior infusion of amino acids during the177Lu DOTATATE treatment to decrease absorption,\nand thus toxicity , in the kidney). No short-term hematotoxicity or renal toxicity was found in\nthis series. Long-term toxicity was marked by four cases of acute leukemia (0.7% of the study\npopulation) and nine cases of myelodysplastic syndrome (1.5%). [10].\nA meta-analysis comparing the efficacy of PRRT with177Lu DOTATATE and everolimus\n(one of the therapeutic alternatives to PRRT in gastroenteropancreatic NET not accessible\nto surgical treatment) compared 15 articles reporting 697 patients treated with PRRT and\n12 articles reporting 946 patients treated with everolimus. The objective response rate was\nhigher with PRRT compared to everolimus (47% vs. 12% respectively , p< 0.001), as was the\nrate of disease control (81% vs. 73% respectively, p< 0.001), and progression-free survival\n(25.7 months vs. 14.7 months respectively , p< 0.001). The tolerance profile was also better with\nPRRT than everolimus. Grade 3/4 hematotoxicity was found in 5% of cases with PRRT versus\n11% with everolimus ( p= 0.02). This result is less contrasted for grade 3/4 nephrotoxicity\nfound in 1% of PRRT and 2.5% of everolimus treatments ( p= 0.34).', 'Cancers 2022 ,14, 5792 7 of 17\ncompared to 11.0 months for sunitinib treatment in patients with advanced, SSTR-positive,\nprogressive panNET [ 70]. Currently, the randomized phase III COMPETE trial is comparing\nPRRT with177Lu-edotreotide with everolimus in advanced, progressive GEP-NET patients.\nA subset of GEP-NET patients present with extensive tumor bulk or high proliferative rate\n(Ki-67 index of 10–55%). In these cases, treatment with octreotide LAR or lanreotide has\nquestionable antiproliferative effects [ 71]. Given its ORR of 39%, which increases to 55% in\npanNETs [ 29],177Lu-DOTATATE can be considered as ﬁrst-line therapy if response is clini-\ncally necessitated [ 72]. These response rates compare favorably to targeted therapy [ 73–75]\nand for panNETs appear similar to capecitabine–temozolomide chemotherapy [ 76]. Poorly\ndifferentiated neuroendocrine carcinomas (NECs) and well-differentiated grade 3 NETs\nare high-grade NENs that display a more aggressive biological behavior than the more\ncommon grade 1 and 2 NETs [ 77]. PRRT is currently not considered a standard treatment\noption for high-grade NENs [68,78]. The rate of SSTR 2expression in grade 3 NETs ranges\nfrom 67–92% and in NECs from 32–50%, compared to a positive expression rate in grade 1\nand 2 NETs ranging from 67–96% [ 5,79–82]. In a meta-analysis of PRRT comprising four\nstudies, grade 3 NET patients had a median PFS of 19 months and median OS of 44 months\nafter PRRT. The median PFS was 11 and 4 months and the median OS was 22 and 9 months\nfor NEC with a Ki-67 of 21–55% and NEC with a Ki-67 above 55%, respectively [ 83]. Recent\nstudies implicated that PRRT could be considered in grade 3 GEP-NETs and GEP-NEC\nwith a Ki-67 of 21–55%. Importantly, to qualify for PRRT, uptake in all lesions is required\non somatostatin receptor imaging [83].\n7. Eligibility Criteria for PRRT\nThere are several inclusion and exclusion criteria to decide if a patient is eligible for\ntreatment with PRRT. A key criterion for PRRT is the degree of uptake on SSTR imaging\nwhich is scored by the Krenning score based on planar111In-DTPA-octereotide imaging.\nIt was reported that68Ga-DOTA-SSA PET/CT results in higher Krenning scores than\n111In-DTPA-octereotide imaging [ 84]. The uptake of all tumor lesions should minimally\nbe equal to the physiological uptake in the liver (Krenning score grade 2) on111In-DTPA-\noctreotide scintigraphy or higher than the physiological uptake in the liver on68Ga-DOTA-\nSSA PET/CT for a patient to be eligible for PRRT. The latter functional imaging is more\naccurate for detecting SSTR-positive primary tumors and metastases and therefore su-\nperior for assessing the total extent of disease [ 85–87]. PRRT is only applicable for pa-\ntients with a Karnofsky Performance Scale of at least 60 [ 27]. PRRT is contra-indicated\nfor patients who are pregnant or breastfeeding, patients with severe cardiac impairment\n(NYHA III or IV) and those with a life expectancy less than 3 months [ 31]. Since PRRT\ncan induce toxicity, the following pre-treatment laboratory values are required: creatinine\nclearance > 40 mL/min, hemoglobin levels ≥6 mmol/L, leukocytes > 2 ×109/L, platelet\ncount > 75 ×109/L, bilirubin, alanine aminotransferase (ALAT) and aspartate aminotrans-\nferase (ASAT) < 3 times the upper limit of normal and albumin > 3 g/dL [2,3].\n8.']",1.0,1.0,1.0,1.0,0,1.0,1.0,1.0,133
1E advanced RAG,What is the role of PRRT in GEP-NET?,english,general,therapy,claude-3-opus-20240229 advanced RAG,"Based on the provided context, peptide receptor radionuclide therapy (PRRT) plays an important role in the treatment of gastroenteropancreatic neuroendocrine tumors (GEP-NETs):

1. PRRT is a validated treatment option for GEP-NETs that strongly overexpress somatostatin receptors (SSTRs), especially in well-differentiated grade 1/2 NETs [1].

2. The NETTER-1 Phase III randomized trial confirmed the low toxicity and effectiveness of 177Lu-DOTATATE in tumor control for metastatic midgut NETs after disease progression under somatostatin analogues [1,2]. 

3. PRRT is considered a viable option for inoperable and metastatic grade 1 and 2 GEP-NETs (Ki-67 LI up to 20%) that have failed first-line somatostatin treatment and express high levels of SSTRs [3].

4. The effectiveness of PRRT in GEP-NETs is correlated with the tumor volume, location of the primary tumor, and degree of SSTR expression [1].

In summary, PRRT is an important targeted treatment modality for advanced, SSTR-positive GEP-NETs, offering tumor control with low toxicity.","['J. Clin. Med. 2021 ,10, 1267 4 of 15\n4. Indications of PRRT in NETs\n4.1. Gastrointestinal NET\nStudies on the role of PRRT in Grade 1–2 gastrointestinal NETs were evaluated with\ntwo different plotters:90Y-DOTATOC and177Lu-DOTATATE. The use of90Y-DOTATOC\nat a dose of 3.7 GBq/m2in 1109 patients with gastrointestinal NET ( n= 387), pancreatic\n(n= 342), pulmonary ( n= 84) or other ( n= 296) showed a morphologic response rate by\n34% measured by a decrease in the sum of the longest diameters of all pretherapeutically\ndetected tumor lesions. to the response assessment criteria usual radiological RECIST.\nIn patients with intestinal and pancreatic NET, the levels of objective responses were\n47% and 27%, respectively. In the overall population, the median of overall survival was\n95 months [ 7]. The comparison clinical trials and retrospective series on the PRRT with\nthe use of90Y-DOTATOC in the gastroenteropancreatic NETs is impossible because the\npatient selection procedures, the criteria for ﬁxation of the tracer to pre-therapeutic imaging,\nand infusion protocols differ widely in function of the studies. Currently, based on the\nNETTER-1 study, the177LuDOTATATE- is the most widely used radiopeptide.\n177Lu-DOTATATE is currently the more widely used radiopeptide. This radiolabel has\ndemonstrated an efﬁciency similar to90Y-DOTATOC, but with lower toxicity, especially\nhematologic (Table 1, [ 2,8–14]). In a serie of 310 patients treated for Gastroenteropancreatic\nNET per four cycles of 7.4 GBq of177Lu-DOTATATE, it was found an objective response\nrate of 30%. Poor general condition (Karnofsky score < 70%) and liver damage were\nassociated with an incorrect response to the treatment. For example,177Lu-DOTATATE and\n90Y-DOTATOC treatments are associated with poor results when tumor volume is high [ 15].\nIn a meta-analysis of 473 patients treated with177Lu-DOTATATE for a NET, objective\nresponse rates ranged from 18% to 44% depending on the RECIST criteria, with an average\ndisease control rate of 81% [ 16]. Retrospective and Phase II studies of177Lu-DOTATATE\nshowed a median progression-free survival of 33–36 months in patients with metastatic\nsmall size NET with documented tumor progression and/or an uncontrolled carcinoid\nsymptom [8].\nIn this context, the NETTER-1 (Phase III randomized study) has evaluated and po-\nsitioned the place of the PRRT at a very early stage in the management of patients with\nmetastatical midgut NET [ 2]. This study compared 229 patients with advanced metastatic\nmidgut NET, an Octreoscanner binding and progression under SSA at a ﬁxed dose of 30 mg\nper month Octreotide,177Lu-DOTATATE versus 60 mg per month of Octreotide (double\ndose). The study’s outcome was progression-free survival evaluated according to the radio-\nlogical criteria RECIST 1.1. The treatment with177Lu-DOTATATE resulted in a reduction of\n79% of the risk of progression or death, compared to double-dose Octreotide (p< 0.0001) .\nThe median survival progression was not reached in the group treated with PRRT versus\n8.4 months in the control group. Moreover, treatment with PRRT was associated with\na rate of objective response of 18% versus 3% with Octreotide ( p< 0.0004). Thus, and\nbased on this Phase III data,177Lu-DOTATATE is positioned as a new therapeutic option\nin grade 1–2 midgut NETs after disease progression under SSA and has been obtained\nmarketing authorization for this indication. It is important to note that long-term follow-up\nis necessary in order to assess the impact of this new treatment on the overall patient\nsurvival.', 'If GEP-NETS are resectable, surgery is the primary ap-\nproach. Patients with unresectable metastatic disease usually\ngo through multiple lines of treatments including somatostatin\nanalogue (SSA) therapy or targeted therapy, such as everoli-mus (mTOR inhibitor) or sunitinib (tyrosine kinase inhibitor)\n[7]. In patients with grade 1 and 2 NETs (Ki-7 LI of up to\n20%) that are inoperable and metastatic, who have failed first-\nline somatostatin treatment, and whose tumors express high\nlevels of somatostatin receptors (SSTRs), peptide receptor ra-\ndionuclide therapy (PRRT) would be a viable option. PRRTusually involves DOTATOC, DOTATATE, and DOTANOC\nlabeled either with\n90Yor177Lu [7]. Patients included in study\nprotocols have positive NET histology and SSTR scintigraphy\nwith111In OctreoScan or68Ga PET-Dota-peptide (Fig. 1). A\npositive scan denotes lesion uptake that is equal to or greaterthan the liver uptake [ 8]. Important criteria to be taken into\naccount when considering PRRT include objective disease\nprogression, adequate blood profile (hemoglobin, white cell,\nand platelet count levels), creatinine, and ECOG performancescore ≤2[8]. A good performance status means the patient\nwould be self-sufficient and reduces the need for physicalassistance during the treatment period (3 days/cycle).Recently published European Society for Medical Oncology\n(ESMO) Clinical Practice Guidelines have recommended\nPRRT up to the upper limit of Ki-67 LI to 30% [ 9].\nScintigraphic or PET tomoscintigraphic evaluation is to datethe most accurate noninvasive method to identify and confirmthe overexpression of functioning receptors [ 10]. An impor-\ntant issue in the consideration of PRRT is that the somatostatinreceptors should be functional, i.e., able to internalize the re-ceptor analogue complex and retain the radioactivity inside\nthe cell. The critical issues for effective therapy are somato-\nstatin receptor overexpression and the evidence of functional-ity. The nuclear physician can calculate a tumor-to-liver ratio\nas a relative measure of receptor number [ 11]; this ratio must\nbe high for PRRT eligibility.Mechanism of Action and Constituents\nof Radiolabeled SSAs\nSomatostatin ’s actions include inhibiting hormone secretion,\nsuppressing the release of insulin-like growth factors,\ninhibiting angiogenesis, and inducing apoptosis in the tumor\ntissue [ 12]. Such biologic effects are mediated through inter-\naction with five subtypes of somatostatin receptors (SSTR1-\n5), which belong to the seven-transmembrane domain, G-\nprotein-coupled receptor superfamily. The currently approvedSSAs are octreotide and lanreotide, in slow-release formula-\ntions, long-acting release (LAR), and supersaturated solution\n(Autogel®).\nDue to the overexpression of SSTRs in NETs, which is\nestimated to be in around 80% of NETs, they are consideredsuitable targets for PRRT with radiolabeled SSA. Once boundto their receptor, radiolabeled SSAs are internalized as per\nnormal receptor recycling dynamics, and the breakdown prod-\nucts of the radiolabeled peptides are stored in lysosomes, thusenabling delivery and causing suspension of radioactivity in-\nside the tumor cell [ 13]. This would result in radiation-induced\nDNA damage of the tumor cell and its eventual death.\nRadiolabeled SSAs are made up of three main constituents;\na radionuclide isotope, a ligand or carrier molecule (TOC or\nTATE), and a chelator or linker (DOTA) that binds them to-\ngether and stabilizes the complex (Fig. 2). Chelators mainly\nused include DOTA (tetraazacyclododecane tetra-acetic acid)\nand DTPA (diethylenetriamine penta-acetic acid), while\noctreotide and octreotate (TOC and TATE, respectively) are\ngenerally used as ligands [ 14]. The most known and studied\nSSA is octreotide.', 'J. Clin. Med. 2021 ,10, 1267 2 of 15\n(SSTR). For many years, evidence of an anti-tumor effect of PRRT were only obtained from\nnon-randomized Phase II trials or retrospective studies. The NETTER-1 Phase III Random-\nized Trial finally validated this treatment option by confirming its low toxicity but also its\neffectiveness in tumor control. Following these results,177Lu-DOTATATE was approved by\nthe US Food and Drug Administration in 2018 and the European Medicines Agency in 2017\nfor the treatment of gastroenteropancreatic NETs that are well differentiated and obtain a\nprescription authorization in France in metastatic midgut NETs [ 2]. Some interesting data\nexist for pancreatic and pulmonary NETs. In this review, we discuss the clinical efficiency of\nPRRT in gastroenteropancreatic and pulmonary NETs.\n2. Somatostatin Receptors (SSTR) and Radio-Labelled Somatostatin Analogues\nEffect of PRRT is correlated with the ability for the markers to ﬁx the SSTR (SSTR1-5).\nThis therapy is therefore dedicated to NETs who strongly over expressed those receptors.\nSSTRs belong to a family of G-protein coupled receptors with seven transmembrane\ndomains. The majority of well differentiated gastroenteropancreatic and pulmonary NETs\nare characterized by the strong expression of SSTR, including SSTR2 Grade 1/2 NETs\nexpress the SSTR more often and at higher levels than grade 3 NETs. When linked to the\nreceptors, radiolabeled somatostatin analogues are internalized according to the normal\nrecycling dynamics of membrane receptors and the degradation products of peptides\nare stored in lysosomes, in intracellular, which allows for the release and retention of\nradioactivity inside tumor cells [ 3]. This mechanism accounts for the low toxicity of the\nPRRT on the healthy cells. Radiolabelled somatostatin analogs are made up of an isotope\nradionuclide, a carrier molecule (derived from octreotide), and a chelating agent that binds\nthem together and stabilizes the complex. The commonly used chelating agents are DOTA\n(DOTA acid and tetra-azacyclododecane-tetra-acetic) and DTPA (di-ethylenetriamine penta-\naceticacid). Three radionucleides (111In,90Y and177Lu) were conjugated to the somatostatin\nanalogues and their different physical characteristics confer speciﬁc advantages. The90Y\nand177Lu emit beta particles with higher energy and longer ranges, which translates into\ngreater therapeutic potential. Due to the emission of gamma rays, the177Lu can also be\nused for dosimetry and monitoring of tumor response [4].\n3. Modalities of Realization and Patients Selection\nPRRT is the single validated treatment option in the NETs, which for there is a pre-\ndictive marker of answer: the expression of SSTR. Response rates have been shown to\nbe increased in patients with a higher degree of absorption of radiotracers in the case of\n111In-pentetreotid scintigraphy An overall response rate of approximately 60% has been\nreported in patients with a grade 4 according to the Krenning score, corresponding to a tu-\nmor absorption greater than that of the spleen, and kidneys. Intense ﬁxation (SUV) greater\nthan 16 on the68Ga-DOTATOC PET/CT is a predictive marker of high tumor response\n(sensitivity: 95%; specﬁcity: 60 %) [ 5] (Figure 1). The effectiveness of PRRT is correlated\nwith the tumor volume and the location of the primary tumor (amount of SSTR present\non the tumor cell) (Figure 2). Thus, NETs with high liver tumor volume are considered\nto be less sensitive to PRRT [ 6]. Similarly, it is suggested that pancreatic NETs frequently\nrespond to the PRRT but with an earlier progression than in midgut NETs. The treatment\nmodalities are relatively standardized in France with a treatment carried out by infusion\nof radiolabel split in four cycles spaced eight weeks apart.']",1.0,1.0,1.0,1.0,1,0.0,1.0,0.5,150
2G advanced RAG,Für welche Indikationen ist PRRT zugelassen?,german,specific,therapy,claude-3-opus-20240229 advanced RAG,"Laut den gegebenen Informationen ist die Peptid-Rezeptor-Radionuklid-Therapie (PRRT) mit 177Lu-DOTA-TATE (177Lu-Oxodotreotid) für die Behandlung von erwachsenen Patienten mit Somatostatin-Rezeptor-positiven gastroenteropankreatischen neuroendokrinen Tumoren (GEP-NETs) zugelassen [1].

Die PRRT mit 177Lu-DOTA-TOC (177Lu-Edotreotid) wird derzeit in der Phase-III-Studie COMPETE im Vergleich zu Everolimus bei Patienten mit progressiven, Somatostatin-Rezeptor-positiven GEP-NETs untersucht. Nach Abschluss dieser Studie wird die Zulassung von 177Lu-DOTA-TOC erwartet [1].

References:
[1] Fani et al. (2022). Radiolabeled Somatostatin Analogs—A Continuously Evolving Field of Research and Clinical Translation. Cancers, 14(5), 1311.","['2.2. Clinical Studies and Approvals\nToday, PRRT with radiolabeled SST agonists (e.g., DOTA-TOC or DOTA-TATE, Table 1)\nis part of the standard of care of NENs. NETTER-1 (NCT01578239; EudraCT number\n2011-005049-11 ) was the ﬁrst prospective, open-label, randomized, phase III trial to com-\npare four cycles of177Lu-DOTA-TATE (4 ×7.4 GBq) plus 30 mg long-acting release oc-\ntreotide (PRRT group, n = 117) with high-dose (60 mg double dose) long-acting release\noctreotide (control group, n = 114) in advanced, progressive midgut NET patients. There\nwas a signiﬁcantly longer progression-free survival for the PRRT arm ( p< 0.001) [ 22]\nand a signiﬁcant improvement in quality of life [ 23]. Consequently,177Lu-DOTA-TATE\n(177Lu-oxodotreotide ) received marketing authorization for the treatment of adult patients\nwith SST-positive gastroenteropancreatic neuroendocrine tumors (GEP-NETs). At the ﬁnal\nanalysis of overall survival (OS), the median OS was improved by 11.7 months for the\n177Lu-DOTA-TATE arm versus the control arm (48.0 (95% CI, 37.4–55.2) vs. 36.3 (95% CI,\n25.9–51.7) months, respectively), which, however, did not reach statistical signiﬁcance in the\nlong-term follow-up with a median of 6.3 years [ 24]. Regarding safety, the NETTER-1 data\nshow a low incidence of long-term side-effects regarding hematotoxicity and nephrotoxicity.\nCurrently , a second prospective, randomized, controlled, open-label, multi-center, phase\nIII trial, COMPETE (NCT03049189), is ongoing, in which PRRT using177Lu-DOTA-TOC\n(177Lu-edotreotide, four cycles with 7.5 GBq/cycle) is being compared with the mTOR\ninhibitor everolimus (10 mg daily) in patients with progressive, SST-positive GEP-NETs.\nUpon completion of the study, the approval of177Lu-DOTA-TOC is expected. These\ntrials and other trials (e.g., OCCLURANDOM, NCT02230176) should further precisely\ndetermine the position of PRRT in the current clinical algorithm with regard to other\nsystemic therapies, such as everolimus and sunitinib.\nUsing routes other than intravenous administration may be an interesting approach to\nenhance the therapeutic and safety window of PRRT. NENs and their liver metastases are\noften highly perfused, and the intra-arterial route can exploit the ﬁrst-pass effect to treat\nliver-dominant disease more efﬁciently. Such an approach can also be used for inoperable\nprimary tumors to downstage the disease in the neoadjuvant setting [ 25,26]. However,\nlarge comparative prospective trials supporting its wider use are missing.', 'Cancers 2022 ,14, 5792 7 of 17\ncompared to 11.0 months for sunitinib treatment in patients with advanced, SSTR-positive,\nprogressive panNET [ 70]. Currently, the randomized phase III COMPETE trial is comparing\nPRRT with177Lu-edotreotide with everolimus in advanced, progressive GEP-NET patients.\nA subset of GEP-NET patients present with extensive tumor bulk or high proliferative rate\n(Ki-67 index of 10–55%). In these cases, treatment with octreotide LAR or lanreotide has\nquestionable antiproliferative effects [ 71]. Given its ORR of 39%, which increases to 55% in\npanNETs [ 29],177Lu-DOTATATE can be considered as ﬁrst-line therapy if response is clini-\ncally necessitated [ 72]. These response rates compare favorably to targeted therapy [ 73–75]\nand for panNETs appear similar to capecitabine–temozolomide chemotherapy [ 76]. Poorly\ndifferentiated neuroendocrine carcinomas (NECs) and well-differentiated grade 3 NETs\nare high-grade NENs that display a more aggressive biological behavior than the more\ncommon grade 1 and 2 NETs [ 77]. PRRT is currently not considered a standard treatment\noption for high-grade NENs [68,78]. The rate of SSTR 2expression in grade 3 NETs ranges\nfrom 67–92% and in NECs from 32–50%, compared to a positive expression rate in grade 1\nand 2 NETs ranging from 67–96% [ 5,79–82]. In a meta-analysis of PRRT comprising four\nstudies, grade 3 NET patients had a median PFS of 19 months and median OS of 44 months\nafter PRRT. The median PFS was 11 and 4 months and the median OS was 22 and 9 months\nfor NEC with a Ki-67 of 21–55% and NEC with a Ki-67 above 55%, respectively [ 83]. Recent\nstudies implicated that PRRT could be considered in grade 3 GEP-NETs and GEP-NEC\nwith a Ki-67 of 21–55%. Importantly, to qualify for PRRT, uptake in all lesions is required\non somatostatin receptor imaging [83].\n7. Eligibility Criteria for PRRT\nThere are several inclusion and exclusion criteria to decide if a patient is eligible for\ntreatment with PRRT. A key criterion for PRRT is the degree of uptake on SSTR imaging\nwhich is scored by the Krenning score based on planar111In-DTPA-octereotide imaging.\nIt was reported that68Ga-DOTA-SSA PET/CT results in higher Krenning scores than\n111In-DTPA-octereotide imaging [ 84]. The uptake of all tumor lesions should minimally\nbe equal to the physiological uptake in the liver (Krenning score grade 2) on111In-DTPA-\noctreotide scintigraphy or higher than the physiological uptake in the liver on68Ga-DOTA-\nSSA PET/CT for a patient to be eligible for PRRT. The latter functional imaging is more\naccurate for detecting SSTR-positive primary tumors and metastases and therefore su-\nperior for assessing the total extent of disease [ 85–87]. PRRT is only applicable for pa-\ntients with a Karnofsky Performance Scale of at least 60 [ 27]. PRRT is contra-indicated\nfor patients who are pregnant or breastfeeding, patients with severe cardiac impairment\n(NYHA III or IV) and those with a life expectancy less than 3 months [ 31]. Since PRRT\ncan induce toxicity, the following pre-treatment laboratory values are required: creatinine\nclearance > 40 mL/min, hemoglobin levels ≥6 mmol/L, leukocytes > 2 ×109/L, platelet\ncount > 75 ×109/L, bilirubin, alanine aminotransferase (ALAT) and aspartate aminotrans-\nferase (ASAT) < 3 times the upper limit of normal and albumin > 3 g/dL [2,3].\n8.', 'Lutetium-177- DOTATATE/\nDOTATOC for treatment of\nGastroenteropancreatic NETs\nNeuroendocrine neoplasms (NENs) are relatively rare\nneoplasms which may arise from pluripotential stem cells in\naddition to cells of the diffuse neuroendocrine system\ncomprising the autonomic nervous system, the thyroid, lungs,\npancreas and gastrointestinal tract ( 2). The classi ﬁcation of NENs\nhas recently been updated by the WHO according to morphology\nand proliferation as well differentiated neuroendocrine tumors\n(NETs) (G1 to G3) and poorly differentiated neuroendocrine\ncarcinomas (NECs) (G3) ( Table 2 )(3).\nNETs may be clinically silent ( ‘non-functioning ’) or may\nsynthesize and secrete a variety of peptides and neuroamines\nwhich lead to the development of characteristic clinical\nsyndromes, including carcinoid syndrome and functional\npancreatic tumors such as insulinoma (hypoglycemia) and\ngastrinoma (gastric hyperacidity). The non-functioning tumors\ntend to present late with widespread metastatic disease,\nparticularly in the liver. NETss tend to be indolent in\ncharacter and patients can still live for relatively prolonged\nperiods with good quality of life even with metastatic disease ( 4).\nThe incidence of NENs is increasing year-on-year. In the\nUSA, the SEER database has documented a 6,4-fold increase in\nincidence between 2007 (1,09 per 100.000) and 2012 (6,98 per\n100.000) ( 5). This increase has included gastroenteropancreatic\n(GEP) NENs with the highest incidence being seen in adults\naged 74-80) ( 6) The age-standardized incidence rate of NENs in\nthe UK between 2013-2015 has been reported as 8.6 per 100,000,\nwith an incidence of 4.6 per 100,000 for gastroenteropancreatic\n(GEP) NENs ( 7).\nGEP-NETs are graded with increasing aggressivity as G1, G2\nor G3, based on Ki-67 labeling index, mitotic count and\nhistological differentiation ( Table 2 )(3). Well differentiated G1\nand G2 GEP-NETs typically show a slower progression and better\nprognosis than G3 GEP-NETs ( 8). A characteristic feature ofGEP-NETs is that a majority express functioning somatostatin\nreceptors (SSTRs) 2 and 5. This renders the tumors amenable to\ntreatment with synthetic somatostatin peptides, which can inhibit\nfunctional secretion and also stabilize tumor growth ( 9). These\nsynthetic peptides, conjugated with a chelator, can be ef ﬁciently\nradiolabeled with photon-, positron- or particle-emitting\nradionuclides. The expression of SSTR2 enables GEP-NETs to\nbe imaged with receptor targeted high resolution PET/CT(DOTATOC/DOTATATE-Ga-68). In addition, tumors can be\ntreated with therapeutic Lu-177 DOTATOC/DOTATATE ( 10).\nPatients with G1 and G2 GEP-NETS often present late, with\nmetastatic disease. Until recently, somatostatin analogues and\nthe molecularly targeted drugs Sunitinib andEverolimus as well\nas chemotherapy in PNETs have provided the mainstays of\ntreatment ( 11). These treatments usually result in disease\nstabilization for a limited period of time. In the RADIANT-3\ntrial, Everolimus achieved a progression free survival (PFS) of 11\nmonths in pancreatic NETS (PNETs) and a similar PFS was\nachieved in midgut and pulmonary NETs in the RADIANT-4\ntrial ( 12,13).\nPRRT has recently emerged as a novel treatment option for\npatients with G1 and G2 GEP-NETs.']",2.0,1.0,1.0,1.0,0,1.0,1.0,1.0,78
2E advanced RAG,For which indication is PRRT approved?,english,specific,therapy,claude-3-opus-20240229 advanced RAG,"According to the context, 177Lu-DOTA-TATE (177Lu-oxodotreotide) has received marketing authorization for the treatment of adult patients with somatostatin receptor-positive gastroenteropancreatic neuroendocrine tumors (GEP-NETs) [1].","['J. Clin. Med. 2021 ,10, 1267 2 of 15\n(SSTR). For many years, evidence of an anti-tumor effect of PRRT were only obtained from\nnon-randomized Phase II trials or retrospective studies. The NETTER-1 Phase III Random-\nized Trial finally validated this treatment option by confirming its low toxicity but also its\neffectiveness in tumor control. Following these results,177Lu-DOTATATE was approved by\nthe US Food and Drug Administration in 2018 and the European Medicines Agency in 2017\nfor the treatment of gastroenteropancreatic NETs that are well differentiated and obtain a\nprescription authorization in France in metastatic midgut NETs [ 2]. Some interesting data\nexist for pancreatic and pulmonary NETs. In this review, we discuss the clinical efficiency of\nPRRT in gastroenteropancreatic and pulmonary NETs.\n2. Somatostatin Receptors (SSTR) and Radio-Labelled Somatostatin Analogues\nEffect of PRRT is correlated with the ability for the markers to ﬁx the SSTR (SSTR1-5).\nThis therapy is therefore dedicated to NETs who strongly over expressed those receptors.\nSSTRs belong to a family of G-protein coupled receptors with seven transmembrane\ndomains. The majority of well differentiated gastroenteropancreatic and pulmonary NETs\nare characterized by the strong expression of SSTR, including SSTR2 Grade 1/2 NETs\nexpress the SSTR more often and at higher levels than grade 3 NETs. When linked to the\nreceptors, radiolabeled somatostatin analogues are internalized according to the normal\nrecycling dynamics of membrane receptors and the degradation products of peptides\nare stored in lysosomes, in intracellular, which allows for the release and retention of\nradioactivity inside tumor cells [ 3]. This mechanism accounts for the low toxicity of the\nPRRT on the healthy cells. Radiolabelled somatostatin analogs are made up of an isotope\nradionuclide, a carrier molecule (derived from octreotide), and a chelating agent that binds\nthem together and stabilizes the complex. The commonly used chelating agents are DOTA\n(DOTA acid and tetra-azacyclododecane-tetra-acetic) and DTPA (di-ethylenetriamine penta-\naceticacid). Three radionucleides (111In,90Y and177Lu) were conjugated to the somatostatin\nanalogues and their different physical characteristics confer speciﬁc advantages. The90Y\nand177Lu emit beta particles with higher energy and longer ranges, which translates into\ngreater therapeutic potential. Due to the emission of gamma rays, the177Lu can also be\nused for dosimetry and monitoring of tumor response [4].\n3. Modalities of Realization and Patients Selection\nPRRT is the single validated treatment option in the NETs, which for there is a pre-\ndictive marker of answer: the expression of SSTR. Response rates have been shown to\nbe increased in patients with a higher degree of absorption of radiotracers in the case of\n111In-pentetreotid scintigraphy An overall response rate of approximately 60% has been\nreported in patients with a grade 4 according to the Krenning score, corresponding to a tu-\nmor absorption greater than that of the spleen, and kidneys. Intense ﬁxation (SUV) greater\nthan 16 on the68Ga-DOTATOC PET/CT is a predictive marker of high tumor response\n(sensitivity: 95%; specﬁcity: 60 %) [ 5] (Figure 1). The effectiveness of PRRT is correlated\nwith the tumor volume and the location of the primary tumor (amount of SSTR present\non the tumor cell) (Figure 2). Thus, NETs with high liver tumor volume are considered\nto be less sensitive to PRRT [ 6]. Similarly, it is suggested that pancreatic NETs frequently\nrespond to the PRRT but with an earlier progression than in midgut NETs. The treatment\nmodalities are relatively standardized in France with a treatment carried out by infusion\nof radiolabel split in four cycles spaced eight weeks apart.', 'If GEP-NETS are resectable, surgery is the primary ap-\nproach. Patients with unresectable metastatic disease usually\ngo through multiple lines of treatments including somatostatin\nanalogue (SSA) therapy or targeted therapy, such as everoli-mus (mTOR inhibitor) or sunitinib (tyrosine kinase inhibitor)\n[7]. In patients with grade 1 and 2 NETs (Ki-7 LI of up to\n20%) that are inoperable and metastatic, who have failed first-\nline somatostatin treatment, and whose tumors express high\nlevels of somatostatin receptors (SSTRs), peptide receptor ra-\ndionuclide therapy (PRRT) would be a viable option. PRRTusually involves DOTATOC, DOTATATE, and DOTANOC\nlabeled either with\n90Yor177Lu [7]. Patients included in study\nprotocols have positive NET histology and SSTR scintigraphy\nwith111In OctreoScan or68Ga PET-Dota-peptide (Fig. 1). A\npositive scan denotes lesion uptake that is equal to or greaterthan the liver uptake [ 8]. Important criteria to be taken into\naccount when considering PRRT include objective disease\nprogression, adequate blood profile (hemoglobin, white cell,\nand platelet count levels), creatinine, and ECOG performancescore ≤2[8]. A good performance status means the patient\nwould be self-sufficient and reduces the need for physicalassistance during the treatment period (3 days/cycle).Recently published European Society for Medical Oncology\n(ESMO) Clinical Practice Guidelines have recommended\nPRRT up to the upper limit of Ki-67 LI to 30% [ 9].\nScintigraphic or PET tomoscintigraphic evaluation is to datethe most accurate noninvasive method to identify and confirmthe overexpression of functioning receptors [ 10]. An impor-\ntant issue in the consideration of PRRT is that the somatostatinreceptors should be functional, i.e., able to internalize the re-ceptor analogue complex and retain the radioactivity inside\nthe cell. The critical issues for effective therapy are somato-\nstatin receptor overexpression and the evidence of functional-ity. The nuclear physician can calculate a tumor-to-liver ratio\nas a relative measure of receptor number [ 11]; this ratio must\nbe high for PRRT eligibility.Mechanism of Action and Constituents\nof Radiolabeled SSAs\nSomatostatin ’s actions include inhibiting hormone secretion,\nsuppressing the release of insulin-like growth factors,\ninhibiting angiogenesis, and inducing apoptosis in the tumor\ntissue [ 12]. Such biologic effects are mediated through inter-\naction with five subtypes of somatostatin receptors (SSTR1-\n5), which belong to the seven-transmembrane domain, G-\nprotein-coupled receptor superfamily. The currently approvedSSAs are octreotide and lanreotide, in slow-release formula-\ntions, long-acting release (LAR), and supersaturated solution\n(Autogel®).\nDue to the overexpression of SSTRs in NETs, which is\nestimated to be in around 80% of NETs, they are consideredsuitable targets for PRRT with radiolabeled SSA. Once boundto their receptor, radiolabeled SSAs are internalized as per\nnormal receptor recycling dynamics, and the breakdown prod-\nucts of the radiolabeled peptides are stored in lysosomes, thusenabling delivery and causing suspension of radioactivity in-\nside the tumor cell [ 13]. This would result in radiation-induced\nDNA damage of the tumor cell and its eventual death.\nRadiolabeled SSAs are made up of three main constituents;\na radionuclide isotope, a ligand or carrier molecule (TOC or\nTATE), and a chelator or linker (DOTA) that binds them to-\ngether and stabilizes the complex (Fig. 2). Chelators mainly\nused include DOTA (tetraazacyclododecane tetra-acetic acid)\nand DTPA (diethylenetriamine penta-acetic acid), while\noctreotide and octreotate (TOC and TATE, respectively) are\ngenerally used as ligands [ 14]. The most known and studied\nSSA is octreotide.', '2.2. Clinical Studies and Approvals\nToday, PRRT with radiolabeled SST agonists (e.g., DOTA-TOC or DOTA-TATE, Table 1)\nis part of the standard of care of NENs. NETTER-1 (NCT01578239; EudraCT number\n2011-005049-11 ) was the ﬁrst prospective, open-label, randomized, phase III trial to com-\npare four cycles of177Lu-DOTA-TATE (4 ×7.4 GBq) plus 30 mg long-acting release oc-\ntreotide (PRRT group, n = 117) with high-dose (60 mg double dose) long-acting release\noctreotide (control group, n = 114) in advanced, progressive midgut NET patients. There\nwas a signiﬁcantly longer progression-free survival for the PRRT arm ( p< 0.001) [ 22]\nand a signiﬁcant improvement in quality of life [ 23]. Consequently,177Lu-DOTA-TATE\n(177Lu-oxodotreotide ) received marketing authorization for the treatment of adult patients\nwith SST-positive gastroenteropancreatic neuroendocrine tumors (GEP-NETs). At the ﬁnal\nanalysis of overall survival (OS), the median OS was improved by 11.7 months for the\n177Lu-DOTA-TATE arm versus the control arm (48.0 (95% CI, 37.4–55.2) vs. 36.3 (95% CI,\n25.9–51.7) months, respectively), which, however, did not reach statistical signiﬁcance in the\nlong-term follow-up with a median of 6.3 years [ 24]. Regarding safety, the NETTER-1 data\nshow a low incidence of long-term side-effects regarding hematotoxicity and nephrotoxicity.\nCurrently , a second prospective, randomized, controlled, open-label, multi-center, phase\nIII trial, COMPETE (NCT03049189), is ongoing, in which PRRT using177Lu-DOTA-TOC\n(177Lu-edotreotide, four cycles with 7.5 GBq/cycle) is being compared with the mTOR\ninhibitor everolimus (10 mg daily) in patients with progressive, SST-positive GEP-NETs.\nUpon completion of the study, the approval of177Lu-DOTA-TOC is expected. These\ntrials and other trials (e.g., OCCLURANDOM, NCT02230176) should further precisely\ndetermine the position of PRRT in the current clinical algorithm with regard to other\nsystemic therapies, such as everolimus and sunitinib.\nUsing routes other than intravenous administration may be an interesting approach to\nenhance the therapeutic and safety window of PRRT. NENs and their liver metastases are\noften highly perfused, and the intra-arterial route can exploit the ﬁrst-pass effect to treat\nliver-dominant disease more efﬁciently. Such an approach can also be used for inoperable\nprimary tumors to downstage the disease in the neoadjuvant setting [ 25,26]. However,\nlarge comparative prospective trials supporting its wider use are missing.']",4.0,1.0,1.0,1.0,1,1.0,1.0,1.0,24
3G advanced RAG,Welche Rolle spielt PRRT im chirurgischen Setting bei GEP-NET?,german,specific,therapy,claude-3-opus-20240229 advanced RAG,"Basierend auf den gegebenen Informationen spielt PRRT eine vielversprechende Rolle als neoadjuvante Therapie bei inoperablen pankreatischen neuroendokrinen Tumoren (pNETs):

- PRRT, insbesondere mit 177Lu-Octreotate, kann bei initial inoperablen pNETs zu einer Tumorverkleinerung führen und so eine anschließende Operation ermöglichen [45]. In einer Studie konnten nach neoadjuvanter PRRT 31% der Patienten mit pNETs erfolgreich operiert werden.

- In einer retrospektiven Studie mit 310 pNET-Patienten, die mit 177Lu-Octreotate behandelt wurden, konnten 4 Patienten mit partiell ansprechenden, nicht-funktionellen pNETs komplett chirurgisch reseziert werden [46]. 

- Eine Studie verglich pNET-Patienten mit neoadjuvanter PRRT vor der Operation mit Patienten, die direkt operiert wurden [47]. Nach PRRT war die Rate an kurativen Resektionen 65%. Die 2-Jahres-Überlebensrate war in beiden Gruppen ähnlich, aber die PRRT-Gruppe hatte ein geringeres Risiko für postoperative Pankreasfisteln (25% vs. 65%).

Zusammengefasst deuten die Daten darauf hin, dass eine neoadjuvante PRRT bei initial inoperablen pNETs zu einer Tumorverkleinerung führen und nachfolgend eine komplette chirurgische Resektion ermöglichen kann.","['might enhance resection rates of primarily unresectable patients and\nimprove recurrence rates. PRRT seems a promising tool for SST-positive locally advanced NF-Pan-NET or even tumours with limited\ndistant metastasis (oligometastatic disease). The first clinical study by\nPartelli et al. in 2018 retrospectively compared 23 patients operatedafter PRRT with patients who had undergone upfront resection.\n48In\naddition to a higher R0 resection rate and less positive lymph nodes\nin the PRRT group, the postoperative pancreatic fistula (POPF) ratedecreased, which might be an important safety issue after this compli-\ncated type of surgery with POPF as its most dreadful complication.\nThese data must be validated in a prospective study, one of such hasrecently completed the accrual (ClinicalTrial.gov Identifier:NCT04385992), and results will be expected in 2023. Another study\nfrom India\n49assessed 57 patients with unresectable primary tumours\nof pancreatic or duodenal origin and/or potentially resectable oligo-metastatic liver lesions. PRRT with\n177Lu-DOTATATE lead to a com-\nplete or partial response in 84% of patients, and one out of four\npatients became resectable. Although these data has to be viewedwith caution due to its retrospective nature and high risk of bias, this\ntreatment strategy seems at least safe and feasible.\nIn clinical practice, chemotherapy is another potentially effective\ntreatment for neoadjuvant/preoperative purposes, given the poten-\ntially high response rate associated with this therapeutic option. How-\never, there is a need for clinical trials to assess the role ofchemotherapy in these specific settings.\n3.1.4 | Recommendations\n1. Patients with locally advanced NF-Pan-NET (stage T3 and T4) can\nbe resected safely with low mortality and acceptable morbidity riskin expert centres (Level of evidence 3: Grade of recommenda-\ntion A).\n2. Radical local resection (R0) including portal-venous resection could\nbe considered in selected cases (Level of evidence 3: Grade of rec-ommendation A).\n3. Nomograms after resection might help to estimate the risk of\nrecurrence and guide clinical follow up schedules (Level of evi-dence 3: Grade of recommendation B).\n4. Preoperative treatment with PRRT in locally advanced or oligome-\ntastatic SST-PET/CT positive grade 1 and 2 NF-Pan-NET may beconsidered in selected cases (Level of evidence 3: Grade of recom-\nmendation B).\n3.2 |Q5. What is the role of PRRT in specific\nsettings of NF-Pan- NET\nPRRT is an effective and relatively safe therapeutic option for patients\nwith NF-Pan-NET. The two-arm randomised phase II noncomparative\nOCLURANDOM trial of PRRT and sunitinib in SST-PET/CT-positiveadvanced Pan-NET patients met its primary endpoint by achieving asignificant PFS with PRRT (177Lu-DOTATATE) (median 20.7 months\nof PRRT and 11.0 months of sunitinib, respectively).\n50\nA recent retrospective study, NETTER-R, also suggested a poten-\ntial benefit of 177Lu-DOTATATE as a treatment option in Pan-NET.51\nCurrent clinical trials are focusing on the prospective evaluation\nof PRRT in Pan-NET (including G3) and in the first-line\n(NCT03972488, NCT04919226).\nIn 2020, a combined analysis of two prospective and six retro-\nspective studies using PRRT in Pan-NET was published, showing a\nmedian PFS ranging from 20 to 39 months and median OS from 37 to\n79 months (PFS and OS were comparable for gastroenteropancreatic(GEP)-NET from different locations).\n52\nThere are still limited data on the efficacy of PRRT for Pan-NET\nG3. In 2019, Zhang et al. reported the results of PRRT with177Lu/\n90Y- (DOTATATE or DOTATOC) in 69 patients, including\n46 patients with Pan-NET.', 'receiving the same combination. Authors report a CR of 13%\nand PR of 70%, with no patients manifesting a PD, and the\nmedian PFS was 48 months. Both of these studies were un-controlled and nonrandomized clinical trials. In a retrospective\nstudy, Kashyap et al. [ 37] showed favorable outcomes in pa-\ntients with\n18F-FDG PET-positive GEP-NETs with advanced\nprogressive68Ga-octreotate PET-avid disease with a combi-\nnation of 5-FU and177Lu-octreotate. Among 52 patients, they\nreport CR in 2%, PR 28%, SD 68%, and PD in only 2% of\npatients with median PFS 48 months.\nA recent randomized clinical trial by Ballal et al. [ 38]\nestablished clinical efficacy of177Lu-DOTATATE combina-\ntion with capecitabine over PRRT alone. According to\nRECIST 1.1 criteria, in the combination group, PR was\nachieved in 34%, SD in 50.2%, and PD in 6.8% of patients(compared to 6.3, 60.9, and 26.5% in the PRRT-only group,\nrespectively), and the combination group was shown to have\nlonger OS and PFS. No significant differences in hematolog-ical toxicity or hepatotoxicity were reported between both\ngroups.\nNeoadjuvant PRRT\nThe use of PRRT in patients with inoperable pNETs as neo-\nadjuvant therapy, targeting tumor shrinkage, and making it\nmore amenable to surgery is very promising. There are some\ncase reports describing the use of neoadjuvant PRRT, partic-ularly 90Y-DOTATATE in patients with pancreatic NETs who\ncould be operated on successfully after PRRT [ 39–42].\nEzzidin et al. [ 43] reported a patient with pNET and liver\nmetastases who received neoadjuvant therapy with\n177Lu-\noctreotate. There was a partial response with tumor shrinkage\nand a small residual metastatic liver lesion. The primary tumorwas then completely resected and the patient remained in CR\nlocally for 22 months postoperatively. Barber et al. [ 44]r e -\nported treating five patients with inoperable NETs with the\ncombination of\n177Lu-octreotate and 5-FU. One of them\nunderwent subsequent complete surgical resection andremained 12 months postoperatively alive and free of disease.\nVan Vliet and colleagues [ 45] studied 29 patients with a\npathology-proven nonfunctioning pNETs treated with\n177Lu-\noctreotate. After treatment, successful surgery was performedin nine patients (31%). The median PFS was 69 months for\npatients with successful surgery and 49 months for the other\npatients. Hence, neoadjuvant treatment with\n177Lu-octreotate\nis a valuable option for patients with initially unresectablepNETs.\nKwekkeboom et al. [ 46] retrospectively studied 310 patients\nwith pNETs who received treatment with\n177Lu-octreotate.\nFour patients with partially res ponding nonfunctioning pNETs\nwere able to undergo complete surgical resection. One of them\ndied postoperatively from surgi cal complications. Recently, a\nstudy abstract from the European Pancreatic Club (EPC) 2017meeting [ 47] compared patients with initially metastatic and/or\nlocally advanced pNETs who underwent neoadjuvant PRRT\nwith a group of patients who underwent upfront surgery.After PRRT, tumor size decreased from 59 to 50 mm, and the\nrate of curative resection was 65%. The 2-year progression-free\nsurvival rate was not significantly different between bothgroups (67% in neoadjuvant vs. 58% in control groups), but\nthere was a lower risk of pancreatic fistula in the neoadjuvant\ngroup (25 vs. 65%) with comparable rates of complications (45vs. 60%).', 'If GEP-NETS are resectable, surgery is the primary ap-\nproach. Patients with unresectable metastatic disease usually\ngo through multiple lines of treatments including somatostatin\nanalogue (SSA) therapy or targeted therapy, such as everoli-mus (mTOR inhibitor) or sunitinib (tyrosine kinase inhibitor)\n[7]. In patients with grade 1 and 2 NETs (Ki-7 LI of up to\n20%) that are inoperable and metastatic, who have failed first-\nline somatostatin treatment, and whose tumors express high\nlevels of somatostatin receptors (SSTRs), peptide receptor ra-\ndionuclide therapy (PRRT) would be a viable option. PRRTusually involves DOTATOC, DOTATATE, and DOTANOC\nlabeled either with\n90Yor177Lu [7]. Patients included in study\nprotocols have positive NET histology and SSTR scintigraphy\nwith111In OctreoScan or68Ga PET-Dota-peptide (Fig. 1). A\npositive scan denotes lesion uptake that is equal to or greaterthan the liver uptake [ 8]. Important criteria to be taken into\naccount when considering PRRT include objective disease\nprogression, adequate blood profile (hemoglobin, white cell,\nand platelet count levels), creatinine, and ECOG performancescore ≤2[8]. A good performance status means the patient\nwould be self-sufficient and reduces the need for physicalassistance during the treatment period (3 days/cycle).Recently published European Society for Medical Oncology\n(ESMO) Clinical Practice Guidelines have recommended\nPRRT up to the upper limit of Ki-67 LI to 30% [ 9].\nScintigraphic or PET tomoscintigraphic evaluation is to datethe most accurate noninvasive method to identify and confirmthe overexpression of functioning receptors [ 10]. An impor-\ntant issue in the consideration of PRRT is that the somatostatinreceptors should be functional, i.e., able to internalize the re-ceptor analogue complex and retain the radioactivity inside\nthe cell. The critical issues for effective therapy are somato-\nstatin receptor overexpression and the evidence of functional-ity. The nuclear physician can calculate a tumor-to-liver ratio\nas a relative measure of receptor number [ 11]; this ratio must\nbe high for PRRT eligibility.Mechanism of Action and Constituents\nof Radiolabeled SSAs\nSomatostatin ’s actions include inhibiting hormone secretion,\nsuppressing the release of insulin-like growth factors,\ninhibiting angiogenesis, and inducing apoptosis in the tumor\ntissue [ 12]. Such biologic effects are mediated through inter-\naction with five subtypes of somatostatin receptors (SSTR1-\n5), which belong to the seven-transmembrane domain, G-\nprotein-coupled receptor superfamily. The currently approvedSSAs are octreotide and lanreotide, in slow-release formula-\ntions, long-acting release (LAR), and supersaturated solution\n(Autogel®).\nDue to the overexpression of SSTRs in NETs, which is\nestimated to be in around 80% of NETs, they are consideredsuitable targets for PRRT with radiolabeled SSA. Once boundto their receptor, radiolabeled SSAs are internalized as per\nnormal receptor recycling dynamics, and the breakdown prod-\nucts of the radiolabeled peptides are stored in lysosomes, thusenabling delivery and causing suspension of radioactivity in-\nside the tumor cell [ 13]. This would result in radiation-induced\nDNA damage of the tumor cell and its eventual death.\nRadiolabeled SSAs are made up of three main constituents;\na radionuclide isotope, a ligand or carrier molecule (TOC or\nTATE), and a chelator or linker (DOTA) that binds them to-\ngether and stabilizes the complex (Fig. 2). Chelators mainly\nused include DOTA (tetraazacyclododecane tetra-acetic acid)\nand DTPA (diethylenetriamine penta-acetic acid), while\noctreotide and octreotate (TOC and TATE, respectively) are\ngenerally used as ligands [ 14]. The most known and studied\nSSA is octreotide.']",3.0,1.0,1.0,1.0,0,1.0,1.0,1.0,154
3E advanced RAG,What is the place of using PRRT in the surgical setting in GEP-NET?,english,specific,therapy,claude-3-opus-20240229 advanced RAG,"Based on the given context, PRRT can be used in both neoadjuvant and adjuvant settings for the surgical treatment of gastroenteropancreatic neuroendocrine tumors (GEP-NETs):

Neoadjuvant PRRT: PRRT can be used as neoadjuvant therapy in patients with inoperable pancreatic NETs, aiming for tumor shrinkage to make the tumor more amenable to surgery [Hirmas et al., 2018]. Several case reports and studies have shown successful surgical resection of pancreatic NETs after neoadjuvant PRRT with 90Y-DOTATATE or 177Lu-octreotate [Hirmas et al., 2018].

Adjuvant PRRT: PRRT may also be used in an adjuvant setting after surgery of GEP-NETs to prevent tumor growth after surgical manipulation or further growth of pre-existing micrometastases. However, there is limited evidence from studies on the best treatment approach for adjuvant PRRT [Hirmas et al., 2018].

In summary, neoadjuvant PRRT appears to be a valuable option for initially unresectable pancreatic NETs, while more research is needed to establish the role of adjuvant PRRT after GEP-NET surgery.","['receiving the same combination. Authors report a CR of 13%\nand PR of 70%, with no patients manifesting a PD, and the\nmedian PFS was 48 months. Both of these studies were un-controlled and nonrandomized clinical trials. In a retrospective\nstudy, Kashyap et al. [ 37] showed favorable outcomes in pa-\ntients with\n18F-FDG PET-positive GEP-NETs with advanced\nprogressive68Ga-octreotate PET-avid disease with a combi-\nnation of 5-FU and177Lu-octreotate. Among 52 patients, they\nreport CR in 2%, PR 28%, SD 68%, and PD in only 2% of\npatients with median PFS 48 months.\nA recent randomized clinical trial by Ballal et al. [ 38]\nestablished clinical efficacy of177Lu-DOTATATE combina-\ntion with capecitabine over PRRT alone. According to\nRECIST 1.1 criteria, in the combination group, PR was\nachieved in 34%, SD in 50.2%, and PD in 6.8% of patients(compared to 6.3, 60.9, and 26.5% in the PRRT-only group,\nrespectively), and the combination group was shown to have\nlonger OS and PFS. No significant differences in hematolog-ical toxicity or hepatotoxicity were reported between both\ngroups.\nNeoadjuvant PRRT\nThe use of PRRT in patients with inoperable pNETs as neo-\nadjuvant therapy, targeting tumor shrinkage, and making it\nmore amenable to surgery is very promising. There are some\ncase reports describing the use of neoadjuvant PRRT, partic-ularly 90Y-DOTATATE in patients with pancreatic NETs who\ncould be operated on successfully after PRRT [ 39–42].\nEzzidin et al. [ 43] reported a patient with pNET and liver\nmetastases who received neoadjuvant therapy with\n177Lu-\noctreotate. There was a partial response with tumor shrinkage\nand a small residual metastatic liver lesion. The primary tumorwas then completely resected and the patient remained in CR\nlocally for 22 months postoperatively. Barber et al. [ 44]r e -\nported treating five patients with inoperable NETs with the\ncombination of\n177Lu-octreotate and 5-FU. One of them\nunderwent subsequent complete surgical resection andremained 12 months postoperatively alive and free of disease.\nVan Vliet and colleagues [ 45] studied 29 patients with a\npathology-proven nonfunctioning pNETs treated with\n177Lu-\noctreotate. After treatment, successful surgery was performedin nine patients (31%). The median PFS was 69 months for\npatients with successful surgery and 49 months for the other\npatients. Hence, neoadjuvant treatment with\n177Lu-octreotate\nis a valuable option for patients with initially unresectablepNETs.\nKwekkeboom et al. [ 46] retrospectively studied 310 patients\nwith pNETs who received treatment with\n177Lu-octreotate.\nFour patients with partially res ponding nonfunctioning pNETs\nwere able to undergo complete surgical resection. One of them\ndied postoperatively from surgi cal complications. Recently, a\nstudy abstract from the European Pancreatic Club (EPC) 2017meeting [ 47] compared patients with initially metastatic and/or\nlocally advanced pNETs who underwent neoadjuvant PRRT\nwith a group of patients who underwent upfront surgery.After PRRT, tumor size decreased from 59 to 50 mm, and the\nrate of curative resection was 65%. The 2-year progression-free\nsurvival rate was not significantly different between bothgroups (67% in neoadjuvant vs. 58% in control groups), but\nthere was a lower risk of pancreatic fistula in the neoadjuvant\ngroup (25 vs. 65%) with comparable rates of complications (45vs. 60%).', 'One of them\ndied postoperatively from surgi cal complications. Recently, a\nstudy abstract from the European Pancreatic Club (EPC) 2017meeting [ 47] compared patients with initially metastatic and/or\nlocally advanced pNETs who underwent neoadjuvant PRRT\nwith a group of patients who underwent upfront surgery.After PRRT, tumor size decreased from 59 to 50 mm, and the\nrate of curative resection was 65%. The 2-year progression-free\nsurvival rate was not significantly different between bothgroups (67% in neoadjuvant vs. 58% in control groups), but\nthere was a lower risk of pancreatic fistula in the neoadjuvant\ngroup (25 vs. 65%) with comparable rates of complications (45vs. 60%).\nAdjuvant PRRT\nPRRT may also be used in an adjuvant setting after surgery ofGEP-NETs, preventing tumor growth after surgical manipula-tion or preventing further growth of pre-existing\nmicrometastases. Unfortunately, only a handful of studiesare available on postoperative treatment with PRRT. Thereare no published randomized trials on adjuvant PRRT favor-\ning any evidence on the best treatment approach in this subset\nof patients.\nOne study [ 48]i n c l u d e dp a t i e n t sw i t hG 1 –G2 pNETs and\nsynchronous liver metastases who were not eligible for liversurgery but were amenable to upfront PRRT. The prospectivestudy followed 94 patients, 31 of whom previously underwent\nprimary resection while the rest had no previous surgeries\nperformed. Both groups were treated with PRRT, either\n90Y-\nDOTATOC or177Lu-DOTATATE. The resection of the prima-\nry tumor was significantly associated with better PR or SDafter PRRT and longer median PFS and OS for operated ver-sus non-operated patients. In this study, only patients with\nsynchronous pNET and liver metastases treated with PRRT\nwere considered, excluding those who underwent primary tu-mor and liver surgery with radical intent. Patients affected by a\nG3 tumor according to the WHO 2010 classification and those\nwho had undergone PRRT at disease progression under so-matostatin analogs were excluded.\nEven though it did not cover surgery per se, one study [ 49]\ncompared patients who received PRRTwho had received priorchemo or radionuclide hepatic embolization (CRHE) with\nthose who did not have any prior history of such intervention.\nA total of 70% of patients who had CRHE (compared to56.5% who did not) experienced benefit from\n177Lu PRRT,\nand 21.6% who had CRHE (compared to 35.8% who did not)experienced progression. Patients with a pervious history of\nCRHE also showed more SD and less PD following PRRT\nwhen compared to the patients who did not have any priorCRHE, but the probability of developing CR and PR is not\nstatistically different between both groups.\nTo detect a difference in survival and/or tumor recurrence\nrate in patients treated with and without adjuvant PRRT, alarge, multicenter trial with several years of follow-up would\nbe needed.Nucl Med Mol Imaging (2018) 52:190 –199 195', 'If GEP-NETS are resectable, surgery is the primary ap-\nproach. Patients with unresectable metastatic disease usually\ngo through multiple lines of treatments including somatostatin\nanalogue (SSA) therapy or targeted therapy, such as everoli-mus (mTOR inhibitor) or sunitinib (tyrosine kinase inhibitor)\n[7]. In patients with grade 1 and 2 NETs (Ki-7 LI of up to\n20%) that are inoperable and metastatic, who have failed first-\nline somatostatin treatment, and whose tumors express high\nlevels of somatostatin receptors (SSTRs), peptide receptor ra-\ndionuclide therapy (PRRT) would be a viable option. PRRTusually involves DOTATOC, DOTATATE, and DOTANOC\nlabeled either with\n90Yor177Lu [7]. Patients included in study\nprotocols have positive NET histology and SSTR scintigraphy\nwith111In OctreoScan or68Ga PET-Dota-peptide (Fig. 1). A\npositive scan denotes lesion uptake that is equal to or greaterthan the liver uptake [ 8]. Important criteria to be taken into\naccount when considering PRRT include objective disease\nprogression, adequate blood profile (hemoglobin, white cell,\nand platelet count levels), creatinine, and ECOG performancescore ≤2[8]. A good performance status means the patient\nwould be self-sufficient and reduces the need for physicalassistance during the treatment period (3 days/cycle).Recently published European Society for Medical Oncology\n(ESMO) Clinical Practice Guidelines have recommended\nPRRT up to the upper limit of Ki-67 LI to 30% [ 9].\nScintigraphic or PET tomoscintigraphic evaluation is to datethe most accurate noninvasive method to identify and confirmthe overexpression of functioning receptors [ 10]. An impor-\ntant issue in the consideration of PRRT is that the somatostatinreceptors should be functional, i.e., able to internalize the re-ceptor analogue complex and retain the radioactivity inside\nthe cell. The critical issues for effective therapy are somato-\nstatin receptor overexpression and the evidence of functional-ity. The nuclear physician can calculate a tumor-to-liver ratio\nas a relative measure of receptor number [ 11]; this ratio must\nbe high for PRRT eligibility.Mechanism of Action and Constituents\nof Radiolabeled SSAs\nSomatostatin ’s actions include inhibiting hormone secretion,\nsuppressing the release of insulin-like growth factors,\ninhibiting angiogenesis, and inducing apoptosis in the tumor\ntissue [ 12]. Such biologic effects are mediated through inter-\naction with five subtypes of somatostatin receptors (SSTR1-\n5), which belong to the seven-transmembrane domain, G-\nprotein-coupled receptor superfamily. The currently approvedSSAs are octreotide and lanreotide, in slow-release formula-\ntions, long-acting release (LAR), and supersaturated solution\n(Autogel®).\nDue to the overexpression of SSTRs in NETs, which is\nestimated to be in around 80% of NETs, they are consideredsuitable targets for PRRT with radiolabeled SSA. Once boundto their receptor, radiolabeled SSAs are internalized as per\nnormal receptor recycling dynamics, and the breakdown prod-\nucts of the radiolabeled peptides are stored in lysosomes, thusenabling delivery and causing suspension of radioactivity in-\nside the tumor cell [ 13]. This would result in radiation-induced\nDNA damage of the tumor cell and its eventual death.\nRadiolabeled SSAs are made up of three main constituents;\na radionuclide isotope, a ligand or carrier molecule (TOC or\nTATE), and a chelator or linker (DOTA) that binds them to-\ngether and stabilizes the complex (Fig. 2). Chelators mainly\nused include DOTA (tetraazacyclododecane tetra-acetic acid)\nand DTPA (diethylenetriamine penta-acetic acid), while\noctreotide and octreotate (TOC and TATE, respectively) are\ngenerally used as ligands [ 14]. The most known and studied\nSSA is octreotide.']",2.0,1.0,1.0,1.0,1,1.0,0.0,0.5,156
4G advanced RAG,Was ist Peptidrezeptor-Radionuklid-Therapie (PRRT)?,german,general,definition,claude-3-opus-20240229 advanced RAG,"Peptidrezeptor-Radionuklid-Therapie (PRRT) ist eine Behandlungsmethode für inoperable oder metastasierte neuroendokrine Neoplasien, die Somatostatinrezeptoren in hoher Dichte exprimieren. PRRT liefert zytotoxische Strahlung gezielt an Tumorzellen durch die spezifische Bindung eines radioaktiv markierten Peptids an ein molekulares Target [1]. Dabei werden hauptsächlich β--Strahler wie 177Lu und 90Y eingesetzt, aber auch zunehmend α-Strahler in verschiedenen klinischen Anwendungen untersucht [1].","['If GEP-NETS are resectable, surgery is the primary ap-\nproach. Patients with unresectable metastatic disease usually\ngo through multiple lines of treatments including somatostatin\nanalogue (SSA) therapy or targeted therapy, such as everoli-mus (mTOR inhibitor) or sunitinib (tyrosine kinase inhibitor)\n[7]. In patients with grade 1 and 2 NETs (Ki-7 LI of up to\n20%) that are inoperable and metastatic, who have failed first-\nline somatostatin treatment, and whose tumors express high\nlevels of somatostatin receptors (SSTRs), peptide receptor ra-\ndionuclide therapy (PRRT) would be a viable option. PRRTusually involves DOTATOC, DOTATATE, and DOTANOC\nlabeled either with\n90Yor177Lu [7]. Patients included in study\nprotocols have positive NET histology and SSTR scintigraphy\nwith111In OctreoScan or68Ga PET-Dota-peptide (Fig. 1). A\npositive scan denotes lesion uptake that is equal to or greaterthan the liver uptake [ 8]. Important criteria to be taken into\naccount when considering PRRT include objective disease\nprogression, adequate blood profile (hemoglobin, white cell,\nand platelet count levels), creatinine, and ECOG performancescore ≤2[8]. A good performance status means the patient\nwould be self-sufficient and reduces the need for physicalassistance during the treatment period (3 days/cycle).Recently published European Society for Medical Oncology\n(ESMO) Clinical Practice Guidelines have recommended\nPRRT up to the upper limit of Ki-67 LI to 30% [ 9].\nScintigraphic or PET tomoscintigraphic evaluation is to datethe most accurate noninvasive method to identify and confirmthe overexpression of functioning receptors [ 10]. An impor-\ntant issue in the consideration of PRRT is that the somatostatinreceptors should be functional, i.e., able to internalize the re-ceptor analogue complex and retain the radioactivity inside\nthe cell. The critical issues for effective therapy are somato-\nstatin receptor overexpression and the evidence of functional-ity. The nuclear physician can calculate a tumor-to-liver ratio\nas a relative measure of receptor number [ 11]; this ratio must\nbe high for PRRT eligibility.Mechanism of Action and Constituents\nof Radiolabeled SSAs\nSomatostatin ’s actions include inhibiting hormone secretion,\nsuppressing the release of insulin-like growth factors,\ninhibiting angiogenesis, and inducing apoptosis in the tumor\ntissue [ 12]. Such biologic effects are mediated through inter-\naction with five subtypes of somatostatin receptors (SSTR1-\n5), which belong to the seven-transmembrane domain, G-\nprotein-coupled receptor superfamily. The currently approvedSSAs are octreotide and lanreotide, in slow-release formula-\ntions, long-acting release (LAR), and supersaturated solution\n(Autogel®).\nDue to the overexpression of SSTRs in NETs, which is\nestimated to be in around 80% of NETs, they are consideredsuitable targets for PRRT with radiolabeled SSA. Once boundto their receptor, radiolabeled SSAs are internalized as per\nnormal receptor recycling dynamics, and the breakdown prod-\nucts of the radiolabeled peptides are stored in lysosomes, thusenabling delivery and causing suspension of radioactivity in-\nside the tumor cell [ 13]. This would result in radiation-induced\nDNA damage of the tumor cell and its eventual death.\nRadiolabeled SSAs are made up of three main constituents;\na radionuclide isotope, a ligand or carrier molecule (TOC or\nTATE), and a chelator or linker (DOTA) that binds them to-\ngether and stabilizes the complex (Fig. 2). Chelators mainly\nused include DOTA (tetraazacyclododecane tetra-acetic acid)\nand DTPA (diethylenetriamine penta-acetic acid), while\noctreotide and octreotate (TOC and TATE, respectively) are\ngenerally used as ligands [ 14]. The most known and studied\nSSA is octreotide.', 'Symptomatic relief was encountered in this therapy in patients\nwith metastasized GEP-NETs. However, objective tumor re-sponses were rare [ 15,16]. The next generation of analogues\nused in PRRT consisted of [Tyr3]octreotide as a somatostatinanalogue and DOTA as a chelator (instead of DTPA), whichallows stable binding of the β-emitting radionuclide\n90Y . Its\nmaximal tissue penetration is 12 mm and its half-life is2.7 days. [\n90Y-DOTA0,Tyr3]octreotide (90Y-DOTATOC) was\nused in multiple phase I and phase II PRRT trials across sev-\neral countries [ 17–24], with reported objective responses rang-\ning from 4 to 33%. It is mainly due to differences in cycle\ndoses, administered cumulative dose, as well as variabilities\nin patients ’characteristics (such as various tumor types and\npatient performance statuses) that make these studies very dif-\nficult to compare. Different studies report median progression-free survival (PFS) varying from 17 to 29 months and medianoverall survival (OS) from 22 to 37 months [ 21–24].\n177Lu-DOTATATE is currently the most widely used\nradiopeptide for PRRT [ 21]. It has shown similar efficacy\nwhen compared to90Y-DOTATOC, while showing a more\nfavorable toxicity profile, especially when speaking of hema-\ntological and renal toxicity [ 25,26]. In a recent study on bron-\nchial and GEP-NETs, Brabander et al. [ 27] evaluated safety,\nefficacy and toxicity of177Lu-DOTATATE and showed im-\npressive results. The objective response rate (ORR) reached\n39%, stable disease (SD) was reported in 43% of patients, andthe PFS and OS for all NET patients were 29 and 63 months,\nrespectively (Fig. 3).\nWith time, the use of PRRT which initially targeted\nNETs was extended to other types of confirmed SSTR-positive tumors. Tumors such as breast cancer, lymphoma,\nglioma, meningioma, and paraganglioma, as well as non-\niodine-absorbing differentiated thyroid cancer can now be\nconsidered for PRRT when registered therapies have failed[8].\n177Lu Radionuclide and NETTER-1 Trial\nThe Neuroendocrine Tumors Therapy (NETTER-1) trial is thefirst randomized controlled trial that evaluated the efficacy\nFig. 1 aMIP image of68Ga\nDOTATOC PET shows the\nprimary NET in the small bowel\non the right side of the abdomen\n(red arrow) with extensive livermetastases, both demonstratingintense increased radiotracer\nuptake reflecting the high\nexpression of the somatostatinreceptors. The axial PET image\n(b), CT image ( c), and fused PET/\nCT image ( d) show the extensive\nliver metastases\nFig. 2 An illustration showing the main components of PRRT: a\nradionuclide isotope like90Y , and177Lu, a ligand or carrier molecule\nlike TATE or TOC, and a chelator or linker like DOTA that binds themtogether and stabilizes the complex192 Nucl Med Mol Imaging (2018) 52:190 –199', 'FOCUS ON MOLECULAR IMAGING\nNew Developments in Peptide Receptor Radionuclide Therapy\nGuillaume P. Nicolas1, Alfred Morgenstern2, Margret Schottelius3, and Melpomeni Fani4\n1Division of Nuclear Medicine, University Hospital Basel, University of Basel, Basel, Switzerland;2Joint Research Centre,\nDirectorate for Nuclear Safety and Security, European Commission, Karlsruhe, Germany;3Institute of Pharmaceutical\nRadiochemistry, Technische Universit¨ at M¨ unchen, Garching, Germany; and4Division of Radiopharmaceutical Chemistry, University\nHospital Basel, University of Basel, Basel, Switzerland\nPeptide receptor radionuclide therapy (PRRT) is an established\ntreatment for nonoperable or metastatic neuroendocrine neoplasms\nthat highly and frequently express somatostatin receptors. More\ngenerally, PRRT is an attractive therapy option for delivering\ncytotoxic radiation to tumor ce lls through speciﬁc binding of a\nradiolabeled peptide to a molecular target. The development of\nimaging companions gave rise to the concept of radiotheranostics,\nimportant for in vivo tumor detection, characterization, and staging\nbut also, and more importantly, for individual patient selection and\ntreatment. The success of somatostatin receptor targeting paved\nthe way for the clinical translation of other peptide-based radio-\npharmaceuticals targeting, for example, the receptors cholecysto-\nkinin 2, gastrin-releasing peptide, neurokinin-1, and C-X-C motif\nchemokine 4. Although historically the Auger emitter111In and the\nhigh-energy β−emitter90Y were used, most PRRT are currently\nperformed with the medium-energy β−emitter177Lu, whereas α\nemitters are increasingly studied in various clinical applications.\nKey Words: targeted radionuclide therapy; theranostics; G-protein\ncoupled receptors; beta radiation therapy; alpha radiation therapy\nJ Nucl Med 2019; 60:167–171\nDOI: 10.2967/jnumed.118.213496\nP eptide receptor radionuclide therapy (PRRT) is part of the\nwider concept of targeted radionuclide therapy. PRRT delivers\ndestructive radiation to cancer cells via radiolabeled peptides able\nto bind speciﬁcally to peptide receptors expressed in higher den-\nsity on the tumor cell membrane than in nontumor tissues. This is\nthe case for many G-protein–coupled receptors, whose overex-\npression is linked to numerous human malignancies. Regulatory\npeptides targeting G-protein–coupled receptors are a rich source\nof vectors ( 1) that can be chemically tuned to transport radioac-\ntivity while preserving their receptor afﬁnity. PRRT is used in the\ntreatment of metastatic or unresectable cancers through systemic\nor, more occasionally, locoregional administration.\nThree types of radiation are used in PRRT: b2particles (elec-\ntrons), aparticles, and Auger electrons ( 2), with a strong focus on\nb2emitters (e.g.,177Lu and90Y). Because bparticles have a long\nrange in tissues (0.05–12 mm), neighboring cells around thetargeted cell are also irradiated (cross-ﬁre effect). This effect is\nconsidered ideal for targeting large tumors with a heterogeneous\ntarget distribution. In contrast, aparticles (e.g.,213Bi and225Ac)\nhave a very short range in tissues (20–100 mm), irradiating vol-\numes with cellular dimensions and therefore sparing normal sur-\nrounding tissues from cytotoxic radiation. Their linear energy\ntransfer is much higher than the one of b2particles (50–230 vs.\n0.2 keV/ mm), making aradiation far more cytotoxic. Finally,\nAuger emitters (e.g.,111In), having a very short range in tissue\n(,20mm, subcellular dimensions) and intermediate linear energy\ntransfer (4–25 keV/ mm), may be better suited for targeting micro-\nscopic disease (i.e., micrometastases), such as in the adjuvant set-\nting. All above-mentioned radionuclides are radiometals ( Table 1).']",3.0,1.0,1.0,1.0,0,1.0,1.0,1.0,56
4E advanced RAG,What is Peptide Receptor Radionuclide Therapy (PRRT)?,english,general,definition,claude-3-opus-20240229 advanced RAG,"Peptide Receptor Radionuclide Therapy (PRRT) is a treatment option for patients with inoperable and metastatic grade 1 and 2 neuroendocrine tumors (NETs) that express high levels of somatostatin receptors (SSTRs) and have failed first-line somatostatin treatment [1]. PRRT involves radiolabeled somatostatin analogues, usually DOTATOC, DOTATATE, and DOTANOC labeled with 90Y or 177Lu [1]. These radiolabeled somatostatin analogues consist of three main components: a radionuclide isotope, a ligand or carrier molecule (like TATE or TOC), and a chelator or linker (like DOTA) that binds them together and stabilizes the complex [1,2]. When bound to their receptor, the radiolabeled somatostatin analogues are internalized, causing retention of radioactivity inside the tumor cell, resulting in radiation-induced DNA damage and eventual cell death [1].","['If GEP-NETS are resectable, surgery is the primary ap-\nproach. Patients with unresectable metastatic disease usually\ngo through multiple lines of treatments including somatostatin\nanalogue (SSA) therapy or targeted therapy, such as everoli-mus (mTOR inhibitor) or sunitinib (tyrosine kinase inhibitor)\n[7]. In patients with grade 1 and 2 NETs (Ki-7 LI of up to\n20%) that are inoperable and metastatic, who have failed first-\nline somatostatin treatment, and whose tumors express high\nlevels of somatostatin receptors (SSTRs), peptide receptor ra-\ndionuclide therapy (PRRT) would be a viable option. PRRTusually involves DOTATOC, DOTATATE, and DOTANOC\nlabeled either with\n90Yor177Lu [7]. Patients included in study\nprotocols have positive NET histology and SSTR scintigraphy\nwith111In OctreoScan or68Ga PET-Dota-peptide (Fig. 1). A\npositive scan denotes lesion uptake that is equal to or greaterthan the liver uptake [ 8]. Important criteria to be taken into\naccount when considering PRRT include objective disease\nprogression, adequate blood profile (hemoglobin, white cell,\nand platelet count levels), creatinine, and ECOG performancescore ≤2[8]. A good performance status means the patient\nwould be self-sufficient and reduces the need for physicalassistance during the treatment period (3 days/cycle).Recently published European Society for Medical Oncology\n(ESMO) Clinical Practice Guidelines have recommended\nPRRT up to the upper limit of Ki-67 LI to 30% [ 9].\nScintigraphic or PET tomoscintigraphic evaluation is to datethe most accurate noninvasive method to identify and confirmthe overexpression of functioning receptors [ 10]. An impor-\ntant issue in the consideration of PRRT is that the somatostatinreceptors should be functional, i.e., able to internalize the re-ceptor analogue complex and retain the radioactivity inside\nthe cell. The critical issues for effective therapy are somato-\nstatin receptor overexpression and the evidence of functional-ity. The nuclear physician can calculate a tumor-to-liver ratio\nas a relative measure of receptor number [ 11]; this ratio must\nbe high for PRRT eligibility.Mechanism of Action and Constituents\nof Radiolabeled SSAs\nSomatostatin ’s actions include inhibiting hormone secretion,\nsuppressing the release of insulin-like growth factors,\ninhibiting angiogenesis, and inducing apoptosis in the tumor\ntissue [ 12]. Such biologic effects are mediated through inter-\naction with five subtypes of somatostatin receptors (SSTR1-\n5), which belong to the seven-transmembrane domain, G-\nprotein-coupled receptor superfamily. The currently approvedSSAs are octreotide and lanreotide, in slow-release formula-\ntions, long-acting release (LAR), and supersaturated solution\n(Autogel®).\nDue to the overexpression of SSTRs in NETs, which is\nestimated to be in around 80% of NETs, they are consideredsuitable targets for PRRT with radiolabeled SSA. Once boundto their receptor, radiolabeled SSAs are internalized as per\nnormal receptor recycling dynamics, and the breakdown prod-\nucts of the radiolabeled peptides are stored in lysosomes, thusenabling delivery and causing suspension of radioactivity in-\nside the tumor cell [ 13]. This would result in radiation-induced\nDNA damage of the tumor cell and its eventual death.\nRadiolabeled SSAs are made up of three main constituents;\na radionuclide isotope, a ligand or carrier molecule (TOC or\nTATE), and a chelator or linker (DOTA) that binds them to-\ngether and stabilizes the complex (Fig. 2). Chelators mainly\nused include DOTA (tetraazacyclododecane tetra-acetic acid)\nand DTPA (diethylenetriamine penta-acetic acid), while\noctreotide and octreotate (TOC and TATE, respectively) are\ngenerally used as ligands [ 14]. The most known and studied\nSSA is octreotide.', 'J. Clin. Med. 2021 ,10, 1267 2 of 15\n(SSTR). For many years, evidence of an anti-tumor effect of PRRT were only obtained from\nnon-randomized Phase II trials or retrospective studies. The NETTER-1 Phase III Random-\nized Trial finally validated this treatment option by confirming its low toxicity but also its\neffectiveness in tumor control. Following these results,177Lu-DOTATATE was approved by\nthe US Food and Drug Administration in 2018 and the European Medicines Agency in 2017\nfor the treatment of gastroenteropancreatic NETs that are well differentiated and obtain a\nprescription authorization in France in metastatic midgut NETs [ 2]. Some interesting data\nexist for pancreatic and pulmonary NETs. In this review, we discuss the clinical efficiency of\nPRRT in gastroenteropancreatic and pulmonary NETs.\n2. Somatostatin Receptors (SSTR) and Radio-Labelled Somatostatin Analogues\nEffect of PRRT is correlated with the ability for the markers to ﬁx the SSTR (SSTR1-5).\nThis therapy is therefore dedicated to NETs who strongly over expressed those receptors.\nSSTRs belong to a family of G-protein coupled receptors with seven transmembrane\ndomains. The majority of well differentiated gastroenteropancreatic and pulmonary NETs\nare characterized by the strong expression of SSTR, including SSTR2 Grade 1/2 NETs\nexpress the SSTR more often and at higher levels than grade 3 NETs. When linked to the\nreceptors, radiolabeled somatostatin analogues are internalized according to the normal\nrecycling dynamics of membrane receptors and the degradation products of peptides\nare stored in lysosomes, in intracellular, which allows for the release and retention of\nradioactivity inside tumor cells [ 3]. This mechanism accounts for the low toxicity of the\nPRRT on the healthy cells. Radiolabelled somatostatin analogs are made up of an isotope\nradionuclide, a carrier molecule (derived from octreotide), and a chelating agent that binds\nthem together and stabilizes the complex. The commonly used chelating agents are DOTA\n(DOTA acid and tetra-azacyclododecane-tetra-acetic) and DTPA (di-ethylenetriamine penta-\naceticacid). Three radionucleides (111In,90Y and177Lu) were conjugated to the somatostatin\nanalogues and their different physical characteristics confer speciﬁc advantages. The90Y\nand177Lu emit beta particles with higher energy and longer ranges, which translates into\ngreater therapeutic potential. Due to the emission of gamma rays, the177Lu can also be\nused for dosimetry and monitoring of tumor response [4].\n3. Modalities of Realization and Patients Selection\nPRRT is the single validated treatment option in the NETs, which for there is a pre-\ndictive marker of answer: the expression of SSTR. Response rates have been shown to\nbe increased in patients with a higher degree of absorption of radiotracers in the case of\n111In-pentetreotid scintigraphy An overall response rate of approximately 60% has been\nreported in patients with a grade 4 according to the Krenning score, corresponding to a tu-\nmor absorption greater than that of the spleen, and kidneys. Intense ﬁxation (SUV) greater\nthan 16 on the68Ga-DOTATOC PET/CT is a predictive marker of high tumor response\n(sensitivity: 95%; specﬁcity: 60 %) [ 5] (Figure 1). The effectiveness of PRRT is correlated\nwith the tumor volume and the location of the primary tumor (amount of SSTR present\non the tumor cell) (Figure 2). Thus, NETs with high liver tumor volume are considered\nto be less sensitive to PRRT [ 6]. Similarly, it is suggested that pancreatic NETs frequently\nrespond to the PRRT but with an earlier progression than in midgut NETs. The treatment\nmodalities are relatively standardized in France with a treatment carried out by infusion\nof radiolabel split in four cycles spaced eight weeks apart.', 'Symptomatic relief was encountered in this therapy in patients\nwith metastasized GEP-NETs. However, objective tumor re-sponses were rare [ 15,16]. The next generation of analogues\nused in PRRT consisted of [Tyr3]octreotide as a somatostatinanalogue and DOTA as a chelator (instead of DTPA), whichallows stable binding of the β-emitting radionuclide\n90Y . Its\nmaximal tissue penetration is 12 mm and its half-life is2.7 days. [\n90Y-DOTA0,Tyr3]octreotide (90Y-DOTATOC) was\nused in multiple phase I and phase II PRRT trials across sev-\neral countries [ 17–24], with reported objective responses rang-\ning from 4 to 33%. It is mainly due to differences in cycle\ndoses, administered cumulative dose, as well as variabilities\nin patients ’characteristics (such as various tumor types and\npatient performance statuses) that make these studies very dif-\nficult to compare. Different studies report median progression-free survival (PFS) varying from 17 to 29 months and medianoverall survival (OS) from 22 to 37 months [ 21–24].\n177Lu-DOTATATE is currently the most widely used\nradiopeptide for PRRT [ 21]. It has shown similar efficacy\nwhen compared to90Y-DOTATOC, while showing a more\nfavorable toxicity profile, especially when speaking of hema-\ntological and renal toxicity [ 25,26]. In a recent study on bron-\nchial and GEP-NETs, Brabander et al. [ 27] evaluated safety,\nefficacy and toxicity of177Lu-DOTATATE and showed im-\npressive results. The objective response rate (ORR) reached\n39%, stable disease (SD) was reported in 43% of patients, andthe PFS and OS for all NET patients were 29 and 63 months,\nrespectively (Fig. 3).\nWith time, the use of PRRT which initially targeted\nNETs was extended to other types of confirmed SSTR-positive tumors. Tumors such as breast cancer, lymphoma,\nglioma, meningioma, and paraganglioma, as well as non-\niodine-absorbing differentiated thyroid cancer can now be\nconsidered for PRRT when registered therapies have failed[8].\n177Lu Radionuclide and NETTER-1 Trial\nThe Neuroendocrine Tumors Therapy (NETTER-1) trial is thefirst randomized controlled trial that evaluated the efficacy\nFig. 1 aMIP image of68Ga\nDOTATOC PET shows the\nprimary NET in the small bowel\non the right side of the abdomen\n(red arrow) with extensive livermetastases, both demonstratingintense increased radiotracer\nuptake reflecting the high\nexpression of the somatostatinreceptors. The axial PET image\n(b), CT image ( c), and fused PET/\nCT image ( d) show the extensive\nliver metastases\nFig. 2 An illustration showing the main components of PRRT: a\nradionuclide isotope like90Y , and177Lu, a ligand or carrier molecule\nlike TATE or TOC, and a chelator or linker like DOTA that binds themtogether and stabilizes the complex192 Nucl Med Mol Imaging (2018) 52:190 –199']",3.0,1.0,1.0,1.0,0,1.0,1.0,1.0,119
5G advanced RAG,Wie viele PRRT-Behandlungen kann man bekommen?,german,specific,therapy,claude-3-opus-20240229 advanced RAG,"Basierend auf den gegebenen Informationen kann man in der Regel bis zu vier Zyklen einer PRRT mit 177Lu-DOTATATE erhalten [1]. Falls der Patient mindestens 18 Monate nach dem ersten Zyklus ein Tumoransprechen zeigte, kann bei erneutem Krankheitsfortschritt eine erneute Behandlung (R-PRRT) mit zwei zusätzlichen Zyklen von je 7,4 GBq in Betracht gezogen werden [1]. In Fällen, in denen die R-PRRT einen zusätzlichen Nutzen für das Tumoransprechen und ein verlängertes progressionsfreies Überleben gezeigt hat, kann zum Zeitpunkt des Fortschreitens eine weitere erneute Behandlung erwogen werden [2].

Referenzen:
[1] A Clinical Guide to Peptide Receptor Radionuclide Therapy. Cancers. 2022;14:5792. Seite 6.
[2] A Clinical Guide to Peptide Receptor Radionuclide Therapy. Cancers. 2022;14:5792. Seite 6.","['Cancers 2022 ,14, 5792 6 of 17\nwhich an antiemetic, typically ondansetron or granisetron, should be given prophylactically\nbefore the start of the infusion.177Lu-DOTATATE allows for post-therapy scintigraphy\nwith planar imaging or SPECT/CT. At patient discharge, the radiation exposure should be\nmeasured and patients should receive tailored advice on the duration of radiation safety\nprecautions at home, to avoid a high radiation exposure to other people, particularly children\nand pregnant women. Patients with NET-associated hormonal syndromes who have an\nindication for continuation of SSA use should adjust the moment of the injections to the\nPRRT cycles. Long-acting SSA should not be given within 4–6 weeks before a cycle of PRRT\nbecause of interference with the radiolabeled SSA. Although there is conflicting evidence\nfrom two limited single center studies whether continuation of SSA treatment is beneficial in\nnon-functioning NETs [ 63,64], this practice is often adopted. If the patient suffers from severe\nhormonal symptoms, short-acting SSA can be used to bridge this period up till 24 h before\nPRRT. Radiopharmaceuticals such as177Lu-DOTATATE need to be administered at specialized\nfacilities by medical personnel trained in radiation safety. These facilities should adhere to\nnational and international regulations on the use of radiopharmaceuticals and be licensed by\nthe regulatory authorities. Depending on local protocol and exposure regulations, PRRT with\n177Lu-DOTATATE can be given in an in-patient as well as an out-patient setting. In between\ncycles, patients should be reviewed for adverse effects, including full blood count and renal\nand liver function. Response evaluation by cross-sectional imaging is usually performed 2–3\nand 6 months after the last cycle of PRRT. Long-term follow-up is determined on an individual\nbasis taking into account the tumor biology and therapeutic response [ 65]. Pseudo-progression\nis a phenomenon that should be considered in the response evaluation when an increase in\ntumor size is seen during or short after treatment with PRRT. Pseudo-progression is probably\nbased on localized, temporarily edema caused by inflammation as a response to PRRT and\ndoes not show the actual tumor response to the therapy [ 58]. When pseudo-progression is\nsuspected, functional imaging (for example, PET/CT) can help differentiate between true\nprogression and pseudo-progression [31].\n5. Salvage PRRT\nIn NET patients who showed tumor response at least 18 months after the first cycle of\n177Lu-DOTATATE, re-treatment with PRRT (R-PRRT) with two additional cycles of 7.4 GBq\neach after renewed PD has shown antitumoral effects. In a meta-analysis on the effect of\nR-PRRT, the pooled median PFS was 14 months with a pooled median OS of 27 months.\nSimilarly, the pooled ORR was 17% with a disease control rate of 77%. Response rates,\nPFS and OS were lower than for initial PRRT [ 66], nonetheless R-PRRT remains a potential\noption for GEP-NET patients when other systemic treatment options are limited. The limited\nefficacy of R-PRRT as compared to initial PRRT might be explained by the administration\nof lower cumulative activity (i.e., generally half of the initial PRRT dosage) [ 51], the increase\nin tumor bulk at baseline before R-PRRT and potential changes in the tumor biology, such\nas a longitudinal increase in Ki-67. In the largest study to date by van der Zwan et al., no\ndifference in toxicity after R-PRRT as compared with initial PRRT was observed, particularly\nno increased occurrence of nephrotoxicity or significant hematological disease [ 67]. In cases\nwhere R-PRRT has provided additional benefit on tumor response and prolonged PFS, further\nre-treatment at the time of progression can be considered [67].\n6. Patient Selection\nPRRT with177Lu-DOTATATE is registered for patients with GEP-NETs that are pro-\ngressive on SSA treatment.', 'PRRT is only applicable for pa-\ntients with a Karnofsky Performance Scale of at least 60 [ 27]. PRRT is contra-indicated\nfor patients who are pregnant or breastfeeding, patients with severe cardiac impairment\n(NYHA III or IV) and those with a life expectancy less than 3 months [ 31]. Since PRRT\ncan induce toxicity, the following pre-treatment laboratory values are required: creatinine\nclearance > 40 mL/min, hemoglobin levels ≥6 mmol/L, leukocytes > 2 ×109/L, platelet\ncount > 75 ×109/L, bilirubin, alanine aminotransferase (ALAT) and aspartate aminotrans-\nferase (ASAT) < 3 times the upper limit of normal and albumin > 3 g/dL [2,3].\n8. PRRT-Related Toxicity\nAdverse events related to PRRT are frequently mild and include nausea, abdominal pain\nand asthenia [ 27,50]. Increased hair loss is observed in up to 60% of patients treated with\n177Lu-DOTATATE, but this is temporary and seldom leads to baldness [ 88]. Besides these\nmild adverse events, PRRT can induce more severe toxicities which can be dose-limiting and\nadjustments to the treatment schedule might be required [ 89]. When the toxicity has subsided\nwithin 16 weeks after the last dose, guidelines advise to administer half of the original activity\nof177Lu-DOTATATE during the next cycle. PRRT should be discontinued when the toxicity\npersists after 16 weeks or recurs after the half dose [ 3]. In the NETTER-1 trial, 7% of the\npatients received a reduced dose because of dose-limiting toxicities [ 27]. The kidneys and the\nbone marrow are the critical organs for dose-limiting toxicities.', 'Cancers 2022 ,14, 5792 7 of 17\ncompared to 11.0 months for sunitinib treatment in patients with advanced, SSTR-positive,\nprogressive panNET [ 70]. Currently, the randomized phase III COMPETE trial is comparing\nPRRT with177Lu-edotreotide with everolimus in advanced, progressive GEP-NET patients.\nA subset of GEP-NET patients present with extensive tumor bulk or high proliferative rate\n(Ki-67 index of 10–55%). In these cases, treatment with octreotide LAR or lanreotide has\nquestionable antiproliferative effects [ 71]. Given its ORR of 39%, which increases to 55% in\npanNETs [ 29],177Lu-DOTATATE can be considered as ﬁrst-line therapy if response is clini-\ncally necessitated [ 72]. These response rates compare favorably to targeted therapy [ 73–75]\nand for panNETs appear similar to capecitabine–temozolomide chemotherapy [ 76]. Poorly\ndifferentiated neuroendocrine carcinomas (NECs) and well-differentiated grade 3 NETs\nare high-grade NENs that display a more aggressive biological behavior than the more\ncommon grade 1 and 2 NETs [ 77]. PRRT is currently not considered a standard treatment\noption for high-grade NENs [68,78]. The rate of SSTR 2expression in grade 3 NETs ranges\nfrom 67–92% and in NECs from 32–50%, compared to a positive expression rate in grade 1\nand 2 NETs ranging from 67–96% [ 5,79–82]. In a meta-analysis of PRRT comprising four\nstudies, grade 3 NET patients had a median PFS of 19 months and median OS of 44 months\nafter PRRT. The median PFS was 11 and 4 months and the median OS was 22 and 9 months\nfor NEC with a Ki-67 of 21–55% and NEC with a Ki-67 above 55%, respectively [ 83]. Recent\nstudies implicated that PRRT could be considered in grade 3 GEP-NETs and GEP-NEC\nwith a Ki-67 of 21–55%. Importantly, to qualify for PRRT, uptake in all lesions is required\non somatostatin receptor imaging [83].\n7. Eligibility Criteria for PRRT\nThere are several inclusion and exclusion criteria to decide if a patient is eligible for\ntreatment with PRRT. A key criterion for PRRT is the degree of uptake on SSTR imaging\nwhich is scored by the Krenning score based on planar111In-DTPA-octereotide imaging.\nIt was reported that68Ga-DOTA-SSA PET/CT results in higher Krenning scores than\n111In-DTPA-octereotide imaging [ 84]. The uptake of all tumor lesions should minimally\nbe equal to the physiological uptake in the liver (Krenning score grade 2) on111In-DTPA-\noctreotide scintigraphy or higher than the physiological uptake in the liver on68Ga-DOTA-\nSSA PET/CT for a patient to be eligible for PRRT. The latter functional imaging is more\naccurate for detecting SSTR-positive primary tumors and metastases and therefore su-\nperior for assessing the total extent of disease [ 85–87]. PRRT is only applicable for pa-\ntients with a Karnofsky Performance Scale of at least 60 [ 27]. PRRT is contra-indicated\nfor patients who are pregnant or breastfeeding, patients with severe cardiac impairment\n(NYHA III or IV) and those with a life expectancy less than 3 months [ 31]. Since PRRT\ncan induce toxicity, the following pre-treatment laboratory values are required: creatinine\nclearance > 40 mL/min, hemoglobin levels ≥6 mmol/L, leukocytes > 2 ×109/L, platelet\ncount > 75 ×109/L, bilirubin, alanine aminotransferase (ALAT) and aspartate aminotrans-\nferase (ASAT) < 3 times the upper limit of normal and albumin > 3 g/dL [2,3].\n8.']",3.0,1.0,0.0,1.0,0,1.0,1.0,1.0,112
5E advanced RAG,How many PRRT treatments can you have?,english,specific,therapy,claude-3-opus-20240229 advanced RAG,"According to van der Zwan et al., patients can receive salvage PRRT (R-PRRT) with two additional cycles of 7.4 GBq each after renewed progressive disease, following an initial treatment of PRRT [67]. In cases where R-PRRT has provided additional benefit on tumor response and prolonged progression-free survival, further re-treatment at the time of progression can be considered [67]. Therefore, based on the given context, patients can receive more than one course of PRRT, with the possibility of salvage therapy and further re-treatment if beneficial.","['Cancers 2022 ,14, 5792 6 of 17\nwhich an antiemetic, typically ondansetron or granisetron, should be given prophylactically\nbefore the start of the infusion.177Lu-DOTATATE allows for post-therapy scintigraphy\nwith planar imaging or SPECT/CT. At patient discharge, the radiation exposure should be\nmeasured and patients should receive tailored advice on the duration of radiation safety\nprecautions at home, to avoid a high radiation exposure to other people, particularly children\nand pregnant women. Patients with NET-associated hormonal syndromes who have an\nindication for continuation of SSA use should adjust the moment of the injections to the\nPRRT cycles. Long-acting SSA should not be given within 4–6 weeks before a cycle of PRRT\nbecause of interference with the radiolabeled SSA. Although there is conflicting evidence\nfrom two limited single center studies whether continuation of SSA treatment is beneficial in\nnon-functioning NETs [ 63,64], this practice is often adopted. If the patient suffers from severe\nhormonal symptoms, short-acting SSA can be used to bridge this period up till 24 h before\nPRRT. Radiopharmaceuticals such as177Lu-DOTATATE need to be administered at specialized\nfacilities by medical personnel trained in radiation safety. These facilities should adhere to\nnational and international regulations on the use of radiopharmaceuticals and be licensed by\nthe regulatory authorities. Depending on local protocol and exposure regulations, PRRT with\n177Lu-DOTATATE can be given in an in-patient as well as an out-patient setting. In between\ncycles, patients should be reviewed for adverse effects, including full blood count and renal\nand liver function. Response evaluation by cross-sectional imaging is usually performed 2–3\nand 6 months after the last cycle of PRRT. Long-term follow-up is determined on an individual\nbasis taking into account the tumor biology and therapeutic response [ 65]. Pseudo-progression\nis a phenomenon that should be considered in the response evaluation when an increase in\ntumor size is seen during or short after treatment with PRRT. Pseudo-progression is probably\nbased on localized, temporarily edema caused by inflammation as a response to PRRT and\ndoes not show the actual tumor response to the therapy [ 58]. When pseudo-progression is\nsuspected, functional imaging (for example, PET/CT) can help differentiate between true\nprogression and pseudo-progression [31].\n5. Salvage PRRT\nIn NET patients who showed tumor response at least 18 months after the first cycle of\n177Lu-DOTATATE, re-treatment with PRRT (R-PRRT) with two additional cycles of 7.4 GBq\neach after renewed PD has shown antitumoral effects. In a meta-analysis on the effect of\nR-PRRT, the pooled median PFS was 14 months with a pooled median OS of 27 months.\nSimilarly, the pooled ORR was 17% with a disease control rate of 77%. Response rates,\nPFS and OS were lower than for initial PRRT [ 66], nonetheless R-PRRT remains a potential\noption for GEP-NET patients when other systemic treatment options are limited. The limited\nefficacy of R-PRRT as compared to initial PRRT might be explained by the administration\nof lower cumulative activity (i.e., generally half of the initial PRRT dosage) [ 51], the increase\nin tumor bulk at baseline before R-PRRT and potential changes in the tumor biology, such\nas a longitudinal increase in Ki-67. In the largest study to date by van der Zwan et al., no\ndifference in toxicity after R-PRRT as compared with initial PRRT was observed, particularly\nno increased occurrence of nephrotoxicity or significant hematological disease [ 67]. In cases\nwhere R-PRRT has provided additional benefit on tumor response and prolonged PFS, further\nre-treatment at the time of progression can be considered [67].\n6. Patient Selection\nPRRT with177Lu-DOTATATE is registered for patients with GEP-NETs that are pro-\ngressive on SSA treatment.', 'The patients were divided into two groups: PRRT monotherapy ( n=81, group 1) and PRRT\nplus SSA ( n=87, group 2). The results showed a higher median PFS (48 months) in the subgroup\nreceiving the combination therapy, compared to the subgroup receiving only PRRT (27 months) [ 95].\nAccordingly, di ﬀerent experimental approaches and strategies are being explored in order to optimize\nthe eﬀectiveness of PRRT and to minimize potential side e ﬀects. First of all, after completing four\ncycles of PRRT, treatment may even be continued, depending on kidney and bone marrow tolerance,\ne.g., with reduced radioactivity as part of a salvage therapy (Re-PRRT) [ 96]. Van der Zwan et al.\ndemonstrated that a cumulative dose of up to 60.5 GBq salvage PRRT with 177Lu-DOTATATE is safe\nand e ﬀective in patients with progressive disease (relapse-PD) after four cycles of 177Lu-DOTATATE\nPRRT [ 97]. Furthermore, no increasing incidence of acute myeloid leukemia or myelodysplastic\nsyndrome was observed, and no grade III or IV nephrotoxicity occurred [ 97]. Further intensiﬁcation\nof the PRRT might be even achieved by administration of the tracer directly into the hepatic artery.\nIn particular, patients with hepatic dominant metastases would beneﬁt from this approach due to\nan increase of uptake of the radiopharmaceutical (the so-called “ﬁrst-pass” e ﬀect) [ 98]. The PRRT is\nbecoming increasingly important in a neoadjuvant setting [ 99]. In patients with inoperable P-NET\nand distant (metastatic) disease, PRRT was associated with a signiﬁcant reduction in tumor size, and\nthe tumor was rendered operable [ 100]. In such cases, complete response can be achieved. Figure 1\ndemonstrates a representative case of PRRT in a neoadjuvant setting.', 'In the largest study to date by van der Zwan et al., no\ndifference in toxicity after R-PRRT as compared with initial PRRT was observed, particularly\nno increased occurrence of nephrotoxicity or significant hematological disease [ 67]. In cases\nwhere R-PRRT has provided additional benefit on tumor response and prolonged PFS, further\nre-treatment at the time of progression can be considered [67].\n6. Patient Selection\nPRRT with177Lu-DOTATATE is registered for patients with GEP-NETs that are pro-\ngressive on SSA treatment. Non-radiolabeled or ‘cold’ long-acting SSAs such as octreotide\nLAR and lanreotide are generally considered the ﬁrst-line systemic treatment option for\nadvanced and metastatic SSTR-positive GEP-NETs, particularly for tumors with a Ki-67\nindex below 10% [ 68]. Among the different second-line options in well-differentiated\npanNETs,177Lu-DOTATATE seems to compare favorably to targeted therapy (everolimus\nor sunitinib) or chemotherapy [ 69]. In the randomized phase II OCLURANDUM trial,\nPRRT with177Lu-DOTATATE was associated with a higher median PFS of 20.7 months']",2.0,1.0,1.0,1.0,1,1.0,1.0,1.0,84
6G advanced RAG,Wie viel kostet eine Behandlung mit PRRT?,german,specific,cost,claude-3-opus-20240229 advanced RAG,"Laut der Studie betrugen die Kosten für eine Behandlung mit Peptidrezeptor-Radionuklidtherapie (PRRT) bei Patienten mit metastasierten neuroendokrinen Tumoren im Median 8835 € pro Person pro Monat (PPPM). Der Hauptkostentreiber war dabei der Krankenhausaufenthalt mit 7443 € PPPM, was 84% der Gesamtkosten ausmachte (Perrier et al., 2022, Tabelle 2).","['Among\tpatients\t\ntreated\twith\tPRRT\tor\tcytotoxic\t chemotherapies,\t the\tmain\tcost\tdriver\t\nwas\thospital\t stay\t(€7443\tand\t€884\tPPPM).\tBy\tcontrast,\t the\tmain\t\ncosts in patients receiving targeted therapies or SSAs were a result of \ndrugs\t(€2960\tand\t€1642\tPPPM,\trespectively)\t because\t other\titems\tof\t\nexpenditure were less expensive (e.g., hospitalizations, transporta -\ntions or indirect costs). Transportations were higher among patients FIGURE 1\u2003Mean\tcosts\tin\teuros\tper\t\nperson\tper\tmonth\t(PPPM)\taccording\tto\t\npre-  and post-  periods of diagnosis in \npatients with metastatic neuroendocrine \ntumours\nTABLE 2\u2003Healthcare\tresource\tuse\tin\tunits\tand\tcosts\tin\teuros,\tper\tperson\tper\tmonth,\taccording\tto\ttype\tof\ttreatment\treceived\tduring\tthe\t\nstudy period\nVariablesSSA\n(n = 244)Cytotoxic chemotherapy\n(n = 124)Targeted therapies\n(n = 85)PRRT\n(n = 46)\nMedian\ttime\tin\tmonths\tof\ttreatment\tperiod\t\n(range)24.1 (90.5) 4.6 (18) 5.9 (39.9) 7.1\t(13.3)\nMedian\tdirect\tmedical\tHRU\t(cost\t€)\nOutpatient \tconsultation 1.2 (35) 1.1 (29) 1.9 (54) 1.3 (30)\nBiology exam 1.1 (14) 2.8 (50) 2.5\t(57) 2.7\t(55)\nImaging 0.3 (30) 0.3\t(27) 0.4 (35) 0.1 (8)\nParamedical \tcare 2.2 (23) 2.8 (39) 1.5 (26) 2.3 (21)\nDrugs 4.6 (1642) 6.7\t(464) 5.7\t(2960) 3.8 (256)\nHospital\tstay 0.2 (263) 1.4 (884) 0.4 (296) 0.5\t(7443)\nMedian\tdirect\tnon- \tmedical\tHRU\t(cost\t€)\nTransportations 0.5 (56) 2.4 (163) 0.9 (96) 1.5 (195)\nMedian\tindirect\tHRU\t(cost\t€)\nCompensation payment 0.0 (0) 0.0 (0) 0.0 (0) 0.0 (0)\nDisability \tpension 0.0 (0) 0.0 (0) 0.0 (0) 0.0 (0)\nMedian\ttotal\tHRU\t(cost\t€) 11.7\t(2316) 20.3 (2549) 15.4 (4380) 13.1 (8835)\nAbbreviations:\tHRU,\thealthcare\tresource\tuse;\tPRRT,\tpeptide\treceptor\tradionuclide\ttherapy;\tSSA,\tsomatostatin\tanalogue.\n 13652826, 2022, 4, Downloaded from https://onlinelibrary.wiley.com/doi/10.1111/jne.13092 by Ludwig-Maximilians-Universität, Wiley Online Library on [15/04/2024]. See the Terms and Conditions (https://onlinelibrary.wiley.com/terms-and-conditions) on Wiley Online Library for rules of use; OA articles are governed by the applicable Creative Commons License', 'To\tdate,\tno\tstudies\thave\tperformed\t detailed\t analyses\t of\tHRU\t\nand costs by type of treatment received in patients with mNETs. \nPrevious\t studies\thave\tonly\tcompared\t HRU\tand\tcosts\tbetween\t oc-\ntreotide and lanreotide among NET patients, showing that long-  \nacting\toctreotide\t was\tassociated\t with\tlower\tcosts\tin\tUSA\t(with\ta\t\ndifference\t of\tapproximately\t $3700\tper\tmonth),10 and especially \nin\tpatients\t with\tmetastatic\t GEP-\tNETs.11\tOur\tfindings \tshowed \tthe\t\nhighest\tcosts\tand\tHRU\tin\tpatients \ttreated\tby\tPRRT\t(€8835\tPPPM),\t\nmainly\tdriven\tby\thospital\t stay\t(€7443\tPPPM,\t84%).\tBy\tcontrast, \t\ncosts\tassociated\t with\ttargeted\t therapies\t (€4380\tPPPM)\tand\tSSAs\t\n(€2316\tPPPM)\twere\tmainly\trelated\tto\tdrug\tprescription\t (68%\tand\t\n71%,\trespectively);\t many\tpatients\t receiving\t targeted\t therapy\t or\t\nSSAs were in fact outpatients with lower costs related to hospital -\nizations\t or\ttransportations.\t In\tFrance,\tthe\tcurrent\tcost\tof\ta\tlong-\t\nacting SSA injection is around €1300 per injection for the maximal \ndose of octreotide or lanreotide, usually given every 4 weeks, with \nan average treatment duration of 24 months; we therefore suspect \nthat some patients required increased doses of SSA for its anti-  \nsecretory\t and/or\tanti-\ttumoral\t effects.\t This\tcost\testimated\t PPPM\t\nhas to be interpreted according to the duration of treatment and \naccording to the median progression-  free survival of 14.3 months \n(octreotide-\t PROMID) \tand\t38.5\tmonths\t(lanreotide- \tCLARINET) \t\nobtained \tin\tthe\trespective \tphase\tIII\tstudies\twith\tSSA.12- 14 By con -\ntrast, the total cost of targeted therapies (sunitinib and everoli -\nmus) was almost twice as higher than that for SSAs by month of \ntreatment in the present study, although they were given during \na shorter time (average treatment duration of 5.9 months and \nbetween\t 4.6\tand\t9.3\tmonths\t in\tthe\tphase\tIII\tstudies\tallowing\t the\t\n 13652826, 2022, 4, Downloaded from https://onlinelibrary.wiley.com/doi/10.1111/jne.13092 by Ludwig-Maximilians-Universität, Wiley Online Library on [15/04/2024]. See the Terms and Conditions (https://onlinelibrary.wiley.com/terms-and-conditions) on Wiley Online Library for rules of use; OA articles are governed by the applicable Creative Commons License', '6 of 9\u2003 |\u2003 \u2003\u2002\nPERRIER Et al.\nreceiving\t PRRT\tand\tcytotoxic\t chemotherapy\t for\ttheir\tmNET\t(€195\t\nand\t€163\tPPPM,\trespectively)\t(Table\t2).\n4\u2003|\u2003DISCUSSION\nThere\tis\ta\tlack\tof\tdata\tin\tthe\tcurrent\tliterature \tabout\tHRU\tand\tthe\tas-\nsociated\t costs\tfor\tNET\tcare\tbecause\t most\tof\tdata\tcome\tfrom\tthe\tUS\t\nhealthcare system, which differs greatly from European ones.3 The \nLyREMeNET \tstudy\twas\tthe\tfirst\tto\tdescribe \tthe\tgeneral\tcharacter -\nistics\tof\tpatients\t with\tmNETs,\t as\twell\tas\tthe\taverage\t HRU\tand\tthe\t\ncorresponding costs for mNET management in France. The median \ntotal\thealthcare\t cost\twas\t€2448\tPPPM\tfor\tmNET\tcare.\tThe\tfirst\tyear\tafter diagnosis was the most expensive period, and the two main \ncost drivers were drugs and hospital stay. Finally, higher costs were \nobserved in patients with a primary tumor arising from the small in -\ntestine, in patients with functional mNETs and in patients treated by \nPRRT\tor\ttargeted\ttherapies.\nThe economic burden of the first year following the diagnosis of \nNET has already been described in elderly NET patients.4 The initial \nphase indeed induces costs for the diagnostic phase (imaging, labo -\nratory tests, in-  and outpatient consultations, production loss), the \ninitial surgical management and also drug use (especially in patients \nwith a secretory syndrome requiring SSAs or locoregional thera -\npies).8 A recent French study has also showed higher overall costs \nduring the first year in incident patients presenting with a carcinoid TABLE 3\u2003Healthcare\tresource\tuse\tin\tunits\tand\tcosts\tin\teuros,\tper\tperson\tper\tmonth,\taccording\tto\tprimary\ttumour\tlocation\nVariablesPancreas\n(n = 102)Small intestine\n(n = 153)Lung\n(n = 35)Unknown/other\n(n = 26)Total\n(n = 316)\nMedian\tdirect\tmedical\tHRU\t(cost\t€)\nOutpatient \tconsultation 1.5 (49) 1.3 (40) 1.5 (46) 1.6 (52) 1.4 (45)\nBiology exam 1.8 (34) 1.2\t(17) 1.6 (23) 1.9 (32) 1.6 (24)\nImaging 0.5\t(77) 0.4 (52) 0.6 (94) 0.5 (83) 0.5 (63)\nParamedical \tcare 1.6 (23) 2.2 (24) 1.8 (31) 1.8 (32) 2.0 (24)\nDrugs 4.7\t(554) 4.4 (1481) 4.5 (859) 5\t(775) 4.5 (1161)\nHospital\tstay 0.4\t(761) 0.3 (661) 0.4 (503) 0.4 (619) 0.3 (662)\nMedian\tdirect\tnon- \tmedical\tHRU\t(cost\t€)\nTransportations 0.8 (85) 0.5 (51) 0.8\t(67) 0.9 (80) 0.6 (62)\nMedian\tindirect\tHRU\t(cost\t€)\nCompensation payment 0.0 (0) 0.0 (0) 0.0 (0) 0.0 (2) 0.0 (0)\nDisability \tpension 0.0 (0) 0.0 (0) 0.0 (0) 0.0 (0) 0.0 (0)\nMedian\ttotal\tHRU\t(cost\t€) 12.5 (2325) 11.8 (2540) 12.7\t(2275) 14.5 (2393) 12.2 (2448)\nAbbreviations:\tHRU,\thealthcare\tresource\tuse;\tPPPM,\tper\tperson\tper\tmonth.']",2.0,1.0,1.0,1.0,0,1.0,0.0,0.5,48
6E advanced RAG,How much does a PRRT treatment cost?,english,specific,cost,claude-3-opus-20240229 advanced RAG,"The given context does not provide specific information about the cost of PRRT treatment. The context focuses on eligibility criteria for PRRT, such as the degree of uptake on somatostatin receptor imaging, performance status, and required pre-treatment laboratory values, but does not mention the associated costs.","['Among\tpatients\t\ntreated\twith\tPRRT\tor\tcytotoxic\t chemotherapies,\t the\tmain\tcost\tdriver\t\nwas\thospital\t stay\t(€7443\tand\t€884\tPPPM).\tBy\tcontrast,\t the\tmain\t\ncosts in patients receiving targeted therapies or SSAs were a result of \ndrugs\t(€2960\tand\t€1642\tPPPM,\trespectively)\t because\t other\titems\tof\t\nexpenditure were less expensive (e.g., hospitalizations, transporta -\ntions or indirect costs). Transportations were higher among patients FIGURE 1\u2003Mean\tcosts\tin\teuros\tper\t\nperson\tper\tmonth\t(PPPM)\taccording\tto\t\npre-  and post-  periods of diagnosis in \npatients with metastatic neuroendocrine \ntumours\nTABLE 2\u2003Healthcare\tresource\tuse\tin\tunits\tand\tcosts\tin\teuros,\tper\tperson\tper\tmonth,\taccording\tto\ttype\tof\ttreatment\treceived\tduring\tthe\t\nstudy period\nVariablesSSA\n(n = 244)Cytotoxic chemotherapy\n(n = 124)Targeted therapies\n(n = 85)PRRT\n(n = 46)\nMedian\ttime\tin\tmonths\tof\ttreatment\tperiod\t\n(range)24.1 (90.5) 4.6 (18) 5.9 (39.9) 7.1\t(13.3)\nMedian\tdirect\tmedical\tHRU\t(cost\t€)\nOutpatient \tconsultation 1.2 (35) 1.1 (29) 1.9 (54) 1.3 (30)\nBiology exam 1.1 (14) 2.8 (50) 2.5\t(57) 2.7\t(55)\nImaging 0.3 (30) 0.3\t(27) 0.4 (35) 0.1 (8)\nParamedical \tcare 2.2 (23) 2.8 (39) 1.5 (26) 2.3 (21)\nDrugs 4.6 (1642) 6.7\t(464) 5.7\t(2960) 3.8 (256)\nHospital\tstay 0.2 (263) 1.4 (884) 0.4 (296) 0.5\t(7443)\nMedian\tdirect\tnon- \tmedical\tHRU\t(cost\t€)\nTransportations 0.5 (56) 2.4 (163) 0.9 (96) 1.5 (195)\nMedian\tindirect\tHRU\t(cost\t€)\nCompensation payment 0.0 (0) 0.0 (0) 0.0 (0) 0.0 (0)\nDisability \tpension 0.0 (0) 0.0 (0) 0.0 (0) 0.0 (0)\nMedian\ttotal\tHRU\t(cost\t€) 11.7\t(2316) 20.3 (2549) 15.4 (4380) 13.1 (8835)\nAbbreviations:\tHRU,\thealthcare\tresource\tuse;\tPRRT,\tpeptide\treceptor\tradionuclide\ttherapy;\tSSA,\tsomatostatin\tanalogue.\n 13652826, 2022, 4, Downloaded from https://onlinelibrary.wiley.com/doi/10.1111/jne.13092 by Ludwig-Maximilians-Universität, Wiley Online Library on [15/04/2024]. See the Terms and Conditions (https://onlinelibrary.wiley.com/terms-and-conditions) on Wiley Online Library for rules of use; OA articles are governed by the applicable Creative Commons License', '6 of 9\u2003 |\u2003 \u2003\u2002\nPERRIER Et al.\nreceiving\t PRRT\tand\tcytotoxic\t chemotherapy\t for\ttheir\tmNET\t(€195\t\nand\t€163\tPPPM,\trespectively)\t(Table\t2).\n4\u2003|\u2003DISCUSSION\nThere\tis\ta\tlack\tof\tdata\tin\tthe\tcurrent\tliterature \tabout\tHRU\tand\tthe\tas-\nsociated\t costs\tfor\tNET\tcare\tbecause\t most\tof\tdata\tcome\tfrom\tthe\tUS\t\nhealthcare system, which differs greatly from European ones.3 The \nLyREMeNET \tstudy\twas\tthe\tfirst\tto\tdescribe \tthe\tgeneral\tcharacter -\nistics\tof\tpatients\t with\tmNETs,\t as\twell\tas\tthe\taverage\t HRU\tand\tthe\t\ncorresponding costs for mNET management in France. The median \ntotal\thealthcare\t cost\twas\t€2448\tPPPM\tfor\tmNET\tcare.\tThe\tfirst\tyear\tafter diagnosis was the most expensive period, and the two main \ncost drivers were drugs and hospital stay. Finally, higher costs were \nobserved in patients with a primary tumor arising from the small in -\ntestine, in patients with functional mNETs and in patients treated by \nPRRT\tor\ttargeted\ttherapies.\nThe economic burden of the first year following the diagnosis of \nNET has already been described in elderly NET patients.4 The initial \nphase indeed induces costs for the diagnostic phase (imaging, labo -\nratory tests, in-  and outpatient consultations, production loss), the \ninitial surgical management and also drug use (especially in patients \nwith a secretory syndrome requiring SSAs or locoregional thera -\npies).8 A recent French study has also showed higher overall costs \nduring the first year in incident patients presenting with a carcinoid TABLE 3\u2003Healthcare\tresource\tuse\tin\tunits\tand\tcosts\tin\teuros,\tper\tperson\tper\tmonth,\taccording\tto\tprimary\ttumour\tlocation\nVariablesPancreas\n(n = 102)Small intestine\n(n = 153)Lung\n(n = 35)Unknown/other\n(n = 26)Total\n(n = 316)\nMedian\tdirect\tmedical\tHRU\t(cost\t€)\nOutpatient \tconsultation 1.5 (49) 1.3 (40) 1.5 (46) 1.6 (52) 1.4 (45)\nBiology exam 1.8 (34) 1.2\t(17) 1.6 (23) 1.9 (32) 1.6 (24)\nImaging 0.5\t(77) 0.4 (52) 0.6 (94) 0.5 (83) 0.5 (63)\nParamedical \tcare 1.6 (23) 2.2 (24) 1.8 (31) 1.8 (32) 2.0 (24)\nDrugs 4.7\t(554) 4.4 (1481) 4.5 (859) 5\t(775) 4.5 (1161)\nHospital\tstay 0.4\t(761) 0.3 (661) 0.4 (503) 0.4 (619) 0.3 (662)\nMedian\tdirect\tnon- \tmedical\tHRU\t(cost\t€)\nTransportations 0.8 (85) 0.5 (51) 0.8\t(67) 0.9 (80) 0.6 (62)\nMedian\tindirect\tHRU\t(cost\t€)\nCompensation payment 0.0 (0) 0.0 (0) 0.0 (0) 0.0 (2) 0.0 (0)\nDisability \tpension 0.0 (0) 0.0 (0) 0.0 (0) 0.0 (0) 0.0 (0)\nMedian\ttotal\tHRU\t(cost\t€) 12.5 (2325) 11.8 (2540) 12.7\t(2275) 14.5 (2393) 12.2 (2448)\nAbbreviations:\tHRU,\thealthcare\tresource\tuse;\tPPPM,\tper\tperson\tper\tmonth.', 'Cancers 2022 ,14, 5792 7 of 17\ncompared to 11.0 months for sunitinib treatment in patients with advanced, SSTR-positive,\nprogressive panNET [ 70]. Currently, the randomized phase III COMPETE trial is comparing\nPRRT with177Lu-edotreotide with everolimus in advanced, progressive GEP-NET patients.\nA subset of GEP-NET patients present with extensive tumor bulk or high proliferative rate\n(Ki-67 index of 10–55%). In these cases, treatment with octreotide LAR or lanreotide has\nquestionable antiproliferative effects [ 71]. Given its ORR of 39%, which increases to 55% in\npanNETs [ 29],177Lu-DOTATATE can be considered as ﬁrst-line therapy if response is clini-\ncally necessitated [ 72]. These response rates compare favorably to targeted therapy [ 73–75]\nand for panNETs appear similar to capecitabine–temozolomide chemotherapy [ 76]. Poorly\ndifferentiated neuroendocrine carcinomas (NECs) and well-differentiated grade 3 NETs\nare high-grade NENs that display a more aggressive biological behavior than the more\ncommon grade 1 and 2 NETs [ 77]. PRRT is currently not considered a standard treatment\noption for high-grade NENs [68,78]. The rate of SSTR 2expression in grade 3 NETs ranges\nfrom 67–92% and in NECs from 32–50%, compared to a positive expression rate in grade 1\nand 2 NETs ranging from 67–96% [ 5,79–82]. In a meta-analysis of PRRT comprising four\nstudies, grade 3 NET patients had a median PFS of 19 months and median OS of 44 months\nafter PRRT. The median PFS was 11 and 4 months and the median OS was 22 and 9 months\nfor NEC with a Ki-67 of 21–55% and NEC with a Ki-67 above 55%, respectively [ 83]. Recent\nstudies implicated that PRRT could be considered in grade 3 GEP-NETs and GEP-NEC\nwith a Ki-67 of 21–55%. Importantly, to qualify for PRRT, uptake in all lesions is required\non somatostatin receptor imaging [83].\n7. Eligibility Criteria for PRRT\nThere are several inclusion and exclusion criteria to decide if a patient is eligible for\ntreatment with PRRT. A key criterion for PRRT is the degree of uptake on SSTR imaging\nwhich is scored by the Krenning score based on planar111In-DTPA-octereotide imaging.\nIt was reported that68Ga-DOTA-SSA PET/CT results in higher Krenning scores than\n111In-DTPA-octereotide imaging [ 84]. The uptake of all tumor lesions should minimally\nbe equal to the physiological uptake in the liver (Krenning score grade 2) on111In-DTPA-\noctreotide scintigraphy or higher than the physiological uptake in the liver on68Ga-DOTA-\nSSA PET/CT for a patient to be eligible for PRRT. The latter functional imaging is more\naccurate for detecting SSTR-positive primary tumors and metastases and therefore su-\nperior for assessing the total extent of disease [ 85–87]. PRRT is only applicable for pa-\ntients with a Karnofsky Performance Scale of at least 60 [ 27]. PRRT is contra-indicated\nfor patients who are pregnant or breastfeeding, patients with severe cardiac impairment\n(NYHA III or IV) and those with a life expectancy less than 3 months [ 31]. Since PRRT\ncan induce toxicity, the following pre-treatment laboratory values are required: creatinine\nclearance > 40 mL/min, hemoglobin levels ≥6 mmol/L, leukocytes > 2 ×109/L, platelet\ncount > 75 ×109/L, bilirubin, alanine aminotransferase (ALAT) and aspartate aminotrans-\nferase (ASAT) < 3 times the upper limit of normal and albumin > 3 g/dL [2,3].\n8.']",1.0,0.6666666666666666,0.0,1.0,1,1.0,0.0,0.5,46
7G advanced RAG,Welche Isotope werden für die Therapie und welche für die Diagnistik der PRRT eingesetzt?,german,specific,therapy,claude-3-opus-20240229 advanced RAG,"Laut den gegebenen Informationen werden für die Peptidrezeptor-Radionuklidtherapie (PRRT) folgende Isotope eingesetzt:

Für die Therapie:
- Yttrium-90 (90Y): Ein reiner hochenergetischer β--Strahler, geeignet für größere Tumoren mit heterogener Rezeptorexpression [1].
- Lutetium-177 (177Lu): Ein mittelenergetischer β--Strahler mit einer γ-Komponente, geeignet für kleinere Tumoren [1].
- α-Strahler wie Astat-211 (211At), Bismut-213 (213Bi) und Actinium-225 (225Ac) wurden in frühen klinischen Studien untersucht [2].

Für die Diagnose:
- Indium-111 (111In) und Gallium-68 (68Ga) werden hauptsächlich für die Diagnose mit DOTATATE verwendet [2].

Die diagnostischen Radionuklide ermöglichen vor der Behandlung die Identifizierung rezeptorpositiver Tumorläsionen, die Behandlungsplanung und Dosimetrie. Durch den Austausch zu einem therapeutischen Radionuklid, oft unter Verwendung desselben Peptidkonjugats, wird dann die gezielte Radionuklidtherapie ermöglicht [2].

Quellen:
[1] Eychenne et al., 2020
[2] Development of Diagnostic and Therapeutic Radiopharmaceuticals, o.J.","['Molecules 2020 ,25, 4012 16 of 35\n3.2. Radiolabeled Somatostatin Analogs for Therapy\nConcerning radionuclide therapy and more particularly peptide receptor radionuclide therapy\n(PRRT), radioactivity is used to destroy the targeted cells. Radiopharmaceuticals used in therapy are\ndesigned in the same way as those used in imaging, only the nature of the radioelement being modiﬁed.\nContrary to imaging, which uses radioelements having very penetrating but little ionizing radiations,\nPRRT privileges the use of radionuclides that have little penetrating and more energetic and thus more\nionizing radiations. Brought directly to the cancer cell, the radiation emitted by the radioactive decay\ncauses irreversible ionization of the cell’s DNA, which induces its apoptosis. The main isotopes used\ntoday are iodine-131, yttrium-90, lutetium-177 and, to a lesser extent, rhenium-188 [ 158]. As mentioned\nearlier, the purpose of the DOTA-SSA design was to work with a chelating cavity capable of complexing\nradioelements for imaging or therapy. Consequently, most of the platforms discussed above have been\ntransposed for therapeutic application via the use of β−emitters [64,74,81,82].\n3.2.1. Yttrium-90 and Lutetium-177\nYttrium-90, a pure high energy β−emitter (T 1/2=64 h, E βmax=2.28 MeV), and lutetium-177,\na medium energy β−emitter (T 1/2=6.7 d, E βmax=0.5 MeV) with a γcomponent (208 keV), are\ncurrently the most used in PRRT. Each of these two elements has its own advantages for targeted\ntherapy. The particles emitted by90Y are more energetic and more penetrating; they are able to di ﬀuse\non a thicker layer of cells, which is an advantage for the treatment of large tumors. However, even if\nhigh energy radiation allows a more uniform irradiation of the tumor, the risk of imposing an excessive\ndose of radiation on the adjacent tissues is very present. For its part, the177Lu emits less energetic\nradiation, more suited to small tumors. In addition, the energy of its γradiation is su ﬃcient to allow\ndetection by scintigraphy and establish dosimetry during the therapy sequences [159].\nThe ﬁrst analog to be studied was [90Y]-DOTATOC (Octreother®), and the ﬁrst treatment sessions\nquickly showed good results, stopping the progression of the tumor [ 72,160,161]. Many studies on this\nlong-used treatment have made it possible to observe a good tolerance for this radiotracer, with fairly\nmild side e ﬀects (fatigue) and in very rare cases a little more severe ones (nausea). However, it also\nshowed some toxicity for the kidneys and the bones, these two aspects being the dose-limiting factors\nfor the patient. In vitro , a greater a ﬃnity for SSTR2 has been demonstrated for [90Y]-DOTATATE\ncompared to [90Y]-DOTATOC [ 64]. However, for the diagnosis in humans, a better contrast between\nthe kidneys and the tumor was found for [111In]-DOTATOC compared to [111In]-DOTATATE [ 73],\nwhich may explain the wider use of DOTATOC analog. Despite this, these two analogs have relatively\nsimilar properties and have proven to be e ﬀective treatment methods that improve survival in some\npatients with neuroendocrine tumors (approximately 50 months vs. 18 months without treatment) [ 162].\nIn a Phase IIA study with [90Y]-DOTALAN (MAURITIUS trial), this one demonstrated lower tumor\nuptake in neuroendocrine tumors compared to90Y-DOTATOC, but could be of potential interest for\nother tumors, such as HCC or lung cancers [ 163]. With the perspective of several years of clinical use,\nPRRT with90Y-labeled somatostatin analogs appears to be well-tolerated with favorable long-term\noutcome.', 'Molecules 2020 ,25, 4012 16 of 35\n3.2. Radiolabeled Somatostatin Analogs for Therapy\nConcerning radionuclide therapy and more particularly peptide receptor radionuclide therapy\n(PRRT), radioactivity is used to destroy the targeted cells. Radiopharmaceuticals used in therapy are\ndesigned in the same way as those used in imaging, only the nature of the radioelement being modiﬁed.\nContrary to imaging, which uses radioelements having very penetrating but little ionizing radiations,\nPRRT privileges the use of radionuclides that have little penetrating and more energetic and thus more\nionizing radiations. Brought directly to the cancer cell, the radiation emitted by the radioactive decay\ncauses irreversible ionization of the cell’s DNA, which induces its apoptosis. The main isotopes used\ntoday are iodine-131, yttrium-90, lutetium-177 and, to a lesser extent, rhenium-188 [ 158]. As mentioned\nearlier, the purpose of the DOTA-SSA design was to work with a chelating cavity capable of complexing\nradioelements for imaging or therapy. Consequently, most of the platforms discussed above have been\ntransposed for therapeutic application via the use of β−emitters [64,74,81,82].\n3.2.1. Yttrium-90 and Lutetium-177\nYttrium-90, a pure high energy β−emitter (T 1/2=64 h, E βmax=2.28 MeV), and lutetium-177,\na medium energy β−emitter (T 1/2=6.7 d, E βmax=0.5 MeV) with a γcomponent (208 keV), are\ncurrently the most used in PRRT. Each of these two elements has its own advantages for targeted\ntherapy. The particles emitted by90Y are more energetic and more penetrating; they are able to di ﬀuse\non a thicker layer of cells, which is an advantage for the treatment of large tumors. However, even if\nhigh energy radiation allows a more uniform irradiation of the tumor, the risk of imposing an excessive\ndose of radiation on the adjacent tissues is very present. For its part, the177Lu emits less energetic\nradiation, more suited to small tumors. In addition, the energy of its γradiation is su ﬃcient to allow\ndetection by scintigraphy and establish dosimetry during the therapy sequences [159].\nThe ﬁrst analog to be studied was [90Y]-DOTATOC (Octreother®), and the ﬁrst treatment sessions\nquickly showed good results, stopping the progression of the tumor [ 72,160,161]. Many studies on this\nlong-used treatment have made it possible to observe a good tolerance for this radiotracer, with fairly\nmild side e ﬀects (fatigue) and in very rare cases a little more severe ones (nausea). However, it also\nshowed some toxicity for the kidneys and the bones, these two aspects being the dose-limiting factors\nfor the patient. In vitro , a greater a ﬃnity for SSTR2 has been demonstrated for [90Y]-DOTATATE\ncompared to [90Y]-DOTATOC [ 64]. However, for the diagnosis in humans, a better contrast between\nthe kidneys and the tumor was found for [111In]-DOTATOC compared to [111In]-DOTATATE [ 73],\nwhich may explain the wider use of DOTATOC analog. Despite this, these two analogs have relatively\nsimilar properties and have proven to be e ﬀective treatment methods that improve survival in some\npatients with neuroendocrine tumors (approximately 50 months vs. 18 months without treatment) [ 162].\nIn a Phase IIA study with [90Y]-DOTALAN (MAURITIUS trial), this one demonstrated lower tumor\nuptake in neuroendocrine tumors compared to90Y-DOTATOC, but could be of potential interest for\nother tumors, such as HCC or lung cancers [ 163]. With the perspective of several years of clinical use,\nPRRT with90Y-labeled somatostatin analogs appears to be well-tolerated with favorable long-term\noutcome.', '19 I.9 Peptide Receptor Radionuclide Therapy  Including surgery and external radiation therapy, there is often no curative treatment available for a large group of patients with disseminated carcinomas. Radionuclide therapy represents an interesting (complementary) option to current treatment modalities because it permits the delivery of a high dose of therapeutic radiation to cancer cells while minimizing exposure of normal cells (143). Due to the fundamental linkage of the CXCR4/CXCL12 axis to cancer progression and metastasis, the CXCR4 receptor holds great potential for targeted radionuclide therapy. The specific activity of the peptide should be as high as possible to reach the maximal achievable absorbed dose in the tumor. Since radionuclide-conjugated peptides are administered in low mass amounts, unwanted side effects like the mobilization of stem cells in the case of CXCR4-targeting peptides are very unlikely to occur whereas ionizing irradiation is effectively delivered to the target. Before treatment, peptides can be radiolabeled with diagnostic radionuclides to identify receptor-positive tumor lesions, for treatment planning, and also dosimetry. Exchange to a therapeutic radionuclide, often by using the same peptide-conjugate, enables targeted radionuclide therapy. DOTATATE for instance has been labeled with different radionuclides for diagnosis (mainly 111In and 68Ga) and also treatment (mainly 177Lu and 90Y) of neuroendocrine tumors (144-146).  The decay properties of radionuclides, e.g. β- or α emission, emission energy, linear energy transfer (LET), and half-life are important characteristics for diagnosis and therapy and can be chosen individually, depending on the type of the tumor, its size, intratumoral distribution (i.e. degree of heterogeneity of radionuclide deposition), pharmacokinetics, and other factors. 177Lu for instance (β-, Emax 0.5 MeV, tissue rangemax 2 mm (144,147) is more appropriate for smaller tumors, while 90Y (β-, Emax 2.3 MeV, tissue rangemax 12 mm (144,147), may be beneficial for larger lesions with heterogeneous receptor expression (144,147,148). Compared to β-particles (LET: 0.1-1 keV/µm) and γ irradiation, the local density of ionizations along a track of α-particles is considerably higher because multiple ionizations  (60-230 keV/µm) occur in the immediate vicinity of the decay site (149). Hence, α-particle emitters can be beneficial to target single cancer cells, i.e. micro-metastases, which are difficult to treat by currently employed techniques (150). Moreover, the high specific ionization of α-emitters causes a higher fraction of double strand breaks and can break radio- and chemoresistance (151). Furthermore, cell death due to α-irradiation is minimally dependent on tumor oxygenation, which means that cells are killed effectively even in hypoxic areas of the tumor (152,153). Accordingly, the therapeutic potential of α-emitters like 211At, 213Bi, and 225Ac have been investigated in some early stage clinical trials (149,150,154). An overview of selected radionuclides for therapy is given in Table 3.']",3.0,1.0,1.0,1.0,0,1.0,0.0,0.5,127
7E advanced RAG,Which isotopes are used for therapy and diagnostics in PRRT?,english,specific,therapy,claude-3-opus-20240229 advanced RAG,"According to the given context, the main isotopes used for peptide receptor radionuclide therapy (PRRT) are [1,2]:

- Yttrium-90 (90Y): A pure β-emitting isotope with a physical half-life of 64 hours. It has higher maximum and mean β-particle energies compared to lutetium-177, allowing deeper tissue penetration.

- Lutetium-177 (177Lu): A β- and γ-emitting radionuclide with a physical half-life of 162 hours (6.73 days). It has lower β-particle energies than 90Y but emits gamma radiation, allowing posttreatment imaging and dosimetry assessments. 

The context also mentions iodine-131 and rhenium-188 being used to a lesser extent for PRRT [1].","['Molecules 2020 ,25, 4012 16 of 35\n3.2. Radiolabeled Somatostatin Analogs for Therapy\nConcerning radionuclide therapy and more particularly peptide receptor radionuclide therapy\n(PRRT), radioactivity is used to destroy the targeted cells. Radiopharmaceuticals used in therapy are\ndesigned in the same way as those used in imaging, only the nature of the radioelement being modiﬁed.\nContrary to imaging, which uses radioelements having very penetrating but little ionizing radiations,\nPRRT privileges the use of radionuclides that have little penetrating and more energetic and thus more\nionizing radiations. Brought directly to the cancer cell, the radiation emitted by the radioactive decay\ncauses irreversible ionization of the cell’s DNA, which induces its apoptosis. The main isotopes used\ntoday are iodine-131, yttrium-90, lutetium-177 and, to a lesser extent, rhenium-188 [ 158]. As mentioned\nearlier, the purpose of the DOTA-SSA design was to work with a chelating cavity capable of complexing\nradioelements for imaging or therapy. Consequently, most of the platforms discussed above have been\ntransposed for therapeutic application via the use of β−emitters [64,74,81,82].\n3.2.1. Yttrium-90 and Lutetium-177\nYttrium-90, a pure high energy β−emitter (T 1/2=64 h, E βmax=2.28 MeV), and lutetium-177,\na medium energy β−emitter (T 1/2=6.7 d, E βmax=0.5 MeV) with a γcomponent (208 keV), are\ncurrently the most used in PRRT. Each of these two elements has its own advantages for targeted\ntherapy. The particles emitted by90Y are more energetic and more penetrating; they are able to di ﬀuse\non a thicker layer of cells, which is an advantage for the treatment of large tumors. However, even if\nhigh energy radiation allows a more uniform irradiation of the tumor, the risk of imposing an excessive\ndose of radiation on the adjacent tissues is very present. For its part, the177Lu emits less energetic\nradiation, more suited to small tumors. In addition, the energy of its γradiation is su ﬃcient to allow\ndetection by scintigraphy and establish dosimetry during the therapy sequences [159].\nThe ﬁrst analog to be studied was [90Y]-DOTATOC (Octreother®), and the ﬁrst treatment sessions\nquickly showed good results, stopping the progression of the tumor [ 72,160,161]. Many studies on this\nlong-used treatment have made it possible to observe a good tolerance for this radiotracer, with fairly\nmild side e ﬀects (fatigue) and in very rare cases a little more severe ones (nausea). However, it also\nshowed some toxicity for the kidneys and the bones, these two aspects being the dose-limiting factors\nfor the patient. In vitro , a greater a ﬃnity for SSTR2 has been demonstrated for [90Y]-DOTATATE\ncompared to [90Y]-DOTATOC [ 64]. However, for the diagnosis in humans, a better contrast between\nthe kidneys and the tumor was found for [111In]-DOTATOC compared to [111In]-DOTATATE [ 73],\nwhich may explain the wider use of DOTATOC analog. Despite this, these two analogs have relatively\nsimilar properties and have proven to be e ﬀective treatment methods that improve survival in some\npatients with neuroendocrine tumors (approximately 50 months vs. 18 months without treatment) [ 162].\nIn a Phase IIA study with [90Y]-DOTALAN (MAURITIUS trial), this one demonstrated lower tumor\nuptake in neuroendocrine tumors compared to90Y-DOTATOC, but could be of potential interest for\nother tumors, such as HCC or lung cancers [ 163]. With the perspective of several years of clinical use,\nPRRT with90Y-labeled somatostatin analogs appears to be well-tolerated with favorable long-term\noutcome.', 'Molecules 2020 ,25, 4012 16 of 35\n3.2. Radiolabeled Somatostatin Analogs for Therapy\nConcerning radionuclide therapy and more particularly peptide receptor radionuclide therapy\n(PRRT), radioactivity is used to destroy the targeted cells. Radiopharmaceuticals used in therapy are\ndesigned in the same way as those used in imaging, only the nature of the radioelement being modiﬁed.\nContrary to imaging, which uses radioelements having very penetrating but little ionizing radiations,\nPRRT privileges the use of radionuclides that have little penetrating and more energetic and thus more\nionizing radiations. Brought directly to the cancer cell, the radiation emitted by the radioactive decay\ncauses irreversible ionization of the cell’s DNA, which induces its apoptosis. The main isotopes used\ntoday are iodine-131, yttrium-90, lutetium-177 and, to a lesser extent, rhenium-188 [ 158]. As mentioned\nearlier, the purpose of the DOTA-SSA design was to work with a chelating cavity capable of complexing\nradioelements for imaging or therapy. Consequently, most of the platforms discussed above have been\ntransposed for therapeutic application via the use of β−emitters [64,74,81,82].\n3.2.1. Yttrium-90 and Lutetium-177\nYttrium-90, a pure high energy β−emitter (T 1/2=64 h, E βmax=2.28 MeV), and lutetium-177,\na medium energy β−emitter (T 1/2=6.7 d, E βmax=0.5 MeV) with a γcomponent (208 keV), are\ncurrently the most used in PRRT. Each of these two elements has its own advantages for targeted\ntherapy. The particles emitted by90Y are more energetic and more penetrating; they are able to di ﬀuse\non a thicker layer of cells, which is an advantage for the treatment of large tumors. However, even if\nhigh energy radiation allows a more uniform irradiation of the tumor, the risk of imposing an excessive\ndose of radiation on the adjacent tissues is very present. For its part, the177Lu emits less energetic\nradiation, more suited to small tumors. In addition, the energy of its γradiation is su ﬃcient to allow\ndetection by scintigraphy and establish dosimetry during the therapy sequences [159].\nThe ﬁrst analog to be studied was [90Y]-DOTATOC (Octreother®), and the ﬁrst treatment sessions\nquickly showed good results, stopping the progression of the tumor [ 72,160,161]. Many studies on this\nlong-used treatment have made it possible to observe a good tolerance for this radiotracer, with fairly\nmild side e ﬀects (fatigue) and in very rare cases a little more severe ones (nausea). However, it also\nshowed some toxicity for the kidneys and the bones, these two aspects being the dose-limiting factors\nfor the patient. In vitro , a greater a ﬃnity for SSTR2 has been demonstrated for [90Y]-DOTATATE\ncompared to [90Y]-DOTATOC [ 64]. However, for the diagnosis in humans, a better contrast between\nthe kidneys and the tumor was found for [111In]-DOTATOC compared to [111In]-DOTATATE [ 73],\nwhich may explain the wider use of DOTATOC analog. Despite this, these two analogs have relatively\nsimilar properties and have proven to be e ﬀective treatment methods that improve survival in some\npatients with neuroendocrine tumors (approximately 50 months vs. 18 months without treatment) [ 162].\nIn a Phase IIA study with [90Y]-DOTALAN (MAURITIUS trial), this one demonstrated lower tumor\nuptake in neuroendocrine tumors compared to90Y-DOTATOC, but could be of potential interest for\nother tumors, such as HCC or lung cancers [ 163]. With the perspective of several years of clinical use,\nPRRT with90Y-labeled somatostatin analogs appears to be well-tolerated with favorable long-term\noutcome.', 'enhancing the therapeutic effect of the\nradiolabelled drug [ 2].\nYttrium-90 The radiometal90Y is a pure β-emitting\nisotope with a physical half-life of 64 h.\nThe maximum and mean β-particle ener-\ngies are 2.28 MeV and 0.934 MeV, re-spectively. The maximum and mean β-\nparticle penetration depths in soft tissue\nare 11 mm and 3.9 mm, respectively.\nLutetium-177\n177Lu is a β- andγ-emitting radionuclide\nwith a physical half-life of 162 h (6.73\ndays). Compared to90Y,177Lu has lower\nmaximum and mean β-particle energies\n(0.498 MeVand 0.133 MeV, respectively).\nThese translate to maximum and meansoft-tissue penetration depths of 1.7 mm\nand 0.23 mm, respectively.\n177Lu has two\nmain gamma emission lines: 113 keV (6 %relative abundance) and 208 keV (11 %\nrelative abundance). The latter properties\nof\n177Lu allow posttreatment imaging and\ndosimetry assessments.\nDOTATOC DOTATOC is a derivatized somatostatin\nanalogue peptide. DOTATOC is the\nabbreviated form of [DOTA0,Tyr3]-\noctreotide, where DOTA stands for thebifunctional chelating molecule 1,4,7,10-\ntetraazacyclo-dodecane-1,4,7,10-\ntetraacetic acid, and Tyr3-octreotide is themodified octreotide. This peptide shows a\nhigh affinity for sstr2 (IC\n5014±2.6 nM),\nbut lower affinities for sstr5 (IC 50393±84\nnM) and sstr3 (IC 50880±324 nM) [ 3].\nDOTATATE DOTATATE is also a derivatized\nsomatostatin analogue peptide.DOTATATE is the abbreviated form of\n[DOTA0,Tyr3,Thr8]-octreotide or\n[DOTA0,Tyr3]-octreotate, and DOTAstands for the bifunctional metal-\nchelating molecule. This peptide shows\na six- to ninefold higher affinity forsstr2 (IC\n501.5±0.4 nM) than DOTA-\nTOC, but has no affinity for either\nsstr5 (IC 50547±160 nM) or sstr3\n(IC50>1,000 nM) [ 4].\nBackgroundNETs have proven to be ideal neoplasms for PRRNT, as the\nmajority of these slow-growing malignancies overexpresssstrs. Appropriate candidates for PRRNT are patients present-\ning with well-differentiated or moderately differentiated neu-\nroendocrine carcinomas, defined as NETs of grade 1 or 2according to the WHO classification of 2010 [ 5]. The inci-\ndence of NETs has been rising over the past 30 years, partic-\nularly those arising from the midgut and pancreas [ 6]. The\nincidence of NETs in the USA rose from 10.9 to 52.4 per\nmillion between 1973 and 2004 (SEER database). NETs can\no c c u ri nc h i l d r e na n dy o u n ga d u l t s ,b e i n gd i a g n o s e da se a r l ya sat the age of 5 years, while their incidence increases with age.\nThe clinical presentation may vary depending on the site of\ntumour origin. About 72 % of NETs arise in gastrointestinalstructures, 25 % are bronchopulmonary in origin, and less than\n5 % arise at other sites (e.g. thymus, breast and genitourinary\nsystem). Frequently, these tumours are discovered when meta-static or locally advanced and therefore inoperable. NETs can\nbe either functioning or nonfunctioning in nature. Functioning\ntumours are associated with clinical syndromes, such as thecarcinoid syndrome (due to the release of serotonin).']",2.0,1.0,1.0,1.0,1,1.0,0.0,0.5,96
8G advanced RAG,Ist der Einsatz von PRRT für den Patienten schädlich?,german,specific,side effects,claude-3-opus-20240229 advanced RAG,"Laut den gegebenen Informationen ist die Peptidrezeptor-Radionuklidtherapie (PRRT) im Allgemeinen gut verträglich, kann aber einige Nebenwirkungen haben [1,2]:

Akute Nebenwirkungen wie Übelkeit und Erbrechen sind meist mild und selbstlimitierend. Sie hängen oft mit der gleichzeitigen Gabe von nierenprotektiven Aminosäuren zusammen [2].

Subakute Nebenwirkungen treten innerhalb von 4-6 Wochen nach der Therapie auf, am häufigsten eine meist milde und reversible Knochenmarksuppression. Schwerwiegendere hämatologische Toxizität (WHO Grad 3-4) tritt bei weniger als 15% der Patienten auf [2].

Langfristige Nebenwirkungen können Nierenversagen sowie in seltenen Fällen Leukämie oder myelodysplastische Syndrome sein [1,2]. Das Risiko für schwere Nephrotoxizität (Grad 3/4) wurde bei nur 1,5% der Patienten beobachtet [1]. Durch Nierenprotektion mit Aminosäuren lässt sich die Nierentoxizität reduzieren [2].

Insgesamt ist die PRRT eine relativ sichere Therapie, solange die nötigen Vorsichtsmaßnahmen getroffen werden. Schwerwiegende Nebenwirkungen sind selten, die meisten Nebenwirkungen sind vorübergehend und beherrschbar.","['J. Clin. Med. 2021 ,10, 1267 11 of 15\n4.5.1. Subacute Effects\nPRRT is overall well tolerated with most patients experiencing only moderate toxicity.\nIn the study NETTER-1, validating the PRRT in midgut NETs, 5% of the patients discon-\ntinued treatment due to toxicity related to PRRT. Acute side effects are mainly nausea,\nvomiting, fatigue and abdominal pain. These adverse events are mainly caused by the\nsimultaneous infusion of aminoacids. Particular vigilance must be exercised with regard\nto the risk of carcinoid crisis. This event was reported in a very small minority (1%) of\npatients who received an PRRT treatment. This crisis usually appears within 48 h of the ﬁrst\ninfusion and is related to the massive release of active amines [ 34]. A myelosuppressure\nhas been described and is caused by the irradiation of the bone marrow. Bone marrow\nis particularly radiosensitive, and this toxicity does not appear to be associated to the\nexpression of SSTRs in myeloid cells. Myelosuppression generally develops four at six\nweeks after the infusion, is usually grade 1/2 and is reversible. Hematotoxic effects grade\n3 and 4 have been described in 13% and 10% of the patients receiving90Y-DOTATOC\nand177Lu-DOTATATE, respectively [ 35]. Lymphopenia is the more often reported severe\ncytopenia. Some studies have also reported that PRRT could be safely used in the case\nof diffuse metastatic bone marrow involvement, without irreversible myelosuppression,\nalthough a higher incidence of subacute transient hematologic toxicity was observed [36]\nOther toxicities have been reported, including a risk of hepatotoxicity in the patients\nwith major liver involvement. Thus, as indicated above, it is desirable to consider PRRT\nearly in the management process of the disease.\n4.5.2. Long-Term Effects\nLong-term side effects of PRRT can include renal failure and leukemic or myelodys-\nplastic syndromes.\nThe radiolabels are reabsorbed in the proximal tubules, may accumulate in the proxi-\nmal tubules in the renal interstitium and cause kidney damage. Because of its higher energy\nand longer penetration range,90Y irradiates the renal interstitium glomeruli more exten-\nsively than177Lu. In a large institutional series of 1109 patients treated with90Y-DOTATOC,\n103 patients (9%) were treated with90Y-DOTATOC with severe renal toxicity [ 7]. Nowa-\ndays, the concomitant administration positively charged aminoacids results in a reduction\nof up to 40% of the renal absorption. Despite renal protection, the median decrease of the\ncreatinine clearance is estimated to 4% per year in patients treated with177Lu-DOTATATE.\nThe risk factors for nephrotoxicity cited are diabetes and poorly controlled hypertension.\nRisk of severe nephrotoxicity (grade 3/4) was observed in only 1.5% of patients [ 37]. In\noverall, end-stage renal disease as a consequence of PRRT is extremely rare.\nCases of leukemia and myelodysplastic syndromes have been reported as late-onset\nPRRT toxicity, with an estimated incidence of up to 2% [ 37,38]. Age over 70 years, cytopenia\nbefore treatment, the presence of bones metastasis, the high number of previous treatments,\nthe prior use of an alkylating agent and the radiotherapy increases the risk of secondary\nmyelodysplastic syndrome. Brieau et al. reported in a retrospective monocentric study\nconducted in a population of patients treated with PRRT and pre-treatment alkylating\nchemotherapy an increased risk late hematologic toxicity (20%; four patients out of 20) [ 39].\nThe main alkylating agent used in the NET treatment is temozolomide. The development\nof myelodysplastic syndrome or leukemia has been reported between 30 and 70 months\nafter treatment with PRRT [ 39].', 'during the first courses of therapy following the injection of\n177Lu-DOTATATE.\nSide effects\nAcute\nSide effects of PRRNT are usually mild, if necessary precau-\ntions are taken. Side effects may be acute, related to the\nadministration of amino acids or to the radiopeptide itself, or\nchronic. The coinfusion of amino acids enlarges the safetymargin for treating with higher activities enabling higher\ntumour radiation doses to be attained safely. Side effects such\nas nausea, headache and rarely vomiting due to metabolicacidosis induced by the amino acid coadministration do occur\nin the majority of patients [ 59,88]. Particular attention and\ncare should be given to avoiding possible electrolyte imbal-ance (hyperkalaemia, hypernatraemia), and the subsequent\nmetabolic acidosis, that might lead to mild nausea and vomit-\ning. The latter side effects should be managed by hydrating thepatient with normal saline and possibly by repeating cortico-\nsteroid or antiemetic administrations.\nPRRNT may exacerbate the syndromes related to the re-\nspective functional tumours, due to the sudden massive re-\nlease of the hormones and receptor stimulation. The clinical\nmanifestation is dependent on the specific hormone involved.The following measures are therefore recommended. Vital\nsigns (at least blood pressure and pulse) should be monitored\nbefore and after radiopeptide infusion, especially in symptom-atic patients. Therapeutic interventions should be undertaken\nto treat the for functional syndrome effects or exacerbation\n(e.g. carcinoid syndrome/hypotension, hypoglycaemia, hyper-gastrinaemia, hypertension, hypotension, WDHA syndrome,\nelectrolyte imbalance) [ 89]. In patients without or with minor\nmetastatic liver involvement, no significant hepatic toxicity\nhas been reported. However, in patients with massive liver\nmetastases and impaired liver function, liver toxicity mayoccur, and this should be considered, along with preexisting\nconditions affecting the liver, when choosing the appropriate\nradioisotope and dosing. In such cases,\n177Lu-labelled pepti-\nd e ss h o u l db eu s e da n dt h ea d m i n i s t e r e da c t i v i t ys h o u l db e\nreduced accordingly. After treatment, patients should avoid\npregnancy for at least 6 months. Due to a temporary impair-ment of fertility, related to a transient damage to Sertoli cells,\nmale patients should consider sperm banking before therapy.\nDelayed side effects\nRenal toxicityThe kidneys are the dose-limiting organs at the activities\nnormally reached with PRRNT. Proper kidney protection, asdiscussed, is currently mandatory. However, despite kidney\nprotection, loss of kidney function can occur after PRRNT,\nwith a creatinine clearance loss of about 3.8 % per year for\n177Lu-DOTATATE and 7.3 % per year for90Y-DOTATOC\n[90]. In a series of 1,109 patients treated with90Y-DOTATOC,\nthe incidence of grade 4 and 5 kidney toxicity was found to be9.2 % [ 50]. Delayed renal toxicity following\n90Y-DOTATOC\ntreatment was observed more frequently in patients with pre-\ndisposing risk factors including longstanding and poorly con-trolled hypertension and diabetes mellitus [ 56].\nBone marrow toxicitySevere (grade 3 and 4), mostly reversible, acute bone mar-\nrow toxicity is observed in less than 10 –13 % of treatment\ncycles with\n90Y-DOTATOC, and in 2 –3 % of cycles with\n177Lu-DOTATATE. Nevertheless, sporadic cases of myelo-\ndysplastic syndrome or overt acute myelogenous leukaemiahave been reported [ 45,49,50].\nEndocrine systemsDespite the presence of sstr in normal pituitary, thyroid and\nadrenal glands and Langerhans cells, no significant alterationin endocrine hormone function have been reported [ 91].\nResults\nPRRNT with the somatostatin analogues\n90Y-DOTATOC\nand177Lu-DOTATATE has been explored in NET for more\nthan a decade.', 'Salvage Treatment\nAlthough tumor response rates after initial treatment with\nPRRT are encouraging, CR is rare and eventually tumor pro-\ngression occurs in the majority of patients. Retreatment with\nextra cycles of PRRT as salvage therapy may be consideredwhen better options are not available. One study showed that\nsalvage therapy with two additional cycles of\n177Lu-octreotate\ndoes not lead to serious hematologic or nephrotoxic side ef-\nfects, but the tumor response rate was less compared with\ninitial treatment [ 50].\nAnother report showed that long PFS after the initial treat-\nment with PRRT predicts a prolonged PFS after salvage ther-apy [ 51], and argued that PRRT with\n177Lu-octreotate in the\nretreatment setting is a safe and effective option in patients\nwith metastatic GEP-NETs. For these reasons, retreatment\nseems a good option for patients who responded well after\nthe initial cycles of PRRT [ 52]. This novel and important\nconcept of salvage therapy of NET needs to be tested in large,\nprospective, and multi-center trials to contribute to evidence-\nbased findings.\nTreatment Side Effects\nPRRT is generally well-tolerated. Side effects can be divided to\nacute, subacute, and long-term side effects, as summarized inTable 4. Acute side effects are usually mild and self-limiting.\nNausea or vomiting are related to the concomitant admin-\nistration of kidney-protective amino acids. Subacute side\neffects are related to the radiopeptide itself, such as bonemarrow suppression, mild hair loss (observed with\n177Lu-\noctreotate), or, more rarely, an exacerbation of a clinicalsyndrome. The most common subacute side effect ofPRRT, occurring within 4 to 6 weeks after therapy, is bone\nmarrow suppression. Usually, the hematologic toxicity is\nmild and reversible. More serious WHO grade 3 or 4 tox-icity may occur, but this has been seen in less than 15% of\npatients [ 53].\nLong-term side effects of PRRT may include renal failure\nas well as leukemia/myelody splastic syndromes (MDS).\nBecause radiopeptides are usually reabsorbed in the proximal\ntubules, they can accumulate in the renal interstitium and in-duce inflammation and fibrosis with eventual kidney damage.\nCo-administration of positively charged amino acids results ina reduction of renal radioactive uptake, up to 40% as reportedin some studies [ 16,54]. If patients have long-standing or\npoorly controlled comorbidities such as diabetes and hyper-\ntension that affect kidney function, it is expected that there\nwould be a larger and more persistent decline in creatinine\nclearance [ 55].\nAdministration of Treatment\nFor purposes of kidney protection, positively charged amino\nacids, such as L-lysine and/or L-arginine, are co-infused to\ncompetitively inhibit the proximal tubular reabsorption ofthe radiopeptide [ 56]. This reduces the renal-absorbed dose.\nDilution of the amino acids with saline allows proper hydra-tion for the patient, an appropriate ratio to use is 25 g of aminoacid in 1 L of normal saline. Obviously, patients ’comorbidi-\nties should be taken into account (e.g., avoid volume overloadin patients with cardiac insufficiency and take care in avoidingelectrolyte imbalances with hyperosmotic solutions).\nAntiemetics can be administered before the infusion to avoidpotential nausea or vomiting. Amino acid infusion should bestarted 30 –60 min before administration of the radiopeptide\nand should be maintained over 4 h. Several amino acid pro-tective schemes have been proposed in the joint IAEA,EANM, and SNMMI practical guidelines on PRRT treatment\nof NETs [ 56].\nCurrent administration schedules comprise the most ap-\npropriate number of cycles (generally four or five) and thebest delivery frequency (8 weeks apart). This pattern allows\nthe patient to recover from the mild side effects of the ther-apy and increases its effectiveness in terms of the radiobi-\nological activity [ 57]. Radioisotope infusion should be\naround 30 min as recommended in the literature.']",4.0,1.0,1.0,1.0,0,1.0,1.0,1.0,139
8E advanced RAG,Is PRRT harmful for the patient?,english,specific,side effects,claude-3-opus-20240229 advanced RAG,"According to the provided context, PRRT can induce some harmful effects for the patient, although most adverse events are mild and reversible [1,2]. The main toxicities associated with PRRT are:

1. Hematological toxicity: Grade 3 or 4 neutropenia, thrombocytopenia, or leukopenia have been observed in a small percentage of patients. There is also a long-term risk of 2% for developing myelodysplastic syndrome and 1% for acute myeloid leukemia after PRRT [2].

2. Nephrotoxicity: Despite the use of lysine and arginine to reduce renal re-absorption of radiolabeled peptides, nephrotoxicity can still occur, such as tubulointerstitial scarring, atrophy, and thrombotic microangiopathy. In the NETTER-1 study, grade ≥3 renal toxicity was observed in 5% of the 177Lu-DOTATATE group [2].

3. Other side effects: Nausea, abdominal pain, asthenia, and increased hair loss are frequently reported but are usually mild [1,2].

In summary, while PRRT can cause some harmful effects, most are manageable and reversible. Severe toxicities are rare but can occur, particularly in patients with pre-existing risk factors [1,2].","['J. Clin. Med. 2021 ,10, 1267 11 of 15\n4.5.1. Subacute Effects\nPRRT is overall well tolerated with most patients experiencing only moderate toxicity.\nIn the study NETTER-1, validating the PRRT in midgut NETs, 5% of the patients discon-\ntinued treatment due to toxicity related to PRRT. Acute side effects are mainly nausea,\nvomiting, fatigue and abdominal pain. These adverse events are mainly caused by the\nsimultaneous infusion of aminoacids. Particular vigilance must be exercised with regard\nto the risk of carcinoid crisis. This event was reported in a very small minority (1%) of\npatients who received an PRRT treatment. This crisis usually appears within 48 h of the ﬁrst\ninfusion and is related to the massive release of active amines [ 34]. A myelosuppressure\nhas been described and is caused by the irradiation of the bone marrow. Bone marrow\nis particularly radiosensitive, and this toxicity does not appear to be associated to the\nexpression of SSTRs in myeloid cells. Myelosuppression generally develops four at six\nweeks after the infusion, is usually grade 1/2 and is reversible. Hematotoxic effects grade\n3 and 4 have been described in 13% and 10% of the patients receiving90Y-DOTATOC\nand177Lu-DOTATATE, respectively [ 35]. Lymphopenia is the more often reported severe\ncytopenia. Some studies have also reported that PRRT could be safely used in the case\nof diffuse metastatic bone marrow involvement, without irreversible myelosuppression,\nalthough a higher incidence of subacute transient hematologic toxicity was observed [36]\nOther toxicities have been reported, including a risk of hepatotoxicity in the patients\nwith major liver involvement. Thus, as indicated above, it is desirable to consider PRRT\nearly in the management process of the disease.\n4.5.2. Long-Term Effects\nLong-term side effects of PRRT can include renal failure and leukemic or myelodys-\nplastic syndromes.\nThe radiolabels are reabsorbed in the proximal tubules, may accumulate in the proxi-\nmal tubules in the renal interstitium and cause kidney damage. Because of its higher energy\nand longer penetration range,90Y irradiates the renal interstitium glomeruli more exten-\nsively than177Lu. In a large institutional series of 1109 patients treated with90Y-DOTATOC,\n103 patients (9%) were treated with90Y-DOTATOC with severe renal toxicity [ 7]. Nowa-\ndays, the concomitant administration positively charged aminoacids results in a reduction\nof up to 40% of the renal absorption. Despite renal protection, the median decrease of the\ncreatinine clearance is estimated to 4% per year in patients treated with177Lu-DOTATATE.\nThe risk factors for nephrotoxicity cited are diabetes and poorly controlled hypertension.\nRisk of severe nephrotoxicity (grade 3/4) was observed in only 1.5% of patients [ 37]. In\noverall, end-stage renal disease as a consequence of PRRT is extremely rare.\nCases of leukemia and myelodysplastic syndromes have been reported as late-onset\nPRRT toxicity, with an estimated incidence of up to 2% [ 37,38]. Age over 70 years, cytopenia\nbefore treatment, the presence of bones metastasis, the high number of previous treatments,\nthe prior use of an alkylating agent and the radiotherapy increases the risk of secondary\nmyelodysplastic syndrome. Brieau et al. reported in a retrospective monocentric study\nconducted in a population of patients treated with PRRT and pre-treatment alkylating\nchemotherapy an increased risk late hematologic toxicity (20%; four patients out of 20) [ 39].\nThe main alkylating agent used in the NET treatment is temozolomide. The development\nof myelodysplastic syndrome or leukemia has been reported between 30 and 70 months\nafter treatment with PRRT [ 39].', 'PRRT is only applicable for pa-\ntients with a Karnofsky Performance Scale of at least 60 [ 27]. PRRT is contra-indicated\nfor patients who are pregnant or breastfeeding, patients with severe cardiac impairment\n(NYHA III or IV) and those with a life expectancy less than 3 months [ 31]. Since PRRT\ncan induce toxicity, the following pre-treatment laboratory values are required: creatinine\nclearance > 40 mL/min, hemoglobin levels ≥6 mmol/L, leukocytes > 2 ×109/L, platelet\ncount > 75 ×109/L, bilirubin, alanine aminotransferase (ALAT) and aspartate aminotrans-\nferase (ASAT) < 3 times the upper limit of normal and albumin > 3 g/dL [2,3].\n8. PRRT-Related Toxicity\nAdverse events related to PRRT are frequently mild and include nausea, abdominal pain\nand asthenia [ 27,50]. Increased hair loss is observed in up to 60% of patients treated with\n177Lu-DOTATATE, but this is temporary and seldom leads to baldness [ 88]. Besides these\nmild adverse events, PRRT can induce more severe toxicities which can be dose-limiting and\nadjustments to the treatment schedule might be required [ 89]. When the toxicity has subsided\nwithin 16 weeks after the last dose, guidelines advise to administer half of the original activity\nof177Lu-DOTATATE during the next cycle. PRRT should be discontinued when the toxicity\npersists after 16 weeks or recurs after the half dose [ 3]. In the NETTER-1 trial, 7% of the\npatients received a reduced dose because of dose-limiting toxicities [ 27]. The kidneys and the\nbone marrow are the critical organs for dose-limiting toxicities.', 'Cancers 2022 ,14, 5792 8 of 17\n8.1. Hematological Toxicity\nPRRT can induce hematological toxicity through bone marrow radiation. The vast\nmajority of patients only have mild and reversible hematological toxicity with a nadir at\n4–6 weeks after administration of PRRT [ 27,36,50]. However, grade 3 or 4 neutropenia,\nthrombocytopenia or leukopenia have been observed in, respectively, 1%, 2% and 1% of\nthe patients treated with177Lu-DOTATATE in the NETTER-1 trial [ 27]. PRRT-induced\nsevere lymphopenia is the most common hematological toxicity [ 27,29], but it has not been\nassociated with increased susceptibility for infections [90]. Thrombocytopenia is the most\ncommon cause of dose reduction in PRRT, whereas bleeding complications are rare [ 27].\nCaution should be taken in patients with widespread bone metastases (Figure 2A), due\nto the risk of persistent cytopenia. In the absence of alternative treatment options, PRRT\nshould preferably be initiated at half the regular activity (3.7 GBq)177Lu-DOTATATE in\nthese patients. Additionally, there is a relevant long-term risk of 2% for the development\nof myelodysplastic syndrome (MDS) and 1% for acute myeloid leukemia (AML) after\nPRRT [ 27,29,91]. Little is known about the pathophysiology of persistent hematological\ntoxicity, but a role for clonal hematopoiesis has been postulated [ 92]. Known risk factors\nfor severe hematological toxicity include decreased renal function, pre-existent cytopenias,\nextensive tumor mass, age over 70, extensive bone metastases and pre-treatment with\nmyelotoxic chemotherapy [ 91,93,94]. Additionally, women are at higher risk for developing\nsubacute grade ≥2 thrombocytopenia than men, which was independent from other risk\nfactors in a multivariable analysis [89].\n8.2. Nephrotoxicity\nDue to SSTR expression in the kidneys and the renal excretion of radiolabeled SSAs, the\nkidneys receive a high radiation dose during PRRT. Following glomerular filtration, SSAs are re-\nabsorbed in the proximal tubuli of the renal cortex because of active transport mechanisms [ 95].\nBy saturating this re-uptake mechanism through the use of lysine and arginine, re-absorption of\nradiolabeled peptides can be significantly reduced. This results in less radiation-induced nephro-\ntoxicity by a reduction of the absorbed kidney dose up to 40% [ 96,97]. However, nephrotoxicity\nafter PRRT still occurs such as tubulointerstitial scarring, atrophy and thrombotic microan-\ngiopathy [ 98]. In the NETTER-1 study , grade ≥3 renal toxicity was observed in 5% of the\n177Lu-DOTATATE group and in 4% of the control group [ 30]. Bergsma et al. reported an overall\ncreatinine clearance loss of 3.4% 1 year after PRRT. No subacute grade ≥3 renal toxicity was\nseen and 1.5% of the patients showed grade 3 renal toxicity in the long term. However, all these\npatients had a creatinine clearance of <60 mL/min at baseline [ 99]. A reduced kidney function\ncan lead to a delayed renal excretion of177Lu-DOTATATE and this has also been associated with\na higher risk of hematological toxicity [ 95]. Risk factors associated with renal toxicity include\nage > 60 years, hypertension, diabetes mellitus, pre-existing renal disease, cumulative radiation\ndose to the kidneys, previous nephrotoxic chemotherapy , tumor or metastases close to the\nkidney and previous PRRT with90Y-DOTATOC [ 100]. Post-renal obstruction can be observed in\nsome GEP-NET patients, particularly in those with retroperitoneal or pelvic metastases, but this\ncan also be caused by the primary tumor, nephrolithiasis and abdominal or retroperitoneal fi-\nbrosis [ 101].']",2.0,1.0,1.0,1.0,1,1.0,1.0,1.0,165
9G advanced RAG,Ist die PRRT die Zukunft für metastasierende Krebspatienten?,german,general,therapy,claude-3-opus-20240229 advanced RAG,"Basierend auf den gegebenen Informationen ist die Peptid-Rezeptor-Radionuklid-Therapie (PRRT) eine vielversprechende Behandlungsoption für bestimmte metastasierende Krebsarten, insbesondere neuroendokrine Tumoren (NETs):

- Die PRRT mit 177Lu-DOTATATE zeigte in Studien bei Patienten mit fortgeschrittenen NETs des Gastrointestinaltrakts und der Bauchspeicheldrüse beeindruckende Ergebnisse, mit Ansprechraten von 39% und einem medianen Gesamtüberleben von 63 Monaten [27].

- Die Anwendung der PRRT wurde mittlerweile auch auf andere Somatostatin-Rezeptor-positive Tumoren wie Brustkrebs, Lymphome und Schilddrüsenkrebs ausgeweitet, wenn zugelassene Therapien versagt haben [8]. 

- Zukünftig sind eine Individualisierung der PRRT-Behandlung basierend auf Dosimetrie sowie ein früherer Einsatz im Behandlungsalgorithmus, z.B. als Erstlinientherapie, von besonderem Interesse. Daten dazu werden aus laufenden Studien erwartet [Harris and Zhernosekov, 2022].

Insgesamt zeigt die PRRT großes Potenzial für die Behandlung bestimmter metastasierter Krebsarten, insbesondere NETs. Ob sie generell die Zukunft für metastasierende Krebspatienten darstellt, lässt sich anhand der Kontextinformationen aber nicht abschließend beantworten. Weitere Forschung ist nötig.","['Lutetium-177- DOTATATE/\nDOTATOC for treatment of\nGastroenteropancreatic NETs\nNeuroendocrine neoplasms (NENs) are relatively rare\nneoplasms which may arise from pluripotential stem cells in\naddition to cells of the diffuse neuroendocrine system\ncomprising the autonomic nervous system, the thyroid, lungs,\npancreas and gastrointestinal tract ( 2). The classi ﬁcation of NENs\nhas recently been updated by the WHO according to morphology\nand proliferation as well differentiated neuroendocrine tumors\n(NETs) (G1 to G3) and poorly differentiated neuroendocrine\ncarcinomas (NECs) (G3) ( Table 2 )(3).\nNETs may be clinically silent ( ‘non-functioning ’) or may\nsynthesize and secrete a variety of peptides and neuroamines\nwhich lead to the development of characteristic clinical\nsyndromes, including carcinoid syndrome and functional\npancreatic tumors such as insulinoma (hypoglycemia) and\ngastrinoma (gastric hyperacidity). The non-functioning tumors\ntend to present late with widespread metastatic disease,\nparticularly in the liver. NETss tend to be indolent in\ncharacter and patients can still live for relatively prolonged\nperiods with good quality of life even with metastatic disease ( 4).\nThe incidence of NENs is increasing year-on-year. In the\nUSA, the SEER database has documented a 6,4-fold increase in\nincidence between 2007 (1,09 per 100.000) and 2012 (6,98 per\n100.000) ( 5). This increase has included gastroenteropancreatic\n(GEP) NENs with the highest incidence being seen in adults\naged 74-80) ( 6) The age-standardized incidence rate of NENs in\nthe UK between 2013-2015 has been reported as 8.6 per 100,000,\nwith an incidence of 4.6 per 100,000 for gastroenteropancreatic\n(GEP) NENs ( 7).\nGEP-NETs are graded with increasing aggressivity as G1, G2\nor G3, based on Ki-67 labeling index, mitotic count and\nhistological differentiation ( Table 2 )(3). Well differentiated G1\nand G2 GEP-NETs typically show a slower progression and better\nprognosis than G3 GEP-NETs ( 8). A characteristic feature ofGEP-NETs is that a majority express functioning somatostatin\nreceptors (SSTRs) 2 and 5. This renders the tumors amenable to\ntreatment with synthetic somatostatin peptides, which can inhibit\nfunctional secretion and also stabilize tumor growth ( 9). These\nsynthetic peptides, conjugated with a chelator, can be ef ﬁciently\nradiolabeled with photon-, positron- or particle-emitting\nradionuclides. The expression of SSTR2 enables GEP-NETs to\nbe imaged with receptor targeted high resolution PET/CT(DOTATOC/DOTATATE-Ga-68). In addition, tumors can be\ntreated with therapeutic Lu-177 DOTATOC/DOTATATE ( 10).\nPatients with G1 and G2 GEP-NETS often present late, with\nmetastatic disease. Until recently, somatostatin analogues and\nthe molecularly targeted drugs Sunitinib andEverolimus as well\nas chemotherapy in PNETs have provided the mainstays of\ntreatment ( 11). These treatments usually result in disease\nstabilization for a limited period of time. In the RADIANT-3\ntrial, Everolimus achieved a progression free survival (PFS) of 11\nmonths in pancreatic NETS (PNETs) and a similar PFS was\nachieved in midgut and pulmonary NETs in the RADIANT-4\ntrial ( 12,13).\nPRRT has recently emerged as a novel treatment option for\npatients with G1 and G2 GEP-NETs.', 'long-term safety of PRRT in NET. The main organs of concern\nare the bone marrow and the kidney. Transient hematotoxicity,\nparticularly thrombocytopenia, is frequently seen usually around\n4-6 weeks after a treatment cycle but this usually rapidly\nrecovers, allowing a following cycle of treatment. Long-term\nmyelodysplasia or leukaemia appears to occur in a little over 2%\nof patients, although historically, many have been heavily pre-\ntreated. Renal toxicity, which is mitigated with concomitant\namino acid infusion ( 20) has been mainly related to Y-90\ntherapy and is uncommon with Lu-177 ( 28,29).\nThe diagnosis, management and follow-up of patients with\nGEP-NETs is detailed in recent ESMO Guidelines ( 3). PRRT has\nbeen shown to be ben ﬁcial in the management of patients with\nsymptoms of carcinoid syndrome ( 30). ESMO Guidelines\nrecommend the use of Lu-177-DOTATATE following\nsomatostatin analogue therapy, for the treatment of patients\nwith carcinoid syndrome, diarrhea and/or ﬂushing. PRRT is also\nrecommended for patients with GE NETs who have progressive\ndisease following treatment with somatostatin analogues or with\neverolimus and for PNETs following treatment with everolimus,\nsunitinib or chemotherapy (capecitabine and temozolomide/\nstreptozotocin and 5- ﬂuorouracil).\nAlthough PRRT for the treatment of patients with NETs has\nprovided a new paradigm for the management of patients with\nadvanced metastatic disease, the optimal treatment regimen and\nalso the positioning of PRRT in the treatment algorithm remain\nto be de ﬁned. At the present time, patients received a standard\nactivity/dose of treatment at ﬁxed intervals of 8 weeks\n(Lutathera) or 12 weeks (COMPETE study). The currenttreatment regimens are based on empirical observations in the\nclinic. Opportunities for further improving the management of\npatients are expected with new antagonist targeting molecules\nand the application of radionuclides which with different\nphysicochemical properties to Lu-177. A number of clinical\ntrials with PRRT in NETs are currently ongoing ( Table 3 ).The future of targeted radiotherapy in\nNETS\nAt the present time, patients receive a standardized\ntreatment regimen of ~7,5GBq 8-12 weekly for 4 cycles. There\nis a great deal of interest in individualizing patients ’therapy\nregimens based on dosimetry. All patients in the COMPETE\nstudy undergo dosimetric evaluation with 2D planar imaging at\n0,5 hrs, 6 hrs, 24 hrs and 72-96 hrs after the ﬁrst infusion and\nSPECT/CT for hybrid 2D/3D dosimetry at 24 hrs post each\ninfusion. Sub-study A will compare the cumulative absorbed\ndoses to kidneys and target lesions extrapolated from dose 1 to\nthe cumulative absorbed dose from all 4 infusions. In sub-study\nB, the absorbed dose estimated by 3D dosimetry will be\ncompared to estimates from planar 2D and hybrid 2D/3D\ndosimetry. It is expected that the dosimetry data from these\nstudies will facilitate the a pplication of dosimetry to\nindividualized therapy, rather than the standard ‘one size ﬁts\nall’approach.\nThe currently available data for PRRT of NET patients are\nmainly for those with advanced disease, who have receivedprevious therapies. These patients inevitably relapse at some\nstage. Earlier positioning in the treatment algorithm is of\nparticular interest and data for the ﬁrst-line therapy will be\nforthcoming from COMPETE ,C O M P O S Ea n dN E T T E R - 2\ntrials. Neoadjuvant therapy in PNETs is a subject of interest\nwith anectodal reports of bene ﬁcial surgical outcomes in some\npatients ( 31).\nIt is apparent from dosimetry and safety that many patients\nare able to receive and bene ﬁt from additional cycles of\ntreatment ( 32,33).', 'Symptomatic relief was encountered in this therapy in patients\nwith metastasized GEP-NETs. However, objective tumor re-sponses were rare [ 15,16]. The next generation of analogues\nused in PRRT consisted of [Tyr3]octreotide as a somatostatinanalogue and DOTA as a chelator (instead of DTPA), whichallows stable binding of the β-emitting radionuclide\n90Y . Its\nmaximal tissue penetration is 12 mm and its half-life is2.7 days. [\n90Y-DOTA0,Tyr3]octreotide (90Y-DOTATOC) was\nused in multiple phase I and phase II PRRT trials across sev-\neral countries [ 17–24], with reported objective responses rang-\ning from 4 to 33%. It is mainly due to differences in cycle\ndoses, administered cumulative dose, as well as variabilities\nin patients ’characteristics (such as various tumor types and\npatient performance statuses) that make these studies very dif-\nficult to compare. Different studies report median progression-free survival (PFS) varying from 17 to 29 months and medianoverall survival (OS) from 22 to 37 months [ 21–24].\n177Lu-DOTATATE is currently the most widely used\nradiopeptide for PRRT [ 21]. It has shown similar efficacy\nwhen compared to90Y-DOTATOC, while showing a more\nfavorable toxicity profile, especially when speaking of hema-\ntological and renal toxicity [ 25,26]. In a recent study on bron-\nchial and GEP-NETs, Brabander et al. [ 27] evaluated safety,\nefficacy and toxicity of177Lu-DOTATATE and showed im-\npressive results. The objective response rate (ORR) reached\n39%, stable disease (SD) was reported in 43% of patients, andthe PFS and OS for all NET patients were 29 and 63 months,\nrespectively (Fig. 3).\nWith time, the use of PRRT which initially targeted\nNETs was extended to other types of confirmed SSTR-positive tumors. Tumors such as breast cancer, lymphoma,\nglioma, meningioma, and paraganglioma, as well as non-\niodine-absorbing differentiated thyroid cancer can now be\nconsidered for PRRT when registered therapies have failed[8].\n177Lu Radionuclide and NETTER-1 Trial\nThe Neuroendocrine Tumors Therapy (NETTER-1) trial is thefirst randomized controlled trial that evaluated the efficacy\nFig. 1 aMIP image of68Ga\nDOTATOC PET shows the\nprimary NET in the small bowel\non the right side of the abdomen\n(red arrow) with extensive livermetastases, both demonstratingintense increased radiotracer\nuptake reflecting the high\nexpression of the somatostatinreceptors. The axial PET image\n(b), CT image ( c), and fused PET/\nCT image ( d) show the extensive\nliver metastases\nFig. 2 An illustration showing the main components of PRRT: a\nradionuclide isotope like90Y , and177Lu, a ligand or carrier molecule\nlike TATE or TOC, and a chelator or linker like DOTA that binds themtogether and stabilizes the complex192 Nucl Med Mol Imaging (2018) 52:190 –199']",4.0,1.0,1.0,1.0,1,1.0,1.0,1.0,145
9E advanced RAG,Is PRRT the future for metastatic cancer patients?,english,general,therapy,claude-3-opus-20240229 advanced RAG,"Based on the provided context, PRRT shows promise for the treatment of metastatic neuroendocrine tumors (NETs), but it is not clear if it will be the future for all metastatic cancer patients. A few key points:

- PRRT has demonstrated high response rates and prolonged progression-free survival in patients with advanced GEP-NETs, with limited serious adverse events compared to other treatments like high-dose octreotide [1].

- PRRT was associated with significant tumor size reduction and rendered some inoperable PanNETs operable, even enabling complete responses in some cases [1]. 

- PRRT is recommended in treatment guidelines for progressive GEP-NETs and PNETs after failure of other therapies like somatostatin analogues, everolimus, sunitinib or chemotherapy [2].

- However, the optimal PRRT treatment regimen and positioning in the treatment algorithm still need to be defined. Ongoing clinical trials are evaluating PRRT in first-line therapy for NETs [2].

In summary, while PRRT is a promising targeted radiotherapy option for metastatic NETs, more data is needed to determine if it will become the future standard treatment for metastatic cancer patients more broadly. Its role is currently focused on certain NET subtypes after progression on other therapies.","['Int. J. Mol. Sci. 2022 ,23, 1447 15 of 22\nstudies examining the feasibility, outcome, and safety of PRRT also demonstrated a PFS\ncomparable to, and in some cases superior to, that of other treatment modalities. Due to\nthe retrospective nature of these studies, the results required conﬁrmation in prospective\ntrials. According to PanNET guidelines, PRRT should even be used as a third-line therapy\nin patients with advanced locoregional disease following the failure of SSAs, everolimus,\nand/or cytotoxic chemotherapy [ 8]. Two cases were presented for third-line therapy, in\nwhich patients with metastatic PanNET (G2 Ki-67 10%) received chemotherapy or PRRT\naccording to the standard of care following SSA failure. After six cycles of STZ/5-FU (over\nnine months), the patient progressed four months later without treatment. The majority of\nparticipants preferred PRRT (38.6%, n = 32) over STZ/5-FU reinduction (26.5%, n = 22) [ 136].\nIn patients with GEP-NET G1 and G2, 177Lu-PRRT was compared to the mTOR inhibitor\neverolimus. Despite the success of 177Lu-DOTATATE PRRT, not all patients showed bene-\nﬁts, and patients typically relapsed 2–3 years after initiating treatment. As a result, various\nexperimental approaches and strategies are being investigated in order to maximize PRRT’s\neffectiveness while minimizing potential side effects [ 8]. The NETTER-1 phase III study\ndemonstrated that, in addition to improving progression-free survival, 177Lu-Dotatate\nsigniﬁcantly improves patient quality of life signiﬁcantly when compared to high-dose\noctreotide [ 137]. In the study where 229 patients randomly received Lu-DOTATATE every\neight weeks for four cycles plus 30 mg octreotide every four weeks or high-dose octreotide\n(60 mg) every four weeks alone showed a signiﬁcant reduction in tumour progression or\ndeath in the Lu-DOTATATE treatment group. According to recent investigations, the time\nto quality of life decline was substantially longer in the 177Lu-DOTATATE therapy group.\nAfter the NETTER-1 phase III trial, the 177Lu-DOTATATE treatment was approved for\nthe somatostatin receptor-positive GEP-NETs [ 138]. To begin, treatment may be continued\nafter four cycles of PRRT, depending on kidney and bone marrow tolerance, for example,\nwith a reduced radioactivity as part of the salvage therapy (Re-PRRT). Retreatment with\n177Lu-DOTATATE-based PRRT showed an optimistic survival beneﬁt with acceptable\nsafety in patients with NETs [ 139]. The administration of PRRT intra-arterially into the\nhepatic artery rather than intravenously may increase the tumour-absorbed dose in liver\nmetastases. However, intra-arterial administration is not mentioned in guidelines and is\nconsidered experimental [ 140]. Patients with hepatic dominant metastases, in particular,\nwould beneﬁt from this approach due to the increased uptake of the radiopharmaceutical\n(the so-called “ﬁrst-pass” effect). In a neoadjuvant setting, the PRRT is becoming increas-\ningly important. PRRT was associated with a signiﬁcant reduction in tumour size and the\ntumour was rendered operable in patients with inoperable PanNETs and distant (metastatic)\ndisease. In such instances, a complete response was possible [ 8]. PRRT was likely to be\nthe best treatment option in patients with advanced well-differentiated NETs in terms\nof the beneﬁt–risk ratio. Numerous nonrandomized studies of PRRT have consistently\ndemonstrated high response rates and prolonged PFS in patients with GEP-NETs. In a more\nrecent randomized phase III trial, PRRT plus the best supportive care provided a longer PFS\nthan high-dose octreotide, and did so with limited serious adverse events (SAEs) in patients\nwith advanced midgut NETs.', 'PRRT was associated with a signiﬁcant reduction in tumour size and the\ntumour was rendered operable in patients with inoperable PanNETs and distant (metastatic)\ndisease. In such instances, a complete response was possible [ 8]. PRRT was likely to be\nthe best treatment option in patients with advanced well-differentiated NETs in terms\nof the beneﬁt–risk ratio. Numerous nonrandomized studies of PRRT have consistently\ndemonstrated high response rates and prolonged PFS in patients with GEP-NETs. In a more\nrecent randomized phase III trial, PRRT plus the best supportive care provided a longer PFS\nthan high-dose octreotide, and did so with limited serious adverse events (SAEs) in patients\nwith advanced midgut NETs. However, PRRT has not been directly compared to any other\nestablished regimen. PRRT outperformed SSA, everolimus, sunitinib, everolimus + SSA ,\nand everolimus + bevacizumab in terms of PFS. PRRT had the highest probability (96%)\nof being the most effective treatment in terms of improving PFS and posing a low risk of\nSAEs based on cluster ranking [129].\nOnly SSTR agonists have been labelled with beta-emitters thus far. SSTR antagonists\nare expected to have a higher afﬁnity for somatostatin-positive tumour cells, resulting in\nan increase in the radiation dose delivered to the tumour. Another intriguing approach\nis to use alpha emitters such as Bismuth-213 (tissue penetration 45 µm, t1\n245 min) or\nActinium-225 (tissue penetration 45 µm, t1\n210 d) as a targeted alpha particle therapy (TAT).\nTAT treatment has gained popularity in recent years, particularly in the treatment of the\ncastration-resistant prostate cancer-expressing 177Luprostate-speciﬁc membrane antigen.\nThe advantage, it has been hypothesized, is a shallow tissue penetration depth combined', 'long-term safety of PRRT in NET. The main organs of concern\nare the bone marrow and the kidney. Transient hematotoxicity,\nparticularly thrombocytopenia, is frequently seen usually around\n4-6 weeks after a treatment cycle but this usually rapidly\nrecovers, allowing a following cycle of treatment. Long-term\nmyelodysplasia or leukaemia appears to occur in a little over 2%\nof patients, although historically, many have been heavily pre-\ntreated. Renal toxicity, which is mitigated with concomitant\namino acid infusion ( 20) has been mainly related to Y-90\ntherapy and is uncommon with Lu-177 ( 28,29).\nThe diagnosis, management and follow-up of patients with\nGEP-NETs is detailed in recent ESMO Guidelines ( 3). PRRT has\nbeen shown to be ben ﬁcial in the management of patients with\nsymptoms of carcinoid syndrome ( 30). ESMO Guidelines\nrecommend the use of Lu-177-DOTATATE following\nsomatostatin analogue therapy, for the treatment of patients\nwith carcinoid syndrome, diarrhea and/or ﬂushing. PRRT is also\nrecommended for patients with GE NETs who have progressive\ndisease following treatment with somatostatin analogues or with\neverolimus and for PNETs following treatment with everolimus,\nsunitinib or chemotherapy (capecitabine and temozolomide/\nstreptozotocin and 5- ﬂuorouracil).\nAlthough PRRT for the treatment of patients with NETs has\nprovided a new paradigm for the management of patients with\nadvanced metastatic disease, the optimal treatment regimen and\nalso the positioning of PRRT in the treatment algorithm remain\nto be de ﬁned. At the present time, patients received a standard\nactivity/dose of treatment at ﬁxed intervals of 8 weeks\n(Lutathera) or 12 weeks (COMPETE study). The currenttreatment regimens are based on empirical observations in the\nclinic. Opportunities for further improving the management of\npatients are expected with new antagonist targeting molecules\nand the application of radionuclides which with different\nphysicochemical properties to Lu-177. A number of clinical\ntrials with PRRT in NETs are currently ongoing ( Table 3 ).The future of targeted radiotherapy in\nNETS\nAt the present time, patients receive a standardized\ntreatment regimen of ~7,5GBq 8-12 weekly for 4 cycles. There\nis a great deal of interest in individualizing patients ’therapy\nregimens based on dosimetry. All patients in the COMPETE\nstudy undergo dosimetric evaluation with 2D planar imaging at\n0,5 hrs, 6 hrs, 24 hrs and 72-96 hrs after the ﬁrst infusion and\nSPECT/CT for hybrid 2D/3D dosimetry at 24 hrs post each\ninfusion. Sub-study A will compare the cumulative absorbed\ndoses to kidneys and target lesions extrapolated from dose 1 to\nthe cumulative absorbed dose from all 4 infusions. In sub-study\nB, the absorbed dose estimated by 3D dosimetry will be\ncompared to estimates from planar 2D and hybrid 2D/3D\ndosimetry. It is expected that the dosimetry data from these\nstudies will facilitate the a pplication of dosimetry to\nindividualized therapy, rather than the standard ‘one size ﬁts\nall’approach.\nThe currently available data for PRRT of NET patients are\nmainly for those with advanced disease, who have receivedprevious therapies. These patients inevitably relapse at some\nstage. Earlier positioning in the treatment algorithm is of\nparticular interest and data for the ﬁrst-line therapy will be\nforthcoming from COMPETE ,C O M P O S Ea n dN E T T E R - 2\ntrials. Neoadjuvant therapy in PNETs is a subject of interest\nwith anectodal reports of bene ﬁcial surgical outcomes in some\npatients ( 31).\nIt is apparent from dosimetry and safety that many patients\nare able to receive and bene ﬁt from additional cycles of\ntreatment ( 32,33).']",4.0,1.0,1.0,1.0,1,1.0,1.0,1.0,190
10G advanced RAG,"Was muss eine Klinik an Equipment haben, um eine PRRT durchführen zu können?",german,specific,therapy,claude-3-opus-20240229 advanced RAG,"Laut den Richtlinien von Zaknun et al. (2013) muss eine Klinik, die eine PRRT durchführen möchte, folgende Ausstattung und Personal haben:

- Die Einrichtung muss über geeignetes Personal, Strahlenschutzausrüstung sowie Verfahren für die Abfallentsorgung und den Umgang mit versehentlicher Kontamination des Standorts oder des Personals verfügen. 

- 90Y-DOTATOC oder 177Lu-DOTATATE sollte von entsprechend geschultem medizinischem Personal mit Unterstützung von Pflegepersonal und einem medizinischen Physikexperten verabreicht werden.

- Ärzte, die für die Behandlung von Patienten verantwortlich sind, sollten allgemeine Kenntnisse über die Pathophysiologie und den natürlichen Verlauf der jeweiligen Erkrankungen haben, mit alternativen Therapieformen vertraut sein und eng mit anderen an der Behandlung der Patienten beteiligten Ärzten zusammenarbeiten können.

- Ärzte, die unversiegelte Radionuklidquellen für die Therapie einsetzen, müssen auch die geltenden nationalen Gesetze und lokalen Vorschriften kennen und einhalten.","['&A patient with pending liver failure should be consid-\nered with caution before being submitted to PRRNT.\nProcedure\nPretherapy assessment\nThe availability of the following information is mandatory\nwhen considering a patient for PRRNT:\n&NET proven by histopathology (immunohistochemistry).\n&High sstr expression determined by functional whole-\nbody imaging with111In-pentetreotide (OctreoScan) or68\nGa-DOTA-peptide PET/CT or immunohistochemistry.\nThe following criteria should be taken into consideration\nwhen deciding whether or not to perform PRRNT.\n&Karnofsky/Lansky performance status above 60 % or\nECOG performance status less than 2.\n&Tumour differentiation, preferably grade 1/2.\n&Tumour proliferation rate, preferably with a Ki-67/mitotic\nindex ≤20 %. In addition, the rate of tumour growth, as\ndetermined by CTor MRI, could be considered. Note that,in general, less-differentiated tumours showing high pro-\nliferation rates are better candidates for chemotherapy.\nFacility and personnel\nPRRNT is still considered an investigational treatment and\nits implementation must comply with national legislation\nand local requirements, as well as with ethical principles\nregarding human studies. The decision to provide PRRNTshould be taken within a multidisciplinary tumour board,\nincluding all the specialists involved in the care of patients\nwith NET. The facility requirements will depend on nationallegislation on the therapeutic use of radioactive agents. If\ninpatient therapy is required by national legislation, the\ntreatment should take place in an approved facility. Thefacility must have appropriate personnel, radiation safety\nequipment, and procedures for waste management and han-\ndling accidental contamination of the site or personnel.\n90Y-DOTATOC or177Lu-DOTATATE should be admin-\nistered by appropriately trained medical staff with support-\ning nursing staff with a medical physics expert available.\nPhysicians responsible for treating patients should have a\ngeneral knowledge of the pathophysiology and natural historyof the respective diseases, should be familiar with alternative\nforms of therapy, and should be able to closely liaise with\nother physicians involved in managing the patients. Cliniciansinvolved in the utilization of unsealed radionuclide sources for\ntherapy must also be knowledgeable about and compliant with\napplicable national legislation and local regulations.Patient preparation\nRenal protectionTogether with the bone marrow, the kidneys are the critical\norgans in PRRNT particularly when using\n90Y-DOTATOC.\nProximal tubular reabsorption of the radiopeptide and subse-\nquent retention in the interstitium result in excessive renal\nirradiation. Nephrotoxicity may be aggravated by risk factors,such as preexisting hypertension or diabetes mellitus [ 57]. To\ncounteract and reduce the high kidney retention of radiopep-\ntides, positively charged amino acids, such as\nL-lysine and/or\nL-arginine, are coinfused to competitively inhibit the proximal\ntubular reabsorption of the radiopeptide. The coadministration\nof these amino acids leads to a significant reduction in the\nrenal absorbed dose, which ranges from 9 % to 53 % [ 58].\nRenal absorbed dose is further reduced by up to 39 % byextending the infusion time of the amino acid solution over\n10 h, and up to 65 % by extending the protection over 2 days\nfollowing radiopeptide administration, thereby covering therenal elimination phase more efficiently [ 59,60].\nAmino acid protection protocols\nLysine and/or arginine should be diluted appropriately in\nlarge volumes of normal saline in order to hydrate thepatient, unless the patient suffers from cardiac insufficiency\n(e.g. carcinoid heart valve disease), in which case volume\noverload, possibly leading to acute exacerbation of the con-dition, should be avoided. Hyperosmotic solutions in partic-\nular should be avoided since they can induce dangerous\nelectrolyte imbalances that might lead to severe metabolicacidosis and cardiac arrhythmias. An appropriate dilution is\n25 g of amino acid in 1 l of normal saline.\nBefore beginning the amino acid infusion, appropriate\nmeasures against nausea and vomiting should be undertaken\nby administering an antiemetic (e.g. 5-HT3 antagonist, such as\ngranisetron) and/or a corticosteroid (e.g.', 'Cancers 2022 ,14, 5792 7 of 17\ncompared to 11.0 months for sunitinib treatment in patients with advanced, SSTR-positive,\nprogressive panNET [ 70]. Currently, the randomized phase III COMPETE trial is comparing\nPRRT with177Lu-edotreotide with everolimus in advanced, progressive GEP-NET patients.\nA subset of GEP-NET patients present with extensive tumor bulk or high proliferative rate\n(Ki-67 index of 10–55%). In these cases, treatment with octreotide LAR or lanreotide has\nquestionable antiproliferative effects [ 71]. Given its ORR of 39%, which increases to 55% in\npanNETs [ 29],177Lu-DOTATATE can be considered as ﬁrst-line therapy if response is clini-\ncally necessitated [ 72]. These response rates compare favorably to targeted therapy [ 73–75]\nand for panNETs appear similar to capecitabine–temozolomide chemotherapy [ 76]. Poorly\ndifferentiated neuroendocrine carcinomas (NECs) and well-differentiated grade 3 NETs\nare high-grade NENs that display a more aggressive biological behavior than the more\ncommon grade 1 and 2 NETs [ 77]. PRRT is currently not considered a standard treatment\noption for high-grade NENs [68,78]. The rate of SSTR 2expression in grade 3 NETs ranges\nfrom 67–92% and in NECs from 32–50%, compared to a positive expression rate in grade 1\nand 2 NETs ranging from 67–96% [ 5,79–82]. In a meta-analysis of PRRT comprising four\nstudies, grade 3 NET patients had a median PFS of 19 months and median OS of 44 months\nafter PRRT. The median PFS was 11 and 4 months and the median OS was 22 and 9 months\nfor NEC with a Ki-67 of 21–55% and NEC with a Ki-67 above 55%, respectively [ 83]. Recent\nstudies implicated that PRRT could be considered in grade 3 GEP-NETs and GEP-NEC\nwith a Ki-67 of 21–55%. Importantly, to qualify for PRRT, uptake in all lesions is required\non somatostatin receptor imaging [83].\n7. Eligibility Criteria for PRRT\nThere are several inclusion and exclusion criteria to decide if a patient is eligible for\ntreatment with PRRT. A key criterion for PRRT is the degree of uptake on SSTR imaging\nwhich is scored by the Krenning score based on planar111In-DTPA-octereotide imaging.\nIt was reported that68Ga-DOTA-SSA PET/CT results in higher Krenning scores than\n111In-DTPA-octereotide imaging [ 84]. The uptake of all tumor lesions should minimally\nbe equal to the physiological uptake in the liver (Krenning score grade 2) on111In-DTPA-\noctreotide scintigraphy or higher than the physiological uptake in the liver on68Ga-DOTA-\nSSA PET/CT for a patient to be eligible for PRRT. The latter functional imaging is more\naccurate for detecting SSTR-positive primary tumors and metastases and therefore su-\nperior for assessing the total extent of disease [ 85–87]. PRRT is only applicable for pa-\ntients with a Karnofsky Performance Scale of at least 60 [ 27]. PRRT is contra-indicated\nfor patients who are pregnant or breastfeeding, patients with severe cardiac impairment\n(NYHA III or IV) and those with a life expectancy less than 3 months [ 31]. Since PRRT\ncan induce toxicity, the following pre-treatment laboratory values are required: creatinine\nclearance > 40 mL/min, hemoglobin levels ≥6 mmol/L, leukocytes > 2 ×109/L, platelet\ncount > 75 ×109/L, bilirubin, alanine aminotransferase (ALAT) and aspartate aminotrans-\nferase (ASAT) < 3 times the upper limit of normal and albumin > 3 g/dL [2,3].\n8.']",4.0,1.0,1.0,1.0,0,1.0,1.0,1.0,129
10E advanced RAG,What equipment does a clinic need to perform PRRT?,english,specific,therapy,claude-3-opus-20240229 advanced RAG,"According to the provided context, a clinic needs the following equipment to perform peptide receptor radionuclide therapy (PRRT) [1]:

- Specialized facilities that adhere to national and international regulations on the use of radiopharmaceuticals and are licensed by regulatory authorities. 

- Depending on local protocol and exposure regulations, PRRT can be given in an in-patient or out-patient setting.

- Radiopharmaceuticals like 177Lu-DOTATATE need to be administered by medical personnel trained in radiation safety.

The context does not provide more specific details on the exact equipment needed, such as radiation safety equipment, waste management procedures, or handling of accidental contamination.","['&A patient with pending liver failure should be consid-\nered with caution before being submitted to PRRNT.\nProcedure\nPretherapy assessment\nThe availability of the following information is mandatory\nwhen considering a patient for PRRNT:\n&NET proven by histopathology (immunohistochemistry).\n&High sstr expression determined by functional whole-\nbody imaging with111In-pentetreotide (OctreoScan) or68\nGa-DOTA-peptide PET/CT or immunohistochemistry.\nThe following criteria should be taken into consideration\nwhen deciding whether or not to perform PRRNT.\n&Karnofsky/Lansky performance status above 60 % or\nECOG performance status less than 2.\n&Tumour differentiation, preferably grade 1/2.\n&Tumour proliferation rate, preferably with a Ki-67/mitotic\nindex ≤20 %. In addition, the rate of tumour growth, as\ndetermined by CTor MRI, could be considered. Note that,in general, less-differentiated tumours showing high pro-\nliferation rates are better candidates for chemotherapy.\nFacility and personnel\nPRRNT is still considered an investigational treatment and\nits implementation must comply with national legislation\nand local requirements, as well as with ethical principles\nregarding human studies. The decision to provide PRRNTshould be taken within a multidisciplinary tumour board,\nincluding all the specialists involved in the care of patients\nwith NET. The facility requirements will depend on nationallegislation on the therapeutic use of radioactive agents. If\ninpatient therapy is required by national legislation, the\ntreatment should take place in an approved facility. Thefacility must have appropriate personnel, radiation safety\nequipment, and procedures for waste management and han-\ndling accidental contamination of the site or personnel.\n90Y-DOTATOC or177Lu-DOTATATE should be admin-\nistered by appropriately trained medical staff with support-\ning nursing staff with a medical physics expert available.\nPhysicians responsible for treating patients should have a\ngeneral knowledge of the pathophysiology and natural historyof the respective diseases, should be familiar with alternative\nforms of therapy, and should be able to closely liaise with\nother physicians involved in managing the patients. Cliniciansinvolved in the utilization of unsealed radionuclide sources for\ntherapy must also be knowledgeable about and compliant with\napplicable national legislation and local regulations.Patient preparation\nRenal protectionTogether with the bone marrow, the kidneys are the critical\norgans in PRRNT particularly when using\n90Y-DOTATOC.\nProximal tubular reabsorption of the radiopeptide and subse-\nquent retention in the interstitium result in excessive renal\nirradiation. Nephrotoxicity may be aggravated by risk factors,such as preexisting hypertension or diabetes mellitus [ 57]. To\ncounteract and reduce the high kidney retention of radiopep-\ntides, positively charged amino acids, such as\nL-lysine and/or\nL-arginine, are coinfused to competitively inhibit the proximal\ntubular reabsorption of the radiopeptide. The coadministration\nof these amino acids leads to a significant reduction in the\nrenal absorbed dose, which ranges from 9 % to 53 % [ 58].\nRenal absorbed dose is further reduced by up to 39 % byextending the infusion time of the amino acid solution over\n10 h, and up to 65 % by extending the protection over 2 days\nfollowing radiopeptide administration, thereby covering therenal elimination phase more efficiently [ 59,60].\nAmino acid protection protocols\nLysine and/or arginine should be diluted appropriately in\nlarge volumes of normal saline in order to hydrate thepatient, unless the patient suffers from cardiac insufficiency\n(e.g. carcinoid heart valve disease), in which case volume\noverload, possibly leading to acute exacerbation of the con-dition, should be avoided. Hyperosmotic solutions in partic-\nular should be avoided since they can induce dangerous\nelectrolyte imbalances that might lead to severe metabolicacidosis and cardiac arrhythmias. An appropriate dilution is\n25 g of amino acid in 1 l of normal saline.\nBefore beginning the amino acid infusion, appropriate\nmeasures against nausea and vomiting should be undertaken\nby administering an antiemetic (e.g. 5-HT3 antagonist, such as\ngranisetron) and/or a corticosteroid (e.g.', 'Cancers 2022 ,14, 5792 2 of 17\ncapacity and the radioactive component) and speciﬁc characteristics of NET patients (such\nas origin, grade and SSTR expression). Consequently, eligibility of NET patients for PRRT\nshould be discussed in an expert multidisciplinary team. This review provides an overview\nof the development of PRRT, clinical management of patients undergoing PRRT and key\nunmet needs for future investigations.\n2. Background of PRRT\n2.1. Mechanism of Action\nPRRT with177Lu-DOTATATE uses an intravenously administered beta radiation-\nemitting radiopharmaceutical targeting SSTR on tumor cells. SSTRs are G-protein coupled\nreceptors with ﬁve subtypes of which subtype 2 (SSTR 2) is the most commonly expressed\nin NETs, followed by SSTR 1and SSTR 5[5,6]. Healthy non-diseased organs can also express\nSSTR subtypes, as can be seen in the healthy liver, spleen, pituitary, salivary glands, thyroid,\nadrenals, kidney, prostate, pancreas, intestine and blood vessels [ 7–9]. The antitumoral\neffect of PRRT is triggered by radiation-induced DNA damage. After binding to the SSTR 2,\nthe radiopharmaceutical agonists are internalized into the tumor cell where the irradiation\ninduces different types of DNA damage such as DNA single strand breaks (SSBs) and DNA\ndouble strand breaks (DSBs) of which the latter are the major contributors to tumor cell\ndeath induction [10,11] (Figure 1).\nCancers 2022 , 14, x FOR PEER REVIEW  2 of 18  \n SSAs target the somatostatin receptor (SSTR) subtype 2 that is over -expressed on the can-\ncer cell surface [4] . Treatment of NET patients with PRRT requires dedicated clinical ex-\npertis e due to the biological characteristics of PRRT (for example , binding to SSTR, DNA \ndamage induction capacity and the radioactive component) and specific characteristics of \nNET patients (such as origin, grade and SSTR expression). Consequently, eligibility of \nNET patients for PRRT should be discussed in an expert multidisciplinary team. This re-view provides an overview of the development of PRRT, clinical management of patients \nundergoing PRRT and key unmet needs for future investigations.  \n2. Background of PRRT  \n2.1. Mechanism of Action  \nPRRT with \n177Lu-DOTATATE uses an intravenously administered beta radiation -\nemitting radiopharmaceutical targeting SSTR on tumor cells. SSTRs are G -protein coupled \nreceptors with five subtypes of which subtype 2 ( SSTR 2) is the most commonly expressed \nin NETs, followed by SSTR 1 and SSTR 5 [5,6] . Healthy non- diseased organs can also express \nSSTR subtypes, as can be seen in the healthy liver, spleen, pituitary, salivary glands, thy-\nroid, adrenals, kidney, prostate, panc reas, intestine and blood vessels [7 –9]. The anti-\ntumoral effect of PRRT is triggered by radiation -induced DNA damage. After binding to \nthe SSTR 2, the radiopharmaceutical agonists are internalized into the tumor cell where the \nirradiation induces dif ferent types of DNA damage such as DNA single strand breaks \n(SSBs) and DNA double strand breaks (DSBs) of which the latter are the major contribu-\ntors to tumor cell death induction [10,11]  (Figure 1 ). \n \nFigure 1. Mechanism of action of PRRT with 177Lu-DOTATATE. Intravenous administration of 177Lu-\nDOTATATE leads to tumor cell binding via SSTR 2. After internalization of the radiopharmaceuti-\ncal–SSTR 2 complex , local radiation by beta particles can lead to cell death th rough the induction of \nDNA damage (image created with BioRender.com , accessed on  1 September  2022 ). \n2.2. The Choice for 177Lu-DOTATATE \nClinical development of PRRT commenced with SSAs labeled with indium -111, yt-\ntrium -90 and lutetium -177 [12].', 'Cancers 2022 ,14, 5792 6 of 17\nwhich an antiemetic, typically ondansetron or granisetron, should be given prophylactically\nbefore the start of the infusion.177Lu-DOTATATE allows for post-therapy scintigraphy\nwith planar imaging or SPECT/CT. At patient discharge, the radiation exposure should be\nmeasured and patients should receive tailored advice on the duration of radiation safety\nprecautions at home, to avoid a high radiation exposure to other people, particularly children\nand pregnant women. Patients with NET-associated hormonal syndromes who have an\nindication for continuation of SSA use should adjust the moment of the injections to the\nPRRT cycles. Long-acting SSA should not be given within 4–6 weeks before a cycle of PRRT\nbecause of interference with the radiolabeled SSA. Although there is conflicting evidence\nfrom two limited single center studies whether continuation of SSA treatment is beneficial in\nnon-functioning NETs [ 63,64], this practice is often adopted. If the patient suffers from severe\nhormonal symptoms, short-acting SSA can be used to bridge this period up till 24 h before\nPRRT. Radiopharmaceuticals such as177Lu-DOTATATE need to be administered at specialized\nfacilities by medical personnel trained in radiation safety. These facilities should adhere to\nnational and international regulations on the use of radiopharmaceuticals and be licensed by\nthe regulatory authorities. Depending on local protocol and exposure regulations, PRRT with\n177Lu-DOTATATE can be given in an in-patient as well as an out-patient setting. In between\ncycles, patients should be reviewed for adverse effects, including full blood count and renal\nand liver function. Response evaluation by cross-sectional imaging is usually performed 2–3\nand 6 months after the last cycle of PRRT. Long-term follow-up is determined on an individual\nbasis taking into account the tumor biology and therapeutic response [ 65]. Pseudo-progression\nis a phenomenon that should be considered in the response evaluation when an increase in\ntumor size is seen during or short after treatment with PRRT. Pseudo-progression is probably\nbased on localized, temporarily edema caused by inflammation as a response to PRRT and\ndoes not show the actual tumor response to the therapy [ 58]. When pseudo-progression is\nsuspected, functional imaging (for example, PET/CT) can help differentiate between true\nprogression and pseudo-progression [31].\n5. Salvage PRRT\nIn NET patients who showed tumor response at least 18 months after the first cycle of\n177Lu-DOTATATE, re-treatment with PRRT (R-PRRT) with two additional cycles of 7.4 GBq\neach after renewed PD has shown antitumoral effects. In a meta-analysis on the effect of\nR-PRRT, the pooled median PFS was 14 months with a pooled median OS of 27 months.\nSimilarly, the pooled ORR was 17% with a disease control rate of 77%. Response rates,\nPFS and OS were lower than for initial PRRT [ 66], nonetheless R-PRRT remains a potential\noption for GEP-NET patients when other systemic treatment options are limited. The limited\nefficacy of R-PRRT as compared to initial PRRT might be explained by the administration\nof lower cumulative activity (i.e., generally half of the initial PRRT dosage) [ 51], the increase\nin tumor bulk at baseline before R-PRRT and potential changes in the tumor biology, such\nas a longitudinal increase in Ki-67. In the largest study to date by van der Zwan et al., no\ndifference in toxicity after R-PRRT as compared with initial PRRT was observed, particularly\nno increased occurrence of nephrotoxicity or significant hematological disease [ 67]. In cases\nwhere R-PRRT has provided additional benefit on tumor response and prolonged PFS, further\nre-treatment at the time of progression can be considered [67].\n6. Patient Selection\nPRRT with177Lu-DOTATATE is registered for patients with GEP-NETs that are pro-\ngressive on SSA treatment.']",3.0,1.0,1.0,1.0,1,1.0,1.0,1.0,99
11G advanced RAG,Welche Ärzte führen PRRT durch? Muss man dafür ein Nuklearmediziner sein?,german,specific,therapy,claude-3-opus-20240229 advanced RAG,"Laut den Informationen im Kontext sollte die Entscheidung zur Durchführung einer PRRT in einem multidisziplinären Tumorboard getroffen werden, das alle an der Behandlung von NET-Patienten beteiligten Spezialisten einschließt [1]. 

Die Ärzte, die die Behandlung durchführen, sollten über allgemeine Kenntnisse der Pathophysiologie und des natürlichen Verlaufs der jeweiligen Erkrankungen verfügen, mit alternativen Therapieformen vertraut sein und eng mit anderen an der Behandlung der Patienten beteiligten Ärzten zusammenarbeiten [1].

Kliniker, die offene Radionuklidquellen für die Therapie einsetzen, müssen außerdem die geltenden nationalen Gesetze und lokalen Vorschriften kennen und einhalten [1]. 

Es wird nicht explizit erwähnt, dass man Nuklearmediziner sein muss. Die Anforderungen hängen von der nationalen Gesetzgebung zum therapeutischen Einsatz radioaktiver Substanzen ab [1].","['When appropriate patient selection is performed, PRRT is accompanied by limited risks\nfor renal and hematological toxicities. Treatment of NET patients with PRRT requires dedicated\nclinical expertise due to the biological characteristics of PRRT and speciﬁc characteristics of NET\npatients. This review provides an overview for clinicians dealing with NET on the history, molecular\ncharacteristics, efﬁcacy, toxicity and relevant clinical speciﬁcs of PRRT.\nKeywords: peptide receptor radionuclide therapy;177Lu-DOTATATE; guide; neuroendocrine tumors\n1. Introduction\nPeptide receptor radionuclide therapy (PRRT) with radiolabeled somatostatin analogs\n(SSAs) has become an established second- or third-line treatment option for patients with\nprogressive well-differentiated (grade 1–2) gastroenteropancreatic (GEP) neuroendocrine\ntumors (NETs). Due to the increasing incidence and prevalence of GEP-NETs over recent\ndecades [ 1] and the development of NET-speciﬁc treatments and treatment protocols, there\nis a growing utilization of such systemic treatment for this advanced patient group. PRRT\nwith [177Lu]Lu-[DOTA0,Tyr3]octreotate (177Lu-DOTATATE) is the ﬁrst registered theranos-\ntic application in the ﬁeld of NETs [ 2,3]. With this therapy, radiolabeled SSAs target the\nsomatostatin receptor (SSTR) subtype 2 that is over-expressed on the cancer cell surface [ 4].\nTreatment of NET patients with PRRT requires dedicated clinical expertise due to the\nbiological characteristics of PRRT (for example, binding to SSTR, DNA damage induction\nCancers 2022 ,14, 5792. https://doi.org/10.3390/cancers14235792 https://www.mdpi.com/journal/cancers', 'however, still used by some in the USA mainly due to the lack\nof availability of β-emitting radiotracers. High-energy βemit-\nters, such as90Y with a longer βrange in soft tissue, were\nconsidered more promising for the treatment of bulky tumour.\nA novel analogue, Tyr3-octreotide, with a similar affinity\nprofile for sstrs, was developed. Linked to a macrocyclicchelator (DOTA), it allows simple and stable radiolabelling\nof\n111In and90Y to [DOTA0,Tyr3]-octreotide (90Y-DOTA-\nTOC) [ 44]. PRRNT using90Y-DOTATOC was first used in\n1996 in a patient in Basel, Switzerland. The excellent subjec-\ntive and objective response following several cycles of90Y-\nDOTATOC led to high expectations as to the therapeuticpotential of PRRNT in patients with NET. Since then other\ncentres worldwide have conducted clinical trials with\n90Y-\nDOTATOC [ 45]. Since the year 2000, octreotate (Tyr3,Thr8-\noctreotide), a newer analogue with improved affinity for sstr2,\nhas been synthesized. The chelated analogue [DOTA0,Tyr3]-\noctreotate (DOTATATE) can be labelled with the β-a n d γ-\nemitting isotope177Lu and has been used in clinical studies.\nIndications and contraindications\nIndications\nPRRNT is indicated for the treatment of patients with\npositive expression of sstr2, or metastatic or inoperable\nNET [ 46–50]. Candidate patients for PRRNT using\nradiolabelled somatostatin analogues are mainly those\nwith sstr2-expressing NET of the gastroenteropancreatic\nand bronchial tracts, but may also include patients withphaeochromocytoma, paraganglioma, neuroblastoma [ 51]\nor medullary thyroid carcinoma [ 52–56]. The ideal can-\ndidates for PRRNT are those w ith well-differentiated\nand moderately differentiated neuroendocrine carcinomas\ndefined as NET grade 1 or 2 according to the recent\nWHO 2010 classification [ 4].\nContraindications\nAbsolute\n&Pregnancy.\n&Severe acute concomitant illnesses.\n&Severe unmanageable psychiatric disorder.\nRelative\n&Breast feeding (if not discontinued).\n&Severely compromised renal function: for PRRNT with\na\n90Y-labelled peptide age-adjusted normal renal func-\ntion is essential. Patients with compromised renal func-\ntion may still be considered for177Lu-labelled peptidetreatment. For177Lu-labelled peptide a mild to moderate\ngrade of renal impairment can be tolerated (e.g. creati-\nnine ≤1.7 mg/dl). Glomerular filtration rate (GFR) and\ntubular extraction rate (TER) should be at least 60 % of\nmean age-adjusted normal values.\n&Severely compromised bone marrow: noncompromised\nhaematological reserve should be present before\nPRRNT. Suggested reference values are:\nWBC <3,000/ μl, with absolute neutrophil count <1,000/ μl\nPLT <75,000/ μl for177Lu-DOTATATE, <90,000/ μl for\n90Y-DOTATOC,\nRBC <3,000,000/ μl.\nSpecial warnings\nRenal function\nThe kidney is the dose-limiting organ at the activities\nnormally used for PRRNT. Side effects involving the\nkidney and the bone marrow are mild if adequate renalprotection and fractionation are used. Renal function\nshould be assessed by means of laboratory tests (creat-\ninine and BUN), or calculation of creatinine clearance(e.g. Cockroft-Gault formula ). Additional studies, e.g.\nmeasurement of GFR with 24-h urine collection or\nnuclear medicine methods (e.g.\n99mTc-MAG3 with\nTER determination,99mTc-DTPA GFR or effective renal\nplasma flow using hippuran), should be performed in\npatients with risk factors for renal toxicity or withcompromised renal function, and in all children.', '&A patient with pending liver failure should be consid-\nered with caution before being submitted to PRRNT.\nProcedure\nPretherapy assessment\nThe availability of the following information is mandatory\nwhen considering a patient for PRRNT:\n&NET proven by histopathology (immunohistochemistry).\n&High sstr expression determined by functional whole-\nbody imaging with111In-pentetreotide (OctreoScan) or68\nGa-DOTA-peptide PET/CT or immunohistochemistry.\nThe following criteria should be taken into consideration\nwhen deciding whether or not to perform PRRNT.\n&Karnofsky/Lansky performance status above 60 % or\nECOG performance status less than 2.\n&Tumour differentiation, preferably grade 1/2.\n&Tumour proliferation rate, preferably with a Ki-67/mitotic\nindex ≤20 %. In addition, the rate of tumour growth, as\ndetermined by CTor MRI, could be considered. Note that,in general, less-differentiated tumours showing high pro-\nliferation rates are better candidates for chemotherapy.\nFacility and personnel\nPRRNT is still considered an investigational treatment and\nits implementation must comply with national legislation\nand local requirements, as well as with ethical principles\nregarding human studies. The decision to provide PRRNTshould be taken within a multidisciplinary tumour board,\nincluding all the specialists involved in the care of patients\nwith NET. The facility requirements will depend on nationallegislation on the therapeutic use of radioactive agents. If\ninpatient therapy is required by national legislation, the\ntreatment should take place in an approved facility. Thefacility must have appropriate personnel, radiation safety\nequipment, and procedures for waste management and han-\ndling accidental contamination of the site or personnel.\n90Y-DOTATOC or177Lu-DOTATATE should be admin-\nistered by appropriately trained medical staff with support-\ning nursing staff with a medical physics expert available.\nPhysicians responsible for treating patients should have a\ngeneral knowledge of the pathophysiology and natural historyof the respective diseases, should be familiar with alternative\nforms of therapy, and should be able to closely liaise with\nother physicians involved in managing the patients. Cliniciansinvolved in the utilization of unsealed radionuclide sources for\ntherapy must also be knowledgeable about and compliant with\napplicable national legislation and local regulations.Patient preparation\nRenal protectionTogether with the bone marrow, the kidneys are the critical\norgans in PRRNT particularly when using\n90Y-DOTATOC.\nProximal tubular reabsorption of the radiopeptide and subse-\nquent retention in the interstitium result in excessive renal\nirradiation. Nephrotoxicity may be aggravated by risk factors,such as preexisting hypertension or diabetes mellitus [ 57]. To\ncounteract and reduce the high kidney retention of radiopep-\ntides, positively charged amino acids, such as\nL-lysine and/or\nL-arginine, are coinfused to competitively inhibit the proximal\ntubular reabsorption of the radiopeptide. The coadministration\nof these amino acids leads to a significant reduction in the\nrenal absorbed dose, which ranges from 9 % to 53 % [ 58].\nRenal absorbed dose is further reduced by up to 39 % byextending the infusion time of the amino acid solution over\n10 h, and up to 65 % by extending the protection over 2 days\nfollowing radiopeptide administration, thereby covering therenal elimination phase more efficiently [ 59,60].\nAmino acid protection protocols\nLysine and/or arginine should be diluted appropriately in\nlarge volumes of normal saline in order to hydrate thepatient, unless the patient suffers from cardiac insufficiency\n(e.g. carcinoid heart valve disease), in which case volume\noverload, possibly leading to acute exacerbation of the con-dition, should be avoided. Hyperosmotic solutions in partic-\nular should be avoided since they can induce dangerous\nelectrolyte imbalances that might lead to severe metabolicacidosis and cardiac arrhythmias. An appropriate dilution is\n25 g of amino acid in 1 l of normal saline.\nBefore beginning the amino acid infusion, appropriate\nmeasures against nausea and vomiting should be undertaken\nby administering an antiemetic (e.g. 5-HT3 antagonist, such as\ngranisetron) and/or a corticosteroid (e.g.']",1.0,0.875,1.0,0.0,0,1.0,1.0,1.0,112
11E advanced RAG,Which doctors perform PRRT? Do you have to be a nuclear medicine physician?,english,specific,therapy,claude-3-opus-20240229 advanced RAG,"According to the provided guidelines, the decision to provide PRRT should be made within a multidisciplinary tumor board, including all specialists involved in the care of patients with neuroendocrine tumors (NETs) [1]. The guidelines state that ""90Y-DOTATOC or 177Lu-DOTATATE should be administered by appropriately trained medical staff with supporting nursing staff with a medical physics expert available."" [1]

While the guidelines do not explicitly state that one must be a nuclear medicine physician to perform PRRT, they mention that ""Physicians responsible for treating patients should have a general knowledge of the pathophysiology and natural history of the respective diseases, should be familiar with alternative forms of therapy, and should be able to closely liaise with other physicians involved in managing the patients. Clinicians involved in the utilization of unsealed radionuclide sources for therapy must also be knowledgeable about and compliant with applicable national legislation and local regulations."" [1]

In summary, while a multidisciplinary approach is recommended, the performing physician should have appropriate training and knowledge of radionuclide therapy and comply with relevant regulations, but being a nuclear medicine physician is not explicitly stated as a requirement.","['&A patient with pending liver failure should be consid-\nered with caution before being submitted to PRRNT.\nProcedure\nPretherapy assessment\nThe availability of the following information is mandatory\nwhen considering a patient for PRRNT:\n&NET proven by histopathology (immunohistochemistry).\n&High sstr expression determined by functional whole-\nbody imaging with111In-pentetreotide (OctreoScan) or68\nGa-DOTA-peptide PET/CT or immunohistochemistry.\nThe following criteria should be taken into consideration\nwhen deciding whether or not to perform PRRNT.\n&Karnofsky/Lansky performance status above 60 % or\nECOG performance status less than 2.\n&Tumour differentiation, preferably grade 1/2.\n&Tumour proliferation rate, preferably with a Ki-67/mitotic\nindex ≤20 %. In addition, the rate of tumour growth, as\ndetermined by CTor MRI, could be considered. Note that,in general, less-differentiated tumours showing high pro-\nliferation rates are better candidates for chemotherapy.\nFacility and personnel\nPRRNT is still considered an investigational treatment and\nits implementation must comply with national legislation\nand local requirements, as well as with ethical principles\nregarding human studies. The decision to provide PRRNTshould be taken within a multidisciplinary tumour board,\nincluding all the specialists involved in the care of patients\nwith NET. The facility requirements will depend on nationallegislation on the therapeutic use of radioactive agents. If\ninpatient therapy is required by national legislation, the\ntreatment should take place in an approved facility. Thefacility must have appropriate personnel, radiation safety\nequipment, and procedures for waste management and han-\ndling accidental contamination of the site or personnel.\n90Y-DOTATOC or177Lu-DOTATATE should be admin-\nistered by appropriately trained medical staff with support-\ning nursing staff with a medical physics expert available.\nPhysicians responsible for treating patients should have a\ngeneral knowledge of the pathophysiology and natural historyof the respective diseases, should be familiar with alternative\nforms of therapy, and should be able to closely liaise with\nother physicians involved in managing the patients. Cliniciansinvolved in the utilization of unsealed radionuclide sources for\ntherapy must also be knowledgeable about and compliant with\napplicable national legislation and local regulations.Patient preparation\nRenal protectionTogether with the bone marrow, the kidneys are the critical\norgans in PRRNT particularly when using\n90Y-DOTATOC.\nProximal tubular reabsorption of the radiopeptide and subse-\nquent retention in the interstitium result in excessive renal\nirradiation. Nephrotoxicity may be aggravated by risk factors,such as preexisting hypertension or diabetes mellitus [ 57]. To\ncounteract and reduce the high kidney retention of radiopep-\ntides, positively charged amino acids, such as\nL-lysine and/or\nL-arginine, are coinfused to competitively inhibit the proximal\ntubular reabsorption of the radiopeptide. The coadministration\nof these amino acids leads to a significant reduction in the\nrenal absorbed dose, which ranges from 9 % to 53 % [ 58].\nRenal absorbed dose is further reduced by up to 39 % byextending the infusion time of the amino acid solution over\n10 h, and up to 65 % by extending the protection over 2 days\nfollowing radiopeptide administration, thereby covering therenal elimination phase more efficiently [ 59,60].\nAmino acid protection protocols\nLysine and/or arginine should be diluted appropriately in\nlarge volumes of normal saline in order to hydrate thepatient, unless the patient suffers from cardiac insufficiency\n(e.g. carcinoid heart valve disease), in which case volume\noverload, possibly leading to acute exacerbation of the con-dition, should be avoided. Hyperosmotic solutions in partic-\nular should be avoided since they can induce dangerous\nelectrolyte imbalances that might lead to severe metabolicacidosis and cardiac arrhythmias. An appropriate dilution is\n25 g of amino acid in 1 l of normal saline.\nBefore beginning the amino acid infusion, appropriate\nmeasures against nausea and vomiting should be undertaken\nby administering an antiemetic (e.g. 5-HT3 antagonist, such as\ngranisetron) and/or a corticosteroid (e.g.', 'ensure an accurate diagnosis or a successful outcome. All that\nshould be expected is that the practitioner will follow a reason-\nable course of action based on current knowledge, available re-\nsources, and the needs of the patient to deliver effective and safe\nmedical care. The sole purpose of these procedure standards is to\nassist practitioners in ac hieving this objective.\nBACKGROUND\nNETs are a heterogeneous group of malignancies that frequently\noverexpress somatostatin receptors (SSTRs) ( 1). NETs can be im-\naged using somatostatin analogs (SSAs) labeled with68Ga (68Ga-\nDOTATATE and68Ga-DOTATOC) ( 2).b-emitting radionuclides\nsuch as177Lu can be used for PRRT ( 3). The NETTER-1 trial\ndemonstrated prolonged progression-free survival in midgut NET\npatients treated with 4 cycles of177Lu-DOTATATE, which subse-\nquently led to the approval of this therapy ( 4).\nTREATMENT OVERVIEW\n177Lu-DOTATATE is administered at an activity of 7.4 GBq\n(200 mCi) every 8 61 wk for 4 cycles. Combined with prophy-\nlactic amino acid infusions and antiemetics, each treatment visit\ncan last approximately 5–8 h ( Fig. 1). Before starting PRRT treat-\nments, each treatment site must ensure that177Lu is included in their\ninstitutional radioactive materials license. A detailed review of pro-\ncedures surrounding177Lu-DOTATATE therapy is provided below.\nPATIENT SCREENING\nPatients should be evaluated by a multidisciplinary NET team,\nincluding a cancer specialist with expertise in the medical man-\nagement of NETs as well as a nuclear medicine physician or\nappropriate authorized user to decide on the appropriateness and\ntiming of PRRT in individual patients. Potential candidates should\nundergo an SSTR PET scan or SSTR scintigraphy (111In-pentetreotide)\nto demonstrate adequate SSTR expression ( 2). Traditionally, SSTR\nexpression on111In-pentetreotide greater than background hepatic\nuptake has been considered an eligibility requirement for PRRT\n(5). Necessary levels of SSTR expression on68Ga-based SSTR\nPET have not been clearly deﬁned, but lesion uptake should ex-\nceed background hepatic uptake. Laboratory values should be\nchecked shortly before the treatment is ordered (typically 2 wk\nbefore each cycle). These should include blood urea nitrogen,\ncreatinine, albumin, alkaline phosphatase, aspartate aminotrans-\nferase, alanine aminotransferase, total bilirubin, white blood cell\nwith differential, hemoglobin, and platelet counts. The threshold\nvalues provided in Table 1 should be taken as general eligibility\nguidelines for therapy.SOMATOSTATIN ANALOG THERAPY\nSSA therapy is used frequently to treat NET patients, and SSAs\nare typically administered in depot formulations every 4 wk. It is\nrecommended that PRRT treatments be scheduled at least 4 wk\nafter the last long-acting SSA therapy to prevent interference with\nSSTR binding. For symptomatic patients, short-acting SSAs being\nused as a bridge should be stopped at least 24 h before treatment.\nSubsequent SSA doses can be administered as soon as several hours\nafter the completion of the radiopharmaceutical therapy. During and\nafter completion of PRRT, it is generally agreed that syndromic\npatients should remain on SSA therapy. It is unclear whether patients\nwith nonfunctional tumors should remain on SSA treatment regard-\nless of whether or not they had progressed on SSA therapy before\ninitiation of PRRT. In the NETTER-1 study, all patients remained\non long-acting release octreotide despite prior progression on this\ndrug, and the177Lu-DOTATATE package insert suggests that patients\nshould remain on SSAs for up to 18 mo after treatment ( 6). How-\never, there are no clear data to support or refute this recommendation.\nTREATMENT LOCATION\nSites have the option to provide PRRT in an inpatient or out-\npatient setting, within the oncology infusion clinic or nuclear med-\nicine department, or a combination of both locations. Most sites in\nthe United States treat in the outpatient setting.', 'however, still used by some in the USA mainly due to the lack\nof availability of β-emitting radiotracers. High-energy βemit-\nters, such as90Y with a longer βrange in soft tissue, were\nconsidered more promising for the treatment of bulky tumour.\nA novel analogue, Tyr3-octreotide, with a similar affinity\nprofile for sstrs, was developed. Linked to a macrocyclicchelator (DOTA), it allows simple and stable radiolabelling\nof\n111In and90Y to [DOTA0,Tyr3]-octreotide (90Y-DOTA-\nTOC) [ 44]. PRRNT using90Y-DOTATOC was first used in\n1996 in a patient in Basel, Switzerland. The excellent subjec-\ntive and objective response following several cycles of90Y-\nDOTATOC led to high expectations as to the therapeuticpotential of PRRNT in patients with NET. Since then other\ncentres worldwide have conducted clinical trials with\n90Y-\nDOTATOC [ 45]. Since the year 2000, octreotate (Tyr3,Thr8-\noctreotide), a newer analogue with improved affinity for sstr2,\nhas been synthesized. The chelated analogue [DOTA0,Tyr3]-\noctreotate (DOTATATE) can be labelled with the β-a n d γ-\nemitting isotope177Lu and has been used in clinical studies.\nIndications and contraindications\nIndications\nPRRNT is indicated for the treatment of patients with\npositive expression of sstr2, or metastatic or inoperable\nNET [ 46–50]. Candidate patients for PRRNT using\nradiolabelled somatostatin analogues are mainly those\nwith sstr2-expressing NET of the gastroenteropancreatic\nand bronchial tracts, but may also include patients withphaeochromocytoma, paraganglioma, neuroblastoma [ 51]\nor medullary thyroid carcinoma [ 52–56]. The ideal can-\ndidates for PRRNT are those w ith well-differentiated\nand moderately differentiated neuroendocrine carcinomas\ndefined as NET grade 1 or 2 according to the recent\nWHO 2010 classification [ 4].\nContraindications\nAbsolute\n&Pregnancy.\n&Severe acute concomitant illnesses.\n&Severe unmanageable psychiatric disorder.\nRelative\n&Breast feeding (if not discontinued).\n&Severely compromised renal function: for PRRNT with\na\n90Y-labelled peptide age-adjusted normal renal func-\ntion is essential. Patients with compromised renal func-\ntion may still be considered for177Lu-labelled peptidetreatment. For177Lu-labelled peptide a mild to moderate\ngrade of renal impairment can be tolerated (e.g. creati-\nnine ≤1.7 mg/dl). Glomerular filtration rate (GFR) and\ntubular extraction rate (TER) should be at least 60 % of\nmean age-adjusted normal values.\n&Severely compromised bone marrow: noncompromised\nhaematological reserve should be present before\nPRRNT. Suggested reference values are:\nWBC <3,000/ μl, with absolute neutrophil count <1,000/ μl\nPLT <75,000/ μl for177Lu-DOTATATE, <90,000/ μl for\n90Y-DOTATOC,\nRBC <3,000,000/ μl.\nSpecial warnings\nRenal function\nThe kidney is the dose-limiting organ at the activities\nnormally used for PRRNT. Side effects involving the\nkidney and the bone marrow are mild if adequate renalprotection and fractionation are used. Renal function\nshould be assessed by means of laboratory tests (creat-\ninine and BUN), or calculation of creatinine clearance(e.g. Cockroft-Gault formula ). Additional studies, e.g.\nmeasurement of GFR with 24-h urine collection or\nnuclear medicine methods (e.g.\n99mTc-MAG3 with\nTER determination,99mTc-DTPA GFR or effective renal\nplasma flow using hippuran), should be performed in\npatients with risk factors for renal toxicity or withcompromised renal function, and in all children.']",2.0,1.0,1.0,0.0,0,1.0,1.0,1.0,186
12G advanced RAG,Was sind die häufigsten Nebenwirkungen der PRRT?,german,general,side effects,claude-3-opus-20240229 advanced RAG,"Basierend auf den gegebenen Informationen sind die häufigsten Nebenwirkungen der Peptidrezeptor-Radionuklidtherapie (PRRT):

Akute Nebenwirkungen (meist mild und selbstlimitierend):
- Übelkeit und Erbrechen, verursacht durch die gleichzeitige Infusion von Aminosäuren zum Nierenschutz [3]

Subakute Nebenwirkungen (treten innerhalb von 4-6 Wochen nach Therapie auf):  
- Knochenmarksuppression, meist mild und reversibel. Schwere Toxizität (WHO Grad 3-4) tritt bei weniger als 15% der Patienten auf [3]
- Milder Haarausfall, beobachtet bei 177Lu-Octreotate [3]
- In seltenen Fällen eine Verschlimmerung eines klinischen Syndroms [3]

Langfristige Nebenwirkungen:
- Nierenversagen [1,2]
- Leukämie oder myelodysplastische Syndrome, mit einer geschätzten Inzidenz von bis zu 2% [2]","['PRRT is only applicable for pa-\ntients with a Karnofsky Performance Scale of at least 60 [ 27]. PRRT is contra-indicated\nfor patients who are pregnant or breastfeeding, patients with severe cardiac impairment\n(NYHA III or IV) and those with a life expectancy less than 3 months [ 31]. Since PRRT\ncan induce toxicity, the following pre-treatment laboratory values are required: creatinine\nclearance > 40 mL/min, hemoglobin levels ≥6 mmol/L, leukocytes > 2 ×109/L, platelet\ncount > 75 ×109/L, bilirubin, alanine aminotransferase (ALAT) and aspartate aminotrans-\nferase (ASAT) < 3 times the upper limit of normal and albumin > 3 g/dL [2,3].\n8. PRRT-Related Toxicity\nAdverse events related to PRRT are frequently mild and include nausea, abdominal pain\nand asthenia [ 27,50]. Increased hair loss is observed in up to 60% of patients treated with\n177Lu-DOTATATE, but this is temporary and seldom leads to baldness [ 88]. Besides these\nmild adverse events, PRRT can induce more severe toxicities which can be dose-limiting and\nadjustments to the treatment schedule might be required [ 89]. When the toxicity has subsided\nwithin 16 weeks after the last dose, guidelines advise to administer half of the original activity\nof177Lu-DOTATATE during the next cycle. PRRT should be discontinued when the toxicity\npersists after 16 weeks or recurs after the half dose [ 3]. In the NETTER-1 trial, 7% of the\npatients received a reduced dose because of dose-limiting toxicities [ 27]. The kidneys and the\nbone marrow are the critical organs for dose-limiting toxicities.', 'J. Clin. Med. 2021 ,10, 1267 11 of 15\n4.5.1. Subacute Effects\nPRRT is overall well tolerated with most patients experiencing only moderate toxicity.\nIn the study NETTER-1, validating the PRRT in midgut NETs, 5% of the patients discon-\ntinued treatment due to toxicity related to PRRT. Acute side effects are mainly nausea,\nvomiting, fatigue and abdominal pain. These adverse events are mainly caused by the\nsimultaneous infusion of aminoacids. Particular vigilance must be exercised with regard\nto the risk of carcinoid crisis. This event was reported in a very small minority (1%) of\npatients who received an PRRT treatment. This crisis usually appears within 48 h of the ﬁrst\ninfusion and is related to the massive release of active amines [ 34]. A myelosuppressure\nhas been described and is caused by the irradiation of the bone marrow. Bone marrow\nis particularly radiosensitive, and this toxicity does not appear to be associated to the\nexpression of SSTRs in myeloid cells. Myelosuppression generally develops four at six\nweeks after the infusion, is usually grade 1/2 and is reversible. Hematotoxic effects grade\n3 and 4 have been described in 13% and 10% of the patients receiving90Y-DOTATOC\nand177Lu-DOTATATE, respectively [ 35]. Lymphopenia is the more often reported severe\ncytopenia. Some studies have also reported that PRRT could be safely used in the case\nof diffuse metastatic bone marrow involvement, without irreversible myelosuppression,\nalthough a higher incidence of subacute transient hematologic toxicity was observed [36]\nOther toxicities have been reported, including a risk of hepatotoxicity in the patients\nwith major liver involvement. Thus, as indicated above, it is desirable to consider PRRT\nearly in the management process of the disease.\n4.5.2. Long-Term Effects\nLong-term side effects of PRRT can include renal failure and leukemic or myelodys-\nplastic syndromes.\nThe radiolabels are reabsorbed in the proximal tubules, may accumulate in the proxi-\nmal tubules in the renal interstitium and cause kidney damage. Because of its higher energy\nand longer penetration range,90Y irradiates the renal interstitium glomeruli more exten-\nsively than177Lu. In a large institutional series of 1109 patients treated with90Y-DOTATOC,\n103 patients (9%) were treated with90Y-DOTATOC with severe renal toxicity [ 7]. Nowa-\ndays, the concomitant administration positively charged aminoacids results in a reduction\nof up to 40% of the renal absorption. Despite renal protection, the median decrease of the\ncreatinine clearance is estimated to 4% per year in patients treated with177Lu-DOTATATE.\nThe risk factors for nephrotoxicity cited are diabetes and poorly controlled hypertension.\nRisk of severe nephrotoxicity (grade 3/4) was observed in only 1.5% of patients [ 37]. In\noverall, end-stage renal disease as a consequence of PRRT is extremely rare.\nCases of leukemia and myelodysplastic syndromes have been reported as late-onset\nPRRT toxicity, with an estimated incidence of up to 2% [ 37,38]. Age over 70 years, cytopenia\nbefore treatment, the presence of bones metastasis, the high number of previous treatments,\nthe prior use of an alkylating agent and the radiotherapy increases the risk of secondary\nmyelodysplastic syndrome. Brieau et al. reported in a retrospective monocentric study\nconducted in a population of patients treated with PRRT and pre-treatment alkylating\nchemotherapy an increased risk late hematologic toxicity (20%; four patients out of 20) [ 39].\nThe main alkylating agent used in the NET treatment is temozolomide. The development\nof myelodysplastic syndrome or leukemia has been reported between 30 and 70 months\nafter treatment with PRRT [ 39].', 'Salvage Treatment\nAlthough tumor response rates after initial treatment with\nPRRT are encouraging, CR is rare and eventually tumor pro-\ngression occurs in the majority of patients. Retreatment with\nextra cycles of PRRT as salvage therapy may be consideredwhen better options are not available. One study showed that\nsalvage therapy with two additional cycles of\n177Lu-octreotate\ndoes not lead to serious hematologic or nephrotoxic side ef-\nfects, but the tumor response rate was less compared with\ninitial treatment [ 50].\nAnother report showed that long PFS after the initial treat-\nment with PRRT predicts a prolonged PFS after salvage ther-apy [ 51], and argued that PRRT with\n177Lu-octreotate in the\nretreatment setting is a safe and effective option in patients\nwith metastatic GEP-NETs. For these reasons, retreatment\nseems a good option for patients who responded well after\nthe initial cycles of PRRT [ 52]. This novel and important\nconcept of salvage therapy of NET needs to be tested in large,\nprospective, and multi-center trials to contribute to evidence-\nbased findings.\nTreatment Side Effects\nPRRT is generally well-tolerated. Side effects can be divided to\nacute, subacute, and long-term side effects, as summarized inTable 4. Acute side effects are usually mild and self-limiting.\nNausea or vomiting are related to the concomitant admin-\nistration of kidney-protective amino acids. Subacute side\neffects are related to the radiopeptide itself, such as bonemarrow suppression, mild hair loss (observed with\n177Lu-\noctreotate), or, more rarely, an exacerbation of a clinicalsyndrome. The most common subacute side effect ofPRRT, occurring within 4 to 6 weeks after therapy, is bone\nmarrow suppression. Usually, the hematologic toxicity is\nmild and reversible. More serious WHO grade 3 or 4 tox-icity may occur, but this has been seen in less than 15% of\npatients [ 53].\nLong-term side effects of PRRT may include renal failure\nas well as leukemia/myelody splastic syndromes (MDS).\nBecause radiopeptides are usually reabsorbed in the proximal\ntubules, they can accumulate in the renal interstitium and in-duce inflammation and fibrosis with eventual kidney damage.\nCo-administration of positively charged amino acids results ina reduction of renal radioactive uptake, up to 40% as reportedin some studies [ 16,54]. If patients have long-standing or\npoorly controlled comorbidities such as diabetes and hyper-\ntension that affect kidney function, it is expected that there\nwould be a larger and more persistent decline in creatinine\nclearance [ 55].\nAdministration of Treatment\nFor purposes of kidney protection, positively charged amino\nacids, such as L-lysine and/or L-arginine, are co-infused to\ncompetitively inhibit the proximal tubular reabsorption ofthe radiopeptide [ 56]. This reduces the renal-absorbed dose.\nDilution of the amino acids with saline allows proper hydra-tion for the patient, an appropriate ratio to use is 25 g of aminoacid in 1 L of normal saline. Obviously, patients ’comorbidi-\nties should be taken into account (e.g., avoid volume overloadin patients with cardiac insufficiency and take care in avoidingelectrolyte imbalances with hyperosmotic solutions).\nAntiemetics can be administered before the infusion to avoidpotential nausea or vomiting. Amino acid infusion should bestarted 30 –60 min before administration of the radiopeptide\nand should be maintained over 4 h. Several amino acid pro-tective schemes have been proposed in the joint IAEA,EANM, and SNMMI practical guidelines on PRRT treatment\nof NETs [ 56].\nCurrent administration schedules comprise the most ap-\npropriate number of cycles (generally four or five) and thebest delivery frequency (8 weeks apart). This pattern allows\nthe patient to recover from the mild side effects of the ther-apy and increases its effectiveness in terms of the radiobi-\nological activity [ 57]. Radioisotope infusion should be\naround 30 min as recommended in the literature.']",3.0,1.0,1.0,1.0,0,1.0,0.0,0.5,98
12E advanced RAG,What are the most common side effects of PRRT?,english,general,side effects,claude-3-opus-20240229 advanced RAG,"According to the provided context, the most common side effects of Peptide Receptor Radionuclide Therapy (PRRT) are:

1. Nausea, vomiting, fatigue and abdominal pain, mainly caused by the simultaneous infusion of amino acids [1].

2. Temporary hair loss, observed in up to 60% of patients treated with 177Lu-DOTATATE [2].

3. Mild adverse events such as nausea, abdominal pain and asthenia [2].

4. Acute side effects related to the administration of amino acids or to the radiopeptide itself, such as headache and rarely vomiting due to metabolic acidosis induced by the amino acid coadministration [3].

References:
[1] Camus et al., 2021, J. Clin. Med.
[2] A Clinical Guide to Peptide Receptor Radionuclide Therapy
[3] Zaknun et al., 2013, The joint IAEA, EANM, and SNMMI practical guidance","['J. Clin. Med. 2021 ,10, 1267 11 of 15\n4.5.1. Subacute Effects\nPRRT is overall well tolerated with most patients experiencing only moderate toxicity.\nIn the study NETTER-1, validating the PRRT in midgut NETs, 5% of the patients discon-\ntinued treatment due to toxicity related to PRRT. Acute side effects are mainly nausea,\nvomiting, fatigue and abdominal pain. These adverse events are mainly caused by the\nsimultaneous infusion of aminoacids. Particular vigilance must be exercised with regard\nto the risk of carcinoid crisis. This event was reported in a very small minority (1%) of\npatients who received an PRRT treatment. This crisis usually appears within 48 h of the ﬁrst\ninfusion and is related to the massive release of active amines [ 34]. A myelosuppressure\nhas been described and is caused by the irradiation of the bone marrow. Bone marrow\nis particularly radiosensitive, and this toxicity does not appear to be associated to the\nexpression of SSTRs in myeloid cells. Myelosuppression generally develops four at six\nweeks after the infusion, is usually grade 1/2 and is reversible. Hematotoxic effects grade\n3 and 4 have been described in 13% and 10% of the patients receiving90Y-DOTATOC\nand177Lu-DOTATATE, respectively [ 35]. Lymphopenia is the more often reported severe\ncytopenia. Some studies have also reported that PRRT could be safely used in the case\nof diffuse metastatic bone marrow involvement, without irreversible myelosuppression,\nalthough a higher incidence of subacute transient hematologic toxicity was observed [36]\nOther toxicities have been reported, including a risk of hepatotoxicity in the patients\nwith major liver involvement. Thus, as indicated above, it is desirable to consider PRRT\nearly in the management process of the disease.\n4.5.2. Long-Term Effects\nLong-term side effects of PRRT can include renal failure and leukemic or myelodys-\nplastic syndromes.\nThe radiolabels are reabsorbed in the proximal tubules, may accumulate in the proxi-\nmal tubules in the renal interstitium and cause kidney damage. Because of its higher energy\nand longer penetration range,90Y irradiates the renal interstitium glomeruli more exten-\nsively than177Lu. In a large institutional series of 1109 patients treated with90Y-DOTATOC,\n103 patients (9%) were treated with90Y-DOTATOC with severe renal toxicity [ 7]. Nowa-\ndays, the concomitant administration positively charged aminoacids results in a reduction\nof up to 40% of the renal absorption. Despite renal protection, the median decrease of the\ncreatinine clearance is estimated to 4% per year in patients treated with177Lu-DOTATATE.\nThe risk factors for nephrotoxicity cited are diabetes and poorly controlled hypertension.\nRisk of severe nephrotoxicity (grade 3/4) was observed in only 1.5% of patients [ 37]. In\noverall, end-stage renal disease as a consequence of PRRT is extremely rare.\nCases of leukemia and myelodysplastic syndromes have been reported as late-onset\nPRRT toxicity, with an estimated incidence of up to 2% [ 37,38]. Age over 70 years, cytopenia\nbefore treatment, the presence of bones metastasis, the high number of previous treatments,\nthe prior use of an alkylating agent and the radiotherapy increases the risk of secondary\nmyelodysplastic syndrome. Brieau et al. reported in a retrospective monocentric study\nconducted in a population of patients treated with PRRT and pre-treatment alkylating\nchemotherapy an increased risk late hematologic toxicity (20%; four patients out of 20) [ 39].\nThe main alkylating agent used in the NET treatment is temozolomide. The development\nof myelodysplastic syndrome or leukemia has been reported between 30 and 70 months\nafter treatment with PRRT [ 39].', 'during the first courses of therapy following the injection of\n177Lu-DOTATATE.\nSide effects\nAcute\nSide effects of PRRNT are usually mild, if necessary precau-\ntions are taken. Side effects may be acute, related to the\nadministration of amino acids or to the radiopeptide itself, or\nchronic. The coinfusion of amino acids enlarges the safetymargin for treating with higher activities enabling higher\ntumour radiation doses to be attained safely. Side effects such\nas nausea, headache and rarely vomiting due to metabolicacidosis induced by the amino acid coadministration do occur\nin the majority of patients [ 59,88]. Particular attention and\ncare should be given to avoiding possible electrolyte imbal-ance (hyperkalaemia, hypernatraemia), and the subsequent\nmetabolic acidosis, that might lead to mild nausea and vomit-\ning. The latter side effects should be managed by hydrating thepatient with normal saline and possibly by repeating cortico-\nsteroid or antiemetic administrations.\nPRRNT may exacerbate the syndromes related to the re-\nspective functional tumours, due to the sudden massive re-\nlease of the hormones and receptor stimulation. The clinical\nmanifestation is dependent on the specific hormone involved.The following measures are therefore recommended. Vital\nsigns (at least blood pressure and pulse) should be monitored\nbefore and after radiopeptide infusion, especially in symptom-atic patients. Therapeutic interventions should be undertaken\nto treat the for functional syndrome effects or exacerbation\n(e.g. carcinoid syndrome/hypotension, hypoglycaemia, hyper-gastrinaemia, hypertension, hypotension, WDHA syndrome,\nelectrolyte imbalance) [ 89]. In patients without or with minor\nmetastatic liver involvement, no significant hepatic toxicity\nhas been reported. However, in patients with massive liver\nmetastases and impaired liver function, liver toxicity mayoccur, and this should be considered, along with preexisting\nconditions affecting the liver, when choosing the appropriate\nradioisotope and dosing. In such cases,\n177Lu-labelled pepti-\nd e ss h o u l db eu s e da n dt h ea d m i n i s t e r e da c t i v i t ys h o u l db e\nreduced accordingly. After treatment, patients should avoid\npregnancy for at least 6 months. Due to a temporary impair-ment of fertility, related to a transient damage to Sertoli cells,\nmale patients should consider sperm banking before therapy.\nDelayed side effects\nRenal toxicityThe kidneys are the dose-limiting organs at the activities\nnormally reached with PRRNT. Proper kidney protection, asdiscussed, is currently mandatory. However, despite kidney\nprotection, loss of kidney function can occur after PRRNT,\nwith a creatinine clearance loss of about 3.8 % per year for\n177Lu-DOTATATE and 7.3 % per year for90Y-DOTATOC\n[90]. In a series of 1,109 patients treated with90Y-DOTATOC,\nthe incidence of grade 4 and 5 kidney toxicity was found to be9.2 % [ 50]. Delayed renal toxicity following\n90Y-DOTATOC\ntreatment was observed more frequently in patients with pre-\ndisposing risk factors including longstanding and poorly con-trolled hypertension and diabetes mellitus [ 56].\nBone marrow toxicitySevere (grade 3 and 4), mostly reversible, acute bone mar-\nrow toxicity is observed in less than 10 –13 % of treatment\ncycles with\n90Y-DOTATOC, and in 2 –3 % of cycles with\n177Lu-DOTATATE. Nevertheless, sporadic cases of myelo-\ndysplastic syndrome or overt acute myelogenous leukaemiahave been reported [ 45,49,50].\nEndocrine systemsDespite the presence of sstr in normal pituitary, thyroid and\nadrenal glands and Langerhans cells, no significant alterationin endocrine hormone function have been reported [ 91].\nResults\nPRRNT with the somatostatin analogues\n90Y-DOTATOC\nand177Lu-DOTATATE has been explored in NET for more\nthan a decade.', 'PRRT is only applicable for pa-\ntients with a Karnofsky Performance Scale of at least 60 [ 27]. PRRT is contra-indicated\nfor patients who are pregnant or breastfeeding, patients with severe cardiac impairment\n(NYHA III or IV) and those with a life expectancy less than 3 months [ 31]. Since PRRT\ncan induce toxicity, the following pre-treatment laboratory values are required: creatinine\nclearance > 40 mL/min, hemoglobin levels ≥6 mmol/L, leukocytes > 2 ×109/L, platelet\ncount > 75 ×109/L, bilirubin, alanine aminotransferase (ALAT) and aspartate aminotrans-\nferase (ASAT) < 3 times the upper limit of normal and albumin > 3 g/dL [2,3].\n8. PRRT-Related Toxicity\nAdverse events related to PRRT are frequently mild and include nausea, abdominal pain\nand asthenia [ 27,50]. Increased hair loss is observed in up to 60% of patients treated with\n177Lu-DOTATATE, but this is temporary and seldom leads to baldness [ 88]. Besides these\nmild adverse events, PRRT can induce more severe toxicities which can be dose-limiting and\nadjustments to the treatment schedule might be required [ 89]. When the toxicity has subsided\nwithin 16 weeks after the last dose, guidelines advise to administer half of the original activity\nof177Lu-DOTATATE during the next cycle. PRRT should be discontinued when the toxicity\npersists after 16 weeks or recurs after the half dose [ 3]. In the NETTER-1 trial, 7% of the\npatients received a reduced dose because of dose-limiting toxicities [ 27]. The kidneys and the\nbone marrow are the critical organs for dose-limiting toxicities.']",4.0,1.0,1.0,1.0,1,1.0,1.0,1.0,125
13G advanced RAG,Was sind die Vorteile einer PRRT?,german,general,advantages of therapy,claude-3-opus-20240229 advanced RAG,"Basierend auf den gegebenen Informationen hat die Peptidrezeptor-Radionuklidtherapie (PRRT) mit 177Lu-DOTATATE bei neuroendokrinen Tumoren (NETs) folgende Vorteile:

- Signifikante Verbesserung des progressionsfreien Überlebens (PFS) im Vergleich zu Octreotid LAR. In der NETTER-1 Studie betrug das mediane PFS 28 Monate mit 177Lu-DOTATATE vs. 8,5 Monate mit Octreotid [27,30].

- Deutliche Verbesserung der Lebensqualität der Patienten, inklusive Symptomen wie Durchfall, Müdigkeit, Körperbild und gastrointestinalen Beschwerden. Die Zeit bis zur Verschlechterung der Lebensqualität war mit 177Lu-DOTATATE 22,7 Monate länger als in der Kontrollgruppe [16,38].  

- Gutes Sicherheitsprofil mit wenigen schwerwiegenden Nebenwirkungen [16,19].

- Möglichkeit der Anwendung als Erstlinientherapie bei progressiven, Somatostatin-Rezeptor positiven NETs des Pankreas und Gastrointestinaltrakts [19].

Insgesamt zeigt die PRRT eine hohe Wirksamkeit bei gleichzeitig guter Verträglichkeit in der Behandlung von neuroendokrinen Tumoren.","['Cancers 2022 ,14, 5792 4 of 17\n3.2. Symptom Control\nPRRT is not only effective in reducing tumor growth, but it can also lead to symp-\ntomatic improvement in NET patients, including associated hormonal syndromes [37]. In\nthe NETTER-1 trial, PRRT with177Lu-DOTATATE provided a signiﬁcant beneﬁt in quality\nof life (QoL) compared to octreotide LAR. Time to deterioration (TTD) was signiﬁcantly\nlonger in the177Lu-DOTATATE group, with positive outcomes in the domains of global\nhealth, physical functioning, diarrhea, pain, body image, disease-related worries and\nfatigue [ 38]. In a prospective series of 265 GEP- and bronchial NET patients, QoL, perfor-\nmance status and symptoms (particularly insomnia, appetite loss and diarrhea) improved\nsigniﬁcantly after PRRT [ 39]. Importantly, QoL in asymptomatic NET patients did not\ndecline during therapy. In a single center study of 144 patients, a symptomatic response to\nPRRT with regard to diarrhea, abdominal pain, ﬂushing and fatigue was observed in 70%,\n63%, 64% and 53%, respectively [ 33]. Results are summarized in Table 1. In patients with a\nfunctioning NET, PRRT has shown to be an effective treatment regarding symptom control\nand circulating hormone levels [ 40,41]. Carcinoid syndrome (CS) is the most prevalent\nhormonal NET syndrome and is caused by excretion of hormones and amines such as\nserotonin, histamine, catecholamines, prostaglandins and tachykinins. In a study involving\n22 patients with refractory CS who received PRRT for symptomatic control, ﬂushing and\nbowel movement frequency improved signiﬁcantly [ 42]. Two-thirds of the patients who\nhad at least two episodes of ﬂushing per day had a minimal decrease of 50% of these\nepisodes. Of patients with bowel movement frequency of at least four times a day, 47%\nexperienced > 30% decrease, while 29% experienced > 50% decrease [ 37]. In a systematic\nreview, symptomatic improvement after PRRT was observed in 74% of patients with diar-\nrhea and in 6% of patients with ﬂushing [ 43]. Together, these results have positioned PRRT\nwith177Lu-DOTATATE as a viable option for refractory CS [ 44]. In addition, case reports\nhave shown improvement of symptoms and echocardiographic parameters of carcinoid\nheart disease after PRRT, which is a severe symptom of CS [ 45]. Similar positive effects of\nPRRT on hormonal levels and symptoms have been observed in patients with functioning\npanNET syndromes, such as insulinoma, gastrinoma, glucagonoma and VIPoma [40].\nTable 1. Overview of tumor control and symptom control following PRRT as described in key phase\nII and III clinical trials.\nPatients, n NET SubtypePFS\n(Months)mOS\n(Months)ORR SD PDmTTD QOL\nGlobal Health\n(Months)Overall\nSymptom\nImprovement\nStrosberg et al. [27,30,38] 101 SI-NET 28 48 18% 66% * 16% 29 m\nControl group SSA 100 SI-NET 8.5 36 3% 41% 56% 6.1 m\nBrabander et al. [29] 443GEP and\nbronchial NET29 63 39% 43% 12%\nBodei et al. [36] 51GEP and\nbronchial NET3668%\nat 36 months55% 27% 18%\nEzziddin et al. [34] 68 GEP-NET 34 53 72% 13% 15%\nSabet et al. [35] 61 SI-NET 44% 48% 8%\nHamiditabar et al. [33] 143 NET of all origins 8% 46% 38% 47%\nKhan et al.', 'Int. J. Mol. Sci. 2022 ,23, 1447 15 of 22\nstudies examining the feasibility, outcome, and safety of PRRT also demonstrated a PFS\ncomparable to, and in some cases superior to, that of other treatment modalities. Due to\nthe retrospective nature of these studies, the results required conﬁrmation in prospective\ntrials. According to PanNET guidelines, PRRT should even be used as a third-line therapy\nin patients with advanced locoregional disease following the failure of SSAs, everolimus,\nand/or cytotoxic chemotherapy [ 8]. Two cases were presented for third-line therapy, in\nwhich patients with metastatic PanNET (G2 Ki-67 10%) received chemotherapy or PRRT\naccording to the standard of care following SSA failure. After six cycles of STZ/5-FU (over\nnine months), the patient progressed four months later without treatment. The majority of\nparticipants preferred PRRT (38.6%, n = 32) over STZ/5-FU reinduction (26.5%, n = 22) [ 136].\nIn patients with GEP-NET G1 and G2, 177Lu-PRRT was compared to the mTOR inhibitor\neverolimus. Despite the success of 177Lu-DOTATATE PRRT, not all patients showed bene-\nﬁts, and patients typically relapsed 2–3 years after initiating treatment. As a result, various\nexperimental approaches and strategies are being investigated in order to maximize PRRT’s\neffectiveness while minimizing potential side effects [ 8]. The NETTER-1 phase III study\ndemonstrated that, in addition to improving progression-free survival, 177Lu-Dotatate\nsigniﬁcantly improves patient quality of life signiﬁcantly when compared to high-dose\noctreotide [ 137]. In the study where 229 patients randomly received Lu-DOTATATE every\neight weeks for four cycles plus 30 mg octreotide every four weeks or high-dose octreotide\n(60 mg) every four weeks alone showed a signiﬁcant reduction in tumour progression or\ndeath in the Lu-DOTATATE treatment group. According to recent investigations, the time\nto quality of life decline was substantially longer in the 177Lu-DOTATATE therapy group.\nAfter the NETTER-1 phase III trial, the 177Lu-DOTATATE treatment was approved for\nthe somatostatin receptor-positive GEP-NETs [ 138]. To begin, treatment may be continued\nafter four cycles of PRRT, depending on kidney and bone marrow tolerance, for example,\nwith a reduced radioactivity as part of the salvage therapy (Re-PRRT). Retreatment with\n177Lu-DOTATATE-based PRRT showed an optimistic survival beneﬁt with acceptable\nsafety in patients with NETs [ 139]. The administration of PRRT intra-arterially into the\nhepatic artery rather than intravenously may increase the tumour-absorbed dose in liver\nmetastases. However, intra-arterial administration is not mentioned in guidelines and is\nconsidered experimental [ 140]. Patients with hepatic dominant metastases, in particular,\nwould beneﬁt from this approach due to the increased uptake of the radiopharmaceutical\n(the so-called “ﬁrst-pass” effect). In a neoadjuvant setting, the PRRT is becoming increas-\ningly important. PRRT was associated with a signiﬁcant reduction in tumour size and the\ntumour was rendered operable in patients with inoperable PanNETs and distant (metastatic)\ndisease. In such instances, a complete response was possible [ 8]. PRRT was likely to be\nthe best treatment option in patients with advanced well-differentiated NETs in terms\nof the beneﬁt–risk ratio. Numerous nonrandomized studies of PRRT have consistently\ndemonstrated high response rates and prolonged PFS in patients with GEP-NETs. In a more\nrecent randomized phase III trial, PRRT plus the best supportive care provided a longer PFS\nthan high-dose octreotide, and did so with limited serious adverse events (SAEs) in patients\nwith advanced midgut NETs.', 'prolonged for 22,7 months in the ¹ ⁷⁷Lu-DOTATATE group.\nThis included improvement in daily activities, role functioning\n(participation in employment and leisure). Furthermore,\npatients also demonstrated improvements in diarrhea (48%),\nfatigue (50%), treatment scale and body image (63%) endocrine\nscale (61%) and GI scale (60%) ( 16). Detailed analysis of the\ndiaries of the patients indicated signi ﬁcant decrease in the mean\nnumber of symptomatic days with diarrhea, ﬂushing and\nabdominal pain which are the major symptoms of the patients\nwith NETs ( 17). In summary, NETTER-1 study demonstrated\nthat the use of ¹ ⁷⁷Lu-DOTATATE improved PFS and quality of\nlife (QoL) together with a well-disposed safety pro ﬁle.\nAnother alternative radiolabeled synthetic somatostatin\nanalogue DOTATOC (Edotreotid e) has been developed for the\nimaging and treatment of GEP-NETs The in vivo pharmacokinetics\nof the Lu-177-labeled peptides DOTATATE, DOTANOC, and\nDOTATOC have been investigate d in patients with GEP-NETs\n(18). This study demonstrated f avorable pharmacokinetic\nproperties of radiolabeled DOTATOC with a more rapid\nclearance from healthy organs compared to DOTATATE and\nDOTANOC, providing a high tumor to background ratio and\nhence a high targeted dose of radiation to the tumor.\nTheﬁrst systematic evaluation of treatment data with n.c.a. Lu-\n177-Edotreotide in patients with GEP-NETs was reported by Baum\net al. ( 19). In this retrospective study, the ef ﬁcacy and safety of\ntreatment with Lu-177-Edotreot i d ew e r ee v a l u a t e di n5 6s u b j e c t s\nwith metastasized, progressive NET (50% gastroenteric, 27%\npancreatic, 23% other primaries ) who had not received previous\nPRRT treatment prior to a new diagnosis of progression. Subjects\nreceived on average 2,1 (range 1 –4) cycles of177Lu-Edotreotide as\nt h es o l et r e a t m e n t ,a d m i n i s t e r e di nm e d i a nd o s e so f7 , 0G B q ,a t\napproximately three-monthly treatment intervals. In the total\npopulation, median PFS and OS were 17,4 and 34,2 months,respectively. In the subjects who had received more than one\ncycle of treatment, median PFS was 32,0 months for all and 34,5\nmonths for GEP-NETs, with median OS of 34,7 months for both\ngroups. No serious adverse event s were noted, with no evidence of\nrenal toxicity. In addition, a long -term safety follow-up of patients\nincluded in the retrospective study showed no lasting relevant\nhematotoxic effects and no long-term renal toxicity for up to 6\nyears after the 1stPRRT. At the present time, it is standard practice\nto provide renal protection with a 2,5% lysine/arginine infusion\nwhich is given concomitantly with the PRRT infusion ( 20).\nBased on the data from the study of Baum et al. ( 19), a\nPhase-III pivotal clinical trial, COMPETE has been initiated.\nCOMPETE is a prospective, randomized, open-label multi-\ncenter Phase III study to evaluate the safety and ef ﬁcacy of\nn.c.a. Lu-177-Edotreotide in comparison to Everolimus in\npatients with G1 and G2 PNETs and GE NETs. The patients\nhave progressive, SSTR positive disease on SSTR imaging.\nUniquely, patients may be included as ﬁrst-line therapy. There\nare 3 sub-studies which focus on Lu-177-Edotreotide dosimetry\nand pharmacokinetics. These sub-studies are of great\nimportance in the development of a personalized, precision\ntherapy approach to the management of patients with PRRT.']",3.0,1.0,1.0,1.0,0,1.0,1.0,1.0,122
13E advanced RAG,What are the benefits of PRRT?,english,general,advantages of therapy,claude-3-opus-20240229 advanced RAG,"According to the provided context, the main benefits of Peptide Receptor Radionuclide Therapy (PRRT) are:

1. Tumor control: PRRT can effectively reduce tumor growth in neuroendocrine tumor (NET) patients. In the NETTER-1 trial, PRRT with 177Lu-DOTATATE showed a significantly longer progression-free survival compared to octreotide LAR (28 vs 8.5 months) [27,30,38].

2. Symptom control: PRRT can lead to symptomatic improvement in NET patients, including associated hormonal syndromes. In the NETTER-1 trial, time to quality of life deterioration was significantly longer in the 177Lu-DOTATATE group compared to the control group (29 vs 6.1 months) [38]. Overall symptom improvement was observed in 47% of patients in one study [33].

3. Effectiveness in functioning NETs: PRRT has shown to be an effective treatment for symptom control and reducing circulating hormone levels in patients with functioning NET syndromes, such as carcinoid syndrome, insulinoma, gastrinoma, glucagonoma, and VIPoma [40,41,42,43].","['Int. J. Mol. Sci. 2022 ,23, 1447 15 of 22\nstudies examining the feasibility, outcome, and safety of PRRT also demonstrated a PFS\ncomparable to, and in some cases superior to, that of other treatment modalities. Due to\nthe retrospective nature of these studies, the results required conﬁrmation in prospective\ntrials. According to PanNET guidelines, PRRT should even be used as a third-line therapy\nin patients with advanced locoregional disease following the failure of SSAs, everolimus,\nand/or cytotoxic chemotherapy [ 8]. Two cases were presented for third-line therapy, in\nwhich patients with metastatic PanNET (G2 Ki-67 10%) received chemotherapy or PRRT\naccording to the standard of care following SSA failure. After six cycles of STZ/5-FU (over\nnine months), the patient progressed four months later without treatment. The majority of\nparticipants preferred PRRT (38.6%, n = 32) over STZ/5-FU reinduction (26.5%, n = 22) [ 136].\nIn patients with GEP-NET G1 and G2, 177Lu-PRRT was compared to the mTOR inhibitor\neverolimus. Despite the success of 177Lu-DOTATATE PRRT, not all patients showed bene-\nﬁts, and patients typically relapsed 2–3 years after initiating treatment. As a result, various\nexperimental approaches and strategies are being investigated in order to maximize PRRT’s\neffectiveness while minimizing potential side effects [ 8]. The NETTER-1 phase III study\ndemonstrated that, in addition to improving progression-free survival, 177Lu-Dotatate\nsigniﬁcantly improves patient quality of life signiﬁcantly when compared to high-dose\noctreotide [ 137]. In the study where 229 patients randomly received Lu-DOTATATE every\neight weeks for four cycles plus 30 mg octreotide every four weeks or high-dose octreotide\n(60 mg) every four weeks alone showed a signiﬁcant reduction in tumour progression or\ndeath in the Lu-DOTATATE treatment group. According to recent investigations, the time\nto quality of life decline was substantially longer in the 177Lu-DOTATATE therapy group.\nAfter the NETTER-1 phase III trial, the 177Lu-DOTATATE treatment was approved for\nthe somatostatin receptor-positive GEP-NETs [ 138]. To begin, treatment may be continued\nafter four cycles of PRRT, depending on kidney and bone marrow tolerance, for example,\nwith a reduced radioactivity as part of the salvage therapy (Re-PRRT). Retreatment with\n177Lu-DOTATATE-based PRRT showed an optimistic survival beneﬁt with acceptable\nsafety in patients with NETs [ 139]. The administration of PRRT intra-arterially into the\nhepatic artery rather than intravenously may increase the tumour-absorbed dose in liver\nmetastases. However, intra-arterial administration is not mentioned in guidelines and is\nconsidered experimental [ 140]. Patients with hepatic dominant metastases, in particular,\nwould beneﬁt from this approach due to the increased uptake of the radiopharmaceutical\n(the so-called “ﬁrst-pass” effect). In a neoadjuvant setting, the PRRT is becoming increas-\ningly important. PRRT was associated with a signiﬁcant reduction in tumour size and the\ntumour was rendered operable in patients with inoperable PanNETs and distant (metastatic)\ndisease. In such instances, a complete response was possible [ 8]. PRRT was likely to be\nthe best treatment option in patients with advanced well-differentiated NETs in terms\nof the beneﬁt–risk ratio. Numerous nonrandomized studies of PRRT have consistently\ndemonstrated high response rates and prolonged PFS in patients with GEP-NETs. In a more\nrecent randomized phase III trial, PRRT plus the best supportive care provided a longer PFS\nthan high-dose octreotide, and did so with limited serious adverse events (SAEs) in patients\nwith advanced midgut NETs.', 'J. Clin. Med. 2021 ,10, 1267 2 of 15\n(SSTR). For many years, evidence of an anti-tumor effect of PRRT were only obtained from\nnon-randomized Phase II trials or retrospective studies. The NETTER-1 Phase III Random-\nized Trial finally validated this treatment option by confirming its low toxicity but also its\neffectiveness in tumor control. Following these results,177Lu-DOTATATE was approved by\nthe US Food and Drug Administration in 2018 and the European Medicines Agency in 2017\nfor the treatment of gastroenteropancreatic NETs that are well differentiated and obtain a\nprescription authorization in France in metastatic midgut NETs [ 2]. Some interesting data\nexist for pancreatic and pulmonary NETs. In this review, we discuss the clinical efficiency of\nPRRT in gastroenteropancreatic and pulmonary NETs.\n2. Somatostatin Receptors (SSTR) and Radio-Labelled Somatostatin Analogues\nEffect of PRRT is correlated with the ability for the markers to ﬁx the SSTR (SSTR1-5).\nThis therapy is therefore dedicated to NETs who strongly over expressed those receptors.\nSSTRs belong to a family of G-protein coupled receptors with seven transmembrane\ndomains. The majority of well differentiated gastroenteropancreatic and pulmonary NETs\nare characterized by the strong expression of SSTR, including SSTR2 Grade 1/2 NETs\nexpress the SSTR more often and at higher levels than grade 3 NETs. When linked to the\nreceptors, radiolabeled somatostatin analogues are internalized according to the normal\nrecycling dynamics of membrane receptors and the degradation products of peptides\nare stored in lysosomes, in intracellular, which allows for the release and retention of\nradioactivity inside tumor cells [ 3]. This mechanism accounts for the low toxicity of the\nPRRT on the healthy cells. Radiolabelled somatostatin analogs are made up of an isotope\nradionuclide, a carrier molecule (derived from octreotide), and a chelating agent that binds\nthem together and stabilizes the complex. The commonly used chelating agents are DOTA\n(DOTA acid and tetra-azacyclododecane-tetra-acetic) and DTPA (di-ethylenetriamine penta-\naceticacid). Three radionucleides (111In,90Y and177Lu) were conjugated to the somatostatin\nanalogues and their different physical characteristics confer speciﬁc advantages. The90Y\nand177Lu emit beta particles with higher energy and longer ranges, which translates into\ngreater therapeutic potential. Due to the emission of gamma rays, the177Lu can also be\nused for dosimetry and monitoring of tumor response [4].\n3. Modalities of Realization and Patients Selection\nPRRT is the single validated treatment option in the NETs, which for there is a pre-\ndictive marker of answer: the expression of SSTR. Response rates have been shown to\nbe increased in patients with a higher degree of absorption of radiotracers in the case of\n111In-pentetreotid scintigraphy An overall response rate of approximately 60% has been\nreported in patients with a grade 4 according to the Krenning score, corresponding to a tu-\nmor absorption greater than that of the spleen, and kidneys. Intense ﬁxation (SUV) greater\nthan 16 on the68Ga-DOTATOC PET/CT is a predictive marker of high tumor response\n(sensitivity: 95%; specﬁcity: 60 %) [ 5] (Figure 1). The effectiveness of PRRT is correlated\nwith the tumor volume and the location of the primary tumor (amount of SSTR present\non the tumor cell) (Figure 2). Thus, NETs with high liver tumor volume are considered\nto be less sensitive to PRRT [ 6]. Similarly, it is suggested that pancreatic NETs frequently\nrespond to the PRRT but with an earlier progression than in midgut NETs. The treatment\nmodalities are relatively standardized in France with a treatment carried out by infusion\nof radiolabel split in four cycles spaced eight weeks apart.', 'Cancers 2022 ,14, 5792 4 of 17\n3.2. Symptom Control\nPRRT is not only effective in reducing tumor growth, but it can also lead to symp-\ntomatic improvement in NET patients, including associated hormonal syndromes [37]. In\nthe NETTER-1 trial, PRRT with177Lu-DOTATATE provided a signiﬁcant beneﬁt in quality\nof life (QoL) compared to octreotide LAR. Time to deterioration (TTD) was signiﬁcantly\nlonger in the177Lu-DOTATATE group, with positive outcomes in the domains of global\nhealth, physical functioning, diarrhea, pain, body image, disease-related worries and\nfatigue [ 38]. In a prospective series of 265 GEP- and bronchial NET patients, QoL, perfor-\nmance status and symptoms (particularly insomnia, appetite loss and diarrhea) improved\nsigniﬁcantly after PRRT [ 39]. Importantly, QoL in asymptomatic NET patients did not\ndecline during therapy. In a single center study of 144 patients, a symptomatic response to\nPRRT with regard to diarrhea, abdominal pain, ﬂushing and fatigue was observed in 70%,\n63%, 64% and 53%, respectively [ 33]. Results are summarized in Table 1. In patients with a\nfunctioning NET, PRRT has shown to be an effective treatment regarding symptom control\nand circulating hormone levels [ 40,41]. Carcinoid syndrome (CS) is the most prevalent\nhormonal NET syndrome and is caused by excretion of hormones and amines such as\nserotonin, histamine, catecholamines, prostaglandins and tachykinins. In a study involving\n22 patients with refractory CS who received PRRT for symptomatic control, ﬂushing and\nbowel movement frequency improved signiﬁcantly [ 42]. Two-thirds of the patients who\nhad at least two episodes of ﬂushing per day had a minimal decrease of 50% of these\nepisodes. Of patients with bowel movement frequency of at least four times a day, 47%\nexperienced > 30% decrease, while 29% experienced > 50% decrease [ 37]. In a systematic\nreview, symptomatic improvement after PRRT was observed in 74% of patients with diar-\nrhea and in 6% of patients with ﬂushing [ 43]. Together, these results have positioned PRRT\nwith177Lu-DOTATATE as a viable option for refractory CS [ 44]. In addition, case reports\nhave shown improvement of symptoms and echocardiographic parameters of carcinoid\nheart disease after PRRT, which is a severe symptom of CS [ 45]. Similar positive effects of\nPRRT on hormonal levels and symptoms have been observed in patients with functioning\npanNET syndromes, such as insulinoma, gastrinoma, glucagonoma and VIPoma [40].\nTable 1. Overview of tumor control and symptom control following PRRT as described in key phase\nII and III clinical trials.\nPatients, n NET SubtypePFS\n(Months)mOS\n(Months)ORR SD PDmTTD QOL\nGlobal Health\n(Months)Overall\nSymptom\nImprovement\nStrosberg et al. [27,30,38] 101 SI-NET 28 48 18% 66% * 16% 29 m\nControl group SSA 100 SI-NET 8.5 36 3% 41% 56% 6.1 m\nBrabander et al. [29] 443GEP and\nbronchial NET29 63 39% 43% 12%\nBodei et al. [36] 51GEP and\nbronchial NET3668%\nat 36 months55% 27% 18%\nEzziddin et al. [34] 68 GEP-NET 34 53 72% 13% 15%\nSabet et al. [35] 61 SI-NET 44% 48% 8%\nHamiditabar et al. [33] 143 NET of all origins 8% 46% 38% 47%\nKhan et al.']",2.0,1.0,1.0,1.0,1,1.0,1.0,1.0,144
14G advanced RAG,Was sind Herausforderungen der PRRT?,german,general,challenges of therapy,claude-3-opus-20240229 advanced RAG,"Basierend auf den gegebenen Informationen sind einige Herausforderungen der Peptidrezeptor-Radionuklidtherapie (PRRT):

- PRRT kann Toxizitäten verursachen, die dosislimitierend sein können und Anpassungen des Behandlungsplans erfordern. Die kritischen Organe für dosislimitierende Toxizitäten sind die Nieren und das Knochenmark [1].

- Milde und schwere Hepatotoxizität wurde bei 12% bzw. 0,4-2,5% der Patienten nach PRRT beobachtet [1]. 

- Bei NET-Patienten mit hormonellen Syndromen, die eine Indikation zur Fortsetzung der SSA-Anwendung haben, muss der Zeitpunkt der Injektionen an die PRRT-Zyklen angepasst werden. Langwirksame SSA sollten aufgrund von Interferenzen mit dem radioaktiv markierten SSA nicht innerhalb von 4-6 Wochen vor einem PRRT-Zyklus verabreicht werden [2].

- Pseudo-Progression ist ein Phänomen, das bei der Beurteilung des Ansprechens berücksichtigt werden sollte, wenn während oder kurz nach der Behandlung mit PRRT eine Zunahme der Tumorgröße zu beobachten ist [2].

Quellen:
[1] Cancers 2022, 14, 5792, Seite 7
[2] Cancers 2022, 14, 5792, Seite 6","['Cancers 2022 ,14, 5792 9 of 17\nCancers 2022 , 14, x FOR PEER REVIEW  10 of 18  \n  \nFigure 2. Potential complicated clinical situations for PRRT.  (A) 68Ga-DOTATATE PET scan of ex-\ntensive bone metastases of SI -NET. R -PRRT with  reduc ed activity of 3.7 GBq 177Lu-DOTATATE in-\nduced hematoxicity. ( B) Hydronephrosis (1) due to obstruction by peritoneal tumor deposit of met-\nastatic panNET  (2), leading to accumulation of radioactivity in renal medulla. ( C) 68Ga-DOTATATE \nPET scan showing extensive liver metastases of panNET before treatment with  3.7 GBq 177Lu-DO-\nTATATE, which was well tolerated by the patient. (D ) Bone metastasis of panNET w ith epidural \nextension at Th12 on MRI. Post -PRRT edema can lead to infringement of the spinal cord . (E) Patient \nwith small bowel NET and metastatic mesenteric mass with desmoplastic reaction, resulting in ve-\nnous congestion, bowel wall thickening and ascites. The patient suffered from intermittent ab-\ndominal pain with temporary aggravation of complaints during PRRT. (F ) Contrast enhanced CT  \nscan  of peritoneal metastases of a multifocal NET of a patient who developed a paralytic ileus or \n‘frozen abdomen’ after  PRRT.  \n8.3. Hepatotoxicity  \nMild and severe hepatotoxicity has been observed in , respectively , 12% and 0.4 –2.5% \nof patients after PRRT [28,33] . Based on clinical experience, liver failure after PRRT can \nFigure 2. Potential complicated clinical situations for PRRT. ( A)68Ga-DOTATATE PET scan of ex-\ntensive bone metastases of SI-NET. R-PRRT with reduced activity of 3.7 GBq177Lu-DOTATATE\ninduced hematoxicity. ( B) Hydronephrosis (1) due to obstruction by peritoneal tumor deposit\nof metastatic panNET (2), leading to accumulation of radioactivity in renal medulla. ( C)68Ga-\nDOTATATE PET scan showing extensive liver metastases of panNET before treatment with 3.7 GBq\n177Lu-DOTATATE, which was well tolerated by the patient. ( D) Bone metastasis of panNET with\nepidural extension at Th12 on MRI. Post-PRRT edema can lead to infringement of the spinal cord.\n(E) Patient with small bowel NET and metastatic mesenteric mass with desmoplastic reaction, result-\ning in venous congestion, bowel wall thickening and ascites. The patient suffered from intermittent\nabdominal pain with temporary aggravation of complaints during PRRT. ( F) Contrast enhanced CT\nscan of peritoneal metastases of a multifocal NET of a patient who developed a paralytic ileus or\n‘frozen abdomen’ after PRRT.', 'Cancers 2022 ,14, 5792 6 of 17\nwhich an antiemetic, typically ondansetron or granisetron, should be given prophylactically\nbefore the start of the infusion.177Lu-DOTATATE allows for post-therapy scintigraphy\nwith planar imaging or SPECT/CT. At patient discharge, the radiation exposure should be\nmeasured and patients should receive tailored advice on the duration of radiation safety\nprecautions at home, to avoid a high radiation exposure to other people, particularly children\nand pregnant women. Patients with NET-associated hormonal syndromes who have an\nindication for continuation of SSA use should adjust the moment of the injections to the\nPRRT cycles. Long-acting SSA should not be given within 4–6 weeks before a cycle of PRRT\nbecause of interference with the radiolabeled SSA. Although there is conflicting evidence\nfrom two limited single center studies whether continuation of SSA treatment is beneficial in\nnon-functioning NETs [ 63,64], this practice is often adopted. If the patient suffers from severe\nhormonal symptoms, short-acting SSA can be used to bridge this period up till 24 h before\nPRRT. Radiopharmaceuticals such as177Lu-DOTATATE need to be administered at specialized\nfacilities by medical personnel trained in radiation safety. These facilities should adhere to\nnational and international regulations on the use of radiopharmaceuticals and be licensed by\nthe regulatory authorities. Depending on local protocol and exposure regulations, PRRT with\n177Lu-DOTATATE can be given in an in-patient as well as an out-patient setting. In between\ncycles, patients should be reviewed for adverse effects, including full blood count and renal\nand liver function. Response evaluation by cross-sectional imaging is usually performed 2–3\nand 6 months after the last cycle of PRRT. Long-term follow-up is determined on an individual\nbasis taking into account the tumor biology and therapeutic response [ 65]. Pseudo-progression\nis a phenomenon that should be considered in the response evaluation when an increase in\ntumor size is seen during or short after treatment with PRRT. Pseudo-progression is probably\nbased on localized, temporarily edema caused by inflammation as a response to PRRT and\ndoes not show the actual tumor response to the therapy [ 58]. When pseudo-progression is\nsuspected, functional imaging (for example, PET/CT) can help differentiate between true\nprogression and pseudo-progression [31].\n5. Salvage PRRT\nIn NET patients who showed tumor response at least 18 months after the first cycle of\n177Lu-DOTATATE, re-treatment with PRRT (R-PRRT) with two additional cycles of 7.4 GBq\neach after renewed PD has shown antitumoral effects. In a meta-analysis on the effect of\nR-PRRT, the pooled median PFS was 14 months with a pooled median OS of 27 months.\nSimilarly, the pooled ORR was 17% with a disease control rate of 77%. Response rates,\nPFS and OS were lower than for initial PRRT [ 66], nonetheless R-PRRT remains a potential\noption for GEP-NET patients when other systemic treatment options are limited. The limited\nefficacy of R-PRRT as compared to initial PRRT might be explained by the administration\nof lower cumulative activity (i.e., generally half of the initial PRRT dosage) [ 51], the increase\nin tumor bulk at baseline before R-PRRT and potential changes in the tumor biology, such\nas a longitudinal increase in Ki-67. In the largest study to date by van der Zwan et al., no\ndifference in toxicity after R-PRRT as compared with initial PRRT was observed, particularly\nno increased occurrence of nephrotoxicity or significant hematological disease [ 67]. In cases\nwhere R-PRRT has provided additional benefit on tumor response and prolonged PFS, further\nre-treatment at the time of progression can be considered [67].\n6. Patient Selection\nPRRT with177Lu-DOTATATE is registered for patients with GEP-NETs that are pro-\ngressive on SSA treatment.', 'PRRT is only applicable for pa-\ntients with a Karnofsky Performance Scale of at least 60 [ 27]. PRRT is contra-indicated\nfor patients who are pregnant or breastfeeding, patients with severe cardiac impairment\n(NYHA III or IV) and those with a life expectancy less than 3 months [ 31]. Since PRRT\ncan induce toxicity, the following pre-treatment laboratory values are required: creatinine\nclearance > 40 mL/min, hemoglobin levels ≥6 mmol/L, leukocytes > 2 ×109/L, platelet\ncount > 75 ×109/L, bilirubin, alanine aminotransferase (ALAT) and aspartate aminotrans-\nferase (ASAT) < 3 times the upper limit of normal and albumin > 3 g/dL [2,3].\n8. PRRT-Related Toxicity\nAdverse events related to PRRT are frequently mild and include nausea, abdominal pain\nand asthenia [ 27,50]. Increased hair loss is observed in up to 60% of patients treated with\n177Lu-DOTATATE, but this is temporary and seldom leads to baldness [ 88]. Besides these\nmild adverse events, PRRT can induce more severe toxicities which can be dose-limiting and\nadjustments to the treatment schedule might be required [ 89]. When the toxicity has subsided\nwithin 16 weeks after the last dose, guidelines advise to administer half of the original activity\nof177Lu-DOTATATE during the next cycle. PRRT should be discontinued when the toxicity\npersists after 16 weeks or recurs after the half dose [ 3]. In the NETTER-1 trial, 7% of the\npatients received a reduced dose because of dose-limiting toxicities [ 27]. The kidneys and the\nbone marrow are the critical organs for dose-limiting toxicities.']",1.0,1.0,1.0,1.0,0,1.0,0.0,0.5,146
14E advanced RAG,What are the challenges of PRRT?,english,general,challenges of therapy,claude-3-opus-20240229 advanced RAG,"According to the provided context, there are a few main challenges with Peptide Receptor Radionuclide Therapy (PRRT):

1. Not all patients show benefits from PRRT, and patients typically relapse 2-3 years after initiating treatment [1].

2. PRRT can have long-term side effects including renal failure and leukemic or myelodysplastic syndromes. The risk of severe nephrotoxicity (grade 3/4) was observed in 1.5% of patients, and cases of leukemia and myelodysplastic syndromes have been reported with an estimated incidence of up to 2% [2].

3. Retreatment with extra cycles of PRRT as salvage therapy may be considered when tumor progression occurs, but the tumor response rate was less compared with initial treatment [3].

In summary, the main challenges are that the benefits are not universal, relapse commonly occurs within a few years, there are potential long-term toxicities, and retreatment is less effective than initial therapy. Strategies are being investigated to maximize PRRT's effectiveness while minimizing side effects [1].","['Salvage Treatment\nAlthough tumor response rates after initial treatment with\nPRRT are encouraging, CR is rare and eventually tumor pro-\ngression occurs in the majority of patients. Retreatment with\nextra cycles of PRRT as salvage therapy may be consideredwhen better options are not available. One study showed that\nsalvage therapy with two additional cycles of\n177Lu-octreotate\ndoes not lead to serious hematologic or nephrotoxic side ef-\nfects, but the tumor response rate was less compared with\ninitial treatment [ 50].\nAnother report showed that long PFS after the initial treat-\nment with PRRT predicts a prolonged PFS after salvage ther-apy [ 51], and argued that PRRT with\n177Lu-octreotate in the\nretreatment setting is a safe and effective option in patients\nwith metastatic GEP-NETs. For these reasons, retreatment\nseems a good option for patients who responded well after\nthe initial cycles of PRRT [ 52]. This novel and important\nconcept of salvage therapy of NET needs to be tested in large,\nprospective, and multi-center trials to contribute to evidence-\nbased findings.\nTreatment Side Effects\nPRRT is generally well-tolerated. Side effects can be divided to\nacute, subacute, and long-term side effects, as summarized inTable 4. Acute side effects are usually mild and self-limiting.\nNausea or vomiting are related to the concomitant admin-\nistration of kidney-protective amino acids. Subacute side\neffects are related to the radiopeptide itself, such as bonemarrow suppression, mild hair loss (observed with\n177Lu-\noctreotate), or, more rarely, an exacerbation of a clinicalsyndrome. The most common subacute side effect ofPRRT, occurring within 4 to 6 weeks after therapy, is bone\nmarrow suppression. Usually, the hematologic toxicity is\nmild and reversible. More serious WHO grade 3 or 4 tox-icity may occur, but this has been seen in less than 15% of\npatients [ 53].\nLong-term side effects of PRRT may include renal failure\nas well as leukemia/myelody splastic syndromes (MDS).\nBecause radiopeptides are usually reabsorbed in the proximal\ntubules, they can accumulate in the renal interstitium and in-duce inflammation and fibrosis with eventual kidney damage.\nCo-administration of positively charged amino acids results ina reduction of renal radioactive uptake, up to 40% as reportedin some studies [ 16,54]. If patients have long-standing or\npoorly controlled comorbidities such as diabetes and hyper-\ntension that affect kidney function, it is expected that there\nwould be a larger and more persistent decline in creatinine\nclearance [ 55].\nAdministration of Treatment\nFor purposes of kidney protection, positively charged amino\nacids, such as L-lysine and/or L-arginine, are co-infused to\ncompetitively inhibit the proximal tubular reabsorption ofthe radiopeptide [ 56]. This reduces the renal-absorbed dose.\nDilution of the amino acids with saline allows proper hydra-tion for the patient, an appropriate ratio to use is 25 g of aminoacid in 1 L of normal saline. Obviously, patients ’comorbidi-\nties should be taken into account (e.g., avoid volume overloadin patients with cardiac insufficiency and take care in avoidingelectrolyte imbalances with hyperosmotic solutions).\nAntiemetics can be administered before the infusion to avoidpotential nausea or vomiting. Amino acid infusion should bestarted 30 –60 min before administration of the radiopeptide\nand should be maintained over 4 h. Several amino acid pro-tective schemes have been proposed in the joint IAEA,EANM, and SNMMI practical guidelines on PRRT treatment\nof NETs [ 56].\nCurrent administration schedules comprise the most ap-\npropriate number of cycles (generally four or five) and thebest delivery frequency (8 weeks apart). This pattern allows\nthe patient to recover from the mild side effects of the ther-apy and increases its effectiveness in terms of the radiobi-\nological activity [ 57]. Radioisotope infusion should be\naround 30 min as recommended in the literature.', 'J. Clin. Med. 2021 ,10, 1267 11 of 15\n4.5.1. Subacute Effects\nPRRT is overall well tolerated with most patients experiencing only moderate toxicity.\nIn the study NETTER-1, validating the PRRT in midgut NETs, 5% of the patients discon-\ntinued treatment due to toxicity related to PRRT. Acute side effects are mainly nausea,\nvomiting, fatigue and abdominal pain. These adverse events are mainly caused by the\nsimultaneous infusion of aminoacids. Particular vigilance must be exercised with regard\nto the risk of carcinoid crisis. This event was reported in a very small minority (1%) of\npatients who received an PRRT treatment. This crisis usually appears within 48 h of the ﬁrst\ninfusion and is related to the massive release of active amines [ 34]. A myelosuppressure\nhas been described and is caused by the irradiation of the bone marrow. Bone marrow\nis particularly radiosensitive, and this toxicity does not appear to be associated to the\nexpression of SSTRs in myeloid cells. Myelosuppression generally develops four at six\nweeks after the infusion, is usually grade 1/2 and is reversible. Hematotoxic effects grade\n3 and 4 have been described in 13% and 10% of the patients receiving90Y-DOTATOC\nand177Lu-DOTATATE, respectively [ 35]. Lymphopenia is the more often reported severe\ncytopenia. Some studies have also reported that PRRT could be safely used in the case\nof diffuse metastatic bone marrow involvement, without irreversible myelosuppression,\nalthough a higher incidence of subacute transient hematologic toxicity was observed [36]\nOther toxicities have been reported, including a risk of hepatotoxicity in the patients\nwith major liver involvement. Thus, as indicated above, it is desirable to consider PRRT\nearly in the management process of the disease.\n4.5.2. Long-Term Effects\nLong-term side effects of PRRT can include renal failure and leukemic or myelodys-\nplastic syndromes.\nThe radiolabels are reabsorbed in the proximal tubules, may accumulate in the proxi-\nmal tubules in the renal interstitium and cause kidney damage. Because of its higher energy\nand longer penetration range,90Y irradiates the renal interstitium glomeruli more exten-\nsively than177Lu. In a large institutional series of 1109 patients treated with90Y-DOTATOC,\n103 patients (9%) were treated with90Y-DOTATOC with severe renal toxicity [ 7]. Nowa-\ndays, the concomitant administration positively charged aminoacids results in a reduction\nof up to 40% of the renal absorption. Despite renal protection, the median decrease of the\ncreatinine clearance is estimated to 4% per year in patients treated with177Lu-DOTATATE.\nThe risk factors for nephrotoxicity cited are diabetes and poorly controlled hypertension.\nRisk of severe nephrotoxicity (grade 3/4) was observed in only 1.5% of patients [ 37]. In\noverall, end-stage renal disease as a consequence of PRRT is extremely rare.\nCases of leukemia and myelodysplastic syndromes have been reported as late-onset\nPRRT toxicity, with an estimated incidence of up to 2% [ 37,38]. Age over 70 years, cytopenia\nbefore treatment, the presence of bones metastasis, the high number of previous treatments,\nthe prior use of an alkylating agent and the radiotherapy increases the risk of secondary\nmyelodysplastic syndrome. Brieau et al. reported in a retrospective monocentric study\nconducted in a population of patients treated with PRRT and pre-treatment alkylating\nchemotherapy an increased risk late hematologic toxicity (20%; four patients out of 20) [ 39].\nThe main alkylating agent used in the NET treatment is temozolomide. The development\nof myelodysplastic syndrome or leukemia has been reported between 30 and 70 months\nafter treatment with PRRT [ 39].', 'Int. J. Mol. Sci. 2022 ,23, 1447 15 of 22\nstudies examining the feasibility, outcome, and safety of PRRT also demonstrated a PFS\ncomparable to, and in some cases superior to, that of other treatment modalities. Due to\nthe retrospective nature of these studies, the results required conﬁrmation in prospective\ntrials. According to PanNET guidelines, PRRT should even be used as a third-line therapy\nin patients with advanced locoregional disease following the failure of SSAs, everolimus,\nand/or cytotoxic chemotherapy [ 8]. Two cases were presented for third-line therapy, in\nwhich patients with metastatic PanNET (G2 Ki-67 10%) received chemotherapy or PRRT\naccording to the standard of care following SSA failure. After six cycles of STZ/5-FU (over\nnine months), the patient progressed four months later without treatment. The majority of\nparticipants preferred PRRT (38.6%, n = 32) over STZ/5-FU reinduction (26.5%, n = 22) [ 136].\nIn patients with GEP-NET G1 and G2, 177Lu-PRRT was compared to the mTOR inhibitor\neverolimus. Despite the success of 177Lu-DOTATATE PRRT, not all patients showed bene-\nﬁts, and patients typically relapsed 2–3 years after initiating treatment. As a result, various\nexperimental approaches and strategies are being investigated in order to maximize PRRT’s\neffectiveness while minimizing potential side effects [ 8]. The NETTER-1 phase III study\ndemonstrated that, in addition to improving progression-free survival, 177Lu-Dotatate\nsigniﬁcantly improves patient quality of life signiﬁcantly when compared to high-dose\noctreotide [ 137]. In the study where 229 patients randomly received Lu-DOTATATE every\neight weeks for four cycles plus 30 mg octreotide every four weeks or high-dose octreotide\n(60 mg) every four weeks alone showed a signiﬁcant reduction in tumour progression or\ndeath in the Lu-DOTATATE treatment group. According to recent investigations, the time\nto quality of life decline was substantially longer in the 177Lu-DOTATATE therapy group.\nAfter the NETTER-1 phase III trial, the 177Lu-DOTATATE treatment was approved for\nthe somatostatin receptor-positive GEP-NETs [ 138]. To begin, treatment may be continued\nafter four cycles of PRRT, depending on kidney and bone marrow tolerance, for example,\nwith a reduced radioactivity as part of the salvage therapy (Re-PRRT). Retreatment with\n177Lu-DOTATATE-based PRRT showed an optimistic survival beneﬁt with acceptable\nsafety in patients with NETs [ 139]. The administration of PRRT intra-arterially into the\nhepatic artery rather than intravenously may increase the tumour-absorbed dose in liver\nmetastases. However, intra-arterial administration is not mentioned in guidelines and is\nconsidered experimental [ 140]. Patients with hepatic dominant metastases, in particular,\nwould beneﬁt from this approach due to the increased uptake of the radiopharmaceutical\n(the so-called “ﬁrst-pass” effect). In a neoadjuvant setting, the PRRT is becoming increas-\ningly important. PRRT was associated with a signiﬁcant reduction in tumour size and the\ntumour was rendered operable in patients with inoperable PanNETs and distant (metastatic)\ndisease. In such instances, a complete response was possible [ 8]. PRRT was likely to be\nthe best treatment option in patients with advanced well-differentiated NETs in terms\nof the beneﬁt–risk ratio. Numerous nonrandomized studies of PRRT have consistently\ndemonstrated high response rates and prolonged PFS in patients with GEP-NETs. In a more\nrecent randomized phase III trial, PRRT plus the best supportive care provided a longer PFS\nthan high-dose octreotide, and did so with limited serious adverse events (SAEs) in patients\nwith advanced midgut NETs.']",2.0,1.0,1.0,1.0,1,1.0,0.0,0.5,156
15G advanced RAG,Was sind die wichtigsten inclusion/exclusion criteria der COMPETE Studie?,german,specific,study,claude-3-opus-20240229 advanced RAG,"Basierend auf den Informationen im Poster zur COMPETE-Studie sind die wichtigsten Einschluss- und Ausschlusskriterien:

Haupteinschlusskriterien:
- Schriftliche Einverständniserklärung
- Männlich oder weiblich ≥18 Jahre alt
- Histologisch und klinisch bestätigte Diagnose eines gut differenzierten NET gastrointestinalen (GI-NET) oder pankreatischen Ursprungs (P-NET), Tumorgrad G1 oder G2 (Ki-67 ≤20%), nicht resektabel oder metastasiert
- Messbare Erkrankung nach RECIST 1.1, definiert als mindestens 1 Läsion mit ≥1 cm im längsten Durchmesser und insgesamt ≥2 radiologische Tumorläsionen
- SSTR+ Erkrankung, nachgewiesen durch SSTR-Bildgebung innerhalb von 4 Monaten vor Randomisierung
- Radiologische Krankheitsprogression, definiert als progressive Erkrankung nach RECIST 1.1 Kriterien, nachgewiesen durch CT/MRT mit ≥90 Tagen Intervall während 12 Monaten vor Randomisierung","['Primary endpoint isprogression free survival, assessed every 12weeks until disease progression\n(RECIST v1.1)ordeath. Secondary outcomes include overall survival, assessed upto2years after\ndisease progression .\nCOMPOSE aims torandomize 202 patients 1:1toadefined number ofcycles of\n177Lu-edotreotide oranactive comparator .Asshown inFigure 2,patients willreceive either :\n•PRRT with n.c.a.177Lu-edotreotide consisting of six cycles (7.5GBq n.c.a.\n177Lu-edotreotide percycle), administered asintravenous infusion (101 patients) .\n•Either CAPTEM, everolimus ,orFOLFOX, aschosen bythestudy doctor and administered\naccording tolocal prescribing information (101 patients) .\nRecruitment commenced inSeptember 2021 with first patient screened inFrance.\nReferences\n1.Severi S,etal.Onco Targets Ther 2017; 10:551− 557;2.UriI&Grozinsky -Glasberg S.Clin\nDiabetes Endocrinol 2018; 4:16;3.Pavel M,etal.Ann Oncol 2020; 31:844− 860;4.Sonbol MB&\nHalfdanarson TR.Curr Treat Options Oncol 2019 ;20:74; 5.Baum R P, etal.Theranostics\n2016; 6:501- 510; 6.Strosberg J,etal.NEngl JMed 2017; 376: 125− 135.MAIN INCLUSION / EXCLUSION CRITERIA\nInclusion Criteria\n•Patients aged ≥18 years\n•Histologically confirmed diagnosis of unresectable, well-differentiated (high grade 2 or \ngrade 3) GEP- NETs \n•SSTR+ disease\nExclusion Criteria\n•Prior PRRT\n•Any major surgery within 4 weeks prior to randomization\n•Other known malignancies\n•Renal, hepatic, cardiovascular, or hematological organ dysfunction, potentially \ninterfering with the safety of the trial treatments\nFigure 2. Summary schedule of treatments and follow -up consultation Figure 1. PRRT mode ofaction\nContact information :  Jorge Hernando. Vall \nd´Hebron University Hospital, Barcelona. \njhernando@vhio.net', 'The  study  is  \nongoing and currently recruiting patients in at least 14 countries5.Study Objectives\nPrimary Objective\nProgression-free survival (PFS). Diagnosis of progression will be established based on \nmorphological imaging (MRI and/or CT) according to RECIST 1.1.\nKey Secondary Objectives\nObjective response rates (ORR) as best outcome; overall survival (OS); duration of di-\nsease control (DDC); safety and tolerability; health-related quality of life (HRQL); dosi-\nmetry; pharmacokinetics. Conclusion\nCOMPETE is the /f_i  rst pivotal study to compare PRRT with an approved therapeutic in \npatients with Grade 1 and Grade 2 GEP-NETs. It is expected that COMPETE will increase \ntreatment options, including /f_i  rst-line therapy. Further studies with lutetium (177Lu) \nedotreotide in patients with NETs and high unmet medical needs are under review.\nMain Inclusion Criteria\n• Written informed consent\n• Male or female ≥18 years of age\n• Histologically and clinically con/f_i  rmed diagnosis of well-diﬀ  erentiated NET of non-\n functional gastrointestinal origin (GI-NET) or both functional or non-functional  \n pancreatic origin (P-NET), tumor grade G1 or G2 (Ki-67 ≤20%), unresectable or  \n metastatic\n• Measurable disease per RECIST 1.1, on CT/MRI scans, de/f_i  ned as at least 1 lesion  \n with ≥1 cm in longest diameter and ≥2 radiological tumor lesions in total\n• SSTR+ disease, as evidenced by SSTR imaging within 4 months prior to \n randomization\n• Radiological disease progression, de/f_i  ned as progressive disease per RECIST 1.1  \n criteria, evidenced by CT/MRI with ≥90 days interval during 12 months prior to  \n randomizationTreatment Schedule\nFigure 1: Kaplan-Meier estimates of PFS in the \nstudy population depending on number of lutetium \n(177Lu) edotreotide PRRT cycles (Baum et al, 2016)Figure 2: Kaplan-Meier estimates of OS in the \nstudy population depending on number of lutetium \n(177Lu) edotreotide PRRT cycles (Baum et al, 2016)Mode of Action\nLock and Key Principle\nTargeted radiopharmaceuticals contain a targeting molecule and a medical radioiso-\ntope. The targeting molecule binds to the tumor speci/f_i  c receptor according to the \nlock and key principle (Figure 4). In most cases, the targeting molecule can be used \nfor both diagnostics and therapy, only the radioisotope needs to be changed. This \nenables the application of theranostics in precision oncology.', 'Method\nTrial Design\nCOMPOSE is a prospective, randomized, controlled, open -label, multi -center, \nPhase III study to evaluate the efficacy, safety and patient -reported outcomes of \nfirst-or later -line treatment with n.c.a.177Lu-edotreotide PRRT compared to best \nstandard of care in patients with well -differentiated, high grade 2 and grade 3 \n(Ki-67 index 15−55) , somatostatin receptor -positive (SSTR+) GEP -NETs. \nThe study was recently opened and is planned to recruit patients in 10 \ncountries. It aims to randomize 202 patients 1:1 to receive one of two treatment \noptions (Figure 4) .\nAs shown above, patients will receive either:\n•PRRT with n.c.a. 177Lu-edotreotide consisting of six cycles (7.5 GBq n.c.a. \n177Lu-edotreotide per cycle), administered as i.v. infusion (101 patients) or\n•Either CAPTEM, everolimus , or FOLFOX, administered according to local \nprescribing information, until diagnosis of progression or end of study (101 \npatients). The appropriate standard therapy will be determined by the \nstudy doctor.\nCOMPOSE: Pivotal phase III trial of 177Lu-edotreotide versus best standard of care in well -differentiated \naggressive grade 2 and grade 3 gastroenteropancreatic neuroendocrine tumors \nHalfdanarson TR ,1Reidy D,2Vijayvergia N,3Halperin D,4Goldstein G,5Kong G,6Michael M,6Leyden S,7Grozinsky -Glasberg S,8Sorbye H,9Öberg K,10Thevenet T, 11Herrmann M11\n1. Presenter: Mayo Clinic, Rochester, MN, USA; 2. Memorial Sloan Kettering Cancer Center, New York, NY , USA; 3. Fox Chase Cancer Center, Ph iladelphia, PA, USA; 4. MD Anderson Cancer Center, Houston, TX, USA; 5. Carcinoid Cancer Foundation, Mt Kisco, \nNY , USA; 6. Peter MacCallum Cancer Centre, Melbourne, VIC, Australia; 7. NeuroEndocrine Cancer, Australia; 8. Hadassah Medica l Center, Jerusalem, Israel; 9. Haukeland University Hospital, Bergen, Norway; 10. Akademiska Sjukhuset, Uppsala, Sweden; 11. \nITM Oncologics GmbH, Garching/Munich, Germany.\nBackground\nGastroenteropancreatic neuroendocrine tumors (GEP -NETs), which represent \napproximately 70% of NETs, frequently develop metastatic disease with limited \ntreatment options.1\nCurrent standard therapies for the subset of well -differentiated high grade 2 and \ngrade 3 GEP -NETs include cytoreductive procedures, somatostatin analogues, \nmolecular targeted therapies (everolimus or sunitinib), chemotherapy and peptide \nreceptor radionuclide therapy (PRRT), with no specified sequence of use.2−4\nPRRT may stabilize disease and induce objective tumor responses. This treatment \nuses radiolabeled somatostatin analogues to selectively target tumor cells \nexpressing somatostatin receptor 2.5\nAs demonstrated in theBad Berka study , PRRT in the form ofnon-carrier added\n(n.c.a .)177Lu-edotreotide is an innovative radiolabeled somatostatin analogue with \na favorable safety profile and promising efficacy in treating patients with NETs \n(Figure 1 and Figure 2).6\nStudy Outcomes\nPrimary\n•Progression -free survival assessed every 12 weeks until disease progression \n(RECIST v1.1) or death, whichever occurs earlier.\nSecondary\n•Overall survival assessed up to 2 years after disease progression\n Figure 1. Kaplan -Meier estimates of PFS in \nthe study population depending onnumber\nof n.c.a.177Lu-edotreotide PRRT cycles.6\nFigure 2.']",3.0,1.0,1.0,1.0,0,1.0,0.0,0.5,108
15E advanced RAG,What are the most important inclusion/exclusion criteria of the COMPETE trial?,english,specific,study,claude-3-opus-20240229 advanced RAG,"The most important inclusion and exclusion criteria for the COMPOSE trial are:

Inclusion Criteria:
- Patients aged ≥18 years
- Histologically confirmed diagnosis of unresectable, well-differentiated (high grade 2 or grade 3) GEP-NETs 
- SSTR+ disease

Exclusion Criteria:
- Prior PRRT
- Any major surgery within 4 weeks prior to randomization
- Other known malignancies
- Renal, hepatic, cardiovascular, or hematological organ dysfunction, potentially interfering with the safety of the trial treatments [1]

References:
[1] ENETS Poster: COMPOSE: Pivotal phase III trial of 177Lu-edotreotide versus best standard of care in well-differentiated aggressive grade 2 and grade 3 gastroenteropancreatic neuroendocrine tumors.","['Trial design\nCOMPOSE is a prospective, randomised, controlled, \nopen -label, multi -center Phase III trial recruiting \npatients with well -differentiated aggressive grade 2 and \n3 (Ki -67 index 15−55%), SSTR+, GEP -NETs. \nCOMPOSE will evaluate efficacy, safety and patient -\nreported outcomes of 1st -or 2nd -line treatment with \n177Lu edotreotide PRRT compared to best standard of \ncare [investigator ´s choice of chemotherapy \n(capecitabine -temozolomide: CAPTEM or folinic acid, \nfluorouracil and oxaliplatin: FOLFOX) or everolimus] \n(Figure 2).\nCOMPOSE aims to randomize 202 patients 1:1 to a \ndefined number of cycles 177Lu-edotreotide or an active \ncomparator (Figure 2).COMPOSE: Pivotal phase III trial to compare 177Lu-edotreotide with best standard of care for \nwell -differentiated aggressive grade 2 and 3 gastroenteropancreatic neuroendocrine tumours \nHalfdanarson TR,1Halperin DM,2Reidy -Lagunes D,3Kong G,4Capdevila J,5Mailman J,6Herrmann K,7Srirajaskanthan R,8Leyden S,9Sierras C,10Harris P10\n1. Mayo Clinic, Rochester, MN USA; 2. MD Anderson Cancer Center, Houston, Texas, USA; 3. Memorial Sloan Kettering Cancer Cent er,New York, USA; 4. Peter MacCallum Cancer Centre, Melbourne, VIC, Australia; 5. Vall d ´Hebron University Hospital, Vall d ´Hebron Institute of \nOncology, Barcelona, Spain; 6. NorCal CarciNET Community, Oakland, CA; 7. University Hospital Essen, Germany; 8. Kings Colleg e Hospital, London, UK; 9. NeuroEndocrine Cancer Australia, Victoria, Australia; 10. ITM Oncologics GmbH, Garching/Munich, Germa ny\nBackground\nApproximately 70% of neuroendocrine tumours are \ngastroenteropancreatic (GEP -NETs). These frequently develop \nmetastatic disease with limited treatment options.1\nFor well -differentiated high grade 2 and 3 GEP -NETs, current \ntherapies include peptide receptor radionuclide therapy (PRRT), \nsomatostatin analogues, chemotherapy, cytoreduction and \nmolecular targeted therapies (everolimus, sunitinib) with no \nspecified use sequence. \nPRRT uses radiolabelled somatostatin analogues to selectively \ntarget somatostatin receptor expressing (SSTR+) tumour cells. \nUse may stabilise disease and induce objective tumour \nresponse.2\n177Lu edotreotide is an innovative radiolabelled somatostatin \nanalogue with promising efficacy and a favourable safety \nprofile.2,3Retrospective data in metastatic GEP -NETs treated \nwith ≥2 cycles of 177Lu-edotreotide demonstrate progression \nfree survival (PFS) of ≥30 months (Figure 1).3\nThe Phase III COMPETE trial , which has completed patient \nrecruitment, is comparing 177Lu edotreotide efficacy/safety \nversus everolimus in grade 1 and 2 GEP -NETs.4References\n1. Severi S, et al. Onco Targets Ther 2017;10:551−557; \n2. Strosberg J, et al. N Engl J Med 2017;376:125−135; 3. Baum RP , \net al. Theranostics 2016;6:501 -510. 4.', 'Method\nTrial Design\nCOMPOSE is a prospective, randomized, controlled, open -label, multi -center, \nPhase III study to evaluate the efficacy, safety and patient -reported outcomes of \nfirst-or later -line treatment with n.c.a.177Lu-edotreotide PRRT compared to best \nstandard of care in patients with well -differentiated, high grade 2 and grade 3 \n(Ki-67 index 15−55) , somatostatin receptor -positive (SSTR+) GEP -NETs. \nThe study was recently opened and is planned to recruit patients in 10 \ncountries. It aims to randomize 202 patients 1:1 to receive one of two treatment \noptions (Figure 4) .\nAs shown above, patients will receive either:\n•PRRT with n.c.a. 177Lu-edotreotide consisting of six cycles (7.5 GBq n.c.a. \n177Lu-edotreotide per cycle), administered as i.v. infusion (101 patients) or\n•Either CAPTEM, everolimus , or FOLFOX, administered according to local \nprescribing information, until diagnosis of progression or end of study (101 \npatients). The appropriate standard therapy will be determined by the \nstudy doctor.\nCOMPOSE: Pivotal phase III trial of 177Lu-edotreotide versus best standard of care in well -differentiated \naggressive grade 2 and grade 3 gastroenteropancreatic neuroendocrine tumors \nHalfdanarson TR ,1Reidy D,2Vijayvergia N,3Halperin D,4Goldstein G,5Kong G,6Michael M,6Leyden S,7Grozinsky -Glasberg S,8Sorbye H,9Öberg K,10Thevenet T, 11Herrmann M11\n1. Presenter: Mayo Clinic, Rochester, MN, USA; 2. Memorial Sloan Kettering Cancer Center, New York, NY , USA; 3. Fox Chase Cancer Center, Ph iladelphia, PA, USA; 4. MD Anderson Cancer Center, Houston, TX, USA; 5. Carcinoid Cancer Foundation, Mt Kisco, \nNY , USA; 6. Peter MacCallum Cancer Centre, Melbourne, VIC, Australia; 7. NeuroEndocrine Cancer, Australia; 8. Hadassah Medica l Center, Jerusalem, Israel; 9. Haukeland University Hospital, Bergen, Norway; 10. Akademiska Sjukhuset, Uppsala, Sweden; 11. \nITM Oncologics GmbH, Garching/Munich, Germany.\nBackground\nGastroenteropancreatic neuroendocrine tumors (GEP -NETs), which represent \napproximately 70% of NETs, frequently develop metastatic disease with limited \ntreatment options.1\nCurrent standard therapies for the subset of well -differentiated high grade 2 and \ngrade 3 GEP -NETs include cytoreductive procedures, somatostatin analogues, \nmolecular targeted therapies (everolimus or sunitinib), chemotherapy and peptide \nreceptor radionuclide therapy (PRRT), with no specified sequence of use.2−4\nPRRT may stabilize disease and induce objective tumor responses. This treatment \nuses radiolabeled somatostatin analogues to selectively target tumor cells \nexpressing somatostatin receptor 2.5\nAs demonstrated in theBad Berka study , PRRT in the form ofnon-carrier added\n(n.c.a .)177Lu-edotreotide is an innovative radiolabeled somatostatin analogue with \na favorable safety profile and promising efficacy in treating patients with NETs \n(Figure 1 and Figure 2).6\nStudy Outcomes\nPrimary\n•Progression -free survival assessed every 12 weeks until disease progression \n(RECIST v1.1) or death, whichever occurs earlier.\nSecondary\n•Overall survival assessed up to 2 years after disease progression\n Figure 1. Kaplan -Meier estimates of PFS in \nthe study population depending onnumber\nof n.c.a.177Lu-edotreotide PRRT cycles.6\nFigure 2.', 'Primary endpoint isprogression free survival, assessed every 12weeks until disease progression\n(RECIST v1.1)ordeath. Secondary outcomes include overall survival, assessed upto2years after\ndisease progression .\nCOMPOSE aims torandomize 202 patients 1:1toadefined number ofcycles of\n177Lu-edotreotide oranactive comparator .Asshown inFigure 2,patients willreceive either :\n•PRRT with n.c.a.177Lu-edotreotide consisting of six cycles (7.5GBq n.c.a.\n177Lu-edotreotide percycle), administered asintravenous infusion (101 patients) .\n•Either CAPTEM, everolimus ,orFOLFOX, aschosen bythestudy doctor and administered\naccording tolocal prescribing information (101 patients) .\nRecruitment commenced inSeptember 2021 with first patient screened inFrance.\nReferences\n1.Severi S,etal.Onco Targets Ther 2017; 10:551− 557;2.UriI&Grozinsky -Glasberg S.Clin\nDiabetes Endocrinol 2018; 4:16;3.Pavel M,etal.Ann Oncol 2020; 31:844− 860;4.Sonbol MB&\nHalfdanarson TR.Curr Treat Options Oncol 2019 ;20:74; 5.Baum R P, etal.Theranostics\n2016; 6:501- 510; 6.Strosberg J,etal.NEngl JMed 2017; 376: 125− 135.MAIN INCLUSION / EXCLUSION CRITERIA\nInclusion Criteria\n•Patients aged ≥18 years\n•Histologically confirmed diagnosis of unresectable, well-differentiated (high grade 2 or \ngrade 3) GEP- NETs \n•SSTR+ disease\nExclusion Criteria\n•Prior PRRT\n•Any major surgery within 4 weeks prior to randomization\n•Other known malignancies\n•Renal, hepatic, cardiovascular, or hematological organ dysfunction, potentially \ninterfering with the safety of the trial treatments\nFigure 2. Summary schedule of treatments and follow -up consultation Figure 1. PRRT mode ofaction\nContact information :  Jorge Hernando. Vall \nd´Hebron University Hospital, Barcelona. \njhernando@vhio.net']",1.0,1.0,1.0,1.0,0,1.0,0.0,0.5,100
16G advanced RAG,Was sind die wichtigsten inclusion/exclusion criteria der COMPOSE Studie?,german,specific,study,claude-3-opus-20240229 advanced RAG,"Basierend auf den Informationen in den Kontextdokumenten sind die wichtigsten Einschluss- und Ausschlusskriterien der COMPOSE-Studie:

Einschlusskriterien:
- Histologisch bestätigte Diagnose eines gut differenzierten neuroendokrinen Tumors gastroenterischen (GE-NET) oder pankreatischen Ursprungs (P-NET) [1]
- Messbare Erkrankung gemäß RECIST 1.1 [1] 
- Somatostatinrezeptor-positive (SSTR+) Erkrankung [1]
- Fortschreitende Erkrankung basierend auf RECIST 1.1 Kriterien [1]

Ausschlusskriterien:
- Bekannte Überempfindlichkeit gegen Edotreotid oder Everolimus [1]
- Bekannte Überempfindlichkeit gegen DOTA, Lutetium-177 oder einen Hilfsstoff von Edotreotid oder Everolimus oder ein anderes Rapamycin-Derivat [1]
- Vorherige Exposition gegenüber einer Peptidrezeptor-Radionuklidtherapie (PRRT) [1]
- Vorherige Therapie mit mTor-Inhibitoren [1]","['15.04.24, 12:02 Efficacy and Safety of 177Lu-edotreotide PRRT in GEP-NET Patients - Full Text View - ClinicalTrials.gov\nhttps://classic.clinicaltrials.gov/ct2/show/study/NCT03049189 4/6\n1. overall survival (OS) [ Time Frame: every 3 months for a period of at least 30 months ]\nOS as secondary outcome measure will be assessed per patient from date of randomization\nuntil the date of death, whichever came first\nEligibility Criteria\nInformation from the National Library of Medicine\nChoosing to participate in a study is an important personal decision. T alk with\nyour doctor and family members or friends about deciding to join a study . To\nlearn more about this study , you or your doctor may contact the study research\nstaff using the contacts provided below . For general information, Learn About\nClinical Studies.\nAges Eligible for Study:  18 Years and older   (Adult, Older Adult)\nSexes Eligible for Study:  All\nAccepts Healthy V olunteers:  No\nCriteria\nInclusion Criteria:\nHistologically confirmed diagnosis of well-dif ferentiated neuro-endocrine tumour of non-functional\ngastroenteric origin (GE-NET) or both functional or non-functional pancreatic origin (P-NET)\nMeasurable disease per RECIST  1.1\nSomatostatin receptor positive (SSTR+) disease\nProgressive disease based on RECIST  1.1. criteria as evidenced by two morphological imaging\nexaminations made with the same imaging method (either CT  or MRI)\nExclusion Criteria:\nKnown hypersensitivity to edotreotide or everolimus\nKnown hypersensitivity to DOT A, lutetium-177, or any excipient of edotreotide or everolimus or\nany other Rapamycin derivative\nPrior exposure to any peptide receptor radionuclide therapy (PRR T)\nPrior therapy with mT or inhibitors\nPrior EFR (external field radiation) to GEP-NET  lesions within 90 days before randomisation or\nradioembolisation therapy\nTherapy with an investigational compound and/or medical device within 30 days prior to\nrandomisationGo to', 'Aims\nCOMPOSE aims to extend the therapeutic options for 177Lu-edotreotide \nto aggressive grade GEP -NETs.\nMaterials and Methods\n•COMPOSE (NCT04919226) is a prospective, randomized, controlled, open -\nlabel, multi -center Phase III study, in patients with well -differentiated \naggressive grade 2 and grade 3, SSTR+, GEP -NETs\n•This trial is to evaluate the efficacy, safety and patient -reported outcomes \nof first -or second -line treatment with 177Lu edotreotide PRRT compared \nto best standard of care. \nCOMPOSE aims to randomize 202 patients 1:1 to a defined number of cycles\n177Lu-edotreotide or an active comparator (Figure 3)\n•PRRT with n.c.a. 177Lu-edotreotide consisting of six cycles (7.5 GBq n.c.a. \n177Lu-edotreotide per cycle) administered as intravenous infusion \n(101 patients) or\n•CAPTEM, everolimus , or FOLFOX, according to investigator ´s choice and \nadministered according to local prescribing information, until diagnosis \nof progression or end of study (101 patients) Pivotal phase III COMPOSE trial will compare 177Lu-edotreotide with best standard of care \nfor well -differentiated aggressive grade 2 and grade 3 gastroenteropancreatic neuroendocrine tumors\nHalfdanarson TR,1Halperin DM,2Reidy -Lagunes D,3Kong G,4Mailman J,5Herrmann K,6Srirajaskanthan R,7Leyden S,8Capdevila J,9Thevenet T,10Harris P10\n1. Mayo Clinic, Rochester, MN USA; 2. MD Anderson Cancer Center, Houston, Texas, USA; 3. Memorial Sloan Kettering Cancer Cent er, New York, USA; 4. Peter MacCallum Cancer Centre, Melbourne, VIC, Australia; 5. NorCal CarciNET Community, Oakland, CA; 6. University \nHospital Essen, Germany 7. Kings College Hospital, London, UK; 8. NeuroEndocrine Cancer Australia, Victoria, Australia; 9. Va ll d´Hebron University Hospital, Vall d ´Hebron Institute of Oncology, Barcelona, Spain; 10. ITM Oncologics GmbH, Garching/Munich, Germany\nBackground\nGastroenteropancreatic neuroendocrine tumors (GEP -NETs), which \nrepresent approximately 70% of NETs, frequently develop metastatic \ndisease with limited treatment options.1\nPRRT uses radiolabeled somatostatin analogues to selectively target \nsomatostatin receptor expressing (SSTR+) tumor cells.2It may be able to \nstabilize disease and induce objectively evaluable tumor response; \nhowever, there is a lack of prospective evidence.\nNo-carrier -added (n.c.a.) 177Lu-edotreotide is an innovative radiolabeled \nsomatostatin analogue with a favorable safety profile and promising \nefficacy.2,3Figure 1A, utilizing retrospective data in metastatic GEP -NETs, \nshows progression -free survival of at least 30 months following treatment \nwith two or more cycles of177Lu-edotreotide. Figure 1B shows overall \nsurvival estimates.3\nCOMPETE, a Phase III trial in grade 1 and grade 2 GEP -NETs comparing the \nefficacy and safety of 177Lu edotreotide versus everolimus, has recently \ncompleted patient recruitment.4References\n1. Severi S, et al. Onco Targets Ther 2017;10:551−557; 2. Strosberg J, et al. N Engl J \nMed 2017;376:125−135; 3. Baum RP , et al. Theranostics 2016;6:501 -510.\n4.', 'Method\nTrial Design\nCOM POSE (NCT04919226), a prospective, randomised , \ncontrolled, open -label, multi -center Phase III study, aims to \nextend therapeutic options for patients with well -differentiated \naggressive grade 2 and grade 3, somatostatin receptor -positive \n(SSTR+), GEP -NETs.\nCOM POSE evaluates efficacy, safety, and patient -reported \noutcomes of first -or second -line treatment with 177Lu-\nedotreotide TRT.\nPatients will be randomised 1:1 ( Figure 2 ) to:\n•Up to six cycles 177Lu-edotreotide (7.5 GBq per cycle), \nadministered as an intravenous infusion (at least 101 \npatients )at 6-to 8-week intervals or\n•Investigator’s choice of CAPTEM, FOLFOX or everolimus, \nadministered according to local prescribing information, \nuntil diagnosis of progression or end of study (at least 101 \npatients )\nCOMPOSE: Pivotal phase III trial for well -differentiated aggressive grade 2/grade 3 gastroenteropancreatic \nneuroendocrine tumors comparing 177Lu-edotreotide with best standard of care\nThorvardur R Halfdanarson ,1Daniel M Halperin,2Diane Reidy -Lagunes,3Grace Kong,4Jaume Capdevila,5Josh Mailman,6Ken Herrmann,7Rajaventhan Srirajaskanthan,8Simone Leyden,9Thomas Thevenet,10Philip Harris10\n1. Presenter: Mayo Clinic, Rochester, MN USA; 2. MD Anderson Cancer Center, Houston, TX, USA; 3. Memorial Sloan Kettering Cancer Center, Ne w York, NY USA; 4. Peter MacCallum Cancer Centre, Melbourne, VIC, Australia; 5. Vall d ´Hebron University Hospital, Vall d ´Hebron \nInstitute of Oncology, Barcelona, Spain; 6. NorCal CarciNET Community, Oakland, CA USA; 7. University Hospital Essen, Essen, Germany; 8. Kings College Hospital, London, UK; 9. NeuroEndocrine Cancer Australia, VIC, Australia; 10. ITM Oncologics GmbH, Gar ching/Munich, Germany\nIntroduction\nGastroenteropancreatic neuroendocrine tumors (GEP -NETs), which \nfrequently develop metastatic disease, represent an estimated 70% of \nNETs.1\nThere are limited treatment options with current standard therapies for \nwell-differentiated aggressive grade 2 and grade 3 (Ki -67 index 15−55%) \nGEP-NETs; however, these may include somatostatin analogues; targeted \nradionuclide therapies (TRT); molecular targeted therapies (everolimus \nor sunitinib); chemotherapy; and cytoreductive procedures.2−4\nTRT, which uses radiolabeled somatostatin analogues to selectively target \nsomatostatin receptor expressing tumor cells, may stabilize disease and \ninduce objective tumor responses .5\nThe radiolabeled somatostatin analogue 177Lu-edotreotide has \ndemonstrated promising efficacy and a favorable safety profile. \nRetrospective data in metastatic GEP -NETs treated with two or more \n177Lu-edotreotide cycles demonstrated nearly 30 months progression \nfree survival (Figure 1).6Study Outcomes\nPrimary\n•Progression -free survival assessed every 12 weeks until \ndisease progression (RECIST v1.1) or death, whichever occurs \nearlier\nSecondary\n•Overall survival assessed up to 2 years after disease \nprogression\nResults\nCOM POSE recruitment commenced in September 2021 and \ncurrently includes 29 open sites in Australia, France, India, Italy, \nthe Netherlands, Spain, Sweden, the United Kingdom, and the \nUnited States. More sites and countries will follow.\nConclusion\nCOM POSE results are expected to inform about optimal \ntreatment options for patients with well differentiated \naggressive grade 2 and grade 3 SSTR+ GEP -NETs, including for \nfirst-line therapy.\nFigure 1.']",4.0,1.0,1.0,1.0,0,1.0,0.0,0.5,94
16E advanced RAG,What are the most important inclusion/exclusion criteria of the COMPOSE trial?,english,specific,study,claude-3-opus-20240229 advanced RAG,"According to the information provided in the posters, the main inclusion and exclusion criteria for the COMPOSE trial are:

Inclusion Criteria:
- Patients aged ≥18 years
- Histologically confirmed diagnosis of unresectable, well-differentiated (high grade 2 or grade 3) GEP-NETs 
- SSTR+ disease

Exclusion Criteria:
- Prior PRRT
- Any major surgery within 4 weeks prior to randomization
- Other known malignancies
- Renal, hepatic, cardiovascular, or hematological organ dysfunction, potentially interfering with the safety of the trial treatments","['Primary endpoint isprogression free survival, assessed every 12weeks until disease progression\n(RECIST v1.1)ordeath. Secondary outcomes include overall survival, assessed upto2years after\ndisease progression .\nCOMPOSE aims torandomize 202 patients 1:1toadefined number ofcycles of\n177Lu-edotreotide oranactive comparator .Asshown inFigure 2,patients willreceive either :\n•PRRT with n.c.a.177Lu-edotreotide consisting of six cycles (7.5GBq n.c.a.\n177Lu-edotreotide percycle), administered asintravenous infusion (101 patients) .\n•Either CAPTEM, everolimus ,orFOLFOX, aschosen bythestudy doctor and administered\naccording tolocal prescribing information (101 patients) .\nRecruitment commenced inSeptember 2021 with first patient screened inFrance.\nReferences\n1.Severi S,etal.Onco Targets Ther 2017; 10:551− 557;2.UriI&Grozinsky -Glasberg S.Clin\nDiabetes Endocrinol 2018; 4:16;3.Pavel M,etal.Ann Oncol 2020; 31:844− 860;4.Sonbol MB&\nHalfdanarson TR.Curr Treat Options Oncol 2019 ;20:74; 5.Baum R P, etal.Theranostics\n2016; 6:501- 510; 6.Strosberg J,etal.NEngl JMed 2017; 376: 125− 135.MAIN INCLUSION / EXCLUSION CRITERIA\nInclusion Criteria\n•Patients aged ≥18 years\n•Histologically confirmed diagnosis of unresectable, well-differentiated (high grade 2 or \ngrade 3) GEP- NETs \n•SSTR+ disease\nExclusion Criteria\n•Prior PRRT\n•Any major surgery within 4 weeks prior to randomization\n•Other known malignancies\n•Renal, hepatic, cardiovascular, or hematological organ dysfunction, potentially \ninterfering with the safety of the trial treatments\nFigure 2. Summary schedule of treatments and follow -up consultation Figure 1. PRRT mode ofaction\nContact information :  Jorge Hernando. Vall \nd´Hebron University Hospital, Barcelona. \njhernando@vhio.net', 'Method\nTrial Design\nCOM POSE (NCT04919226), a prospective, randomised , \ncontrolled, open -label, multi -center Phase III study, aims to \nextend therapeutic options for patients with well -differentiated \naggressive grade 2 and grade 3, somatostatin receptor -positive \n(SSTR+), GEP -NETs.\nCOM POSE evaluates efficacy, safety, and patient -reported \noutcomes of first -or second -line treatment with 177Lu-\nedotreotide TRT.\nPatients will be randomised 1:1 ( Figure 2 ) to:\n•Up to six cycles 177Lu-edotreotide (7.5 GBq per cycle), \nadministered as an intravenous infusion (at least 101 \npatients )at 6-to 8-week intervals or\n•Investigator’s choice of CAPTEM, FOLFOX or everolimus, \nadministered according to local prescribing information, \nuntil diagnosis of progression or end of study (at least 101 \npatients )\nCOMPOSE: Pivotal phase III trial for well -differentiated aggressive grade 2/grade 3 gastroenteropancreatic \nneuroendocrine tumors comparing 177Lu-edotreotide with best standard of care\nThorvardur R Halfdanarson ,1Daniel M Halperin,2Diane Reidy -Lagunes,3Grace Kong,4Jaume Capdevila,5Josh Mailman,6Ken Herrmann,7Rajaventhan Srirajaskanthan,8Simone Leyden,9Thomas Thevenet,10Philip Harris10\n1. Presenter: Mayo Clinic, Rochester, MN USA; 2. MD Anderson Cancer Center, Houston, TX, USA; 3. Memorial Sloan Kettering Cancer Center, Ne w York, NY USA; 4. Peter MacCallum Cancer Centre, Melbourne, VIC, Australia; 5. Vall d ´Hebron University Hospital, Vall d ´Hebron \nInstitute of Oncology, Barcelona, Spain; 6. NorCal CarciNET Community, Oakland, CA USA; 7. University Hospital Essen, Essen, Germany; 8. Kings College Hospital, London, UK; 9. NeuroEndocrine Cancer Australia, VIC, Australia; 10. ITM Oncologics GmbH, Gar ching/Munich, Germany\nIntroduction\nGastroenteropancreatic neuroendocrine tumors (GEP -NETs), which \nfrequently develop metastatic disease, represent an estimated 70% of \nNETs.1\nThere are limited treatment options with current standard therapies for \nwell-differentiated aggressive grade 2 and grade 3 (Ki -67 index 15−55%) \nGEP-NETs; however, these may include somatostatin analogues; targeted \nradionuclide therapies (TRT); molecular targeted therapies (everolimus \nor sunitinib); chemotherapy; and cytoreductive procedures.2−4\nTRT, which uses radiolabeled somatostatin analogues to selectively target \nsomatostatin receptor expressing tumor cells, may stabilize disease and \ninduce objective tumor responses .5\nThe radiolabeled somatostatin analogue 177Lu-edotreotide has \ndemonstrated promising efficacy and a favorable safety profile. \nRetrospective data in metastatic GEP -NETs treated with two or more \n177Lu-edotreotide cycles demonstrated nearly 30 months progression \nfree survival (Figure 1).6Study Outcomes\nPrimary\n•Progression -free survival assessed every 12 weeks until \ndisease progression (RECIST v1.1) or death, whichever occurs \nearlier\nSecondary\n•Overall survival assessed up to 2 years after disease \nprogression\nResults\nCOM POSE recruitment commenced in September 2021 and \ncurrently includes 29 open sites in Australia, France, India, Italy, \nthe Netherlands, Spain, Sweden, the United Kingdom, and the \nUnited States. More sites and countries will follow.\nConclusion\nCOM POSE results are expected to inform about optimal \ntreatment options for patients with well differentiated \naggressive grade 2 and grade 3 SSTR+ GEP -NETs, including for \nfirst-line therapy.\nFigure 1.', 'Trial design\nCOMPOSE is a prospective, randomised, controlled, \nopen -label, multi -center Phase III trial recruiting \npatients with well -differentiated aggressive grade 2 and \n3 (Ki -67 index 15−55%), SSTR+, GEP -NETs. \nCOMPOSE will evaluate efficacy, safety and patient -\nreported outcomes of 1st -or 2nd -line treatment with \n177Lu edotreotide PRRT compared to best standard of \ncare [investigator ´s choice of chemotherapy \n(capecitabine -temozolomide: CAPTEM or folinic acid, \nfluorouracil and oxaliplatin: FOLFOX) or everolimus] \n(Figure 2).\nCOMPOSE aims to randomize 202 patients 1:1 to a \ndefined number of cycles 177Lu-edotreotide or an active \ncomparator (Figure 2).COMPOSE: Pivotal phase III trial to compare 177Lu-edotreotide with best standard of care for \nwell -differentiated aggressive grade 2 and 3 gastroenteropancreatic neuroendocrine tumours \nHalfdanarson TR,1Halperin DM,2Reidy -Lagunes D,3Kong G,4Capdevila J,5Mailman J,6Herrmann K,7Srirajaskanthan R,8Leyden S,9Sierras C,10Harris P10\n1. Mayo Clinic, Rochester, MN USA; 2. MD Anderson Cancer Center, Houston, Texas, USA; 3. Memorial Sloan Kettering Cancer Cent er,New York, USA; 4. Peter MacCallum Cancer Centre, Melbourne, VIC, Australia; 5. Vall d ´Hebron University Hospital, Vall d ´Hebron Institute of \nOncology, Barcelona, Spain; 6. NorCal CarciNET Community, Oakland, CA; 7. University Hospital Essen, Germany; 8. Kings Colleg e Hospital, London, UK; 9. NeuroEndocrine Cancer Australia, Victoria, Australia; 10. ITM Oncologics GmbH, Garching/Munich, Germa ny\nBackground\nApproximately 70% of neuroendocrine tumours are \ngastroenteropancreatic (GEP -NETs). These frequently develop \nmetastatic disease with limited treatment options.1\nFor well -differentiated high grade 2 and 3 GEP -NETs, current \ntherapies include peptide receptor radionuclide therapy (PRRT), \nsomatostatin analogues, chemotherapy, cytoreduction and \nmolecular targeted therapies (everolimus, sunitinib) with no \nspecified use sequence. \nPRRT uses radiolabelled somatostatin analogues to selectively \ntarget somatostatin receptor expressing (SSTR+) tumour cells. \nUse may stabilise disease and induce objective tumour \nresponse.2\n177Lu edotreotide is an innovative radiolabelled somatostatin \nanalogue with promising efficacy and a favourable safety \nprofile.2,3Retrospective data in metastatic GEP -NETs treated \nwith ≥2 cycles of 177Lu-edotreotide demonstrate progression \nfree survival (PFS) of ≥30 months (Figure 1).3\nThe Phase III COMPETE trial , which has completed patient \nrecruitment, is comparing 177Lu edotreotide efficacy/safety \nversus everolimus in grade 1 and 2 GEP -NETs.4References\n1. Severi S, et al. Onco Targets Ther 2017;10:551−557; \n2. Strosberg J, et al. N Engl J Med 2017;376:125−135; 3. Baum RP , \net al. Theranostics 2016;6:501 -510. 4.']",4.0,1.0,1.0,1.0,0,1.0,0.0,0.5,79
17G advanced RAG,Welche radiopharmazeitische Medikamente sind von der FDA zugelassen?,german,specific,medication,claude-3-opus-20240229 advanced RAG,"Basierend auf den gegebenen Informationen sind folgende radiopharmazeutische Medikamente von der FDA zugelassen:

1. 223RaCl2 (Radium-223-Dichlorid): 2013 von der FDA zugelassen für Patienten mit kastrationsresistentem Prostatakarzinom mit symptomatischen Knochenmetastasen und ohne bekannte viszerale Metastasen (Burkett et al., 2023).

2. 177Lu-DOTATATE (Lutetium-177-DOTATATE): 2018 von der FDA zugelassen für die Behandlung von neuroendokrinen Tumoren (Burkett et al., 2023).

3. 131I (Iod-131): Wird seit langem für die Behandlung von gutartigen und bösartigen Schilddrüsenerkrankungen eingesetzt, wie Hyperthyreose und Schilddrüsenkrebs (Akgun et al., 2021).","['Radiology: Imaging Cancer Volume 5: Number 4—2023 ■ radiology-ic.rsna.org 5\nBurkett et alapproval of multiple radionuclide therapies indicates that \nthis is an area with momentum toward growing clinical \nadoption, which has found success in the setting of multiple \ntypes of malignancies.\n223RaCl2 Therapy\nIn 2013, 223RaCl2 became the first α particle–emitting radio-\npharmaceutical to be granted FDA approval for clinical use \nand was indicated for patients with castration-resistant pros-\ntate cancer with symptomatic bone metastases and no known \nvisceral metastatic disease (19). 223RaCl2 is a calcium analog \nthat binds avidly to bone matrix with high bone turnover and \nosteoblastic activity. The naked, unstable radionuclide incor-\nporates into the extracellular environment, and the α particle \nemission in the tumor microenvironment suppresses abnormal \nbone formation and induces cell death (20). The phase 3 AL-\nSYMPCA (or, ΑLpharadin in SYMPtomatic Prostate CAncer) \ntrial demonstrated that 223RaCl2 was well tolerated and im-\nproved median overall survival to 14.9 months in the treat-\nment arm versus 11.3 months in the placebo arm (30% risk \nreduction; hazard ratio, 0.70 [95% CI: 0.58, 0.83]; P < .001); \nit also improved the median time to first symptomatic skeletal \nevent to 15.6 months in the radium arm versus 9.8 months in \nthe placebo arm (34% risk reduction; hazard ratio, 0.66 [95% \nCI: 0.52, 0.83]; P < .001) (19).\nSomatostatin Receptor–targeted Radionuclide Therapy\nSomatostatin receptors (SSR), particularly SSR2a, expressing \nneuroendocrine tumors (NETs) of the pancreas and midgut \ncan be imaged with gallium 68 (68Ga) DOTA peptides (DOT -\nATATE [tetraazacyclododecane tetraacetic acid octreotate], \nDOTANOC [tetraazacyclododecane tetraacetic acid sodium \ntriiodide octreotide], and DOTATOC [tetraazacyclododecane \ntetraacetic acid D-phenylalanine 1 tyrosine 3 octreotide]), in-\ndium 111 (111In) octreotide, or 99 mTc-octreotide and treated \nwith 177Lu-DOTA-peptides or yttrium 99 octreotate (21) as a \ntheranostic pair. The pivotal Neuroendocrine T umors Therapy \n(NETTER)–1 phase 3 trial of 177Lu-DOTATATE in patients \nwith advanced midgut NETs demonstrated increased progres-\nsion-free survival at 20 months of 65.2% versus 10.8% in the \ncontrol, as well as a significantly increased tumor response \nrate with 177Lu-DOTATATE (22). In 2018, FDA approval of \n177Lu-DOTATATE for NETs represented a major addition to \nthe treatment options for patients with these tumors (21). Sub-\nsequently, the NETTER-1 trial did not demonstrate a statisti-\ncally significant increase in overall survival at 5 years, compli-\ncated by high crossover within the randomized control group \n(36% of the controls subsequently received SSR-coupled ra-\ndionuclide therapy) (23). Further research and innovation in \nradionuclide therapy are merited for patients with advanced \nmidgut NETs.\nEmerging SSR-targeted radionuclide therapies are under in-\nvestigation. A recent phase 2 clinical trial investigated the use of \nan SSR-targeted α -particle therapy using actinium 225 (225Ac) \nDOTATATE, demonstrating promising response and progres-\nsion-free survival outcomes for gastroenteropancreatic NETs. thyroid remnant (the minimum required for adequate ablation), \nallowing the calculation of a personally optimized dose (12,13).', '95\nFABAD J. Pharm. Sci., 46, 1, 93-104, 20211.1. Diagnosis of Diseases with Radiopharma-\nceuticals\nRadiopharmaceuticals that emit gamma rays are \nused in nuclear medicine to diagnose disease and \ndetermine the condition and function of specific tis-sue and organ (Gundogdu et al., 2018). There are two standard methods to diagnose the disease with radio-pharmaceuticals:\nNon-image diagnostic applications: The radiophar -\nmaceutical is reached to the desired organ/tissue, and radioactivity is counted from outside. The radioac-tivity calculation in the organ can be calculated with the Medical Internal Radiation Dose (MIRD), and the body surface area can be calculated using Monte Carlo methods (Kovan, 2016).\nImage diagnostic applications: The radiopharma-\nceutical is reached to desired organ/tissue and the or -\ngan/tissue is imaged by various imaging systems such as gamma cameras, single-photon emission computed tomography (SPECT), Positron Emission Tomogra-phy (PET), SPECT/CT, and PET/CT hybrid systems  (Gundogdu et al., 2018).\n1.2. Treatment of Diseases with Radiopharma-\nceuticals\nRadiopharmaceuticals that emit alpha and beta \nrays are administered in many nuclear medicine treat-ment studies. The radiopharmaceuticals are given to the patient and kept in the target tissue/organ. They destroy diseased tissue and provide the treatment. In this way, near/healthy tissues are exposed to dose as low as possible and targeted therapy occurs (Kovan, 2016; Sivri et al., 2004). The properties of the radionu-clides used for radionuclide therapy are given in Table 3. Elemental, metabolic, pharmaceutical agents, an-tibodies, bone imaging chelates, bioreducing agents, labeled cells, liposomes, microspheres, nanoparticles and niosomes are radiolabeled with radionuclides suitable for the treatment of diseases. These have some advantages:\n•\t They\tare\tnon-invasive\ttreatment,•\t They\t show\tmedium\t and\tlong-term\t low\tside\tef-fects,\n•\t These\t agents\tare\tuseful\tbecause\tthey\tcan\tbe\ttarget-\ned.\n•\t The\tdose\tin\tnormal\ttissue\tis\tlow\tbecause\tthese\t\nagents can be absorbed in desired tissues (Sivri et \nal., 2004).\nThere are many radiopharmaceuticals that are \nused in the treatment of some diseases. The samples of \nradiopharmaceuticals are summarized below. \nClassification of Treatments Using Radiopharma-\nceutics:\n1. Radioactive iodine therapy in thyroid diseases2. Radiopharmaceutical treatment in metastatic \nbone pain\n3. Radionuclidic therapy in neuroendocrine tu-\nmors\n4. Treatment with labeled antibody5. Intra-cavitary radiocolloid therapy6. Radiation synovectomy7. Radionuclidic therapy in myeloproliferative dis-\neases\n8. Intra-arterial radionuclide therapy by radiola-\nbeled microspheres\n 1.2.1 Iodine-131 Treatment in Thyroid Diseases\nThe treatment of benign and malignant diseases \nof the thyroid can be done with Iodine-131 (I-131). \nRadioiodine therapy has been used for a long time. In treating diseases such as hyperthyroidism, I-131 ra-dionuclide settles in the thyroid tissue. It destroys the follicle cells with the beta particles it emits and stops the growth and activities of the thyroid cells. In this case, it returns the functions of the overactive thyroid gland to normal (Mumtaz et al., 2009).  In malignant diseases such as thyroid cancer, radioactive iodine therapy can also be applied to remove residual thyroid gland residues after thyroid surgery and treatment of the spread of thyroid cancers in the body. Since the dose of radioactive iodine preferred in the treatment of thyroid cancers is higher than the iodine dose in the treatment of hyperthyroidism, the patient should sleep in a room specially prepared for radioiodine', 'RG • Volume 40  Number 6  Gomes Marin et al  1719\n131I. The following iodine isotopes may be used as \ntheranostic agents (12,14):\n131I is a dual ( β- and γ-ray) emitting isotope with \na low cost and long half-life (~8 days) that is used \nfor therapy and whole-body diagnostic scanning to \nidentify remnant thyroid tissue or metastatic thy -\nroid cancer. However, it is not an ideal diagnostic \nagent owing to its γ-ray emission pattern and long \nhalf-life, which result in poor image quality and a \nrelatively high patient radiation dose.\n123I, a purely γ-ray emitter, has a more optimal \nphysical profile than 131I for diagnostic purposes \nin that it yields better image quality and involves \na lower radiation burden. Thus, this isotope is \nalso well suited for use in more recent approaches \nsuch as tomographic (SPECT) and hybrid imag-\ning in conjunction with CT (SPECT/CT). For \nthese reasons, despite its higher cost compared \nwith 131I, 123I is the most used iodine radioisotope \nfor diagnostic scintigraphy in the United States.\nIodine 124 (124I), a promising diagnostic agent, \nis a positron emitter and is therefore used in PET. \nIt is less frequently used clinically owing to its \neven higher production cost and lack of wide-\nspread availability.\nIn terms of therapeutic applications, radio-\niodine therapy with 131I remains the modality of \nchoice for treating patients with differentiated \nthyroid cancer in the postoperative setting. 131I \ntherapy can be performed by using different pro-\ntocols for different purposes, taking into account \nfactors such as initial extent of disease, surgical \nspecimen characteristics, histologic subtype, im-\naging findings, and biochemical changes, which ultimately determine the risk of disease recur-\nrence. The applications for 131I therapy, which \nmay be superimposed in the same patient, consist \nof ablation of residual normal tissue, adjuvant \ntreatment of occult disease, and treatment of \nknown local-regional or, especially, metastatic \ndisease. Posttreatment images can be acquired in \naddition to pretreatment images, which, owing to \nthe higher activity of 131I used in therapy, provide \nhigher sensitivity in the assessment of metastatic \nlesions and overall staging, particularly in cases \nof small metastatic lesions such as micronodular \nlung metastases (15). The example case in Figure \n5 illustrates the difference between pre- and post-\ntreatment images (15–17).\n131I-MIBG for Neural Crest–derived \nTumors\nRationale and Clinical Aspects.— The molecular \nanalog of norepinephrine, MIBG labeled with 131I \n(131I-MIBG), is another classic theranostic agent \nthat is suitable for gamma  camera and SPECT \nimaging, and it has been used in clinical settings \nsince 1981. 131I-MIBG enters the neuroendocrine \ncells of the sympathetic nervous system by means \nof endocytosis or diffusion and remains stored \nin neurosecretory vesicles. It has high sensitivity \n(>90%) and specificity (>95%) for the detec-\ntion of neural crest–derived (neuroectodermic) \ntumors and their secondary lesions (particularly \nin neuroblastoma, pheochromocytoma, and \nparaganglioma), complementing conventional \nimaging and indicating which tumors may benefit \nfrom radioisotopic therapy (12,18).\nLike radioiodine, 123I-MIBG facilitates better \nimaging and is suitable for SPECT and SPECT/\nCT, but at a higher cost. Recent improvements \nin SPECT/CT techniques include the use of 124I-\nMIBG for PET, which yields higher spatial reso-\nlution and accuracy. Both 123I-MIBG and 124I-\nMIBG are limited to use for diagnostic purposes \nonly, serving as imaging tracers, while 131I-MIBG \nis predominately used for therapeutics (19).']",1.0,1.0,1.0,1.0,0,1.0,0.0,0.5,79
17E advanced RAG,Which radiopharmaceutical drugs are approved by the FDA?,english,specific,medication,claude-3-opus-20240229 advanced RAG,"Based on the provided context, the following radiopharmaceutical drugs are mentioned as being approved by the FDA:

1. 223RaCl2 (Radium-223 dichloride) was granted FDA approval in 2013 for patients with castration-resistant prostate cancer with symptomatic bone metastases and no known visceral metastatic disease [1].

2. 177Lu-DOTATATE received FDA approval in 2018 for neuroendocrine tumors (NETs) [1].

3. Iobenguane I-131 (131I-mIBG), a radioiodinated small-molecule, was recently approved by the FDA for the treatment of adult and pediatric patients aged 12 years or older with unresectable metastatic pheochromocytoma or paraganglioma [2].

References:
[1] Burkett et al. (2023)
[2] Sgouros et al. (2020)","['Radiology: Imaging Cancer Volume 5: Number 4—2023 ■ radiology-ic.rsna.org 5\nBurkett et alapproval of multiple radionuclide therapies indicates that \nthis is an area with momentum toward growing clinical \nadoption, which has found success in the setting of multiple \ntypes of malignancies.\n223RaCl2 Therapy\nIn 2013, 223RaCl2 became the first α particle–emitting radio-\npharmaceutical to be granted FDA approval for clinical use \nand was indicated for patients with castration-resistant pros-\ntate cancer with symptomatic bone metastases and no known \nvisceral metastatic disease (19). 223RaCl2 is a calcium analog \nthat binds avidly to bone matrix with high bone turnover and \nosteoblastic activity. The naked, unstable radionuclide incor-\nporates into the extracellular environment, and the α particle \nemission in the tumor microenvironment suppresses abnormal \nbone formation and induces cell death (20). The phase 3 AL-\nSYMPCA (or, ΑLpharadin in SYMPtomatic Prostate CAncer) \ntrial demonstrated that 223RaCl2 was well tolerated and im-\nproved median overall survival to 14.9 months in the treat-\nment arm versus 11.3 months in the placebo arm (30% risk \nreduction; hazard ratio, 0.70 [95% CI: 0.58, 0.83]; P < .001); \nit also improved the median time to first symptomatic skeletal \nevent to 15.6 months in the radium arm versus 9.8 months in \nthe placebo arm (34% risk reduction; hazard ratio, 0.66 [95% \nCI: 0.52, 0.83]; P < .001) (19).\nSomatostatin Receptor–targeted Radionuclide Therapy\nSomatostatin receptors (SSR), particularly SSR2a, expressing \nneuroendocrine tumors (NETs) of the pancreas and midgut \ncan be imaged with gallium 68 (68Ga) DOTA peptides (DOT -\nATATE [tetraazacyclododecane tetraacetic acid octreotate], \nDOTANOC [tetraazacyclododecane tetraacetic acid sodium \ntriiodide octreotide], and DOTATOC [tetraazacyclododecane \ntetraacetic acid D-phenylalanine 1 tyrosine 3 octreotide]), in-\ndium 111 (111In) octreotide, or 99 mTc-octreotide and treated \nwith 177Lu-DOTA-peptides or yttrium 99 octreotate (21) as a \ntheranostic pair. The pivotal Neuroendocrine T umors Therapy \n(NETTER)–1 phase 3 trial of 177Lu-DOTATATE in patients \nwith advanced midgut NETs demonstrated increased progres-\nsion-free survival at 20 months of 65.2% versus 10.8% in the \ncontrol, as well as a significantly increased tumor response \nrate with 177Lu-DOTATATE (22). In 2018, FDA approval of \n177Lu-DOTATATE for NETs represented a major addition to \nthe treatment options for patients with these tumors (21). Sub-\nsequently, the NETTER-1 trial did not demonstrate a statisti-\ncally significant increase in overall survival at 5 years, compli-\ncated by high crossover within the randomized control group \n(36% of the controls subsequently received SSR-coupled ra-\ndionuclide therapy) (23). Further research and innovation in \nradionuclide therapy are merited for patients with advanced \nmidgut NETs.\nEmerging SSR-targeted radionuclide therapies are under in-\nvestigation. A recent phase 2 clinical trial investigated the use of \nan SSR-targeted α -particle therapy using actinium 225 (225Ac) \nDOTATATE, demonstrating promising response and progres-\nsion-free survival outcomes for gastroenteropancreatic NETs. thyroid remnant (the minimum required for adequate ablation), \nallowing the calculation of a personally optimized dose (12,13).', 'trial of this agent against osteosarcoma has been listed \n(NCT03612466) but is not yet recruiting.\nSmall- molecule RPT\n[131I]mIBG. The success of iodide-131 in targeting and \ntreating thyroid disorders and carcinomas encouraged \nthe expansion of its use in a variety of cancers through \nits incorporation into targeting vectors. For example, iobenguane I-131 is the radioiodinated small- molecule \nmeta - iodobenzylguanidine ([\n131I]mIBG), an analogue of  \nthe adrenergic neutrotransmitter noradrenaline that \nis used to treat patients with neuroblastomas140– 142. \nIodide-131 can be introduced to targeting vectors as a highly reactive electrophilic iodine compound, allowing \nrapid iodination of molecules containing activated aro-matic groups, or through displacement by nucleophilic attack of the radioiodide\n143. mIBG radiolabelled with \nhigh- specific- activity iodine-131 was recently approved \nby the FDA for the treatment of adult and paediatric patients aged 12 years or older with unresectable meta-static phaeochromocytoma or paraganglioma. No FDA-  \napproved therapy was available for these conditions \nbefore approval of this agent. Use of this agent requires \na positive mIBG imaging scan, standard, weight- based \ntherapeutic dosing and the application of a process for individualized dosimetry using a pretreatment tracer \nstudy to calculate absorbed doses for normal organs. \nNormal organ dosimetry is used to adjust the activity administered so that the organ doses are below speci-fied threshold levels. FDA approval of this agent was \nbased on the substantial pre- existing experience with \n[\n131I]mIBG144– 151 and on a recent phase I study which \nyielded 1-  year and 2-  year overall survival of 85.7% and \n61.9%, respectively, in 21 patients treated with the maxi-\nmum tolerated dose152. Clinical trials using this agent are \nongoing (NCT03561259 and NCT02378428).\nPSMA and folate receptor ligands. The past decade has \nseen increasing use of small- molecule radiotherapeutics \ntargeting receptors such as PSMA receptor and folate \nreceptor (FR). Small- molecule PSMA inhibitors have \nbeen modified to deliver radiotherapeutic nuclides in \nprostate cancer as well as other cancers owing to the expression of PSMA on the neovasculature of tumours. \nPSMA inhibitors are designed to mimic its substrates, \nγ- glutamyl folic acid derivatives and the neuropeptide \nN- acetylaspartylglutamate\n153,154. These small- molecule \nRPT agents are either urea- based inhibitors (for \nexample, 177Lu- labelled PSMA- R2 and 177Lu- labelled  \nPSMA-617)155– 162 or phosphoramidate- based inhibitors \n(for example, 177Lu- labelled CTT-1403) modified to \ndeliver therapeutic radionuclides163– 165. The urea and \nphosphoramidate functionalities interact with zinc(ii) \nlocated in the PSMA active site; in addition, these small \nmolecules are designed to interact with the S1 glutamate pocket as well as the entrance funnel of PSMA \n(fIG.4a,b) . \nThe entrance funnel allows a wide variation of modi -\nfications to present a pendant group or a chelator for radiolabelling with therapeutic and imaging radio-nuclides. All three agents are currently in clinical trials: NCT03490838, NCT03511664 and NCT03822871, \nrespectively \n(TAbLe\xa0 2).177Lu- labelled PSMA-617 is currently in a multicentre \n(84 sites), phase III randomized trial (VISION). In a pre-vious prospective single- centre phase II trial in men with \nmetastatic castration- resistant prostate cancer in whom \nstandard therapies had failed, patients who showed \nhigh expression of the PSMA target by (\n68Ga- labelled \nPSMA-11) PET yielded favourable responses; patients \nwith high [18F]fluorodeoxyglucose (FDG) uptake in \nlow- PSMA- uptake lesions were excluded.', '94\nAkgün, Özgenç, GündoğduINTRODUCTION\nRadiation is the condition of atoms breaking down \nspontaneously by emitting energy to make them more \nstable. The heavy nucleus of atoms is unstable because of their high energy amount and try to become stable \nto abandon this situation. This situation is called ra-\ndioactivity or radioactive degradation (Asikoglu et al., \n2017). Radioactivity is substantial in radiopharmacy \nstudies. Radiopharmacy is a significant part of phar -\nmacy, concerned with the preparation, distribution, and administration of radioactive drugs. The develop-ment of radiopharmacy has also been begun with the discovery of radiation (Asikoglu et al., 2017; Kovan, 2016; Ozer, 2004).\nRadiopharmaceuticals are drugs and used for the \ndiagnosis and treatment of diseases (Silindir Gunay, \n2020). They can be administered to patients safely. In nuclear medicine applications, 95% of radiopharma-ceuticals are used for diagnosis, and 5% for treatment. \nThe radiopharmaceuticals used in diagnosis emit \ngamma (γ)-ray, and the radiopharmaceuticals used \nin treatment emit alpha (α) and beta (ß) particles \n(Asikoglu et al., 2017; Henkin et al., 2006). The main features of radiopharmaceuticals used in diagnosis or treatment are shown in Table 1.\nTable 1. The features of radiopharmaceuticals used in diagnosis or treatment (Asikoglu et al., 2017).\nDiagnosis Treatment\nRadioisotopes These should emit γ and β+ rays These should emit α and ß- rays\nEnergy 150 KeV on average Medium/high energy (>1MeV)\nEffective half life 1,5 x test time Hour/day\nLocalization High in the target organ High in the target organ\nRadiation dose Low dose, high efficiency Effective dose\nFinding Easy and cheap Easy and cheap\nQuality control Easy Easy\nNuclear medicine is an area of medicine and has \na significant role in the diagnosis, and treatment of \nmany diseases. With nuclear medicine imaging stud-ies, medical problems can be identified at an early stage and treatment can also be provided using ra-diopharmaceuticals. In nuclear medicine, radiophar -maceuticals show therapeutic efficiency by destroying the target cells in the tissue with radiation  (Kovan, 2016; Sivri et al., 2004).  Radiopharmaceuticals used for diagnosis and treatment in nuclear medicine are shown in Table 2.\nTable 2. Radiopharmaceuticals for diagnostic and therapeutic applications (Asikoglu et al., 2017; Y ordanova et al., 2017).\nDiagnosis of Diseases with Radiopharmaceuticals Treatment of Diseases with Radiopharmaceuticals\nSodium Fluoride (18F) Solution for Injection I-131\n(18F)-Fluoro-2-Deoxy-D-Glucose (18F) FDG) Solution for Injection Phosphorus-32 (P-32), \n(18F) Florotimidin Çözeltisi . Strontium Chloride (Sr-89),\n68Ga-PSMA Rhenium Diphosphonate (Re-186)\n68Ga-DOTATATE Smarium-153 (Sa-153),\nRadiopharmaceuticals prepared with technetium-99m Tin-117m (Sn-117m)\nXenon-133 Lu-177 Dotatate\nThallium-201 Chloride I-131-tositumomab\nIodine-131 sodium iodide Yttrium-90 (Y-90)-ibritumomab tiuxetan\nIndium-111 labeled leukocytes I-131-metaiodobenzylguanidine (MIBG)\nIndium-111 octreskan Erbium citrate colloid (Er169)']",1.0,1.0,1.0,1.0,1,1.0,0.0,0.5,100
18G advanced RAG,In welcher Indikationen werden zur Zeit PSMA-targeting Radiopharmazeutika entwickelt?,german,specific,medication,claude-3-opus-20240229 advanced RAG,"Basierend auf den gegebenen Informationen werden PSMA-targeting Radiopharmazeutika derzeit für folgende Indikationen entwickelt:

1. Bildgebung von metastasiertem Prostatakrebs mittels PET und SPECT, z.B. mit 68Ga-PSMA-11, 18F-DCFPyL, 99mTc-MIP-1404 und anderen Tracern [1].

2. Zielgerichtete Radiotherapie von metastasiertem kastrationsresistentem Prostatakrebs (mCRPC) mit beta-strahlenden Radionukliden wie Lutetium-177 (177Lu) und alpha-strahlenden Radionukliden wie Actinium-225 (225Ac), konjugiert an kleine Moleküle wie PSMA-617 oder Antikörper wie J591 [1,2].

3. Metastasen-gerichtete Therapie (MDT) wie stereotaktische Bestrahlung (SABR) von oligometastatischem Prostatakrebs, wobei die PSMA-PET/CT zur Lokalisierung der Metastasen genutzt wird [2].

Die Entwicklung zielt darauf ab, die Überlebenszeit von Patienten mit fortgeschrittenem Prostatakrebs zu verlängern und Nebenwirkungen im Vergleich zu konventionellen Therapien zu reduzieren.","['68Ga-PSMA-11 [129] and 18F-DCFPyL \n[130] recently received FDA approval and are marketed as Ga68 \nPSMA-11 and Pylarifly ®, respectively. Both 68Ga-PSMA-11 and \n18F-DCFPyL are cleared renally, leading to high bladder accumulation. \nAs this can be disadvantageous for imaging metastases proximal to the \nprostate gland [131] , new alternatives with more favorable clearance \nprofiles are in various stages of clinical evaluation, including \n18F-PSMA-1007 [132,133], 18F-CTT1057 [131] , and 18F-JK-PSMA-7 \n[134,135]. Numerous single photon computed tomography (SPECT) \nagents for detecting prostate cancer by planar imaging have been \ndeveloped in parallel to these PET agents. Among the SPECT agents to \nundergo preliminary clinical evaluation are 99mTc-MIP-1404 [83], \n99mTc-MIP-1427 [136] , 99mTc-PSMA-T4 [137] , 99mTc-PSMA-I &S [138] \nand 99mTc-EDDA/HYNIC-iPSMA [139] . As an alternative strategy, \nradiohybrid PSMA ligands incorporating fluorine-18/fluorine-19 and \nmacrocyclic radiometal chelators have been developed as theranostic \nagents that exploit the superior imaging properties of fluorine-18 [140] . Among this new class of compounds, 18F-rhPSMA-7.3 has undergone \npreliminary clinical evaluation and is under FDA review [141] . \nClinically advanced theranostic PSMA ligands \nThe first generation of PSMA-targeting agents were antibodies con-\njugated to radiometals for imaging or therapy. The 111In-labeled \nmonoclonal antibody 7E11-C5.3 [142] (marketed as ProstaScint ®) \nprovided early validation of this PSMA targeted theranostic approach in \nadvanced prostate cancer. Nevertheless, despite uptake in primary dis-\nease and metastatic lesions [142] , 7E11-C5.3 targets an intracellular \nepitope on PSMA [89], restricting its ability to bind viable cells. Sub-\nsequent development of J591, a humanized monoclonal antibody \nagainst the external domain of PSMA, stimulated renewed clinical \ninvestigation into PSMA-targeted imaging and therapy of progressive \ndisease [143] . J591 has undergone evaluation in men with metastatic \ncastration-resistant prostate cancer (mCRPC) as an 111In-DOTA conju -\ngate for SPECT imaging [144] , an 89Zr-DFO conjugate for PET imaging \n[145] , 90Y- [146] and 177Lu-DOTA [147] conjugates for targeted \nb-particle therapy, and an 225Ac-DOTA conjugate for targeted α-particle \ntherapy [148] . Phase II clinical trials with 177Lu-J591 have been \ncompleted, in which the response rate in treated patients, defined as ≥\n50% decrease in PSA, is 11% [147] . As a result of a circulation half-life \nin excess of 1 day [144] , hematological toxicity is dose limiting [146] . \nOngoing Phase I clinical trials with 225Ac-J591 highlight response even \nin patients with prior 177Lu-J591 PSMA-targeted radiotherapy, with no \nnon-hematological grade 3/4 adverse events [149] . \nSmall molecule alternatives to J591 have proliferated following the \nidentification of a high affinity heterodimeric urea pharmacophore for \nPSMA binding [150] . The chemical structures of leading examples of \nsmall molecule PSMA inhibitors are depicted in Fig. 3. In comparison to \nmonoclonal antibodies, small molecules are excreted more rapidly, \nthereby reducing the likelihood of hematological toxicity. The majority \nof ligands to reach clinical trials incorporate a glutamate-urea-lysine \n(EuK) moiety for PSMA targeting.', 'For instance, a study of MEDI3726\n(a PSMA-targeted antibody–drug conjugate) in patients with mCRPC after failure of abiraterone or\nenzalumatide observed significant responses at higher doses of MEDI3726, although responses were not\ndurable because patients discontinued therapy due to drug-related adverse events [ 53]. Small-molecule\nPSMA inhibitors have been labeled with both beta- and alpha-emitting radioisotopes, which have variable\nenergy levels and path lengths. Beta-emitting radioisotopes, such as lutetium-177 (177Lu), are the favored\nradioisotopes given their short maximal tissue penetration and relatively long half-life, permitting delivery\nof a high degree of radiation to PCa lesions. Advantages of alpha-emitting radioisotopes include reduced\nred-marrow infiltration, leading to less hematotoxicity . In a proof-of-concept paper, application of the\nalpha-emitting225actinium (225Ac) to two patients with diffuse bone marrow involvement led to undetectable\nPSA levels in both patients and no relevant hematotoxicity [54].\nAmong alpha-emitting radioisotopes, preliminary investigations of225Ac-PSMA-617 suggest that\nit has substantial therapeutic e ﬃcacy for mCRPC. In a study of 17 chemotherapy-naive patients with\nadvanced metastatic PCa treated with225Ac-PSMA-617, 82% of patients had a PSA decline of ≥90%,\nand 41% of patients had undetectable serum PSA 12 months after therapy [ 55]. Targeted alpha-therapy', 'Cancers 2020 ,12, 1367 6 of 14\nImproved localization of metastatic PCa using PSMA-targeted imaging may also increase the\nsuccess rate of metastasis-directed therapy (MDT), including stereotactic body radiotherapy (SABR).\nMDT intends to postpone systemic treatment for patients with oligometastatic disease, thereby\nreducing the side-e ﬀects of hormonal therapy. Prospective data suggest that SABR is well tolerated\nand improves PFS in patients with oligometastatic PCa [ 50]. In the randomized STOMP study, which\nused choline PET /CT, stereotactic ablation of oligometastatic disease in 62 patients delayed the need\nfor hormonal therapy from 13 to 21 months compared with surveillance [ 51]. Data from ORIOLE, a\nsimilar randomized Phase II study investigating the e ﬃcacy of SABR in forestalling metastases for\nhormone-sensitive PCa compared with observation, provide evidence for the value of PSMA PET /CT\nin controlling disease [ 52]. Patients randomized to the SABR arm of ORIOLE underwent18F-DCFPyl\nPET/CT, a urea-based PSMA radiotracer, prior to and 180 days after treatment. Patients with no\nadditional untreated lesions detected by PSMA PET /CT at baseline were signiﬁcantly less likely to\ndevelop new metastatic lesions at six months than those whose PSMA PET /CT showed at least one\nadditional lesion at baseline (16% vs. 63%, respectively).\nCurrently, the only PSMA-targeted imaging agent approved by the U.S. Food and Drug\nAdministration is111In-capromab pendetide (ProstaScint), which is approved for SPECT imaging of\nbiopsy-proven PCa localized to the prostatic bed but at high risk for pelvic LNM. Regulatory approval\nof PSMA radiotracers in the United States has lagged behind other areas of the world, such as Europe\nand Australia, where much of the innovation in PSMA theranostics has occurred. Given the growing\nevidence of the clinical potential of PSMA, its availability is expanding in the United States, and\nregulatory approval of novel radiotracers, including68Ga-PSMA-11 and18F-DCFPyl, is expected within\nthe next year. Ongoing clinical trials will help to better deﬁne the clinical role and impact of PSMA\nimaging and possibly strengthen the case for regulatory approval (Table 1). In sum, PSMA-targeted\nimaging has demonstrated clinical beneﬁts through targeting stereotactic ablation in oligometastatic\ndisease, but no studies have yet shown that PSMA-targeted imaging improves clinical outcomes for\nbiochemically recurrent PCa patients.\n4. PSMA Radioligand Therapy (RLT)\nPSMA has also emerged as a promising therapeutic molecular target. Although various therapies are\nnow approved for mCRPC, their survival benefit is generally limited to less than 6 months. There is thus a\nclinical need for novel therapies leading to a sustained response. Progress in the development of synthetic\nPSMA radioligands has led to an emerging body of research indicating significant therapeutic efficacy of\nPSMA RLT.\nPSMA RLT studies have mostly utilized small-molecule inhibitors of PSMA as radioligands, which\nhave been shown to be less hematotoxic than monoclonal antibodies. For instance, a study of MEDI3726\n(a PSMA-targeted antibody–drug conjugate) in patients with mCRPC after failure of abiraterone or\nenzalumatide observed significant responses at higher doses of MEDI3726, although responses were not\ndurable because patients discontinued therapy due to drug-related adverse events [ 53]. Small-molecule\nPSMA inhibitors have been labeled with both beta- and alpha-emitting radioisotopes, which have variable\nenergy levels and path lengths. Beta-emitting radioisotopes, such as lutetium-177 (177Lu), are the favored\nradioisotopes given their short maximal tissue penetration and relatively long half-life, permitting delivery\nof a high degree of radiation to PCa lesions. Advantages of alpha-emitting radioisotopes include reduced\nred-marrow infiltration, leading to less hematotoxicity .']",3.0,1.0,1.0,1.0,0,1.0,0.0,0.5,106
18E advanced RAG,In which indications are PSMA-targeting radiopharmaceuticals currently being developed?,english,specific,medication,claude-3-opus-20240229 advanced RAG,"Based on the provided context, PSMA-targeting radiopharmaceuticals are currently being developed in the following indications:

1. High risk localized or locoregional advanced prostate cancer: The UpTheP trial is evaluating neoadjuvant 177Lu-PSMA-617 followed by radical prostatectomy and pelvic lymph node dissection in patients with PSMA-avid disease [1].

2. Oligometastatic hormone-sensitive prostate cancer (HSPC): The Bullseye trial is testing 177Lu-PSMA-I&T in patients with PSMA-avid disease with five or less metastatic lesions [1]. 

3. Newly-diagnosed high volume metastatic HSPC: The UpFrontPSMA trial is comparing the efficacy of 177Lu-PSMA-617 followed by docetaxel chemotherapy versus docetaxel alone in patients with PSMA-avid visceral metastases or ≥4 PSMA-avid bone lesions [1].

4. Metastatic castration-resistant prostate cancer (mCRPC): The ARROW trial is evaluating 131I-MIP-1095 in combination with enzalutamide in patients with PSMA-avid mCRPC who have progressed on abiraterone [1]. A phase 1/2 dose escalation study of 177Lu-PSMA-R2 is also being conducted in patients with PSMA-avid mCRPC [1].","['Cancers 2021 ,13, 4023 9 of 17\nis an Australian open label, phase I/II non-randomized study evaluating neoadjuvant\n177Lu-PSMA-617 (one or two cycles) followed by radical prostatectomy + pelvic lymph\nnode dissection in patients with high risk localized or locoregional advanced prostate\ncancer and PSMA-avid disease. Accrual for this study has begun with estimated primary\ncompletion date in August of 2022.\nThe Bullseye trial (NCT04443062) is a Dutch randomized, open label, multi-center,\nphase 2 study testing177Lu-PSMA-I&T in oligometastatic HSPC. Patients with PSMA-avid\ndisease with ﬁve or less metastatic lesions are randomized to either two cycles of177Lu-\nPSMA-I&T given six weeks apart vs. standard of care. The estimated enrollment size is\n58 patients with estimated primary completion in January 2023. The important clinical\nrationale of this study is that many patients with oligometastatic prostate cancer do not\nqualify for local MDT treatment such as surgery or EBRT due to tumor location or prior\ntherapy, in which targeted radioligand therapy for these lesions maybe beneﬁcial.\nUpFrontPSMA (NCT04343885) is an Australian phase 2 randomized clinical trial\ncomparing the efﬁcacy of two cycles177Lu-PSMA-617 given every six weeks followed by\ndocetaxel chemotherapy every three weeks for six cycles, versus docetaxel chemotherapy\non its own in patients with newly-diagnosed high volume mHSPC, deﬁned as PSMA-avid\nvisceral metastases, or ≥4 PSMA-avid bone lesions with one or more outside the vertebral\ncolumn and pelvis as seen on68Ga-PSMA PET/CT. The study aims to enroll 140 patients\nwith estimated primary completion in April of 2024.\n3.4. Other Notable Beta-Emitting PSMA-Targeted Radionuclide Therapy Agents\n3.4.1.131I-MIP-1095\nIodine-131(131I)-MIP-1095 is a PSMA-targeted small-molecule inhibitor radionuclide\ntherapy developed by Molecular Insight Pharmaceuticals, Inc. It was one of the ﬁrst agents\nused in radiopharmaceutical therapy against prostate cancer.131I is a beta-emitter having a\nsimilar particle range and half-life as177Lu (eight vs. 6.7 days, respectively), but with much\nmore abundant gamma emission, which makes it less ideal from toxicity and radiation\nsafety perspectives [70].\nA study testing a single cycle of131I-MIP-1095 in 28 mCRPC patients showed PSA\ndecrease of >50% in 60.7% of patients with median time to PSA progression of 126 days.\nSeven of the 28 patients experienced transient xerostomia with all reported symptoms\nresolved within 3–4 weeks. Although hematological toxicities were infrequent (two patients\nwith grade 3 thrombocytopenia, one patient was grade 3 leukopenia), thrombocytopenia\nlasted multiple months [ 70]. In a subsequent study involving 36 mCRPC patients, 70.6%\nexperienced PSA decrease >50% with median PSA progression of 116 days. Patients\nreceived an additional dose at PSA progression. However, only 65.2% experienced any PSA\ndecline with only much higher percentage grade 3 thrombocytopenia of 13%, compared\nto 5.9% after ﬁrst dose. Grade 3 xerostomia was observed in 13%, which was not seen\nafter the ﬁrst dose [ 71]. ARROW (NCT03939689) is a randomized, multicenter, controlled\nphase 2 study is currently underway to evaluate the safety and efﬁcacy of131I-MIP-1095 in\ncombination with enzalutamide compared to enzalutamide alone in patients with PSMA-\navid mCRPC who have progressed on abiraterone.\n3.4.2.177Lu-PSMA-R2\n177Lu-PSMA-R2 is being developed by Advanced Accelerator Applications (a sub-\nsidiary of Novartis).', 'Cancers 2020 ,12, 1367 6 of 14\nImproved localization of metastatic PCa using PSMA-targeted imaging may also increase the\nsuccess rate of metastasis-directed therapy (MDT), including stereotactic body radiotherapy (SABR).\nMDT intends to postpone systemic treatment for patients with oligometastatic disease, thereby\nreducing the side-e ﬀects of hormonal therapy. Prospective data suggest that SABR is well tolerated\nand improves PFS in patients with oligometastatic PCa [ 50]. In the randomized STOMP study, which\nused choline PET /CT, stereotactic ablation of oligometastatic disease in 62 patients delayed the need\nfor hormonal therapy from 13 to 21 months compared with surveillance [ 51]. Data from ORIOLE, a\nsimilar randomized Phase II study investigating the e ﬃcacy of SABR in forestalling metastases for\nhormone-sensitive PCa compared with observation, provide evidence for the value of PSMA PET /CT\nin controlling disease [ 52]. Patients randomized to the SABR arm of ORIOLE underwent18F-DCFPyl\nPET/CT, a urea-based PSMA radiotracer, prior to and 180 days after treatment. Patients with no\nadditional untreated lesions detected by PSMA PET /CT at baseline were signiﬁcantly less likely to\ndevelop new metastatic lesions at six months than those whose PSMA PET /CT showed at least one\nadditional lesion at baseline (16% vs. 63%, respectively).\nCurrently, the only PSMA-targeted imaging agent approved by the U.S. Food and Drug\nAdministration is111In-capromab pendetide (ProstaScint), which is approved for SPECT imaging of\nbiopsy-proven PCa localized to the prostatic bed but at high risk for pelvic LNM. Regulatory approval\nof PSMA radiotracers in the United States has lagged behind other areas of the world, such as Europe\nand Australia, where much of the innovation in PSMA theranostics has occurred. Given the growing\nevidence of the clinical potential of PSMA, its availability is expanding in the United States, and\nregulatory approval of novel radiotracers, including68Ga-PSMA-11 and18F-DCFPyl, is expected within\nthe next year. Ongoing clinical trials will help to better deﬁne the clinical role and impact of PSMA\nimaging and possibly strengthen the case for regulatory approval (Table 1). In sum, PSMA-targeted\nimaging has demonstrated clinical beneﬁts through targeting stereotactic ablation in oligometastatic\ndisease, but no studies have yet shown that PSMA-targeted imaging improves clinical outcomes for\nbiochemically recurrent PCa patients.\n4. PSMA Radioligand Therapy (RLT)\nPSMA has also emerged as a promising therapeutic molecular target. Although various therapies are\nnow approved for mCRPC, their survival benefit is generally limited to less than 6 months. There is thus a\nclinical need for novel therapies leading to a sustained response. Progress in the development of synthetic\nPSMA radioligands has led to an emerging body of research indicating significant therapeutic efficacy of\nPSMA RLT.\nPSMA RLT studies have mostly utilized small-molecule inhibitors of PSMA as radioligands, which\nhave been shown to be less hematotoxic than monoclonal antibodies. For instance, a study of MEDI3726\n(a PSMA-targeted antibody–drug conjugate) in patients with mCRPC after failure of abiraterone or\nenzalumatide observed significant responses at higher doses of MEDI3726, although responses were not\ndurable because patients discontinued therapy due to drug-related adverse events [ 53]. Small-molecule\nPSMA inhibitors have been labeled with both beta- and alpha-emitting radioisotopes, which have variable\nenergy levels and path lengths. Beta-emitting radioisotopes, such as lutetium-177 (177Lu), are the favored\nradioisotopes given their short maximal tissue penetration and relatively long half-life, permitting delivery\nof a high degree of radiation to PCa lesions. Advantages of alpha-emitting radioisotopes include reduced\nred-marrow infiltration, leading to less hematotoxicity .', 'However, only 65.2% experienced any PSA\ndecline with only much higher percentage grade 3 thrombocytopenia of 13%, compared\nto 5.9% after ﬁrst dose. Grade 3 xerostomia was observed in 13%, which was not seen\nafter the ﬁrst dose [ 71]. ARROW (NCT03939689) is a randomized, multicenter, controlled\nphase 2 study is currently underway to evaluate the safety and efﬁcacy of131I-MIP-1095 in\ncombination with enzalutamide compared to enzalutamide alone in patients with PSMA-\navid mCRPC who have progressed on abiraterone.\n3.4.2.177Lu-PSMA-R2\n177Lu-PSMA-R2 is being developed by Advanced Accelerator Applications (a sub-\nsidiary of Novartis). PSMA-R2 is a urea-based PSMA-targeting small molecule inhibitor. In\npreclinical studies,177Lu-PSMA-R2 has rapid and speciﬁc uptake in mice bearing prostate\ncancer tumors, with rapid elimination through urinary system [ 72]. A phase 1/2 dose\nescalation study of177Lu-PSMA-R2 in patients with PSMA-avid mCRPC is currently being\nconducted, with planned completion in June 2022 (NCT03490838).']",3.0,1.0,1.0,1.0,1,1.0,0.0,0.5,149
19G advanced RAG,Welche wichtigen Studien wurden in den letzten Jahren im Bereich der neuroendokrinen Tumore gestartet bzw. durchgeführt?,german,specific,study,claude-3-opus-20240229 advanced RAG,"Basierend auf den gegebenen Informationen wurden in den letzten Jahren folgende wichtige Studien im Bereich der neuroendokrinen Tumore durchgeführt:

- Die NETTER-1 Phase-III-Studie untersuchte die Wirksamkeit und Sicherheit von 177Lu-DOTATATE bei Patienten mit neuroendokrinen Tumoren des Mitteldarms (Strosberg et al., 2016).

- Kwekkeboom et al. (2008) untersuchten in einer Studie die Toxizität, Wirksamkeit und Überlebensraten nach Behandlung mit dem radioaktiv markierten Somatostatin-Analogon [177Lu-DOTA0, Tyr3]Octreotate. 

- In einer Phase-II-Studie analysierten Cwikla et al. (2009) die Wirksamkeit der Radionuklidtherapie mit 90Y-DOTATATE bei Patienten mit progressiven metastasierten gastroenteropankreatischen neuroendokrinen Karzinomen.

- Imhof et al. (2011) untersuchten in einer Studie das Ansprechen, Überleben und die Langzeittoxizität nach Therapie mit dem radioaktiv markierten Somatostatin-Analogon [90Y-DOTA]-TOC bei metastasierten neuroendokrinen Tumoren.","['55. Thang SP, Lung MS, Kong G, et al. Peptide receptor radionuclide ther-\napy (PRRT) in European Neuroendocrine Tumour Society (ENETS)\ngrade 3 (G3) neuroendocrine neoplasia (NEN)-a single-institution ret-\nrospective analysis. Eur J Nucl Med Mol Imaging . 2018;45(2):262-277.\n56. Ambrosini V, Kunikowska J, Baudin E, et al. Consensus on molecular\nimaging and theranostics in neuroendocrine neoplasms. Eur J Cancer .\n2021;146:56-73.\n57. Yordanova A, Mayer K, Brossart P, et al. Safety of multiple repeated\ncycles of (177)Lu-octreotate in patients with recurrent neuroendo-crine tumour. Eur J Nucl Med Mol Imaging . 2017;44(7):1207-1214.\n58. Zemczak A, Gut P, Pawlak D, et al. The safety and efficacy of the\nrepeated PRRT with [(90)Y]Y/[(177)Lu]Lu-DOTATATE in patients\nwith NET. Int J Endocrinol . 2021;2021:6615511.\n59. Harris PE, Zhernosekov K. The evolution of PRRT for the treatment\nof neuroendocrine tumors; what comes next? Front Endocrinol . 2022;\n13:941832.\n60. Strosberg J, Leeuwenkamp O, Siddiqui MK. Peptide receptor radio-\ntherapy re-treatment in patients with progressive neuroendocrinetumors: a systematic review and meta-analysis. Cancer Treat Rev .\n2021;93:102141.\n61. Caplin ME, Pavel M, Cwikla JB, et al. Lanreotide in metastatic entero-\npancreatic neuroendocrine tumors. N Engl J Med . 2014;371(3):\n224-233.\n62. Carmona-Bayonas A, Jimenez-Fonseca P, Lamarca A, et al. Prediction\nof progression-free survival in patients with advanced, well-differentiated, neuroendocrine tumors being treated with a somato-\nstatin analog: the GETNE-TRASGU study. J Clin Oncol . 2019;37(28):\n2571-2580.\n63. Merola E, Alonso Gordoa T, Zhang P, et al. Somatostatin analogs for\npancreatic neuroendocrine tumors: any benefit when Ki-67 is\n>/=10%? Oncologist . 2021;26(4):294-301.\n64. Pavel M, Cwikla JB, Lombard-Bohas C, et al. Efficacy and safety of\nhigh-dose lanreotide autogel in patients with progressive pancreaticor midgut neuroendocrine tumours: CLARINET FORTE phase 2 studyresults. Eur J Cancer . 2021;157:403-414.\n65. Raymond E, Dahan L, Raoul JL, et al. Sunitinib malate for the treat-\nment of pancreatic neuroendocrine tumors. N Engl J Med . 2011;\n364(6):501-513.\n66. Jiao Y, Shi C, Edil BH, et al. DAXX/ATRX, MEN1, and mTOR pathway\ngenes are frequently altered in pancreatic neuroendocrine tumors.\nScience . 2011;331(6021):1199-1203.\n67. Yao JC, Shah MH, Ito T, et al. Everolimus for advanced pancreatic\nneuroendocrine tumors. N Engl J Med . 2011;364(6):514-523.\n68. Panzuto F, Rinzivillo M, Spada F, et al. Everolimus in pancreatic neu-\nroendocrine carcinomas G3. Pancreas . 2017;46(3):302-305.\n69. Pellat A, Dreyer C, Couffignal C, et al.', '[CrossRef] [PubMed]\n82. Strosberg, J.; Wolin, E.; Chasen, B.; Kulke, M.; Bushnell, D.; Caplin, M.; Baum, R.; Mittra, E.;\nHobday, T.; Hendifar, A. NETTER-1 phase III in patients with midgut neuroendocrine tumors treated\nwith 177Lu-DOTATATE: E ﬃcacy and safety results. J. Nucl. Med. 2016 ,57, 629.\n83. Valkema, R.; De Jong, M.; Bakker, W.H.; Breeman, W.A.; Kooij, P .P .; Lugtenburg, P .J.; De Jong, F.H.;\nChristiansen, A.; Kam, B.L.; De Herder, W.W.; et al. Phase I study of peptide receptor radionuclide therapy\nwith [In-DTPA] octreotide: The Rotterdam experience. Semin. Nucl. Med. 2002 ,32, 110–122. [CrossRef]\n[PubMed]\n84. Bushnell, D.L., Jr.; O’Dorisio, T.M.; O’Dorisio, M.S.; Menda, Y.; Hicks, R.J.; Van Cutsem, E.; Baulieu, J.-L.;\nBorson-Chazot, F.; Anthony, L.; Benson, A.B. 90Y-edotreotide for metastatic carcinoid refractory to octreotide.\nJ. Clin. Oncol. 2010 ,28, 1652–1659. [CrossRef] [PubMed]\n85. Cwikla, J.; Sankowski, A.; Seklecka, N.; Buscombe, J.; Nasierowska-Guttmejer, A.; Jeziorski, K.; Mikolajczak, R.;\nPawlak, D.; Stepien, K.; Walecki, J. E ﬃcacy of radionuclide treatment DOTATATE Y-90 in patients with\nprogressive metastatic gastroenteropancreatic neuroendocrine carcinomas (GEP-NETs): A phase II study.\nAnn. Oncol. 2009 ,21, 787–794. [CrossRef] [PubMed]\n86. Imhof, A.; Brunner, P .; Marincek, N.; Briel, M.; Schindler, C.; Rasch, H.; Mäcke, H.R.; Rochlitz, C.;\nMüller-Brand, J.; Walter, M.A. Response, survival, and long-term toxicity after therapy with the radiolabeled\nsomatostatin analogue [90Y-DOTA]-TOC in metastasized neuroendocrine cancers. J. Clin. Oncol. 2011 ,29,\n2416–2423. [CrossRef]\n87. Kwekkeboom, D.J.; de Herder, W.W.; Kam, B.L.; van Eijck, C.H.; van Essen, M.; Kooij, P .P .; Feelders, R.A.;\nvan Aken, M.O.; Krenning, E.P . Treatment with the radiolabeled somatostatin analog [177 Lu-DOTA 0, Tyr3]\noctreotate: Toxicity, e ﬃcacy, and survival. J. Clin. Oncol. 2008 ,26, 2124–2130. [CrossRef]\n88. Lassmann, M.; Eberlein, U. Radiation Dosimetry Aspects of (177) Lu. Curr. Radiopharm. 2015 ,8, 139–144.\n[CrossRef]\n89. Valkema, R.; Pauwels, S.; Kvols, L.K.; Barone, R.; Jamar, F.; Bakker, W.H.; Kwekkeboom, D.J.; Bouterfa, H.;\nKrenning, E.P .']",2.0,1.0,1.0,1.0,0,1.0,0.0,0.5,114
19E advanced RAG,What are the major studies that have been initiated or conducted in the field of neuroendocrine tumors in recent years?,english,specific,study,claude-3-opus-20240229 advanced RAG,"According to the provided context, some of the major studies that have been conducted in the field of neuroendocrine tumors in recent years include:

1. The CLARINET study, which randomized 204 patients with gastroenteropancreatic NETs to receive either lanreotide or placebo, and showed that lanreotide was associated with an improvement in progression-free survival (PFS) [26].

2. The RADIANT-4 study, which evaluated everolimus for the treatment of advanced, nonfunctional neuroendocrine tumors of the lung or gastrointestinal tract [27]. 

3. The NETTER-1 trial, which compared 177Lu-Dotatate plus long-acting octreotide versus high-dose long-acting octreotide in patients with midgut neuroendocrine tumors. The study reported final overall survival and long-term safety results [29].","['in Pan-NET patients, showed no statistically significant difference in\nthe primary endpoint, the one-year PFS rate.82On the other hand, the\npreliminary results of the randomised phase II noncomparative\nOCLURANDOM study with PRRT and sunitinib showed a longer PFS\nof PRRT (177Lu-DOTATATE) in pretreated Pan-NET patients (median\n20.7 months (90% CI: 17.2 –23.7) and 11.0 months (90% CI: 8.8 –\n12.4), respectively).50A large retrospective multicentre Italian\nnationwide study showed that second-line therapy with PRRT wasmore effective in terms of PFS tha nc h e m o t h e r a p yo re v e r o l i m u so r\ns u n i t i n i bi np a t i e n t sw i t hG E P - N E T( i n c l u d i n gN F - P a n - N E T ) ,w h i c h\nwas confirmed in the Pan-NET an d nonfunctioning subgroups.\n10\nTwo ongoing international phase III studies are exploring the effi-\ncacy of PRRT in advanced GEP-NET with high Ki-67 index (10% –\n55%), in comparison with octreotide LAR 60 mg/q4w as first-line\n(NETTER-2 trial, NCT03972488) or in comparison with chemother-a p yo re v e r o l i m u sa sf i r s t -o rs econd-line (C OMPOSE trial,\nNCT04919226).\n59\nThe proposed algorithm of G1-2 NF-Pan-NETs treatment is pre-\nsented in Figure 1.\n3.6 |Q9. Is there a specific work-up in MEN1\npatients?\nThe molecular bases of NF-Pan-NET tumorigenesis is not well under-\nstood and although 90% of cases are sporadic a minority may be\nincluded in the context of important genetic syndromes such as\nMEN1, VHL and tuberous sclerosis complex (TSC) syndrome.83A sep-\narate ENETS guidance paper on MEN1 syndrome is currently being\nworked on at the same time as this manuscript.MEN1 is a rare autosomal dominantly inherited endocrine tumour\npredisposition syndrome, caused by germline heterozygous mutationsin the MEN1 tumour suppressor gene, located on chromosome\n11q13. The MEN1 gene encodes the menin protein involved in the\nregulation of gene transcription and mutation carriers will have clinicalmanifestations by the age of 50 years. The syndrome is associated\nwith parathyroid adenomas, duodenopancreatic NET and anterior\npituitary adenomas with a lifetime prevalence of 80% for NF-Pan-NET. MEN1 syndrome associates less frequently with thymic, lung\nand gastric NET and other tumours, and it is thus important to moni-\ntor patients for other neoplasms. Early recognition of relatives withMEN1 syndrome is of outmost importance due to 50% probability offirst line family members being carriers and also in the light of possible\ngenetic anticipation.\n84\nPan-NET arising in the context of MEN1 syndrome are usually\nmultiple, nonfunctioning and may develop early in the second decade\nof life.85The current state of evidence suggests initial close follow up\nwith MRI to assess growth rate alternating with EUS. SRI-PET may becarried out when it may change management such as in NF-Pan-NET\n>1 cm for detection of occult metastases or before interventions are\nconsidered.\n86,87\nSeveral studies have indicated that MEN1-associated NF-\nPan-NET usually exhibit a low propensity to grow and lesions <2 cm\ncan be simply followed up by observation. If they are NET G2-G3,have lymph node metastases and are >3 cm in diameter, surgical exci-sion is then considered as they may display metastatic potential.\n88For\nlesions between 2 and 3 cm there is uncertainty, and more studies are\nrequired prior to being able to make recommendations.', 'Version 1.2023 © 202 3 National Comprehensive Cancer Network© (NCCN©), All rights reserved. NCCN Guidelines® and this illustration may not be reproduced in any form without the express written permission of NCCN .  NCCN Guidelines Version 1.2023 \nNeuroendocrine and Adrenal Tumors  \n \nMS-25 octreotide and/or other medicati on to manage their symptoms as \npreviously described. Patients without hormone- related symptoms who \nhave uptake with somatostatin scintigraphy can also be considered for \ntreatment with octreotide or lanreotide. Results from the CLARINET study, \nin which 204 patients with gastroenteropancreatic NETs (including both \ncarcinoid and pancreatic NETs ) were randomized to receive treatment \nwith either lanreotide or placebo, showed that treatment with lanreotide \nwas associated with in an improvement in PFS (PFS, not reached vs. 18 \nmonths; HR, 0.47; 95% CI, 0.30– 0.73; P < .001).136 Although no \nrandomized studies to date have directly shown an antitumor effect of \noctreotide in pancreatic NETs , the PROMID trial showed an improvement \nin its primary endpoint of time to tumor progression (14.3 vs. 6 months; P \n= .000072) in carcinoid (neuroendocrine)  tumors of the midgut.133 \nLanreotide and octreotide share the same mechanism of action, and the \npanel believes that either lanreotide or octreotide are appropriate options \nfor tumor control in this setting.  \nAdditional therapies  can be given in place of or in addition to octreotide or \nlanreotide, as discussed below.  \nMolecularly Targeted  Therapies  \nThe molecularly targeted agents everolimus and sunitinib have been confirmed to have antitumor activity and to improve PFS in patients with \nadvanced pancreatic NETs . In addition, data have shown the clinical \nbenefits of belzutifan  in patients with pancreatic NETs not requiring \nimmediate surgery, in the setting of germline VHL .   \nEverolimus, administered orally at a dose of 10 mg once daily, was \nevaluated in a multicenter study (RADIANT- 3) enrolling 410 patients with \nadvanced, progr essive, pancreatic NETs .\n239 In this study, the median PFS \nduration for patients randomized to everolimus was 11.0 months, \ncompared with 4.6 months for patients receiving placebo ( P < .001). \nSubset analyses of RADIAN T-3 suggested that the PFS benefit associated with everolimus is independent of prior or concurrent \nsomatostatin analog therapy or prior chemotherapy.167,240,241 Everolimus \ncan also be considered to stabilize glucose levels for patients with insulinomas.\n242 Adverse events associated with everolimus include \nstomatitis, hyperglycemia, and, in rare cases, pneumonitis.239 Other side \neffects have also been described.164-166 One report highlight ed the \noutcomes of 169 pretreated patients with advanced NETs  of the pancreas \n(n = 85) or other  sites (n = 84) who received everolimus through a \ncompassionate use program.168 A higher risk of adverse events was noted \nin patients with previous radiolabeled peptide therapy and chemotherapy.  \nSunitinib, administered orally at a dose of 37.5 mg once daily , was \ncompared with placebo in a multicenter r andomized study of patients with \nadvanced, progressive, metastatic pancreatic NETs .243 The study was \ndesigned to enroll 340 patients but was discontinued aft er enrollment of \n171 patients, before the predefined efficacy analysis. At discontinuation, \npatients who received sunitinib had a median PFS duration of 11.4 \nmonths, compared with 5.5 months for patients receiving placebo (P < \n.001) .', 'J. Clin. Oncol. Off. J.\nAm. Soc. Clin. Oncol. 2009 ,27, 4656–4663. [CrossRef] [PubMed]\n25. Kvols, L.K.; Moertel, C.G.; O’Connell, M.J.; Schutt, A.J.; Rubin, J.; Hahn, R.G. Treatment of the Malignant Carcinoid Syndrome. N.\nEngl. J. Med. 1986 ,315, 663–666. [CrossRef]\n26. Caplin, M.E.; Pavel, M.; ´Cwikła, J.B.; Phan, A.T.; Raderer, M.; Sedl áˇ ckov á, E.; Cadiot, G.; Wolin, E.M.; Capdevila, J.; Wall, L.; et al.\nLanreotide in metastatic enteropancreatic neuroendocrine tumors. N. Engl. J. Med. 2014 ,371, 224–233. [CrossRef] [PubMed]\n27. Yao, J.C.; Fazio, N.; Singh, S.; Buzzoni, R.; Carnaghi, C.; Wolin, E.; Tomasek, J.; Raderer, M.; Lahner, H.; Voi, M.; et al. Everolimus\nfor the treatment of advanced, nonfunctional neuroendocrine tumours of the lung or gastrointestinal tract (RADIANT-4): A\nrandomised, placebo-controlled, phase 3 study. Lancet Lond. Engl. 2016 ,387, 968–977. [CrossRef]\n28. Kulke, M.H.; Siu, L.L.; Tepper, J.E.; Fisher, G.; Jaffe, D.; Haller, D.G.; Ellis, L.M.; Benedetti, J.K.; Bergsland, E.K.; Hobday,\nT.J.; et al. Future Directions in the Treatment of Neuroendocrine Tumors: Consensus Report of the National Cancer Institute\nNeuroendocrine Tumor Clinical Trials Planning Meeting. J. Clin. Oncol. 2011 ,29, 934–943. [CrossRef] [PubMed]\n29. Strosberg, J.R.; Caplin, M.E.; Kunz, P .L.; Ruszniewski, P .B.; Bodei, L.; Hendifar, A.; Mittra, E.; Wolin, E.M.; Yao, J.C.; Pavel, M.E.;\net al.177Lu-Dotatate plus long-acting octreotide versus high-dose long-acting octreotide in patients with midgut neuroendocrine\ntumours (NETTER-1): Final overall survival and long-term safety results from an open-label, randomised, controlled, phase 3\ntrial. Lancet Oncol. 2021 ,22, 1752–1763. [CrossRef] [PubMed]\n30. EMA Annexe I—R ésum éDes Caract éristiques Du Produit—Lutathera 370MBq/mL Solution Pour Perfusion [Internet]. Available\nonline: https://www.ema.europa.eu/en/documents/product-information/lutathera-epar-product-information_fr.pdf (accessed\non 11 January 2023).\n31. Haute Autorit éde Sant éAvis de la Commission de la Transparence Du 11 Juillet 2018 Concernant le177Lutécium-Oxodotr éotide.\nAvailable online: https://www.has-sante.fr/upload/docs/evamed/CT-16606_LUTATHERA_PIC_INS_Avis3_CT16606.pdf\n(accessed on 27 January 2023).\n32. SociétéSavante Des Maladies Et Cancers de L’appareil Digestif N éoplasies Neuroendocrines (NNe) Digestives—Th ésaurus\nNational de Canc érologie Digestive.']",3.0,1.0,1.0,1.0,1,1.0,0.0,0.5,108
20G advanced RAG,Was ist der Vergleichsarm in der Netter-1 Studie,german,specific,study,claude-3-opus-20240229 advanced RAG,"Laut den Informationen im Kontext war der Vergleichsarm in der NETTER-1 Studie eine Behandlung mit hochdosiertem langwirksamen Octreotid (60 mg), das alle 4 Wochen intramuskulär verabreicht wurde (Strosberg et al., 2021, S. 23).","['23 Briefly, eligible patients were \naged 18 years and older, with advanced, inoperable, well \xad\ndifferentiated (Ki67 index ≤20%) midgut NETs with \npositive uptake on ¹¹¹In \xadDTPA \xadoctreotide scintigraphy \n(OctreoScan) on all target lesions and centrally confirmed disease progression on CT or MRI (as per Response Evaluation Criteria in Solid Tumors [RECIST], version 1.1) \nwhile taking a fixed dose of long \xadacting octreotide 20–30 mg every 3–4 weeks for at least 12 weeks before randomisation. Patients had to have a Karnofsky performance status score of at least 60. Previous PRRT was not allowed, nor was any surgery, transarterial therapy, or chemotherapy within 12 weeks of ran\xaddomisation. Key laboratory exclusion criteria included \nserum creatinine above 150 µmol/L (>1·7 mg/dL) or creatinine clearance below 50 mL/min as calculated by the Cockcroft–Gault method; haemoglobin concen\xadtration of less than 8·0 g/dL; white blood cell count \nbelow 2000 cells/mm³; platelets below 75  000 cells/mm³; \ntotal bilirubin above three times the upper limit of normal; and serum albumin below or equal to 3·0 g/dL (unless prothrombin time was within normal range). Comorbidities not permitted were congestive heart failure, uncontrolled diabetes, spontaneous urinary \nincontinence, and co \xadexisting malignancies.  At selected \nstudy sites, patients who met eligibility criteria for the main randomised study were enrolled separately into a \nnon\xadrandomised substudy to evaluate ¹⁷⁷Lu \xadDotatate \ndosimetry and pharmacokinetics; this study will be published elsewhere (appendix p 3). All patients provided written informed consent. Independent ethical review boards approved the study protocol at each participating institution. The independent committee monitored safety throughout the study.\nRandomisation and masking\nPatients were randomly assigned in a 1:1 ratio to receive study treatments. The allocation sequence was generated by Pierrel Research (Zurich, Switzerland). The interactive \nweb\xadbased response system module of the electronic case \nreport form assigned a unique randomisation number, linked to a treatment group, to each patient. Randomisation was stratified by highest tumour uptake on OctreoScan (Krenning grade 2, 3, or 4; using the highest score measured among all target lesions in an individual patient) and by length of time on most recent fixed dose of \nlong\xadacting octreotide (≤6  months or >6 months). The \nstudy was open \xadlabel, and both investigators and patients \nwere aware of treatment allocation.\nProcedures\nPatients were randomly assigned to receive either \nfour cycles of ¹⁷⁷Lu \xadDotatate 7 ·4 GBq (200 mCi) every \n8 weeks (or within 1 week of this timeframe) by \nintravenous infusions plus concomitant long \xadacting \noctreotide (30 mg) administered intramuscularly (then \nevery 4 weeks after ¹⁷⁷Lu \xadDotatate administrations were \ncompleted; ¹⁷⁷Lu \xadDotatate group), or high \xaddose long \xad\nacting octreotide (60 mg) administered intramuscularly every 4 weeks (or within 3 days of this timeframe; control \ngroup). All patients could receive short \xadacting octreotide \nrescue injections for symptom control. An infusion of an \namino acid solution (Aminosyn II 10% or VAMIN \xad18) \nwas administered concomitantly with ¹⁷⁷Lu \xadDotatate for \nrenal protection. During the study treatment period,']",5.0,0.75,1.0,1.0,0,1.0,1.0,1.0,33
20E advanced RAG,What is the control arm in the Netter-1 trial?,english,specific,study,claude-3-opus-20240229 advanced RAG,"According to the context, in the control group of the NETTER-1 trial, ""octreotide LAR at a dose of 60 mg was administered intramuscularly every 4 weeks"" [1].","['n engl j med 376;2 nejm.org January 12, 2017 127177Lu-Dotatate for Midgut Neuroendocrine Tumors\nbefore randomization; and any surgery, liver-\ndirected transarterial therapy, or chemotherapy within 12 weeks before randomization.\nTrial Design\nIn this open-label, phase 3 trial, we randomly assigned patients, in a 1:1 ratio, to receive \n177Lu-\nDotatate plus best supportive care, consisting of octreotide LAR at a dose of 30 mg every 4 weeks for symptom control (\n177Lu-Dotatate group) or to \nreceive high-dose octreotide LAR, at a dose of 60 mg every 4 weeks (control group). Random -\nization was performed with the use of a central -\nized permuted block (block size of 4) randomiza -\ntion scheme, with stratification according to the highest tumor uptake score on somatostatin re -\nceptor scintigraphy (grade 2, 3, or 4 on a scale ranging from 0 [no uptake by tumor] to 4 [very intense uptake by tumor] with higher grades in -\ndicating a higher level of expression of soma -\ntostatin receptors)\n12 and according to the length \nof time that a patient had been receiving a con -\nstant dose of octreotide (≤6 months or >6 months).\nIn the 177Lu-Dotatate group, 7.4 GBq (200 mCi) \nof 177Lu-Dotatate was infused intravenously over \na period of 30 minutes. Patients received four infusions every 8 weeks (cumulative radioactivity, 29.6 GBq [800 mCi]) unless unacceptable toxic effects occurred, centrally confirmed disease progression (according to RECIST) was present on imaging, the patient was unable or unwilling to adhere to trial procedures, the patient with -\ndrew consent, or the patient died. For renal protection, an intravenous amino acid solution (Aminosyn II 10% [21.0 g of lysine and 20.4 g of arginine in 2 liters of solution] or VAMIN-18 [18 g of lysine and 22.6 g of arginine in 2 liters of solution]) was administered concomitantly for at least 4 hours, starting 30 minutes before infu -\nsion of the radiopharmaceutical. In the \n177Lu-\nDotatate group, patients continued to receive supportive care with octreotide LAR, which was administered intramuscularly at a dose of 30 mg approximately 24 hours after each infusion of \n177Lu-Dotatate and then monthly after completion \nof all four treatments. In the control group, octreotide LAR at a dose of 60 mg was adminis -\ntered intramuscularly every 4 weeks. In both treat -\nment groups, patients were allowed to receive subcutaneous rescue injections of octreotide in the event of hormonal symptoms (i.e., diarrhea or flushing) associated with their carcinoid syn -\ndrome.Trial Oversight\nThis trial was sponsored by Advanced Accelera -\ntor Applications and was designed by Advanced Accelerator Applications in collaboration with the last two authors. The trial protocol was approved by the investigational review board or independent ethics committee at each participating institu -\ntion. Contract research organizations monitored the trial and collected, compiled, maintained, and analyzed the data. The trial was performed in ac -\ncordance with the principles of the Declaration of Helsinki, International Conference on Harmoni -\nsation Good Clinical Practice guidelines, and all applicable regulations. All the patients provided written informed consent. An independent data and safety monitoring board oversaw the conduct of the trial. The first draft of the manuscript was prepared by the first author with assistance from a professional medical writer funded by the spon -\nsor. All the authors contributed to subsequent drafts and agreed to submit the manuscript for publication. All the authors vouch for the accu -\nracy and completeness of the data and the analy -\nsis and for the fidelity of the trial to the protocol. The protocol and statistical analysis plan are avail -\nable with the full text of this article at NEJM.org.\nEnd Points and Assessments\nThe primary end point was progression-free sur -\nvival, which was defined as the time from ran -\ndomization to documented disease progression (as evaluated by independent central review by radiologists who were unaware of the treatment assignments) or death from any cause.', 'Method\nTrial Design\nCOMPOSE is a prospective, randomized, controlled, open -label, multi -center, \nPhase III study to evaluate the efficacy, safety and patient -reported outcomes of \nfirst-or later -line treatment with n.c.a.177Lu-edotreotide PRRT compared to best \nstandard of care in patients with well -differentiated, high grade 2 and grade 3 \n(Ki-67 index 15−55) , somatostatin receptor -positive (SSTR+) GEP -NETs. \nThe study was recently opened and is planned to recruit patients in 10 \ncountries. It aims to randomize 202 patients 1:1 to receive one of two treatment \noptions (Figure 4) .\nAs shown above, patients will receive either:\n•PRRT with n.c.a. 177Lu-edotreotide consisting of six cycles (7.5 GBq n.c.a. \n177Lu-edotreotide per cycle), administered as i.v. infusion (101 patients) or\n•Either CAPTEM, everolimus , or FOLFOX, administered according to local \nprescribing information, until diagnosis of progression or end of study (101 \npatients). The appropriate standard therapy will be determined by the \nstudy doctor.\nCOMPOSE: Pivotal phase III trial of 177Lu-edotreotide versus best standard of care in well -differentiated \naggressive grade 2 and grade 3 gastroenteropancreatic neuroendocrine tumors \nHalfdanarson TR ,1Reidy D,2Vijayvergia N,3Halperin D,4Goldstein G,5Kong G,6Michael M,6Leyden S,7Grozinsky -Glasberg S,8Sorbye H,9Öberg K,10Thevenet T, 11Herrmann M11\n1. Presenter: Mayo Clinic, Rochester, MN, USA; 2. Memorial Sloan Kettering Cancer Center, New York, NY , USA; 3. Fox Chase Cancer Center, Ph iladelphia, PA, USA; 4. MD Anderson Cancer Center, Houston, TX, USA; 5. Carcinoid Cancer Foundation, Mt Kisco, \nNY , USA; 6. Peter MacCallum Cancer Centre, Melbourne, VIC, Australia; 7. NeuroEndocrine Cancer, Australia; 8. Hadassah Medica l Center, Jerusalem, Israel; 9. Haukeland University Hospital, Bergen, Norway; 10. Akademiska Sjukhuset, Uppsala, Sweden; 11. \nITM Oncologics GmbH, Garching/Munich, Germany.\nBackground\nGastroenteropancreatic neuroendocrine tumors (GEP -NETs), which represent \napproximately 70% of NETs, frequently develop metastatic disease with limited \ntreatment options.1\nCurrent standard therapies for the subset of well -differentiated high grade 2 and \ngrade 3 GEP -NETs include cytoreductive procedures, somatostatin analogues, \nmolecular targeted therapies (everolimus or sunitinib), chemotherapy and peptide \nreceptor radionuclide therapy (PRRT), with no specified sequence of use.2−4\nPRRT may stabilize disease and induce objective tumor responses. This treatment \nuses radiolabeled somatostatin analogues to selectively target tumor cells \nexpressing somatostatin receptor 2.5\nAs demonstrated in theBad Berka study , PRRT in the form ofnon-carrier added\n(n.c.a .)177Lu-edotreotide is an innovative radiolabeled somatostatin analogue with \na favorable safety profile and promising efficacy in treating patients with NETs \n(Figure 1 and Figure 2).6\nStudy Outcomes\nPrimary\n•Progression -free survival assessed every 12 weeks until disease progression \n(RECIST v1.1) or death, whichever occurs earlier.\nSecondary\n•Overall survival assessed up to 2 years after disease progression\n Figure 1. Kaplan -Meier estimates of PFS in \nthe study population depending onnumber\nof n.c.a.177Lu-edotreotide PRRT cycles.6\nFigure 2.']",5.0,1.0,1.0,1.0,1,1.0,1.0,1.0,27
21G advanced RAG,Was ist der Vergleichsarm in der Netter-2 Studie,german,specific,study,claude-3-opus-20240229 advanced RAG,"Basierend auf den gegebenen Kontextinformationen wird die NETTER-2 Studie nicht erwähnt. Die Kontextinformationen beziehen sich auf die PROMID Studie [1], die CLARINET Studie [2] und eine Studie von Caplin et al. [3], aber es werden keine Details zu einer NETTER-2 Studie oder deren Vergleichsarm gegeben.","['Treatment groups are for patients\nreceiving lanreotide autogel/depot 120 mg in both the CLARINETcore study and the OLE (LAN –LAN group) and patients receiving\nplacebo in the CLARINET core study and crossing over to lanreotide\nin the OLE (PBO –LAN group)\nbEnroled by the investigator before communication of the results of the\ncentral assessment (PD) in the core study; patient withdrawn from the\nOLE on receipt of the assessment result\ncTumour grades based on WHO 2010 classi ﬁcation [ 15] (G1, mitotic\ncount <2 mitoses/10 HPF and/or Ki-67 ≤2%; G2, mitotic count 2 –20\nmitoses/10 HPF and Ki-67 > 2 –20%) —note that none of the patients\nhad tumours with Ki-67 > 10%. OLE open-label extension, LAN–LAN\ngroup patients receiving lanreotide autogel/depot in core study as well\nas the OLE study, PBO –LAN group patients receiving placebo in the\ncore study before crossing over to lanreotide in the OLE study, WHO\nWorld Health Organization, NET neuroendocrine tumour, PD\nprogressive disease506 Endocrine (2021) 71:502 –513', 'Even data from different prospective trials are difficult \nto compare, as shown for patients included into the PRO-MID trial and the recently published CLARINET trial. The PROMID cohort was randomized without an obser-vation period prior to randomization; therefore, sponta-neous tumor growth was unknown. For ethical reasons, the investigators decided to avoid randomization of pa-tients with documented tumor progression to placebo treatment. In the CLARINET trial, patients with metasta-sized gastroenteropancreatic NETs and a Ki-67 prolifera-tion index <10% were randomized to lanreotide autogel or placebo. Ninety-six percent of the patients had stable disease according to RECIST in the 3–6 months before randomization. In contrast, 50% of the patients included in the PROMID trial and randomized to receive placebo were progressive after 6 months  \n[1] . TTP in the PROMID \nstudy was 14.3 months for the octreotide and 6.0 months for the placebo group. The respective figures for PFS of the midgut subgroup in the CLARINET study were much longer: ‘not reached’ in the lanreotide and 21 months in the placebo group  \n[2] . Both trials reach identical conclu-\nsions concerning the key message: long-acting soma-tostatin analogs inhibit tumor growth and prolong TTP and PFS. However, the trials markedly differ with respect to the underlying absolute figures for TTP and PFS. The use of different response criteria (the bidimensional WHO criteria vs. the unidimensional RECIST) and the inclusion of patients with different tumor biology, espe-cially the selection of patients without disease progression before randomization into the CLARINET trial, may contribute to the obvious differences found in both trials. In future studies, tumor growth behavior at study entry should be documented.\n  To conclude, this prospectively designed study pro-\nvides for the first time long-term survival data for patients with metastatic midgut NETs. The study shows that a high tumor burden is a strong indicator for a shorter sur-vival. Patients with a low tumor burden displayed a favor-able prognosis with a median survival of 107 months after randomization. There was a tendency for a survival ad-vantage in the group of patients with a low hepatic tumor load at the time of randomization, which was not ob-served for the whole cohort of patients treated with oc-treotide LAR.Downloaded from http://karger.com/nen/article-pdf/104/1/26/3906115/000443612.pdf by guest on 15 February 2024', 'An HR of 0.6 was postulated asa clinically meaningful difference to be detected with a power of 80%. Anoptimized group sequential design, with one interim analysis after observationof 64 progressions and the ﬁnal analysis after observation of 124 progressions,with a local type I error level of 0.0122 at interim, was ﬁxed in the protocol. Ause function in the sense of DeMets and Lan\n37was set up by reoptimization,\nresulting in the type I error level of 0.0125 after observation of 67 progressions.According to Schoenfeld and Richter\n38and compensating for a lost to\nfollow-up rate of 10%, recruitment of 162 patients was planned.\nFor survival time, a ﬁxed-sample test based on 121 observed deaths was\ndeﬁned in the protocol. Controlling the family-wise error rate at the level of5%, this test was planned as a conﬁrmatory test in the event of a signiﬁcantresult for the primary end point, with the option of a redesign according toMu¨ller and Scha ¨fer.\n39,40\nA sensitivity analysis was performed on a per-protocol basis. Other\nsecondary end points and safety variables were analyzed descriptively. Explor-ative analyses were performed to investigate potential prognostic factors fortime to tumor progression and survival time. During the study, hepatic tumorinvolvement was recognized as a further possibly important factor.\n35\nStatistical analyses were performed using log-rank tests, univariate and\nmultivariate Cox regression models, Fisher’s exact test, and Wilcoxon-Mann-Whitney test, with or without stratiﬁcation. They were performed with SASVersion 9.1 (SAS Institute, Cary, NC) and StatXact of Cytel Studio Version6.2.0 (Cytel, Cambridge, MA). Pvalues quantiﬁed results of conﬁrmatory or\nexplorative tests or imbalances between treatment groups with respect toOctreotide Controls Growth in Neuroendocrine Midgut Tumors\nwww.jco.org © 2009 by American Society of Clinical Oncology 4657\nDownloaded from ascopubs.org by 91.26.26.250 on August 16, 2023 from 091.026.026.250\nCopyright © 2023 American Society of Clinical Oncology. All rights reserved.']",0.0,0.6,1.0,0.0,1,1.0,0.0,0.5,45
21E advanced RAG,What is the control arm in the Netter-2 trial?,english,specific,study,claude-3-opus-20240229 advanced RAG,"According to the context provided in Table 3, the NETTER-2 trial (NCT03972488) is described as ""A phase III multi-center, randomized, open-label study to evaluate the efficacy and safety of lutathera in patients with grade 2 and grade 3 advanced GEP-NET"" (Harris and Zhernosekov, 2022). However, the specific details of the control arm in the NETTER-2 trial are not provided in the given context.","['A total of 202\npatients will be randomized 1:1 to receive 6 cycles of n.c.a Lu-\n177-edotreotide (7,5 GBq) ( Figure 2 ). The comparator arm\ncomprises of a choice of SOC from Capecitabine and\nTemozolomide (CAPTEM), Eve rolimus or Folinic acid,\nFluorouracil and Oxiplatin (FOLFOX). The treatment regimen\nis determined according to local prescribing information, until\ndiagnosis of progression or end of the study. The primary\nendpoint is PFS with OS, a key secondary endpoint assessed\nup to 2 years after disease progression.\nDiscussion\nThere are now extensive data available from retrospective\nstudies and the more recent prospective studies attesting to the\nTABLE 3 Ongoing NET trials with PRRT.\nNCT Protocol/\nTrial IDTrial Title Trial\nPhase\nNCT03972488 NETTER-2 A phase III multi-center, randomized, open-label study to evaluate the ef ﬁcacy and safety of lutathera in patients with\ngrade 2 and grade 3 advanced GEP-NETIII\nNCT02743741 NA Lu-DOTATATE treatment in patients with 68Ga-DOTATATE somatostatin receptor positive neuroendocrine tumors NA\nNCT05153772 ALPHAMEDIX02 Targeted alpha-emitter therapy of PRRT naive neuroendocrine tumor patients IINCT03773133 NA Evaluate the safety, tolerability, biodistribution and anti tumour activity of 177Lu-OPS201 with companion imaging 68Ga-\nOPS202 PET/CT in previously treated subjects with locally advanced or metastatic cancers expressing somatostatin\nreceptor 2 (SSTR2) (SSTR2+)II\nNCT03457948 NA Pembrolizumab with liver-directed or peptide receptor radionuclide therapy for neuroendocrine tumors and liver\nmetastasesII\nNCT02489604 LUNET Peptide receptor radionuclide therapy (PRRT) with 177Lu-DOTATATE in advanced gastro-entero-pancreatic\nneuroendocrine tumorsII\nNCT03454763 LUTHREE Optimizing the interval between cycles of PRRT with 177Lu-DOTATATE in SSTR2 positive tumors II\nNCT04525638 NA A clinical study to assess the combination of two drugs (177Lu-DOTATATE and Nivolumab) in neuroendocrine tumours II\nNCT02736448 Lu-Ca-S 177Lutethium - Peptide receptor radionuclide therapy (Lu-PRRT) plus Capecitabine versus Lu-PRRT in FDG positive,\nGastro-entero-pancreatic neuroendocrine tumorsII\nNCT04543955 NA Telotristat with Lutathera in neuroendocrine tumors II\nNCT03466216 NA Phase 1 study of alphamedix\n™in adult subjects with SSTR (+) NET I\nNCT04234568 NA Testing the addition of an anti-cancer drug, triapine, to the usual radiation-based treatment (Lutetium Lu-177\nDOTATATE) for neuroendocrine tumorsI\nNCT04086485 NA Lu-177-DOTATATE (Lutathera) in combination with Olaparib in inoperable gastroenteropancreatic neuroendocrine\ntumors (GEP-NET)I\nNCT04750954 NA Testing the addition of an anti-cancer drug, m3814 (Peposertib), to the usual radiation-based treatment (Lutetium Lu-177\nDOTATATE) for neuroendocrine tumorsI\nNA, not applicable.Harris and Zhernosekov 10.3389/fendo.2022.941832\nFrontiers in Endocrinology frontiersin.org 05', 'Conclusions\nCOMPOSE will contribute with the first prospective \ncontrolled data for 177Lu-edotreotide, CAPTEM, FOLFOX and \neverolimus in the treatment of patients with high G2 and G3 \nGEP- NETs, clarifying the positioning of 177Lu-edotreotide in \nthe therapeutic algorithm.\nCOMPOSE :Phase IIITrial of177Lu-edotreotide versus Standard ofCare inWell -\ndifferentiated (WD) Aggressive Grade 2and Grade 3Gastroenteropancreatic\nNeuroendocrine Tumors (GEP -NETs)\nJ. Hernando1, T. R. Halfdarnarson2, D. M. Halperin3, D. Reidy Lagunes4, G. Kong5, J. Mailman6, K. Herrmann7, R. Srirajaskanthan8, S. Leyden9, J. Capdevila1, T. Thevenet10, M. Herrmann10\n1. Vall d´Hebron University Hospital, Vall d´Hebron Institute of Oncology, Barcelona, Spain; 2. Mayo Clinic, Rochester, USA; 3. MD Anderson Cancer Center, Houston, Texas, USA; 4. Memorial Sloan Kettering Cancer Center, New \nYork, USA; 5. Peter MacCallum Cancer Centre, Melbourne, Australia; 6. NorCal CarciNET Community, Oakland, CA; 7. Clinic for Nuclear Medicine, Universitätsklinikum Essen, Essen, Germany; 8. Kings College Hospital, London, \nUK; 9. NeuroEndocrine Cancer Australia , Victoria, Australia; 10. ITM Oncologics GmbH, Garching /Munich, Germany\nBACKGROUND\nGastroenteropancreatic neuroendocrine tumors (GEP -NETs), which represent\napproximately 70%ofNETs, frequently develop metastatic disease with limited\ntreatment options.1\nTherapeutic algorithm for well-differentiated (WD) high -grade 2and grade 3\ngastroenteropancreatic neuroendocrine tumors (G2+G3GEP-NETs) isnot well\nestablished. Current options include cytoreductive procedures ,somatostatin\nanalogues ,everolimus, sunitinib ,chemotherapy and peptide receptor radionuclide\ntherapy (PRRT), with nospecified sequence ofuse.2−4\nPeptide Receptor Radionuclide Therapy (PRRT) could beuseful inhigh grade NETs,\nhowever there isalack ofprospective evidence.177Lu-edotreotide isaninnovative\nradiolabeled somatostatin analogue with afavorable safety profile and efficacy5.\nThe ongoing Phase IIItrial COMPETE inG1and G2GEP-NETs isexploring theefficacy\nand safety of177Lu-edotreotide, incomparison toeverolimus. COMPOSE isa\ncomplementary study with the aim ofextending the therapeutic options for177Lu-\nedotreotide tohigh grade NETs .STUDY DESIGN\nCOMPOSE (NCT 04919226 )isaprospective, randomized, controlled, open -label, multi -center ,\nPhase IIItrial, inpatients with well-differentiated, high grade 2and grade 3,SSTR +GEP-NETs .\nThis trial istoevaluate theefficacy, safety and patient -reported outcomes offirst-orsecond -line\ntreatment with n.c.a.177Lu-edotreotide PRRT compared tobest standard ofcare .\nPrimary endpoint isprogression free survival, assessed every 12weeks until disease progression\n(RECIST v1.1)ordeath. Secondary outcomes include overall survival, assessed upto2years after\ndisease progression .\nCOMPOSE aims torandomize 202 patients 1:1toadefined number ofcycles of\n177Lu-edotreotide oranactive comparator .Asshown inFigure 2,patients willreceive either :\n•PRRT with n.c.a.177Lu-edotreotide consisting of six cycles (7.5GBq n.c.a.\n177Lu-edotreotide percycle), administered asintravenous infusion (101 patients) .\n•Either CAPTEM, everolimus ,orFOLFOX, aschosen bythestudy doctor and administered\naccording tolocal prescribing information (101 patients) .\nRecruitment commenced inSeptember 2021 with first patient screened inFrance.', 'Method\nTrial Design\nCOMPOSE is a prospective, randomized, controlled, open -label, multi -center, \nPhase III study to evaluate the efficacy, safety and patient -reported outcomes of \nfirst-or later -line treatment with n.c.a.177Lu-edotreotide PRRT compared to best \nstandard of care in patients with well -differentiated, high grade 2 and grade 3 \n(Ki-67 index 15−55) , somatostatin receptor -positive (SSTR+) GEP -NETs. \nThe study was recently opened and is planned to recruit patients in 10 \ncountries. It aims to randomize 202 patients 1:1 to receive one of two treatment \noptions (Figure 4) .\nAs shown above, patients will receive either:\n•PRRT with n.c.a. 177Lu-edotreotide consisting of six cycles (7.5 GBq n.c.a. \n177Lu-edotreotide per cycle), administered as i.v. infusion (101 patients) or\n•Either CAPTEM, everolimus , or FOLFOX, administered according to local \nprescribing information, until diagnosis of progression or end of study (101 \npatients). The appropriate standard therapy will be determined by the \nstudy doctor.\nCOMPOSE: Pivotal phase III trial of 177Lu-edotreotide versus best standard of care in well -differentiated \naggressive grade 2 and grade 3 gastroenteropancreatic neuroendocrine tumors \nHalfdanarson TR ,1Reidy D,2Vijayvergia N,3Halperin D,4Goldstein G,5Kong G,6Michael M,6Leyden S,7Grozinsky -Glasberg S,8Sorbye H,9Öberg K,10Thevenet T, 11Herrmann M11\n1. Presenter: Mayo Clinic, Rochester, MN, USA; 2. Memorial Sloan Kettering Cancer Center, New York, NY , USA; 3. Fox Chase Cancer Center, Ph iladelphia, PA, USA; 4. MD Anderson Cancer Center, Houston, TX, USA; 5. Carcinoid Cancer Foundation, Mt Kisco, \nNY , USA; 6. Peter MacCallum Cancer Centre, Melbourne, VIC, Australia; 7. NeuroEndocrine Cancer, Australia; 8. Hadassah Medica l Center, Jerusalem, Israel; 9. Haukeland University Hospital, Bergen, Norway; 10. Akademiska Sjukhuset, Uppsala, Sweden; 11. \nITM Oncologics GmbH, Garching/Munich, Germany.\nBackground\nGastroenteropancreatic neuroendocrine tumors (GEP -NETs), which represent \napproximately 70% of NETs, frequently develop metastatic disease with limited \ntreatment options.1\nCurrent standard therapies for the subset of well -differentiated high grade 2 and \ngrade 3 GEP -NETs include cytoreductive procedures, somatostatin analogues, \nmolecular targeted therapies (everolimus or sunitinib), chemotherapy and peptide \nreceptor radionuclide therapy (PRRT), with no specified sequence of use.2−4\nPRRT may stabilize disease and induce objective tumor responses. This treatment \nuses radiolabeled somatostatin analogues to selectively target tumor cells \nexpressing somatostatin receptor 2.5\nAs demonstrated in theBad Berka study , PRRT in the form ofnon-carrier added\n(n.c.a .)177Lu-edotreotide is an innovative radiolabeled somatostatin analogue with \na favorable safety profile and promising efficacy in treating patients with NETs \n(Figure 1 and Figure 2).6\nStudy Outcomes\nPrimary\n•Progression -free survival assessed every 12 weeks until disease progression \n(RECIST v1.1) or death, whichever occurs earlier.\nSecondary\n•Overall survival assessed up to 2 years after disease progression\n Figure 1. Kaplan -Meier estimates of PFS in \nthe study population depending onnumber\nof n.c.a.177Lu-edotreotide PRRT cycles.6\nFigure 2.']",0.0,1.0,0.0,1.0,1,1.0,0.0,0.5,63
22G advanced RAG,Was ist der Vergleichsarm in der COMPETE Studie,german,specific,study,claude-3-opus-20240229 advanced RAG,"Laut der Beschreibung der COMPETE-Studie ist der Vergleichsarm Everolimus, das in einer Dosis von 10 mg täglich über 24 Monate oder bis zum Fortschreiten der Erkrankung verabreicht wird (Harris and Zhernosekov, 2022).","['Method\nTrial Design\nCOMPOSE is a prospective, randomized, controlled, open -label, multi -center, \nPhase III study to evaluate the efficacy, safety and patient -reported outcomes of \nfirst-or later -line treatment with n.c.a.177Lu-edotreotide PRRT compared to best \nstandard of care in patients with well -differentiated, high grade 2 and grade 3 \n(Ki-67 index 15−55) , somatostatin receptor -positive (SSTR+) GEP -NETs. \nThe study was recently opened and is planned to recruit patients in 10 \ncountries. It aims to randomize 202 patients 1:1 to receive one of two treatment \noptions (Figure 4) .\nAs shown above, patients will receive either:\n•PRRT with n.c.a. 177Lu-edotreotide consisting of six cycles (7.5 GBq n.c.a. \n177Lu-edotreotide per cycle), administered as i.v. infusion (101 patients) or\n•Either CAPTEM, everolimus , or FOLFOX, administered according to local \nprescribing information, until diagnosis of progression or end of study (101 \npatients). The appropriate standard therapy will be determined by the \nstudy doctor.\nCOMPOSE: Pivotal phase III trial of 177Lu-edotreotide versus best standard of care in well -differentiated \naggressive grade 2 and grade 3 gastroenteropancreatic neuroendocrine tumors \nHalfdanarson TR ,1Reidy D,2Vijayvergia N,3Halperin D,4Goldstein G,5Kong G,6Michael M,6Leyden S,7Grozinsky -Glasberg S,8Sorbye H,9Öberg K,10Thevenet T, 11Herrmann M11\n1. Presenter: Mayo Clinic, Rochester, MN, USA; 2. Memorial Sloan Kettering Cancer Center, New York, NY , USA; 3. Fox Chase Cancer Center, Ph iladelphia, PA, USA; 4. MD Anderson Cancer Center, Houston, TX, USA; 5. Carcinoid Cancer Foundation, Mt Kisco, \nNY , USA; 6. Peter MacCallum Cancer Centre, Melbourne, VIC, Australia; 7. NeuroEndocrine Cancer, Australia; 8. Hadassah Medica l Center, Jerusalem, Israel; 9. Haukeland University Hospital, Bergen, Norway; 10. Akademiska Sjukhuset, Uppsala, Sweden; 11. \nITM Oncologics GmbH, Garching/Munich, Germany.\nBackground\nGastroenteropancreatic neuroendocrine tumors (GEP -NETs), which represent \napproximately 70% of NETs, frequently develop metastatic disease with limited \ntreatment options.1\nCurrent standard therapies for the subset of well -differentiated high grade 2 and \ngrade 3 GEP -NETs include cytoreductive procedures, somatostatin analogues, \nmolecular targeted therapies (everolimus or sunitinib), chemotherapy and peptide \nreceptor radionuclide therapy (PRRT), with no specified sequence of use.2−4\nPRRT may stabilize disease and induce objective tumor responses. This treatment \nuses radiolabeled somatostatin analogues to selectively target tumor cells \nexpressing somatostatin receptor 2.5\nAs demonstrated in theBad Berka study , PRRT in the form ofnon-carrier added\n(n.c.a .)177Lu-edotreotide is an innovative radiolabeled somatostatin analogue with \na favorable safety profile and promising efficacy in treating patients with NETs \n(Figure 1 and Figure 2).6\nStudy Outcomes\nPrimary\n•Progression -free survival assessed every 12 weeks until disease progression \n(RECIST v1.1) or death, whichever occurs earlier.\nSecondary\n•Overall survival assessed up to 2 years after disease progression\n Figure 1. Kaplan -Meier estimates of PFS in \nthe study population depending onnumber\nof n.c.a.177Lu-edotreotide PRRT cycles.6\nFigure 2.', 'Based on the data from the study of Baum et al. ( 19), a\nPhase-III pivotal clinical trial, COMPETE has been initiated.\nCOMPETE is a prospective, randomized, open-label multi-\ncenter Phase III study to evaluate the safety and ef ﬁcacy of\nn.c.a. Lu-177-Edotreotide in comparison to Everolimus in\npatients with G1 and G2 PNETs and GE NETs. The patients\nhave progressive, SSTR positive disease on SSTR imaging.\nUniquely, patients may be included as ﬁrst-line therapy. There\nare 3 sub-studies which focus on Lu-177-Edotreotide dosimetry\nand pharmacokinetics. These sub-studies are of great\nimportance in the development of a personalized, precision\ntherapy approach to the management of patients with PRRT.\nIn addition, Lu-177 is uniquely non-carrier-added (n.c.a.), which\nmeans that it is a pure radionuclide of high speci ﬁc activity.\nThe study has completed the recruitment of 300 patients. A\ntotal of 200 patients will receive up to 4 cycles of177Lu-edotreotide\n(7,5 GBq/cycle) every 3 months or until disease progression and\n100 patients will receive Everolimus 10 mg daily for 24 months or\nuntil disease progression. The study duration is 30 months with 5\nyears follow-up for OS. The primary end-point is progression-free\nsurvival as assessed by RECIST 1.1. Key secondary end-points\ninclude safety and tolerability, dosimetry, objective response rate,\noverall survival and quality of life ( Figure 1 ).\nFIGURE 1\nCOMPETE study. Study subjects are randomised 2:1 between 4 x 12 weekly cycles of Lu-177-edotreotide vs 10 mg daily Everolimus, followed up\nfor 30 months for PFS and 5 years for OS. *unless diagnosis of progression or end of study. **until diagnosis of progression or end of study.***or until diagnosis of progression, whichever is earlier.Harris and Zhernosekov 10.3389/fendo.2022.941832\nFrontiers in Endocrinology frontiersin.org 04']",5.0,1.0,1.0,0.0,0,1.0,1.0,1.0,32
22E advanced RAG,What is the control arm in the COMPETE trial?,english,specific,study,claude-3-opus-20240229 advanced RAG,"According to the information provided, in the COMPETE trial, 100 patients will receive Everolimus 10 mg daily for 24 months or until disease progression as the control arm, compared to 200 patients who will receive up to 4 cycles of 177Lu-edotreotide (7.5 GBq/cycle) every 3 months or until disease progression (1).","['Based on the data from the study of Baum et al. ( 19), a\nPhase-III pivotal clinical trial, COMPETE has been initiated.\nCOMPETE is a prospective, randomized, open-label multi-\ncenter Phase III study to evaluate the safety and ef ﬁcacy of\nn.c.a. Lu-177-Edotreotide in comparison to Everolimus in\npatients with G1 and G2 PNETs and GE NETs. The patients\nhave progressive, SSTR positive disease on SSTR imaging.\nUniquely, patients may be included as ﬁrst-line therapy. There\nare 3 sub-studies which focus on Lu-177-Edotreotide dosimetry\nand pharmacokinetics. These sub-studies are of great\nimportance in the development of a personalized, precision\ntherapy approach to the management of patients with PRRT.\nIn addition, Lu-177 is uniquely non-carrier-added (n.c.a.), which\nmeans that it is a pure radionuclide of high speci ﬁc activity.\nThe study has completed the recruitment of 300 patients. A\ntotal of 200 patients will receive up to 4 cycles of177Lu-edotreotide\n(7,5 GBq/cycle) every 3 months or until disease progression and\n100 patients will receive Everolimus 10 mg daily for 24 months or\nuntil disease progression. The study duration is 30 months with 5\nyears follow-up for OS. The primary end-point is progression-free\nsurvival as assessed by RECIST 1.1. Key secondary end-points\ninclude safety and tolerability, dosimetry, objective response rate,\noverall survival and quality of life ( Figure 1 ).\nFIGURE 1\nCOMPETE study. Study subjects are randomised 2:1 between 4 x 12 weekly cycles of Lu-177-edotreotide vs 10 mg daily Everolimus, followed up\nfor 30 months for PFS and 5 years for OS. *unless diagnosis of progression or end of study. **until diagnosis of progression or end of study.***or until diagnosis of progression, whichever is earlier.Harris and Zhernosekov 10.3389/fendo.2022.941832\nFrontiers in Endocrinology frontiersin.org 04', 'Conclusions\nCOMPOSE will contribute with the first prospective \ncontrolled data for 177Lu-edotreotide, CAPTEM, FOLFOX and \neverolimus in the treatment of patients with high G2 and G3 \nGEP- NETs, clarifying the positioning of 177Lu-edotreotide in \nthe therapeutic algorithm.\nCOMPOSE :Phase IIITrial of177Lu-edotreotide versus Standard ofCare inWell -\ndifferentiated (WD) Aggressive Grade 2and Grade 3Gastroenteropancreatic\nNeuroendocrine Tumors (GEP -NETs)\nJ. Hernando1, T. R. Halfdarnarson2, D. M. Halperin3, D. Reidy Lagunes4, G. Kong5, J. Mailman6, K. Herrmann7, R. Srirajaskanthan8, S. Leyden9, J. Capdevila1, T. Thevenet10, M. Herrmann10\n1. Vall d´Hebron University Hospital, Vall d´Hebron Institute of Oncology, Barcelona, Spain; 2. Mayo Clinic, Rochester, USA; 3. MD Anderson Cancer Center, Houston, Texas, USA; 4. Memorial Sloan Kettering Cancer Center, New \nYork, USA; 5. Peter MacCallum Cancer Centre, Melbourne, Australia; 6. NorCal CarciNET Community, Oakland, CA; 7. Clinic for Nuclear Medicine, Universitätsklinikum Essen, Essen, Germany; 8. Kings College Hospital, London, \nUK; 9. NeuroEndocrine Cancer Australia , Victoria, Australia; 10. ITM Oncologics GmbH, Garching /Munich, Germany\nBACKGROUND\nGastroenteropancreatic neuroendocrine tumors (GEP -NETs), which represent\napproximately 70%ofNETs, frequently develop metastatic disease with limited\ntreatment options.1\nTherapeutic algorithm for well-differentiated (WD) high -grade 2and grade 3\ngastroenteropancreatic neuroendocrine tumors (G2+G3GEP-NETs) isnot well\nestablished. Current options include cytoreductive procedures ,somatostatin\nanalogues ,everolimus, sunitinib ,chemotherapy and peptide receptor radionuclide\ntherapy (PRRT), with nospecified sequence ofuse.2−4\nPeptide Receptor Radionuclide Therapy (PRRT) could beuseful inhigh grade NETs,\nhowever there isalack ofprospective evidence.177Lu-edotreotide isaninnovative\nradiolabeled somatostatin analogue with afavorable safety profile and efficacy5.\nThe ongoing Phase IIItrial COMPETE inG1and G2GEP-NETs isexploring theefficacy\nand safety of177Lu-edotreotide, incomparison toeverolimus. COMPOSE isa\ncomplementary study with the aim ofextending the therapeutic options for177Lu-\nedotreotide tohigh grade NETs .STUDY DESIGN\nCOMPOSE (NCT 04919226 )isaprospective, randomized, controlled, open -label, multi -center ,\nPhase IIItrial, inpatients with well-differentiated, high grade 2and grade 3,SSTR +GEP-NETs .\nThis trial istoevaluate theefficacy, safety and patient -reported outcomes offirst-orsecond -line\ntreatment with n.c.a.177Lu-edotreotide PRRT compared tobest standard ofcare .\nPrimary endpoint isprogression free survival, assessed every 12weeks until disease progression\n(RECIST v1.1)ordeath. Secondary outcomes include overall survival, assessed upto2years after\ndisease progression .\nCOMPOSE aims torandomize 202 patients 1:1toadefined number ofcycles of\n177Lu-edotreotide oranactive comparator .Asshown inFigure 2,patients willreceive either :\n•PRRT with n.c.a.177Lu-edotreotide consisting of six cycles (7.5GBq n.c.a.\n177Lu-edotreotide percycle), administered asintravenous infusion (101 patients) .\n•Either CAPTEM, everolimus ,orFOLFOX, aschosen bythestudy doctor and administered\naccording tolocal prescribing information (101 patients) .\nRecruitment commenced inSeptember 2021 with first patient screened inFrance.', 'Trial design\nCOMPOSE is a prospective, randomised, controlled, \nopen -label, multi -center Phase III trial recruiting \npatients with well -differentiated aggressive grade 2 and \n3 (Ki -67 index 15−55%), SSTR+, GEP -NETs. \nCOMPOSE will evaluate efficacy, safety and patient -\nreported outcomes of 1st -or 2nd -line treatment with \n177Lu edotreotide PRRT compared to best standard of \ncare [investigator ´s choice of chemotherapy \n(capecitabine -temozolomide: CAPTEM or folinic acid, \nfluorouracil and oxaliplatin: FOLFOX) or everolimus] \n(Figure 2).\nCOMPOSE aims to randomize 202 patients 1:1 to a \ndefined number of cycles 177Lu-edotreotide or an active \ncomparator (Figure 2).COMPOSE: Pivotal phase III trial to compare 177Lu-edotreotide with best standard of care for \nwell -differentiated aggressive grade 2 and 3 gastroenteropancreatic neuroendocrine tumours \nHalfdanarson TR,1Halperin DM,2Reidy -Lagunes D,3Kong G,4Capdevila J,5Mailman J,6Herrmann K,7Srirajaskanthan R,8Leyden S,9Sierras C,10Harris P10\n1. Mayo Clinic, Rochester, MN USA; 2. MD Anderson Cancer Center, Houston, Texas, USA; 3. Memorial Sloan Kettering Cancer Cent er,New York, USA; 4. Peter MacCallum Cancer Centre, Melbourne, VIC, Australia; 5. Vall d ´Hebron University Hospital, Vall d ´Hebron Institute of \nOncology, Barcelona, Spain; 6. NorCal CarciNET Community, Oakland, CA; 7. University Hospital Essen, Germany; 8. Kings Colleg e Hospital, London, UK; 9. NeuroEndocrine Cancer Australia, Victoria, Australia; 10. ITM Oncologics GmbH, Garching/Munich, Germa ny\nBackground\nApproximately 70% of neuroendocrine tumours are \ngastroenteropancreatic (GEP -NETs). These frequently develop \nmetastatic disease with limited treatment options.1\nFor well -differentiated high grade 2 and 3 GEP -NETs, current \ntherapies include peptide receptor radionuclide therapy (PRRT), \nsomatostatin analogues, chemotherapy, cytoreduction and \nmolecular targeted therapies (everolimus, sunitinib) with no \nspecified use sequence. \nPRRT uses radiolabelled somatostatin analogues to selectively \ntarget somatostatin receptor expressing (SSTR+) tumour cells. \nUse may stabilise disease and induce objective tumour \nresponse.2\n177Lu edotreotide is an innovative radiolabelled somatostatin \nanalogue with promising efficacy and a favourable safety \nprofile.2,3Retrospective data in metastatic GEP -NETs treated \nwith ≥2 cycles of 177Lu-edotreotide demonstrate progression \nfree survival (PFS) of ≥30 months (Figure 1).3\nThe Phase III COMPETE trial , which has completed patient \nrecruitment, is comparing 177Lu edotreotide efficacy/safety \nversus everolimus in grade 1 and 2 GEP -NETs.4References\n1. Severi S, et al. Onco Targets Ther 2017;10:551−557; \n2. Strosberg J, et al. N Engl J Med 2017;376:125−135; 3. Baum RP , \net al. Theranostics 2016;6:501 -510. 4.']",4.0,1.0,1.0,1.0,0,1.0,1.0,1.0,51
23G advanced RAG,Was ist der Vergleichsarm in der COMPOSE Studie,german,specific,study,claude-3-opus-20240229 advanced RAG,"Laut den Informationen in den Postern ist der Vergleichsarm in der COMPOSE-Studie entweder CAPTEM (Capecitabin-Temozolomid), Everolimus oder FOLFOX (Folinsäure, Fluorouracil und Oxaliplatin), je nach Wahl des Prüfarztes und verabreicht gemäß den lokalen Verschreibungsinformationen, bis zur Diagnose einer Progression oder bis zum Studienende (Halfdanarson et al., n.d.).","['Methods\nCOMPOSE isaprospective, randomized, controlled, open -label, multi -center, Phase IIItrial,in\npatients with well-differentiated, high grade 2and grade 3(Ki-67index 15−55%),SSTR+ GEP-\nNETs .This trial istoevaluate theefficacy, safety and patient -reported outcomes offirst-or\nsecond -line treatment with n.c.a.177Lu-edotreotide PRRT compared tobest standard ofcare .\nCOMPOSE was recently opened and isplanned torecruit patients in10countries .\nCOMPOSE aims torandomize 202 patients 1:1toadefined number ofcycles of\n177Lu-edotreotide oranactive comparator .Asshown inFigure 3,patients willreceive either :\n•PRRT with n.c.a.177Lu-edotreotide consisting of six cycles (7.5GBq n.c.a.\n177Lu-edotreotide percycle), administered asintravenous infusion (101 patients)\nor:\n•Either CAPTEM, everolimus ,orFOLFOX, aschosen bythestudy doctor and administered\naccording tolocal prescribing information, until diagnosis ofprogression orend ofstudy\n(101 patients)Pivotal phase III COMPOSE trial will compare177Lu-edotreotide with best standard of care \nforwell -differentiated aggressive grade 2 and grade 3 gastroenteropancreatic neuroendocrine tumors\nHalfdanarson TR,1Reidy D,2Vijayvergia N,3Halperin D,4Goldstein G,5Kong G,6Michael M,6Leyden S,7Grozinsky -Glasberg S,8Sorbye H,9Öberg K,10Sierras C, 11Harris P .11\n1. Presenter: Mayo Clinic, Rochester, MN, USA; 2. Memorial Sloan Kettering Cancer Center , New York, NY , USA; 3. Fox Chase Cancer Center , Philadelphia, PA, USA; 4. MD Anderson Cancer Center , Houston, TX, USA; 5. Carcinoid Cancer Foundation, New York, NY , USA; \n6. Peter MacCallum Cancer Centre, Melbourne, VIC, Australia; 7. NeuroEndocrine Cancer, Australia; 8. Hadassah Medical Center , Jerusalem, Israel; 9. Haukeland University Hospital, Bergen, Norway; 10. Akademiska Sjukhuset , Uppsala, Sweden; 11. ITM Oncologics\nGmbH, Garching /Munich, Germany. \nBackground\nGastroenteropancreatic neuroendocrine tumors (GEP -NETs), which represent approximately\n70%ofNETs, frequently develop metastatic disease with limited treatment options .1\nCurrent standard therapies forthe subset ofwell-differentiated high grade 2and grade 3\nGEP-NETs include cytoreductive procedures, somatostatin analogues, molecular targeted\ntherapies (everolimus orsunitinib), chemotherapy and peptide receptor radionuclide\ntherapy (PRRT), with nospecified sequence ofuse.2−4\nPRRT may stabilize disease and induce objective tumor responses .This treatment uses\nradiolabeled somatostatin analogues toselectively target somatostatin receptor expressing\n(SSTR+) tumor cells .5\nNo-carrier -added (n.c.a.)177Lu-edotreotide isaninnovative radiolabeled somatostatin\nanalogue with afavorable safety profile and promising efficacy .5,6Retrospective data in\nmetastatic GEP-NETs treated with two ormore177Lu-edotreotide cycles demonstrated a\nprogression -free survival (PFS) ofatleast 30months (Figure 1A).Overall survival estimates\narepresented inFigure 1B.\nThe currently recruiting Phase IIICOMPETE trial compares theefficacy and safety of177Lu-\nedotreotide ,versus everolimus ,ingrade 1and grade 2GEP-NETs .\nStudy Endpoints\n•Primary :Progression -free survival assessed every 12weeks until disease progression\n(RECIST v1.1)ordeath, whichever occurs earlier .\n•Key Secondary :Overall survival assessed upto2years after disease progressionFigure 1 .Kaplan -\nMeier estimates of \n(A) PFS and (B) OS \nin the study \npopulation\ndepending on\nnumber ofn.c.a .', 'Aims\nCOMPOSE aims to extend the therapeutic options for 177Lu-edotreotide \nto aggressive grade GEP -NETs.\nMaterials and Methods\n•COMPOSE (NCT04919226) is a prospective, randomized, controlled, open -\nlabel, multi -center Phase III study, in patients with well -differentiated \naggressive grade 2 and grade 3, SSTR+, GEP -NETs\n•This trial is to evaluate the efficacy, safety and patient -reported outcomes \nof first -or second -line treatment with 177Lu edotreotide PRRT compared \nto best standard of care. \nCOMPOSE aims to randomize 202 patients 1:1 to a defined number of cycles\n177Lu-edotreotide or an active comparator (Figure 3)\n•PRRT with n.c.a. 177Lu-edotreotide consisting of six cycles (7.5 GBq n.c.a. \n177Lu-edotreotide per cycle) administered as intravenous infusion \n(101 patients) or\n•CAPTEM, everolimus , or FOLFOX, according to investigator ´s choice and \nadministered according to local prescribing information, until diagnosis \nof progression or end of study (101 patients) Pivotal phase III COMPOSE trial will compare 177Lu-edotreotide with best standard of care \nfor well -differentiated aggressive grade 2 and grade 3 gastroenteropancreatic neuroendocrine tumors\nHalfdanarson TR,1Halperin DM,2Reidy -Lagunes D,3Kong G,4Mailman J,5Herrmann K,6Srirajaskanthan R,7Leyden S,8Capdevila J,9Thevenet T,10Harris P10\n1. Mayo Clinic, Rochester, MN USA; 2. MD Anderson Cancer Center, Houston, Texas, USA; 3. Memorial Sloan Kettering Cancer Cent er, New York, USA; 4. Peter MacCallum Cancer Centre, Melbourne, VIC, Australia; 5. NorCal CarciNET Community, Oakland, CA; 6. University \nHospital Essen, Germany 7. Kings College Hospital, London, UK; 8. NeuroEndocrine Cancer Australia, Victoria, Australia; 9. Va ll d´Hebron University Hospital, Vall d ´Hebron Institute of Oncology, Barcelona, Spain; 10. ITM Oncologics GmbH, Garching/Munich, Germany\nBackground\nGastroenteropancreatic neuroendocrine tumors (GEP -NETs), which \nrepresent approximately 70% of NETs, frequently develop metastatic \ndisease with limited treatment options.1\nPRRT uses radiolabeled somatostatin analogues to selectively target \nsomatostatin receptor expressing (SSTR+) tumor cells.2It may be able to \nstabilize disease and induce objectively evaluable tumor response; \nhowever, there is a lack of prospective evidence.\nNo-carrier -added (n.c.a.) 177Lu-edotreotide is an innovative radiolabeled \nsomatostatin analogue with a favorable safety profile and promising \nefficacy.2,3Figure 1A, utilizing retrospective data in metastatic GEP -NETs, \nshows progression -free survival of at least 30 months following treatment \nwith two or more cycles of177Lu-edotreotide. Figure 1B shows overall \nsurvival estimates.3\nCOMPETE, a Phase III trial in grade 1 and grade 2 GEP -NETs comparing the \nefficacy and safety of 177Lu edotreotide versus everolimus, has recently \ncompleted patient recruitment.4References\n1. Severi S, et al. Onco Targets Ther 2017;10:551−557; 2. Strosberg J, et al. N Engl J \nMed 2017;376:125−135; 3. Baum RP , et al. Theranostics 2016;6:501 -510.\n4.', 'Trial design\nCOMPOSE is a prospective, randomised, controlled, \nopen -label, multi -center Phase III trial recruiting \npatients with well -differentiated aggressive grade 2 and \n3 (Ki -67 index 15−55%), SSTR+, GEP -NETs. \nCOMPOSE will evaluate efficacy, safety and patient -\nreported outcomes of 1st -or 2nd -line treatment with \n177Lu edotreotide PRRT compared to best standard of \ncare [investigator ´s choice of chemotherapy \n(capecitabine -temozolomide: CAPTEM or folinic acid, \nfluorouracil and oxaliplatin: FOLFOX) or everolimus] \n(Figure 2).\nCOMPOSE aims to randomize 202 patients 1:1 to a \ndefined number of cycles 177Lu-edotreotide or an active \ncomparator (Figure 2).COMPOSE: Pivotal phase III trial to compare 177Lu-edotreotide with best standard of care for \nwell -differentiated aggressive grade 2 and 3 gastroenteropancreatic neuroendocrine tumours \nHalfdanarson TR,1Halperin DM,2Reidy -Lagunes D,3Kong G,4Capdevila J,5Mailman J,6Herrmann K,7Srirajaskanthan R,8Leyden S,9Sierras C,10Harris P10\n1. Mayo Clinic, Rochester, MN USA; 2. MD Anderson Cancer Center, Houston, Texas, USA; 3. Memorial Sloan Kettering Cancer Cent er,New York, USA; 4. Peter MacCallum Cancer Centre, Melbourne, VIC, Australia; 5. Vall d ´Hebron University Hospital, Vall d ´Hebron Institute of \nOncology, Barcelona, Spain; 6. NorCal CarciNET Community, Oakland, CA; 7. University Hospital Essen, Germany; 8. Kings Colleg e Hospital, London, UK; 9. NeuroEndocrine Cancer Australia, Victoria, Australia; 10. ITM Oncologics GmbH, Garching/Munich, Germa ny\nBackground\nApproximately 70% of neuroendocrine tumours are \ngastroenteropancreatic (GEP -NETs). These frequently develop \nmetastatic disease with limited treatment options.1\nFor well -differentiated high grade 2 and 3 GEP -NETs, current \ntherapies include peptide receptor radionuclide therapy (PRRT), \nsomatostatin analogues, chemotherapy, cytoreduction and \nmolecular targeted therapies (everolimus, sunitinib) with no \nspecified use sequence. \nPRRT uses radiolabelled somatostatin analogues to selectively \ntarget somatostatin receptor expressing (SSTR+) tumour cells. \nUse may stabilise disease and induce objective tumour \nresponse.2\n177Lu edotreotide is an innovative radiolabelled somatostatin \nanalogue with promising efficacy and a favourable safety \nprofile.2,3Retrospective data in metastatic GEP -NETs treated \nwith ≥2 cycles of 177Lu-edotreotide demonstrate progression \nfree survival (PFS) of ≥30 months (Figure 1).3\nThe Phase III COMPETE trial , which has completed patient \nrecruitment, is comparing 177Lu edotreotide efficacy/safety \nversus everolimus in grade 1 and 2 GEP -NETs.4References\n1. Severi S, et al. Onco Targets Ther 2017;10:551−557; \n2. Strosberg J, et al. N Engl J Med 2017;376:125−135; 3. Baum RP , \net al. Theranostics 2016;6:501 -510. 4.']",5.0,1.0,1.0,1.0,0,1.0,1.0,1.0,46
23E advanced RAG,What is the control arm in the COMPOSE trial?,english,specific,study,claude-3-opus-20240229 advanced RAG,"According to the information provided, the control arm in the COMPOSE trial consists of either CAPTEM, everolimus, or FOLFOX, as chosen by the study doctor and administered according to local prescribing information, until diagnosis of progression or end of study (101 patients) [1,2].","['Aims\nCOMPOSE aims to extend the therapeutic options for 177Lu-edotreotide \nto aggressive grade GEP -NETs.\nMaterials and Methods\n•COMPOSE (NCT04919226) is a prospective, randomized, controlled, open -\nlabel, multi -center Phase III study, in patients with well -differentiated \naggressive grade 2 and grade 3, SSTR+, GEP -NETs\n•This trial is to evaluate the efficacy, safety and patient -reported outcomes \nof first -or second -line treatment with 177Lu edotreotide PRRT compared \nto best standard of care. \nCOMPOSE aims to randomize 202 patients 1:1 to a defined number of cycles\n177Lu-edotreotide or an active comparator (Figure 3)\n•PRRT with n.c.a. 177Lu-edotreotide consisting of six cycles (7.5 GBq n.c.a. \n177Lu-edotreotide per cycle) administered as intravenous infusion \n(101 patients) or\n•CAPTEM, everolimus , or FOLFOX, according to investigator ´s choice and \nadministered according to local prescribing information, until diagnosis \nof progression or end of study (101 patients) Pivotal phase III COMPOSE trial will compare 177Lu-edotreotide with best standard of care \nfor well -differentiated aggressive grade 2 and grade 3 gastroenteropancreatic neuroendocrine tumors\nHalfdanarson TR,1Halperin DM,2Reidy -Lagunes D,3Kong G,4Mailman J,5Herrmann K,6Srirajaskanthan R,7Leyden S,8Capdevila J,9Thevenet T,10Harris P10\n1. Mayo Clinic, Rochester, MN USA; 2. MD Anderson Cancer Center, Houston, Texas, USA; 3. Memorial Sloan Kettering Cancer Cent er, New York, USA; 4. Peter MacCallum Cancer Centre, Melbourne, VIC, Australia; 5. NorCal CarciNET Community, Oakland, CA; 6. University \nHospital Essen, Germany 7. Kings College Hospital, London, UK; 8. NeuroEndocrine Cancer Australia, Victoria, Australia; 9. Va ll d´Hebron University Hospital, Vall d ´Hebron Institute of Oncology, Barcelona, Spain; 10. ITM Oncologics GmbH, Garching/Munich, Germany\nBackground\nGastroenteropancreatic neuroendocrine tumors (GEP -NETs), which \nrepresent approximately 70% of NETs, frequently develop metastatic \ndisease with limited treatment options.1\nPRRT uses radiolabeled somatostatin analogues to selectively target \nsomatostatin receptor expressing (SSTR+) tumor cells.2It may be able to \nstabilize disease and induce objectively evaluable tumor response; \nhowever, there is a lack of prospective evidence.\nNo-carrier -added (n.c.a.) 177Lu-edotreotide is an innovative radiolabeled \nsomatostatin analogue with a favorable safety profile and promising \nefficacy.2,3Figure 1A, utilizing retrospective data in metastatic GEP -NETs, \nshows progression -free survival of at least 30 months following treatment \nwith two or more cycles of177Lu-edotreotide. Figure 1B shows overall \nsurvival estimates.3\nCOMPETE, a Phase III trial in grade 1 and grade 2 GEP -NETs comparing the \nefficacy and safety of 177Lu edotreotide versus everolimus, has recently \ncompleted patient recruitment.4References\n1. Severi S, et al. Onco Targets Ther 2017;10:551−557; 2. Strosberg J, et al. N Engl J \nMed 2017;376:125−135; 3. Baum RP , et al. Theranostics 2016;6:501 -510.\n4.', 'Methods\nCOMPOSE isaprospective, randomized, controlled, open -label, multi -center, Phase IIItrial,in\npatients with well-differentiated, high grade 2and grade 3(Ki-67index 15−55%),SSTR+ GEP-\nNETs .This trial istoevaluate theefficacy, safety and patient -reported outcomes offirst-or\nsecond -line treatment with n.c.a.177Lu-edotreotide PRRT compared tobest standard ofcare .\nCOMPOSE was recently opened and isplanned torecruit patients in10countries .\nCOMPOSE aims torandomize 202 patients 1:1toadefined number ofcycles of\n177Lu-edotreotide oranactive comparator .Asshown inFigure 3,patients willreceive either :\n•PRRT with n.c.a.177Lu-edotreotide consisting of six cycles (7.5GBq n.c.a.\n177Lu-edotreotide percycle), administered asintravenous infusion (101 patients)\nor:\n•Either CAPTEM, everolimus ,orFOLFOX, aschosen bythestudy doctor and administered\naccording tolocal prescribing information, until diagnosis ofprogression orend ofstudy\n(101 patients)Pivotal phase III COMPOSE trial will compare177Lu-edotreotide with best standard of care \nforwell -differentiated aggressive grade 2 and grade 3 gastroenteropancreatic neuroendocrine tumors\nHalfdanarson TR,1Reidy D,2Vijayvergia N,3Halperin D,4Goldstein G,5Kong G,6Michael M,6Leyden S,7Grozinsky -Glasberg S,8Sorbye H,9Öberg K,10Sierras C, 11Harris P .11\n1. Presenter: Mayo Clinic, Rochester, MN, USA; 2. Memorial Sloan Kettering Cancer Center , New York, NY , USA; 3. Fox Chase Cancer Center , Philadelphia, PA, USA; 4. MD Anderson Cancer Center , Houston, TX, USA; 5. Carcinoid Cancer Foundation, New York, NY , USA; \n6. Peter MacCallum Cancer Centre, Melbourne, VIC, Australia; 7. NeuroEndocrine Cancer, Australia; 8. Hadassah Medical Center , Jerusalem, Israel; 9. Haukeland University Hospital, Bergen, Norway; 10. Akademiska Sjukhuset , Uppsala, Sweden; 11. ITM Oncologics\nGmbH, Garching /Munich, Germany. \nBackground\nGastroenteropancreatic neuroendocrine tumors (GEP -NETs), which represent approximately\n70%ofNETs, frequently develop metastatic disease with limited treatment options .1\nCurrent standard therapies forthe subset ofwell-differentiated high grade 2and grade 3\nGEP-NETs include cytoreductive procedures, somatostatin analogues, molecular targeted\ntherapies (everolimus orsunitinib), chemotherapy and peptide receptor radionuclide\ntherapy (PRRT), with nospecified sequence ofuse.2−4\nPRRT may stabilize disease and induce objective tumor responses .This treatment uses\nradiolabeled somatostatin analogues toselectively target somatostatin receptor expressing\n(SSTR+) tumor cells .5\nNo-carrier -added (n.c.a.)177Lu-edotreotide isaninnovative radiolabeled somatostatin\nanalogue with afavorable safety profile and promising efficacy .5,6Retrospective data in\nmetastatic GEP-NETs treated with two ormore177Lu-edotreotide cycles demonstrated a\nprogression -free survival (PFS) ofatleast 30months (Figure 1A).Overall survival estimates\narepresented inFigure 1B.\nThe currently recruiting Phase IIICOMPETE trial compares theefficacy and safety of177Lu-\nedotreotide ,versus everolimus ,ingrade 1and grade 2GEP-NETs .\nStudy Endpoints\n•Primary :Progression -free survival assessed every 12weeks until disease progression\n(RECIST v1.1)ordeath, whichever occurs earlier .\n•Key Secondary :Overall survival assessed upto2years after disease progressionFigure 1 .Kaplan -\nMeier estimates of \n(A) PFS and (B) OS \nin the study \npopulation\ndepending on\nnumber ofn.c.a .']",5.0,1.0,1.0,1.0,0,1.0,1.0,1.0,43
24G advanced RAG,"Ist es möglich die verschiedenen Guidelines zu Management von neuroendokrinen Tumoren vergleichend darzustellen (ENETS, NANETS)? Wo sind hier die Unterschiede in der Therapie dieser Erkrankung? ",german,specific,guidelines,claude-3-opus-20240229 advanced RAG,"Basierend auf den gegebenen Informationen ist ein direkter Vergleich der ENETS und NANETS Guidelines für das Management von neuroendokrinen Tumoren nicht möglich, da der Kontext nur die ENETS Guidelines behandelt. 

Die ENETS Consensus Guidelines geben folgende Empfehlungen für die Therapie von metastasierten neuroendokrinen Tumoren des Gastrointestinaltrakts und Pankreas [Pavel et al., 2016]:

- Bei potenziell resektablen G1/G2 NET sollte immer eine kurative Resektion erwogen werden, auch bei Leber- und/oder Lymphknotenmetastasen. 

- Bei nicht-resektablen Tumoren kommen lokoregionale Verfahren (Embolisation, Chemoembolisation, Radioembolisation, Radiofrequenzablation) und systemische Therapien zum Einsatz.

- Somatostatinanaloga (Octreotid, Lanreotid) werden zur Symptomkontrolle und auch antiproliferativ eingesetzt.

- Weitere systemische Optionen sind Interferon alpha, Chemotherapie mit Streptozotocin/5-FU oder Temozolomid/Capecitabin, die Tyrosinkinase-Inhibitoren Everolimus und Sunitinib sowie die Peptidrezeptor-Radionuklidtherapie (PRRT).

- Bei G3 neuroendokrinen Karzinomen wird eine Platin-basierte Chemotherapie empfohlen.

Die genauen Indikationen und Bedingungen für den bevorzugten Einsatz der verschiedenen Therapien als Erstlinientherapie sind in Tabelle 1 zusammengefasst.

Ohne Informationen zu den NANETS Guidelines lässt sich anhand des gegebenen Kontextes kein Vergleich der Empfehlungen anstellen. Die ENETS Guidelines stellen aber einen umfassenden Expertenk","['ENETS Consensus Guidelines Update for \nDistant Metastatic Disease  Neuroendocrinology 2016;103:172–185 \nDOI: 10.1159/000443167181in pancreatic NET and it may be considered in G3 NET and in \nhigh-risk NET of other primary site (e.g. pulmonary NET). In G3 NEC, platinum-based chemotherapy is recommended as a first-line therapy.\n  Peptide Receptor Radionuclide Therapy\n  PRRT is a therapeutic option in progressive SSTR-pos-\nitive NET with homogenous SSTR expression (all lesions are positive). In general, the use of PRRT follows failed first-line medical therapy. Radionuclide therapy with ei-ther  \n90 Y and/or  177 Lu-labeled SSA is most frequently used \nin NET, but  177 Lu-labelled SSA is increasingly used due\nto lower kidney toxicity. The minimum requirementsfor PRRT are reported in a separate consensus guideline  \n[84] . Until recently, there were no results from prospec-\ntive randomized trials available. The registrational trialof  \n177 Lu-DOTATATE in progressive midgut NET\n(NETTER-1) has reached its primary endpoint with a sig-nificant prolongation of PFS compared to high-dose oc-treotide (60 mg/month). Based on this trial, and cumula-tive data from prospective and retrospective trials over the last 15 years, PRRT may be recommended in midgut NET as a second-line therapy after failure of SSA if the general requirements for applying PRRT are fulfilled  \n[84–\n87]  or as a third-line therapy after failure of everolimus. \n  Given the different established and approved therapeu-\ntic options in pancreatic NET and the lack of a prospective trial with PRRT in pancreatic NET, PRRT (if available) is in general recommended in G1/G2 NET after failure of medical therapy including SSA, chemotherapy or novel targeted drugs. However, potential increasing toxicity, e.g. after prior chemotherapy or targeted therapy, needs to be considered, requires close surveillance and might justify an earlier use of PRRT in selected patients ( table\xa01 ).\n  Minimal Consensus Statement \n \nPRRT is recommended after failure of medical therapy. Data \nfrom a prospective trial in midgut NET support its role as a second-line therapy option in intestinal NET if the general requirements for PRRT are fulfilled and as an alternative option to everolimus. The optimal sequencing with targeted drugs and/or chemotherapy needs to be defined in pancreatic NET when data from prospective randomized trials with PRRT in pancreatic NET become available.\n  Management of NET with Unknown Primary Tumor \n In approximately 13% of patients who are diagnosed \nas having NEN, the primary site is not known. In patients with unknown primary tumor, the site is most frequently localized in the intestine or the lung. Additional tools \nshould be exploited to identify the primary tumor. These include immunohistochemistry of transcription factors (CDX-2, Islet-1, TTF-1)  \n[88] , PET/CT (e.g.  Ga 68-SR,  11 C-\n5-hydroxytryptophan or  18 F-DOPA)  [89, 90]   and upper \nand lower gastrointestinal endoscopy and optionally cap-sule endoscopy  \n[91, 92]  . If the primary tumor site remains \nunknown, therapeutic decision making is essentially based on grading, functionality, SSTR status, tumor ex-tent and hepatic tumor burden.\n  Further information is provided in the consensus \nguideline updates for other GEP NET [ \n83, 93–97  , this is-\nsue].\n  Appendix \n All Other Vienna Consensus Conference Participants    \nAnlauf, M. (Institut für Pathologie und Zytologie, St. Vincenz \nKrankenhaus, Limburg, Germany); Bartsch, D.K. (Department of Surgery, Philipps University, Marburg, Germany); Baudin, E. (In-stitut Gustave Roussy, Villejuif, France); Caplin, M. (Neuroendo-crine Tumour Unit, Royal Free Hospital, London, UK); Cwikla, J.B. (Department of Radiology, Faculty of Medical Sciences, Uni-versity of Warmia and Mazury, Olsztyn, Poland); De Herder, W.W.', 'ENETS Consensus Guidelines Update for \nDistant Metastatic Disease  Neuroendocrinology 2016;103:172–185 \nDOI: 10.1159/000443167173the rarity of the disease, the number of prospective ran-\ndomized trials is limited, and most recommendations are based on uncontrolled studies, representing expert opinions. This is especially true for surgical treatment, different locoregional or ablative therapies [emboliza-tion, chemoembolization, radiofrequency ablation and selective internal radiation therapy (SIRT)] and system-ic chemotherapy. Somatostatin analogues (SSA) and novel targeted drugs, such as the multiple tyrosine ki-nase inhibitor sunitinib and the mTOR inhibitor evero-limus, are the only drugs that have been evaluated in NEN within placebo-controlled trials. Based on the re-sults of these trials, SSA, sunitinib and everolimus have been approved and registered for antiproliferative ther-apy in different neuroendocrine tumor (NET) subtypes excluding neuroendocrine carcinoma (NEC). Recent data from a placebo-controlled trial with lanreotide (CLARINET study) in enteropancreatic NET have pro-vided novel evidence for the antiproliferative activity of SSA. Furthermore, it has recently been reported that \nthree large randomized controlled drug trials (i.e. evero-limus vs. placebo in lung and intestinal NET and NET of unknown primary tumor, RADIANT-4;  \n177 Lu-\nDOTATATE vs. high-dose octreotide in midgut NET, NETTER-1, and telotristat etiprate vs. placebo in refrac-tory carcinoid syndrome, TELESTAR) have reached their primary endpoints  \n[10–12]  . These well-construct-\ned phase III trials in NET have an impact on the current treatment recommendations and therapeutic algorithm. In addition, there is novel information available on the use of targeted drugs from application outside of ran-domized clinical trials. \n  Given the variety of treatment options, the heteroge-\nneity of NEN and the individual disease complexity, it is strongly recommended if not mandatory to discuss NEN patients after accurate imaging and pathology review in a multidisciplinary tumor board for appropriate therapeu-tic decision making, especially to exploit surgical therapy (a) Simple pattern of LMs\nG1/G2\n(unilobar or limited)Resection of primary\n(b) Complex pattern of LMs\nG1/G2\n(bilobar)Morphological and\nfunctional imaging\n(c) Diffuse LMs\nG1/G2\nOr surgery\ncontraindicated\nSurgery\ncontraindicatedResection\n(minor or\nanatomical)One-step surgery\nMajor liver\nresection ± RFATwo-step surgery(1) Minor resection   ± RFA, RPVE, RPVL\n(2) Sequential major\n   liver resectionSmall intestinal- SSA (IFN)- PRRT\n- EverolimusPancreatic\n- SSA (IFN)- Chemotherapy\n- Everolimus\n- Sunitinib\n- PRRTSelected cases\n(<1%)\nTACE, TAE\nSIRT*Ablation\n(RFA, LiTT)\nTACE, TAE\nSIRT*Liver\ntransplantation\n  Fig. 1.   Management of liver metastases without extrahepatic disease in G1/G2 NEN.  * \xa0SIRT (selective internal \nradiation therapy) is still an investigational method. LiTT = Laser-induced thermotherapy; LMs = liver metasta-ses; RFA = radiofrequency ablation; RPVE = right portal vein embolization; RPVL = right portal vein ligation; TACE = transarterial chemoembolization; TAE = transarterial embolization. \nDownloaded by: \nUCL                                                    \n195.195.103.221 - 5/11/2016 5:05:16 PM', 'Pavel \xa0 \xa0et\xa0al.\n  Neuroendocrinology 2016;103:172–185 \nDOI: 10.1159/000443167174in potentially resectable NEN patients and explore lo-\ncoregional therapies upfront. Choosing antiproliferative therapies is also challenging depending on the tumor pri-mary, its functional status, its growth rate, grade and overall disease burden and the goal of individual thera-pies within the patient’s choice and status. Variation of treatment choices will also depend on physician exper-tise, the complexity of the treatment center and access to novel treatments. Recommendations for the preferential use of targeted drugs or chemotherapy as first-line thera-py are summarized in  table\xa01 .\n  This review focuses on intestinal and pancreatic NEN, \nand it provides a therapeutic algorithm for both subtypes ( fig.\xa02, 3 ). The management of typical and atypical lung NET is similar to that of gastroenteropancreatic (GEP) NEN taking into consideration pathological features (mi-totic count, Ki-67), somatostatin receptor (SSTR) expres-sion, growth rate and disease extent. The best practice recommendations for the management of typical and atypical bronchial NET are reported in a separate recent-ly published ENETS consensus paper  \n[13] .  Therapeutic Options \n In grade 1 (G1) and G2 NET, surgery with curative in-\ntent always has to be considered, even if liver and/ or lymph node metastases are present ( fig.\xa01 ). In non-resect-able disease, the following treatment options should be considered to control symptoms secondary to the hyper-secretion of peptide hormones/amines leading to a func-tional syndrome (carcinoid syndrome, diarrhea and oth-er symptoms related to functionally active pancreatic NEN) and/or tumor growth control. In some patients, it may be necessary to combine therapies for example to suppress symptoms using SSA in addition to locoregion-al therapies or other antiproliferative agents. \n  Locoregional Therapies \n In the absence of any large comparative trials of dif-\nferent locoregional or ablative therapies (bland embo-lization, chemoembolization, radioembolization, radio-frequency ablation or microwave destruction) or system-ic treatment, the choice of treatment is based on individual patient features (e.g. size, distribution and  Table 1.  Therapeutic options and conditions for preferential use as first-line therapy in advanced NEN\nDrug Functionality Grading Primary site SSTR status Special considerations\nOctreotide +/– G1 midgut + low tumor burden\nLanreotide +/– G1/G2 (–10%) midgut, \npancreas+ low and high (>25%) liver \ntumor burden\nIFN-alpha 2b +/– G1/G2 midgut if SSTR negative\nSTZ/5-FU +/– G1/G2 pancreas progressive in short-term * or \nhigh tumor burden or symptomatic\nTEM/CAP +/– G2 pancreas progressive in short-term * or \nhigh tumor burden or symptomatic;if STZ is contraindicated or not available\nEverolimus +/– G1/G2 lung atypical carcinoid and/or SSTR \nnegative\npancreas insulinoma or contraindication \nfor CTX\nmidgut if SSTR negative\nSunitinib +/– G1/G2 pancreas contraindication for CTXPRRT +/– G1/G2 midgut + (required) extended disease; extrahepatic \ndisease, e.g. bone metastasis\nCisplatin\n§/\netoposide+/– G3 any all poorly differentiated NEC\n CAP = Capecitabine; TEM = temozolomide.  * ≤6–12 months. § Cisplatin can be replaced by carboplatin. \nDownloaded by: \nUCL                                                    \n195.195.103.221 - 5/11/2016 5:05:16 PM']",0.0,1.0,1.0,1.0,1,1.0,1.0,1.0,172
24E advanced RAG,"Is it possible to compare the different guidelines for the management of neuroendocrine tumors (ENETS, NANETS)? Where are the differences in the therapy of this disease?",english,specific,guidelines,claude-3-opus-20240229 advanced RAG,"Based on the provided context, it is not possible to directly compare the different guidelines for the management of neuroendocrine tumors such as ENETS and NANETS. The context focuses on the ENETS guidelines and recommendations for treating gastroenteropancreatic neuroendocrine neoplasms, but does not provide information about the NANETS guidelines or highlight differences between the two [1]. To properly compare the guidelines and identify differences in therapy recommendations, the full text of both the ENETS and NANETS guidelines would need to be reviewed and analyzed.","[""1|INTRODUCTION\nThis ENETS guidance paper for the management of well-\ndifferentiated nonfunctioning pancreatic neuroendocrine tumours\n(NF-Pan-NET) aims to answer 10 major questions (Table 1) on the\nmanagement of these neoplasms.\nData were identified by MEDLINE database searches and expert\nopinion. Recommendations are given according to the best availableevidence and authors' experience and will have a level of evidence\n(1–5) and strength of recommendation (A –D) (Table\n2) as per the\nGRADE system.1\nThe incidence of Pan-NET is rising, most recently reported as\n0.48 per 100,000 new cases per year according to the Surveillance,\nEpidemiology, and End Results (SEER) Programme; although Pan-NET\ncarry an unfavourable prognosis compared to NET from other primarysites, an improvement in overall survival (OS) has been observed over\ntime (median OS of 3.6 years), particularly in patients with distant\nmetastases.\n2\nThe majority (between 50% and 85%) of Pan-NET are nonfunc-\ntioning. Moreover, NF-Pan-NET tend to present with more advanced\ndisease (more advanced tumour [T]-stage, lymph node involvementand liver metastases) and arise in the head of the pancreas. Conse-\nquently, patients with NF-Pan-NET have a significantly worse OS than\ntheir functioning counterparts ( p< .001).\n3,4\nIn patients undergoing curative resection, a shorter survival\nwas observed in patients with NF-Pan-NET, lymphatic invasion,\nand size >10 cm, while a shorter disease-free survival (DFS)\nwas associated with advanced pT-stage (pT3 –4), size >5 cm and\nhistological grade (G) 2 –3. Ki-67 > 10% predicted a poorer\nprognosis.52|DIAGNOSIS\n2.1 |Q1. How should we define and characterise a\nNF-Pan-NET at presentation?\nWhile the diagnosis of functionality relies on the presence of a\nhormonal syndrome, the NET-diagnosis relies on histological or cyto-\nlogical analysis. Histopathological diagnosis is based on the neuroen-docrine growth pattern, including nesting, trabecular, gyriform and\nsolid architecture, as well as the expression of neuroendocrine\nmarkers including synaptophysin and chromogranin A (CgA).\n6It should\nbe noted that in the pancreas, especially acinic cell carcinoma, solidpseudopapillary neoplasm and paraganglioma can be positive for\nthese markers, and therefore they should be actively excluded.\n7More\nrecently, the transcription factor INSM1 has emerged as a both sensi-tive and specific diagnostic mar ker of NET. Grading is assessed by\nTABLE 1 Ten major questions on management of nonfunctioning\npancreatic neuroendocrine tumours.\nQ1 How should we define and characterise a NF-Pan-NET\npatient at clinical presentation?\nQ2 Which biochemical tests should be performed in a patient\nwith NF-Pan-NET?\nQ3 Which is the most suitable imaging work-up for NF-Pan-NET\npatients?\nQ4 What is the appropriate surgical management of NF-Pan-\nNET?\nQ5 What is the role of PRRT in patiente with NF-Pan-NET?Q6 What is the role of biotherapy and molecular targeted\ntherapies in patients with advanced NF-Pan-NET?\nQ7 What is the role of chemotherapy in patients with advanced\nNF-Pan-NET?\nQ8 In the setting of advanced disease, which is the most suitable\nfirst-line systemic therapy? Which sequence of treatments\nshould be used?\nQ9 Is there a specific work-up in MEN1-associated NF-Pan-NET\npatients?\nQ10 What is the recommended follow-up in NF-Pan-NET\npatients?TABLE 2 Level of evidence and strength of recommendations."", 'Version 1.2023 © 202 3 National Comprehensive Cancer Network© (NCCN©), All rights reserved. NCCN Guidelines® and this illustration may not be reproduced in any form without the express written permission of NCCN .  NCCN Guidelines Version 1.2023 \nNeuroendocrine and Adrenal Tumors  \n \nMS-29 significantly higher median OS (41– 99 months vs. 17 months) compared \nto patients with poorly differentiated NECs.280,281 \nEvaluation of Well -Differentiated  Grade 3 Neuroendocrine Tumors  \nImaging with multiphasic abdominal/pelvic CT or MRI scans with contrast, \nwith or without chest CT scans (if clinically indicated), and SSR -based \nPET imaging (SSR -PET) is recommended. SSR -based PET imaging \nshould include PET/CT or PET/MRI of the skull base to mid -thigh with IV \ncontrast (both arterial and portal venous phase), when possible. Data are limited on the optimal timing of SSR scans following administration of \nsomatostatin analogs. FDG -PET/CT scans can be performed as \nappropriate if SSR PET imaging is negative. There are some instances where FDG PET is useful in patients with positive SSR PET. Biochemical  \nevaluation should be performed if the patient has symptoms suggestive of a secretory tumor. Pathology review is recommended and assessment of \np53, Rb, and p16, by histopathologic analysis or molecular profiling, can \nbe considered if there is uncertainty about the tumor’s degree of \ndifferentiation, as a mutation in these genes would suggest a poorly \ndifferentiated NEC.\n282-284 SSR 2A staining may also be helpful.285 Genetic \ncounseling and testing for inherited genet ic syndromes is recommended \nonly for duodenal or pancreatic NETs.  \nPrimary Treatment of Well -Differentiated Grade 3 Neuroendocrine Tumors  \nTreatment recommendations are based on the biology of the tumor. A \ntumor with favorable biology typically possesses Ki -67 less than 55%, is \nslow- growing, and may yield a positive SSR -based PET result. A tumor \nwith unfavorable biology typically has Ki -67% greater than or equal to \n55%, is faster -growing, and may yield a negative SSR -based PET result.  \nImportantly, the data informing the appropriate Ki -67 cutoff are limited and \nvariability/heterogeneity of Ki -67 in a given tumor and over time in serial \nbiopsies  make decision- making less straightforward in this entity \ncompared to other NENs. The combination of clinical course and histopathologic workup should dictate therapy, not solely Ki -67. For \nlocoregional (resectable) disease, resection is recommended, along  with \nregional lymphadenectomy, if feasible, regardless of tumor biology.286 \nPatient factors should be considered.  \nFor resectable locoregional disease with unfavorable biology, a clinical \ntrial is preferred. Neoad juvant chemotherapy can also be given on a case -\nby-case basis and options include temozolomide with or without \ncapecitabine, oxaliplatin- based therapy (FOLFOX or CAPEOX), \ncisplatin/etoposide, or carboplatin/etoposide. Temozolomide may have \nmore activity in  tumors arising in the pancreas. Following the completion of \nneoadjuvant chemotherapy, the patient should undergo resection with regional lymphadenectomy if feasible.  \nFor resectable locally advanced or metastatic disease with favorable \nbiology, resection of the primary and metastatic sites may be performed, if \nfeasible. The treatment for unresectable locally advanced or metastatic \ntumors depends on the degree of tumor burden. If the patient is \nasymptomatic with low tumor burden, observation with a short interval \nfollow- up scan is an option for select patients; otherwise, octreotide or \nlanreotide is recommended if the patient is SSR -positive and/or has \nhormonal symptoms. There are multiple treatment modalities if the patient \nhas a clinically significant tumo r burden or evidence of disease \nprogression. Octreotide or lanreotide is recommended if the patient is \nSSR-positive and/or has hormonal symptoms.  Enrollment in a clinical trial \nis preferred.', '/C15Sunitinib is one of the EMA-approved treatment options\nin advanced progressive Pan-NETs [I, A; ESMO-MCBS v1.1\nscore: 3].\n/C15Both sunitinib and everolimus cannot be recommended\nin NEC G3 outside of clinical trials [V, E].\n/C15The use of systemic ChT is recommended in advancedPan-NETs and in NEN G3 of any site [II, A].\nBIn patients with non-resectable LMs and/or otherdistant metastases from G1/G2 Pan-NETs, STZ/5-FU isrecommended in progressive disease [II, A].\nBTEM alone or in combination with CAP is recommen-ded as alternative ChT in Pan-NETs [II, B].\nBSystemic ChT can also be recommended in bulkydisease without prior tumour progression inPan-NETs [II, B].\nBCisplatin or carboplatin with etoposide is recommen-ded standard ﬁrst-line ChT in NEC G3 [III, A]. There is\nno established second-line therapy, but different\nregimens [e.g. 5-FU/leucovorin/irinotecan (FOLFIRI),\n5-FU/leucovorin/oxaliplatin (FOLFOX), CAPTEM /C6\nbevacizumab] may be considered [IV, B].\n/C15In NET G3, response rates to cisplatin/etoposide arelow, and the use of this combination is not recommen-ded [IV, C].\n/C15ChT cannot be recommended in well-differentiatedslowly growing NETs of the GI tract [II, C]; exceptions\nmay be rapidly progressive tumours or NET G2 with\nhigher Ki-67 close to NET G3 [V, C].\n/C15PRRT is recommended as second-line therapy in patientswith midgut NETs with disease progression on SSAs whofulﬁl the general requirements for PRRT [I, A].\n/C15\n177Lu-DOTATATE is EMA- and FDA-approved for patients\nwith midgut NETs [I, A; ESMO-MCBS v1.1 score: 4] andPan-NETs [III, A; ESMO-MCBS v1.1 score: 4].\n/C15In Pan-NETs, PRRT should be used after failure ofapproved therapies [III, A].\n/C15In carefully selected patients, PRRT may be considered inNET G3 [IV, C].\n/C15SSA should be combined with PRRT in patients withfunctioning tumours (CS) to prevent increasing symp-toms such as diarrhoea and/or ﬂushing and hormonal\ncrisis soon after PRRT [II, A].\n/C15It is also common practice to continue SSA beyond PRRTin functioning tumours, as a full resolution of CS-relatedsymptoms is rarely achieved after PRRT [II, A].\n/C15The combination of SSA with PRRT is not recommendedin patients with NF-NETs, [IV, C] and it remains unclear ifSSA should be continued after PRRT as a maintenancetherapy.\nPERSONALISED MEDICINE\nIn the absence of de ﬁnite predictive markers and paucity of\ncomparative randomised trials, therapy selection in\nadvanced non-resectable disease is frequently based onindividual patient clinical and pathological features andSSTR imaging [IV, A]. Several issues are unresolved: toconsider surgery upfront for potentially resectable LMs orsystemic therapy, or locoregional therapies. Amongsystemic treatments, approved drugs should be used withhigher priority, although comorbidities and age may impact\ntreatment choices. The treatment selection should be based\non an interdisciplinary tumour board decision in experi-enced centres including experts familiar with the disease.Recently identi ﬁed prognostic molecular markers may have\nan impact on therapy strategies in the future if validated inprospective trials. A recent meta-analysis identiﬁ ed a diag-\nnostic accuracy of a NET mRNA genomic biomarker (NETest)of 95%e96%; this marker seems to have a predictive value\nfor PRRT response and achievement of complete surgery.']",1.0,1.0,1.0,1.0,1,1.0,1.0,1.0,84
25G advanced RAG,In welchem Bereich werden PRRT Therapien in den ESMO Guidelines dargestellt?,german,specific,guidelines,claude-3-opus-20240229 advanced RAG,"Basierend auf den gegebenen Informationen werden PRRT Therapien in den ENETS (European Neuroendocrine Tumor Society) Consensus Guidelines für folgende Bereiche empfohlen:

- Als Zweitlinientherapie bei intestinalen neuroendokrinen Tumoren (NET) nach Versagen einer Somatostatin-Analoga-Therapie, wenn die allgemeinen Voraussetzungen für eine PRRT erfüllt sind, und als Alternative zu Everolimus. [1]

- Bei pankreatischen NET wird PRRT im Allgemeinen nach Versagen einer medikamentösen Therapie einschließlich Somatostatin-Analoga, Chemotherapie oder neuen zielgerichteten Medikamenten empfohlen. Die optimale Sequenzierung mit zielgerichteten Medikamenten und/oder Chemotherapie muss noch definiert werden, wenn Daten aus prospektiven randomisierten Studien mit PRRT bei pankreatischen NET verfügbar werden. [1]

Die ESMO (European Society for Medical Oncology) Guidelines werden in den gegebenen Kontextinformationen nicht explizit erwähnt.","['ENETS Consensus Guidelines Update for \nDistant Metastatic Disease  Neuroendocrinology 2016;103:172–185 \nDOI: 10.1159/000443167181in pancreatic NET and it may be considered in G3 NET and in \nhigh-risk NET of other primary site (e.g. pulmonary NET). In G3 NEC, platinum-based chemotherapy is recommended as a first-line therapy.\n  Peptide Receptor Radionuclide Therapy\n  PRRT is a therapeutic option in progressive SSTR-pos-\nitive NET with homogenous SSTR expression (all lesions are positive). In general, the use of PRRT follows failed first-line medical therapy. Radionuclide therapy with ei-ther  \n90 Y and/or  177 Lu-labeled SSA is most frequently used \nin NET, but  177 Lu-labelled SSA is increasingly used due\nto lower kidney toxicity. The minimum requirementsfor PRRT are reported in a separate consensus guideline  \n[84] . Until recently, there were no results from prospec-\ntive randomized trials available. The registrational trialof  \n177 Lu-DOTATATE in progressive midgut NET\n(NETTER-1) has reached its primary endpoint with a sig-nificant prolongation of PFS compared to high-dose oc-treotide (60 mg/month). Based on this trial, and cumula-tive data from prospective and retrospective trials over the last 15 years, PRRT may be recommended in midgut NET as a second-line therapy after failure of SSA if the general requirements for applying PRRT are fulfilled  \n[84–\n87]  or as a third-line therapy after failure of everolimus. \n  Given the different established and approved therapeu-\ntic options in pancreatic NET and the lack of a prospective trial with PRRT in pancreatic NET, PRRT (if available) is in general recommended in G1/G2 NET after failure of medical therapy including SSA, chemotherapy or novel targeted drugs. However, potential increasing toxicity, e.g. after prior chemotherapy or targeted therapy, needs to be considered, requires close surveillance and might justify an earlier use of PRRT in selected patients ( table\xa01 ).\n  Minimal Consensus Statement \n \nPRRT is recommended after failure of medical therapy. Data \nfrom a prospective trial in midgut NET support its role as a second-line therapy option in intestinal NET if the general requirements for PRRT are fulfilled and as an alternative option to everolimus. The optimal sequencing with targeted drugs and/or chemotherapy needs to be defined in pancreatic NET when data from prospective randomized trials with PRRT in pancreatic NET become available.\n  Management of NET with Unknown Primary Tumor \n In approximately 13% of patients who are diagnosed \nas having NEN, the primary site is not known. In patients with unknown primary tumor, the site is most frequently localized in the intestine or the lung. Additional tools \nshould be exploited to identify the primary tumor. These include immunohistochemistry of transcription factors (CDX-2, Islet-1, TTF-1)  \n[88] , PET/CT (e.g.  Ga 68-SR,  11 C-\n5-hydroxytryptophan or  18 F-DOPA)  [89, 90]   and upper \nand lower gastrointestinal endoscopy and optionally cap-sule endoscopy  \n[91, 92]  . If the primary tumor site remains \nunknown, therapeutic decision making is essentially based on grading, functionality, SSTR status, tumor ex-tent and hepatic tumor burden.\n  Further information is provided in the consensus \nguideline updates for other GEP NET [ \n83, 93–97  , this is-\nsue].\n  Appendix \n All Other Vienna Consensus Conference Participants    \nAnlauf, M. (Institut für Pathologie und Zytologie, St. Vincenz \nKrankenhaus, Limburg, Germany); Bartsch, D.K. (Department of Surgery, Philipps University, Marburg, Germany); Baudin, E. (In-stitut Gustave Roussy, Villejuif, France); Caplin, M. (Neuroendo-crine Tumour Unit, Royal Free Hospital, London, UK); Cwikla, J.B. (Department of Radiology, Faculty of Medical Sciences, Uni-versity of Warmia and Mazury, Olsztyn, Poland); De Herder, W.W.', 'octreotide.7 For pancreatic NET, PRRT was not recommended specifically as a second-line \ntherapy due to the absence of data comparing PRRT to other approved treatments such as \nsunitinib and everolimus or streptozotocin-based systemic chemotherapy.\nPanellists considered PRRT as appropriate second line treatment option in all GI NET \npatients (NET G1 and G2, Ki-67<20%) with matched [18F]FDG and SSTR-positive uptake \nin all lesions. Considering the well-known heterogeneous NET behaviour, the employment \nof PRRT in only G1 and G2 patients may exclude some G3 patients, who might derive \nbenefit from treatment. In fact, good responses to PRRT were also reported in selected \nG3 NET with lower Ki-67 (reported values of <55%).57,58 EANM Focus 3 panellists were \nin favour of extending current indication to a subset of patients with GEP G3 (NET G3, \nKi-67>20%) showing matched [18F]FDG and SSTR uptake in all lesions (based on risk, \nsymptoms, and primary tumour location).\nPanellists also agreed that patients responding to [177Lu]Lu-DOTATATE may benefit from \nretreatment at disease progression, if partial remission or disease stability was obtained for \nat least one year after first administration. However, criteria to assess disease stability are not \nfully standardized and trials are lacking.\nIn patients with lesions showing heterogeneous (eg, high and low Ki67 values) grade, \ncombining PRRT with capecitabine-temozolomide (CAPTEM) has been reported, but \npanellists agreed that, based on current evidence, it should only be used within a dedicated \nprotocol considering the potential toxicity of CAPTEM in combination with PRRT.59\nPanellists were in favour of considering PRRT as first line treatment in selected cases, eg, \npatients with high tumour burden and associated symptoms. An ongoing trial (NETTER-2) \nis currently evaluating first line use of PRRT in advanced NET G2-G3. A few reports \nindicate a potential use in the neoadjuvant setting but no agreement was reached.60\nUse of PRRT with [177Lu]Lu-DOTATATE beyond small bowel has been approved by the \nEMA and FDA.7,61 However, the comparison of the reported response to PRRT compared \nto everolimus or sunitinib in pancreatic NET is difficult given differences in study designs, \neligibility criteria, and absence of head-to-head comparisons.62,63 Clinical evidence suggests \nthat lesions with mismatched [18F]FDG and somatostatin avidity may develop during NET \nnatural history, particularly in G2 but also in a minority of G1 cases. In the clinical setting \nof heterogeneous disease and with [18F]FDG positive as the most aggressive component, no \nconsensus was reached on the feasibility of PRRT at disease progression.\nTo select candidate patients for PRRT, diagnostic nuclear medicine is mandatory \nfor confirming significant SSTR expression in tumour cells. In line with current \nguidelines,4,8–17 panellists agreed that [68Ga]Ga-DOTA-SSA PET/CT should be \npreferentially used for NET imaging rather than 99mTc- or 111In-based SSTR scintigraphy. \n[68Ga]Ga-DOTA-SSA is recommended as the first choice for PET/CT imaging of all \nNET, by all guidelines as well as EANM Focus 3, 4,8–17 with the exception of adrenal \npheochromocytoma (due to physiologic biodistribution to the adrenals), medullary thyroid \ncarcinoma, benign insulinoma, neuroblastoma, and abdominal PGL (all characterized by \nvariable SSTR expression).12 Although EANM guidelines consider using [18F]F-DOPA as Ambrosini et al. Page 10\nEur J Cancer . Author manuscript; available in PMC 2022 March 08.\nAuthor Manuscript Author Manuscript Author Manuscript Author Manuscript']",0.0,1.0,1.0,0.0,1,1.0,0.0,0.5,111
